song_name,href,lyric,artist
อดีตรักเข้าพรรษา,/music/thailyric/18798,"น้ำ มูลไหล หลั่ง
สองฟากฝั่ง อุบลวาริน
แว่ว เสียงแคนเสียง พิณ
ซึ้งใจอ้าย บ่ลืมหลง

เข้า พรรษา ปีกลาย
ยังได้ เคียงคู่ อนงค์
แห่เทียน เป็นขบวนร้องส่ง
สองเรายังคง รักกันชื่นบาน

แต่ในงาน ปีนี้ ไม่มีน้องเจ้า
พี่ยัง มาคอยเหมือนเก่า
แม้น แต่เงา น้อง ก็ไม่มี

นี่ หรือ ใจ คน
สาว อุบลที่ว่าใจดี
จากกัน ก็เพียงหนึ่งปี
แต่มาบัดนี้ น้องลืมสัญญา

มองดูฟ้าเห็นแต่เมฆาบัง
อ้ายแทบกลั้นบ่อยู่
ซูเอ๋ยซูต่างบ้าน
ซ่างมาต้มหลอกกัน
วันที่อ้าย ตั้งตัวมาดน
บัดว่าวนมาถึง ซ่างบ่มาน้อเจ้า

เสียง แคนเป่า
เขาแห่ เทียนเข้าพรรษา
แว่ว ดังมา เหมือนเสียงสั่ง
จากสาว อุบล

เหมือนบอกว่าเขาลืมเราแล้ว
ลืมแล้วสัญญารักคนจน
ปีนี้ ตัวพี่หมองหม่น
สาวเมืองอุบล น้องไม่กลับมา

ตา เหม่อ มอง
น้ำ มูลไหล หลั่ง
ไหลไปหวั่งๆ ไม่กลับหลัง คืนมา
น้อง ก็คงเหมือนกัน
ใจเจ้านั้น ดั่งสายธารา
รักเรา วันเข้าพรรษา
เดี๋ยวนี้มาเป็นอดีตแล้วเอย

ใจคนเอย คนเอย ผู้สาวเมือง บัวบาน
บ้านพี่น้อง แสนซื่อ เจ้าคือบ่คึดพ้อ
คำเว้าต่อกัน จากมื้อนั้น มื้อนั้น
โอ๊ยมื้อนั้น จนมาฮอด มื้อนี้
พี่บ่เปลี่ยนแปรไป บัดว่าใจของนาง
ซ่างมาโอ๊ยลืม อ้าย",ble_patumrach
อยากซูนคิง,/music/thailyric/18736,"โอ้จั่งแม่นงามแทะละครับ
ซะมาเป็นตาฮักคักแทะเด้
อยากจับอยากซูนอยากบายเบิ่งเด้ เฮ้
ป้าดจั่งแม่นสวดจู่นฟูน

ขอคำเบิ่งคิงแหน่ผู้สาว
ทรงเป็นสีหนาวๆ บ่ล่ะนาง
เป็นห่วงอาการปอดของนาง
คือจั่งละเป็นสีบวมๆ

อ้ายเป็นห่วงดอกคำแพงน้องหล่า
กะสิเลิฟแหน่อยู่ฮันหล่าน่ารักป่านนี้
ตั้งแต่เกิดมา ไม่เคยพ้ออะไรแบบนี้
อดใจบ่ได้อีหลี มันฮักเจ้าหลาย

อ้ายอยากคำคิงน้อง
ให้อ้ายบายเบิ่งแหน่น้องหล่า
โพดโพสา อะไรขนาดนี้
อ้ายอยากซูนคิงเจ้า
กะคนน่ารักมันเลยฮักมักอีหลี
บ่ได้คิดหยังเกินกว่านี้ เชื่ออ้าย

เหลียวเบิ่งหม่องใด๋กะมีแต่หม่องเป็นซัง
อยากจับอยากซูนอยากบายในความงามของนาง
บ่ได้คิดเลย บ่ได้คิดหยัง
คั้นเจ้าบ่รังเกียจ อ้ายอยากชวนเจ้าไปนั่ง
ใต้ตล่างเฮี่อนอ้ายจัดคราว
ได้บ้อน้อหล่าเอ้ย

โอ้จั่งแม่นงามแทะละครับ
ซะมาเป็นตาฮักคักแทะเด้
อยากจับอยากซูนอยากบายเบิ่งเด้ เฮ้
ป้าดจั่งแม่นสวดจู่นฟูน

ขอคำเบิ่งคิงแหน่ผู้สาว
ทรงเป็นสีหนาวๆ บ่ล่ะนาง
เป็นห่วงอาการปอดของนาง
คือจั่งละเป็นสีบวมๆ

อ้ายเป็นห่วงดอกคำแพงน้องหล่า
กะสิเลิฟแหน่อยู่ฮันหล่าน่ารักป่านนี้
ตั้งแต่เกิดมา ไม่เคยพ้ออะไรแบบนี้
อดใจบ่ได้อีหลี มันฮักเจ้าหลาย

อ้ายอยากคำคิงน้อง
ให้อ้ายบายเบิ่งแหน่น้องหล่า
โพดโพสา อะไรขนาดนี้
อ้ายอยากซูนคิงเจ้า
กะคนน่ารักมันเลยฮักมักอีหลี
บ่ได้คิดหยังเกินกว่านี้ เชื่ออ้าย

อ้ายอยากคำคิงน้อง
ให้อ้ายบายเบิ่งแหน่น้องหล่า
โพดโพสา อะไรขนาดนี้
อ้ายอยากซูนคิงเจ้า
กะคนน่ารักมันเลยฮักมักอีหลี
บ่ได้คิดหยังเกินกว่านี้ เชื่ออ้าย

เหลียวเบิ่งหม่องใด๋กะมีแต่หม่องเป็นซัง
อยากจับอยากซูนอยากบายในความงามของนาง
บ่ได้คิดเลย บ่ได้คิดหยัง
คั้นเจ้าบ่รังเกียจ อ้ายอยากชวนเจ้าไปนั่ง
ใต้ตล่างเฮี่อนอ้ายจัดคราว
ได้บ้อน้อหล่าเอ้ย",ble_patumrach
อะลาดิน,/music/thailyric/16285,"ท้องฟ้าและทะเลทราย ดินแดนที่สายลมพา
ให้โชคชะตาเปลี่ยนชีวิตคนหนึ่งคน
หนุ่มน้อยผู้ต้อยต่ำ เจ้าหญิงผู้สูงศักดิ์
ก่อกำเนิดหนึ่งความรักดังเวทย์มนตร์

โอ้ อะลาดิน  โอ้ อะลาดิน
เหินบินไปกับพรม ผ่านอาทิตย์จันทรา
สู่ขอบฟ้าอันกว้างไกล ไปกับสายลม

เหนือพื้นทรายอันกว้างใหญ่ อันตรายที่ต้องเจอ
ขอแค่มีเธอ อยู่เคียงข้างกันไม่ห่างไป
เป็นพลังให้ฟันฝ่า ไม่ว่ายากสักเท่าไร
ดวงดาวแสนไกล ก็จะไปคว้ามันมาให้เธอ

จะมีพายุสุดโหด ผจญพ่อมดจอมเลว
ให้จมกองทรายไต่หุบเหวก็จะไป
ตะเกียงมียักษ์อยู่ อาบูเจ้าเพื่อนยาก
อุปสรรคกี่ขวากหนามไม่ถอดใจ

โอ้ อะลาดิน  โอ้ อะลาดิน
เหินบินไปกับพรม ผ่านอาทิตย์จันทรา
สู่ขอบฟ้าอันกว้างไกล ไปกับสายลม

เหนือพื้นทรายอันกว้างใหญ่ อันตรายที่ต้องเจอ
ขอแค่มีเธอ อยู่เคียงข้างกันไม่ห่างไป
เป็นพลังให้ฟันฝ่า ไม่ว่ายากสักเท่าไร
ดวงดาวแสนไกล ก็จะไปคว้ามันมาให้เธอ

เหนือพื้นทรายอันกว้างใหญ่ อันตรายที่ต้องเจอ
ขอแค่มีเธอ อยู่เคียงข้างกันไม่ห่างไป
เป็นพลังให้ฟันฝ่า ไม่ว่ายากสักเท่าไร
ดวงดาวแสนไกล ก็จะไปคว้ามา

เหนือพื้นทรายอันกว้างใหญ่ อันตรายที่ต้องเจอ
ขอแค่มีเธอ อยู่เคียงข้างกันไม่ห่างไป
เป็นพลังให้ฟันฝ่า ไม่ว่ายากสักเท่าไร
ดวงดาวแสนไกล ก็จะไปคว้ามันมาให้เธอ",ble_patumrach
อ้ายมีเหตุผล,/music/thailyric/12038,"ฮักที่เจ้าให้มา มันมีค่าสำหรับโตอ้าย
อ้ายบ่เคย สิทำร้ายมัน
อ้ายนี้แค่เพียงเจียมตัว ก่อนทูนหัวสิมาพัวพัน
โปรดอย่ามาถิ่มความฝัน ที่อ้ายเลยหนา

บ่เคยให้ใจกับไผ ทั้งหัวใจกะมีแต่เจ้า
ผู้แส่ ผู้สาว บ่เคยสิหัวซา
แต่ต้องยอมรับความเป็นจริง เพื่อผู้หญิงที่อ้ายเห็นค่า
ให้คนใหม่ที่เขาเข้ามา ดูแลให้ดี

สำหรับอ้ายแล้วเจ้านั้นมีค่า ที่ผ่านมาอ้ายฮักเจ้าจริง
ให้เกียรติน้องเป็นผู้หญิง ที่อ้ายนั้นมี
อยากเอ่ยปากเรียกเธอว่าแฟน เดินควงแขนสักครั้งก็ยังดี
อยากให้ฮู้ว่าที่เฮ็ดแบบนี้ อ้ายมีเหตุผล

บ่เคยให้ใจกับไผ ทั้งหัวใจกะมีแต่เจ้า
ผู้แส่ ผู้สาว บ่เคยสิหัวซา
แต่ต้องยอมรับความเป็นจริง เพื่อผู้หญิงที่อ้ายเห็นค่า
ให้คนใหม่ที่เขาเข้ามา ดูแลให้ดี

สำหรับอ้ายแล้วเจ้านั้นมีค่า ที่ผ่านมาอ้ายฮักเจ้าจริง
ให้เกียรติน้องเป็นผู้หญิง ที่อ้ายนั้นมี
อยากเอ่ยปากเรียกเธอว่าแฟน เดินควงแขนสักครั้งก็ยังดี
อยากให้ฮู้ว่าที่เฮ็ดแบบนี้ อ้ายมีเหตุผล

แค่อยากบอกให้น้องเข้าใจ อ้ายบ่เคยคบใครหลายคน
มีแต่เจ้าผู้เดียวหน้ามล เชื่อใจอ้ายเด้อ
อ้ายฮักเจ้าบ่ได้อีหลี ทั้งที่ใจนั้นมีแต่เธอ
ยังหวังดีกับน้องเสมอ บ่เคยเปลี่ยนใจ

ยังหวังดีกับน้องเสมอ บ่เคยรักใคร",ble_patumrach
อ้ายเฮ็ดทุกวิถีทาง อยากได้นางเป็นเมีย,/music/thailyric/13509,"อ้ายเฮ็ดทุกวิถีทาง
อยากได้นางเป็นเมีย
แต่สุดท้ายกะเสีย ให้เขาไป

สองเฮาเกิดมาเป็นคนที่ฮู้จัก
บ่ได่เกิดมาเป็นคนฮู้ใจ
อิหยังหลาย สองเฮาเกิดมา
ได้พบได้เดินได้ย่างใกล้ บ่ได้เว้าบ่ได่
อธิบายบายอิหยังกับนาง
สองเฮาเกิดมาได้พ้อได้แค่รอได้แค่หวัง
สุดท้าย สุดท้าย ต้องผิดหวัง อ้ายจริงจังบ่ได้

อ้ายเฮ็ดทุกวิถีทาง อยากได้นางเป็นเมีย
แต่สุดท้ายกะเสีย ให้เขาไป
จักสิเฮ็ดจั่งได่ จั่งสิได่นางคืน
อีกตัวอ้ายยิ่งฝืน ยิ่งปวดหัวใจ

ย้อนว่าอ้ายนี้บ่มีปัญญาสิไปขอเจ้า
จนทุกมื้อสุดท้าย นี้อ้ายอยากได้เจ้าเป็นได้หวัง
แค่เก็บไว้ฟัดไว้เด้าสู้เช้าของสองเฮา
บ่ได้เว่าบ่ได้จา บ่ได้เว่าอีหยังเลย
สุดท้ายนี้ อยากบอกน้องว่า อ้ายมีเงินอยู่สองร้อย
อยากได้ตัวเจ้านั้นมาเป็นเมียน้อย
สุดท้ายอ้ายต้องแห้ว สุดท้ายบ่ได่สอย
อ้ายมีแค่สองร้อยเขามีเป็นสองล้าน บักห่ามึง โอ้ย

อ้ายเฮ็ดทุกวิถีทาง อยากได้นางเป็นเมีย
แต่สุดท้ายกะเสีย ให้เขาไป
อ้ายสิเฮ็ดจั่งได่ จั่งสิได่นางคืน
อีกตัวอ้ายยิ่งฝืน ยิ่งปวดหัวใจ",ble_patumrach
ฮักมั่น,/music/thailyric/22745,"อ้ายบ่าวอีสาน อยากเว่ากับสาวฝรั่ง
ฝรั่งอีหยัง น้องเป็นลูกครึ่งเมืองไทย
แม่นอีหลีบ่ ว่าแต่บ้านน้องอยู่ไส
สวิตเซอร์แลนด์เมืองใหญ่ ลูกครึ่งร้อยเอ็ดเมืองงาม

อ้ายอยากฝึกภาษา อยากเว่าฝรั่งกับเจ้า
น้องสิสอนเว่า ส่วนอ้ายสอนเว่าอีวาน
กะเว่าเป็นอยู่เด้ คนก็น่าฮักเสียงเว่าแฮงหวาน
อ้ายกะหวานบ่แพ้กัน ผู้บ่าวอีสานเมืองไทย

I love you เด้อนาง
บ่ต้องเว่าฝรั่ง น้องอยากฟังภาษาของอ้าย
คือน่าฮักแท้ พ่อกับแม่เจ้าเลี้ยงมาจั่งใด๋
คงเลี้ยงคือกันกับอ้าย ถึงได้ลูกชายน่าฮัก

โอ๊ยถือใจเด้ อยากสิเปย์ทุกอย่างให้เจ้า
น้องคงบ่เอา ขอแค่หัวใจส่ำนั้น
เว่าอีหลีบ่ อีหลีล่ะเนาะขอแค่ฮักกัน
ขอมีสายใยฮักมั่น ฮักกันชั่วนิรันดร

I love you เด้อนาง
บ่ต้องเว่าฝรั่ง น้องอยากฟังภาษาของอ้าย
คือน่าฮักแท้ พ่อกับแม่เจ้าเลี้ยงมาจั่งใด๋
คงเลี้ยงคือกันกับอ้าย ถึงได้ลูกชายน่าฮัก

โอ๊ยเขินอยู่เด้ อยากสิเปย์ทุกอย่างให้เจ้า
น้องคงบ่เอา ขอแค่หัวใจส่ำนั้น
เว่าอีหลีบ่ อีหลีล่ะเนาะขอแค่ฮักกัน
ขอมีสายใยฮักมั่น ฮักกันชั่วนิรันดร

ขอมีสายใยฮักมั่น ฮักกันชั่วนิรันดร",ble_patumrach
เฮ็ดทุกวิถีทาง,/music/thailyric/14433,"อ้ายเฮ็ดทุกวิถีทาง อยากได้นางเป็นเมีย
แต่สุดท้ายกะเสียให้เขาไป

เฮาเกิดมาเป็นคนแค่ฮู้จัก
บ่ได้เกิดมาเป็นคนฮู้ใจอีหยังหลาย
เฮาเกิดมาได้พ้อได้อย่างกาย
บ่ได้เว้าอธิบาย อีหยัง อีหยัง

อ้ายเกิดมาเสือกบุญบ่พอ
ได้แต่รอได้แต่หวังสุดท้าย
สุดท้าย ก็ผิดหวัง จริงจังบ่ได้

อ้ายเฮ็ดทุกวิถีทาง อยากได้นางเป็นเมีย
แต่สุดท้ายกะเสียให้เขาไป
จักสิเฮ็ดจังใด๋ จังสิได้นางคืน
ยิ่งโตอ้ายยิ่งฝืนยิ่งปวดหัวใจ

อ้ายกะอยากสิเป็นเศรษฐี
แต่ว่าฐานะที่มีเป็นแค่เศษไง
คั่นแม่นอ้ายได้ไปเกิดอยู่ดูไบ
กะอยากสิเป็นเจ้าชายมีเงินพันล้าน
แต่สุมื้อนี้อ้ายกะภูมิใจ
เกิดชาติไทยภาคอีสาน
หน้าตา หน้าตาบ้านๆ ที่ฮักเจ้า

อ้ายเฮ็ดทุกวิถีทาง อยากได้นางเป็นเมีย
แต่สุดท้ายกะเสียให้เขาไป
จักสิเฮ็ดจังใด๋ จังสิได้นางคืน
ยิ่งโตอ้ายยิ่งฝืนยิ่งปวดหัวใจ

Ok baby กะย้อนว่าอ้ายนั้น
มันซอมเจ้ามาตั้งแต่น้อย
แต่สุดท้ายกะต้องผิดหวัง
ย้อนอ้ายมีเงินแค่สองร้อย
จักละสิเฮ็ดจังใด๋กะย้อนชีวิตมีปมด้อย
กะได้แต่ถ่ากะได้คอยได้แต่หวังไปมื้อๆ

บัดเขาคนนั้นมีหลายล้านพร้อมที่ดิน
มีทั้งรถเก๋งทั้งเรือยอร์ช ทั้งรถสปอร์ต ทั้งเครื่องบิน
เอ้าโตเฮามีสองร้อยพอซื้อเหล้าขาวไว้นั่งกิน
ให้เซาเว้าให้ฟ้าวริน มันผิดหวัง ผิดหวัง

อ้ายเฮ็ดทุกวิถีทาง อยากได้นางเป็นเมีย
แต่สุดท้ายกะเสียให้เขาไป
จักสิเฮ็ดจังใด๋ จังสิได้นางคืน
ยิ่งโตอ้ายยิ่งฝืนยิ่งปวดหัวใจ

อ้ายเฮ็ดทุกวิถีทาง อยากได้นางเป็นเมีย
แต่สุดท้ายกะเสียให้เขาไป
จักสิเฮ็ดจังใด๋ จังสิได้นางคืน
ยิ่งโตอ้ายยิ่งฝืนยิ่งปวดหัวใจ

โว โห้ ยิ่งปวดหัวใจ",ble_patumrach
