song_name,href,lyric,artist
ไปหาทำ (Active),/music/thailyric/20712,"ตื่นมาตอนเช้าไม่ออกไปหาเธอ
เย็นเหรอฉันออกไปหาทำ
ก็ใช้ชีวิตประจำ ตื่นค่ำนอนเช้า

เธอบอกว่าฉันน่ะไม่ค่อยสนเธอ
ใช่เหรอที่บอกว่าทำงาน
เข้าใจว่าฉันรำคาญ โถ่เธอ

ฉันมีอะไรตั้งมากมายที่ต้องทำ
ร่างกายเริ่มเหนื่อย
ส่งสัญญาณว่าเริ่มพัง
ทิ้งให้เธอรอมาตั้งนานหลายวัน
กลับกันแล้วฉันนั้นมีอะไรบอกเธอ

ถ้ามีเวลาก็มาหากันหน่อย
จับมือกันแล้วห้ามปล่อย
อยากจะเจอหน้าเธอบ่อยกว่านี้

(ไปหาทำ)
ให้เธอช่วยชาร์จชีวิตแล้วไปต่อ
นับวันรอทุกนาที
ใกล้เธอมันดีที่สุดเลย

Come on baby
ชาร์จชีวิต Like crazy
ให้ฉันได้เดินต่อไปโดยไม่สะดุด
ใช้ชีวิตครั้งนึง ก็ต้องเอาให้สุด

For a minute
สักนิด If you let me
มีเธอมันดีที่สุดเลย

ถ้ามีเวลาก็มาหากันหน่อย
จับมือกันแล้วห้ามปล่อย
อยากจะเจอหน้าเธอบ่อยกว่านี้

(ไปหาทำ)
ให้เธอช่วยชาร์จชีวิตแล้วไปต่อ
นับวันรอทุกนาที
ใกล้เธอมันดีที่สุดเลย

ถ้ามีเวลาก็มาหากันหน่อย
จับมือกันแล้วห้ามปล่อย
อยากจะเจอหน้าเธอบ่อยกว่านี้

(ไปหาทำ)
ให้เธอช่วยชาร์จชีวิตแล้วไปต่อ
นับวันรอทุกนาที
ใกล้เธอมันดีที่สุดเลย

ถ้ามีเวลาก็มาหากันหน่อย
จับมือกันแล้วห้ามปล่อย
อยากจะเจอหน้าเธอบ่อยกว่านี้

(ไปหาทำ)
ให้เธอช่วยชาร์จชีวิตแล้วไปต่อ
นับวันรอทุกนาที
ใกล้เธอมันดีที่สุดเลย",bowkylion
ผิดไหม,/music/thailyric/23674,"ฉันไม่รู้เลยจริงๆ
ว่าความรักของเธอนั้นจริงหรือเปล่า
ช้ำเพราะรักครั้งเก่าๆ
จนหวาดกลัวที่จะมีใคร

จนเธอได้เดินเข้ามา ในใจที่เคยอ่อนล้า
ต้องมาแปรปรวนหวั่นไหวเพราะเธอ

ผิดไหม ถ้าหากจะรักเธอฉันทำผิดไหม
มันจะผิดซ้ำรอยแผลเดิมอีกไหม
ไม่อยากช้ำซ้ำๆ เรื่องเดิมอย่างเคยเป็นมา

ผิดไหม ถ้าหากตัวฉันทำตามใจปรารถนา
เธอจะรักฉันจริงหรือต้องมีน้ำตา
ตอบได้ไหมว่าฉันควรทำ อย่างไร

ฉันต้องเสียใจจนชิน อีกกี่ครั้งหัวใจถึงเจอความสุข
ฉันต้องทุกข์ทรมาน อยู่อย่างนี้ไปนานแค่ไหน

เมื่อเธอได้เดินเข้ามา ในใจเริ่มมีปัญหา
ไม่รู้ว่าควรจะทำเช่นไร

ผิดไหม ถ้าหากจะรักเธอฉันทำผิดไหม
มันจะผิดซ้ำรอยแผลเดิมอีกไหม
ไม่อยากช้ำซ้ำๆ เรื่องเดิมอย่างเคยเป็นมา

ผิดไหม ถ้าหากตัวฉันทำตามใจปรารถนา
เธอจะรักฉันจริงหรือต้องมีน้ำตา
ตอบได้ไหมว่าฉันควรทำ อย่างไร

ผิดไหม ถ้าหากจะรักเธอฉันทำผิดไหม
มันจะผิดซ้ำรอยแผลเดิมอีกไหม
ไม่อยากช้ำซ้ำๆ เรื่องเดิมอย่างเคยเป็นมา

ผิดไหม ถ้าหากตัวฉันทำตามใจปรารถนา
เธอจะรักฉันจริงหรือต้องมีน้ำตา
ตอบได้ไหมว่าฉันควรทำ อย่างไร

สุดท้ายคงต้องรักเธอใช่ไหม",bowkylion
ยิ้มมา (Crush),/music/thailyric/18834,"ขอโทษนะคะที่คุณมองหน้า
ไม่ทราบว่าคุณมีปัญหาอะไร
ขอโทษนะคะฉันแค่สงสัย
ว่าคุณน่ะเป็นอะไรมากไหมเอ่ย

ขอโทษนะคะที่คุณสบตา
ไม่ทราบว่าคุณมีปัญญาไหม
จะรับผิดชอบใจฉันยังไงคะคุณ

เดินอยู่ดีๆ ต้องมาใจสั่น
มองจากไกลๆ เล่นๆ ทุกวัน
ดูจากตรงนี้ฉันเองก็พอรู้ดี
(ไม่มีวัน)

เธอคงมีใครที่เขาสำคัญ
ฉันอยู่กับเธอแค่ในความฝัน
แค่เพียงเธอยิ้มมา
ไม่ต้องการสายตาใดอีก

ขอมองเธอแค่เพียงได้เห็นและสบตา
นี่ใจฉันนะได้โปรดรับไว้
ตกเป็นจำเลยในคดีจำนองใจของเธอ

ขอโทษนะคะที่คุณมองหน้า
ไม่ทราบว่าคุณมีปัญหาอะไร
ขอโทษนะคะฉันแค่สงสัย
ว่าคุณน่ะเป็นอะไรมากไหมเอ่ย

ขอโทษนะคะที่คุณสบตา
ไม่ทราบว่าคุณมีปัญญาไหม
จะรับผิดชอบใจฉันยังไงคะคุณ

ทำใจฉันเสียควรจะเคลียร์กันให้ดี
ขออนุญาตแจ้งคุณคู่กรณี
จ่ายมาค่าทำขวัญแค่เพียงคุณจับมือฉัน
ยินดียอมความโดยไม่ต้องพยายาม

ตามองคุณได้แต่ใจไร้วาสนา
เห็นเขาทีไรได้แต่เซ็งและอิจฉา
จะเอายังไงคะ อยากจะมีปัญหา
กับคุณเป็นการส่วนตัว

ขอโทษนะคะที่คุณมองหน้า
ไม่ทราบว่าคุณมีปัญหาอะไร
ขอโทษนะคะฉันแค่สงสัย
ว่าคุณน่ะเป็นอะไรมากไหมเอ่ย

ขอโทษนะคะที่คุณสบตา
ไม่ทราบว่าคุณมีปัญญาไหม
จะรับผิดชอบใจฉันยังไงคะคุณ",bowkylion
รอ,/music/thailyric/18134,"รับฟัง เรื่องราว ที่เกิดขึ้นนั้น เมื่อเธอเจ็บช้ำ เพราะรักที่เปลี่ยนไป
รู้ดี ฉันเอง ที่รอมานาน ให้เธอเปิดใจ และรับมันเอาไว้

วันเวลานานเท่าไร ที่รักเก่าๆ ยังคงจะทำร้าย
เธอยังมองไม่เห็นใคร ที่ห่วงใยกันอย่างนี้มานาน
ตัวเธอเองยังต้องการเวลาก่อน
เฝ้ามองดูเธอที่ไกลห่าง อาจจะมีสักวัน

รอนานๆ ก็อาจจะบั่นทอนหัวใจ อย่าให้นานเกินไป
ก่อนอะไรมันอาจจะสาย
รอนานๆ ก็อาจทำให้ใจวุ่นวาย รู้ดีแต่ยังน้อยใจ
เพราะฉันเป็นคนเดียวที่รอ

ฉันเอง เข้าใจ ก็คงต้องใช้เวลา หากรักยังพอจะมีหวัง
ทุกลม หายใจ เธอรู้บ้างไหม มีใครที่คอยเฝ้ารักและห่วงใย

วันเวลานานเท่าไร
เธอยังมองไม่เห็นใคร ที่ห่วงใยกันอย่างนี้มานาน
ตัวเธอเองยังต้องการเวลาก่อน
เฝ้ามองดูเธอยิ่งห่าง อาจจะมีสักวัน

รอนานๆ ก็อาจจะบั่นทอนหัวใจ อย่าให้นานเกินไป
ก่อนอะไรมันอาจจะสาย
รอนานๆ ก็อาจทำให้ใจวุ่นวาย รู้ดีแต่ยังน้อยใจ
เพราะฉันเป็นคนเดียวที่รอ

รอนานๆ ก็อาจจะบั่นทอนหัวใจ อย่าให้นานเกินไป
ก่อนอะไรมันอาจจะสาย
รอนานๆ ก็อาจทำให้ใจวุ่นวาย รู้ดีแต่ยังน้อยใจ
เพราะฉันเป็นคนเดียว ที่รอ",bowkylion
รักคืน,/music/thailyric/22219,"รู้ รู้ว่าเราต่าง
รู้ไม่ควรมีเธอข้าง ๆ
จะรักได้อย่างไร

แม้ฉันต้องข้ามไป
แต่ยิ่งฉันได้ใกล้เธอเท่าไร
ไม่สามารถหยุดหัวใจ

จากนี้ ที่ฉันได้มีเธออยู่
ไม่ว่าเพราะสิ่งใด
อยากจะใช้ทุกเวลาที่มีกับเธอคนนี้

กอดฉันไว้ให้นาน
ปล่อยวันคืนให้พ้นและเลยผ่าน
ราวกับเรานั้นฝันไป
กอดรักไว้ข้างกาย
ไม่ต้องการจุดหมายอื่น
แค่เพียงฉันได้รักเธอ และเธอรักคืน

ยิ่งกว่าฝัน แค่วันนี้ฉันไม่ต้องตื่น
ได้ยืนอยู่ข้างเธอจริงๆ
แค่ได้มีเธอเคียง
ทุกเรื่องราวฉันพร้อมเสี่ยง
ไม่ว่าเจออะไร

จากนี้ ที่ฉันได้มีเธออยู่
ไม่ว่าเพราะสิ่งใด
อยากจะใช้ทุกเรื่องราวที่มีกับเธอคนนี้

กอดฉันไว้ให้นาน
ปล่อยวันคืนให้พ้นและเลยผ่าน
ราวกับเรานั้นฝันไป
กอดรักไว้ข้างกาย
ไม่ต้องการจุดหมายอื่น
แค่เพียงฉันได้รักเธอ และเธอรักคืน

ยิ่งกว่าฝัน แค่วันนี้ฉันไม่ต้องตื่น
ได้ยืนอยู่ข้างเธอจริงๆ

กอดฉันไว้ให้นาน
ปล่อยวันคืนให้พ้นและเลยผ่าน
ราวกับเรานั้นฝันไป
กอดรักไว้ข้างกาย
ไม่ต้องการจุดหมายอื่น
แค่เพียงฉันได้รักเธอ และเธอรักคืน

ยิ่งกว่าฝัน แค่วันนี้ฉันไม่ต้องตื่น
ได้ยืนอยู่ข้างเธอจริงๆ",bowkylion
ลงใจ,/music/thailyric/17445,"ปลอบใจตัวเองว่าฉันมาไกลเกินย้อนไป
เหนื่อยแทบไม่ไหว และน้ำตายังไหลนอง
สิ่งที่ประคอง กลับค่อยๆ ไกลจนลับไป
จนมีแค่ฉันคนเดียวเท่านั้น ที่ยังคงกอดมันไว้

จะหลุดพ้นเมื่อไร ทำไมอยู่ตรงนี้
ถามตัวเองซ้ำๆ ไม่เข้าใจสักที

โอ๊ย เจ็บไปทั้งหัวใจทำไมยังทน
เริ่มใหม่อีกกี่หนนะคนใจร้าย
ปวดไปทั้งหัวใจแทบเจียนตาย
ขาดเธอไม่ได้ เพราะฉันนั้นลงใจให้เธอ

สิ่งที่เธอทำ กลับย้ำให้ฉันยิ่งเข้าใจ
เจ็บไปทำไม อยากหนีให้ไกลสักที
แต่เมื่อได้มองดวงดาว และเห็นว่ามันสวยดี
ใจมันกลับคิด จะดีกว่าไหมถ้ามีเธออยู่ตรงนี้

จะหลุดพ้นเมื่อไร ทำไมอยู่ตรงนี้
ถามตัวเองซ้ำๆ ไม่เข้าใจสักที

โอ๊ย เจ็บไปทั้งหัวใจทำไมยังทน
เริ่มใหม่อีกกี่หนนะคนใจร้าย
ปวดไปทั้งหัวใจแทบเจียนตาย
ขาดเธอไม่ได้ เพราะฉันนั้นลงใจให้เธอ

แม้ว่าเธอจะทำให้ช้ำเท่าไร
ฉันยังมีใจ
แม้ว่าใคร ต่อให้ฉุดรั้งเท่าไร
ฉันยังลงใจให้เธอ

โอ๊ย เจ็บไปทั้งหัวใจทำไมยังทน
เริ่มใหม่อีกกี่หนนะคนใจร้าย
ปวดไปทั้งหัวใจแทบเจียนตาย
ขาดเธอไม่ได้ เพราะฉันนั้นลงใจให้เธอ",bowkylion
เอาเลย (Whatever),/music/thailyric/12204,"ล้าเกินขยับ รับความจริงไม่ไหว
เมื่อหัวใจเธอไปกับคนนั้น
ฝันเกินจะตื่น ฝืนเกินจะหลับใหล
ร้อนเหมือนไฟ ราดไปด้วยน้ำมัน

ช้ำเกินรู้สึก นึกก็ทนไม่ไหว
แผลข้างใน ขึ้นใหม่แทบไม่ทัน
บ้าบอขมขื่น ชื่นอุรากว่าใคร
นี่หัวใจ เอาไปเหยียบเลยแล้วกัน

อดทนไว้ก่อน นะใจฉัน
อีกสักพักมัน จะค่อยๆ ช้ำจนเจียนตาย
เตรียมตัวไว้ก่อน นะตัวฉัน
อีกไม่นานมัน ก็คงยังไม่หาย

เอาเลย เอาเลย จะทำอะไรก็ทำนะ
เชิญเลย เชิญเลย มาเหยียบย่ำตรงหัวใจ
มาเลย มาเลย ถ้ายังไม่สาแก่ใจ
ก็เชิญชวนเขา มาช่วยกันทำร้าย
เอาให้ตายเลย

อดทนไว้ก่อน นะใจฉัน
อีกสักพักมัน จะค่อยๆ ช้ำจนเจียนตาย
เตรียมตัวไว้ก่อน นะตัวฉัน
อีกไม่นานมัน ก็คงยังไม่หาย

เอาเลย เอาเลย จะทำอะไรก็ทำนะ
เชิญเลย เชิญเลย มาเหยียบย่ำตรงหัวใจ
มาเลย มาเลย ถ้ายังไม่สาแก่ใจ
ก็เชิญชวนเขา มาช่วยกันทำร้าย
เอาให้ตายเลย

เอาเลย เอาเลย จะทำอะไรก็ทำนะ
เชิญเลย เชิญเลย มาเหยียบย่ำตรงหัวใจ
มาเลย มาเลย ถ้ายังไม่สาแก่ใจ
ก็เชิญชวนเขา มาช่วยกันทำร้าย
เอาให้ตายเลย",bowkylion
