song_name,href,lyric,artist
คิดถึงแต่ (Untold),/music/thailyric/17614,"คิดถึงแต่ต้องทน
เพราะเราสองคน
ไม่ได้เป็นอะไรกัน

รักเธออยู่ทุกวัน แค่ไม่เคยเอ่ย
ยังไม่อยากเฉลยไว้เธอค่อยเข้าใจ

ไม่ว่าเธอจะไปไหน ฉันก็ไปกับเธอทุกที่เลย
ไม่ว่าเธอจะเจอใคร ฉันจะคอยรับฟังอยู่เฉยๆ
จะให้เป็นที่ปรึกษา มีไว้คอยแก้ปัญหา
ล้าหัวใจ แค่ซบตรงไหล่

บางครั้งเราต้องห่างไกล
กลัวว่าเธออาจสงสัย
และถามมา อย่ารู้ดีกว่า

คิดถึงแต่ต้องทน
เพราะเราสองคน
ไม่ได้เป็นอะไรกัน

รักเธออยู่ทุกวัน แค่ไม่เคยเอ่ย
ยังไม่อยากเฉลยไว้เธอค่อยเข้าใจ

แค่ในบางทีเมฆบนฟ้านั้นดูหม่น
แต่ไม่อาจปล่อยฝนลงมาให้เป็นสาย
รักแค่ในใจเก็บเอาไว้ไม่ง่ายดาย
เคียงข้างกายถึงแม้มีใครข้างๆ เธอ

คิดถึงแต่ต้องทน
เพราะเราสองคน
ไม่ได้เป็นอะไรกัน

รักเธออยู่ทุกวัน แค่ไม่เคยเอ่ย
ยังไม่อยากเฉลยไว้เธอค่อยเข้าใจ

คิดถึงแต่ต้องทน (คิดถึงเธอเหลือเกิน)
รักเธออยู่ทุกวัน (เก็บเธอในใจ)
(และไม่บอกใคร มีเธอเท่านั้น)
แต่เป็นเพียงแค่ฝันฉันคงต้องเข้าใจ",bowkylion
คือราย (So What),/music/thailyric/17116,"เธอบอกไม่ได้คิดอะไรกับฉัน
แล้วที่เราคุยกันทุกวัน
คำสัญญาทุกความผูกพัน
นั้นคือราย

เธอบอกไม่ได้เป็นอะไรกับฉัน
ไม่เข้าใจในความสัมพันธ์
แต่เธอก็ยังไม่ไปจากฉัน
งั้นยังงาย

ไม่ได้ตั้งใจจะเรียกร้อง
สถานะของเราทั้งสอง
ฉันเคยลองหายไป เธอทักมา
ไม่ใช่แค่เพื่อนคุยธรรมดา

เฝ้าโทรหาว่าอยู่ที่ไหน
เธอคอยหวงว่าไปกับใคร
ให้มาลองคบกันเธอไม่เอา
หรือที่จริงแล้วฉันเป็นแค่เงา

เธอบอกไม่ได้คิดอะไรกับฉัน
แล้วที่เราคุยกันทุกวัน
คำสัญญาทุกความผูกพัน
นั้นคือราย

เธอบอกไม่ได้เป็นอะไรกับฉัน
ไม่เข้าใจในความสัมพันธ์
แต่เธอก็ยังไม่ไปจากฉัน
งั้นยังงาย

สิ่ง สิ่งที่เหลือคือความรัก
ที่มันยังคงคลุมเครือสุดหัวใจ
จริงจริงก็รู้ว่าตัวฉันนั้นมันไม่เคยจะเป็นคนที่ใช่
ทุกวันเธอยังคุยกับฉันอยู่ all night
ทั้งที่จริง ใจเธอรักใครอยู่ สงสัย
แต่ฉันยังคงรักเธอ มันรักเธออยู่ทั้งหัวใจ

เธอบอกไม่ได้คิดอะไรกับฉัน
แล้วที่เราคุยกันทุกวัน
คำสัญญาทุกความผูกพัน
นั้นคือราย

เธอบอกไม่ได้เป็นอะไรกับฉัน
ไม่เข้าใจในความสัมพันธ์
แต่เธอก็ยังไม่ไปจากฉัน
งั้นยังงาย",bowkylion
คืออะไร,/music/thailyric/13466,"บางวันก็ดี บางทีก็ร้าย ร้ายยิ่งกว่าใคร
จนบางครั้งมันไม่อาจเข้าใจ
ในวันที่ดีก็ดีใจหาย รักยิ่งกว่าใคร
แค่เพียงไม่นานก็ทำร้ายใจ

บอกให้รู้ฉันเริ่มหมดแรง คาดเดาใจเธอไม่ได้
บอกได้ไหม ที่จริง เป็นเช่นไร

อยากรู้คำว่ารัก จากปากเธอนั้นคืออะไร
ตกลงความจริงมันเป็นยังไง หรือทำเป็นแกล้งหลอกฉัน
เจ็บลึกที่เธอทำ อย่างกับเราไม่เคยรักกัน
จะเจ็บยังไงในใจของฉัน ก็ยังจะเป็น
คนคนนี้ ที่รักเธอจนหมดใจ

เธอเป็นเช่นไร ก็ยังจะรัก
รักเธอต่อไป ถึงบางครั้งมันจะต้องเสียใจ

บอกให้รู้ฉันเริ่มหมดแรง คาดเดาใจเธอไม่ได้
บอกได้ไหม ที่จริง เป็นเช่นไร

อยากรู้คำว่ารัก จากปากเธอนั้นคืออะไร
ตกลงความจริงมันเป็นยังไง หรือทำเป็นแกล้งหลอกฉัน
เจ็บลึกที่เธอทำ อย่างกับเราไม่เคยรักกัน
จะเจ็บยังไงในใจของฉัน ก็ยังจะเป็น
คนคนนี้ ที่รักเธอจนหมดใจ

อยากรู้คำว่ารัก จากปากเธอนั้นคืออะไร
ตกลงความจริงมันเป็นยังไง หรือทำเป็นแกล้งหลอกฉัน
เจ็บลึกที่เธอทำ อย่างกับเราไม่เคยรักกัน
จะเจ็บยังไงในใจของฉัน ก็ยังจะเป็น
คนคนนี้ ที่รักเธอจนหมดใจ
ที่รักเธอตลอดไป",bowkylion
ใครอีกคน,/music/thailyric/13183,"เหมือนฉันกำลังหมดแรงอยู่
เมื่อเธอนั้นเดินจากไป
เพราะใครคนหนึ่งที่เข้ามา
และทำให้เธอเปลี่ยนไป

หากว่าเธอมีใครอีกคน
และเขาดูแลเธอดีเหลือเกิน
ไม่เป็นไรฉันพร้อมยอมปล่อยมือ
แต่ถ้าวันหนึ่งเธอต้องเจออะไรร้ายๆ
ก็ขอให้เธอเข้าใจ
และจำไว้ว่าเธอ
มีฉันยืนรอที่เดิม

แม้ใจยังคงอ่อนไหวอยู่
ที่รู้ว่าเธอต้องไป
ฉันขอให้เธอได้ลองคิดดูใหม่
หากเธอแน่ใจ
หากเธอจะไป ฉันพร้อม

หากว่าเธอมีใครอีกคน
และเขาดูแลเธอดีเหลือเกิน
ไม่เป็นไรฉันพร้อมยอมปล่อยมือ
แต่ถ้าวันหนึ่งเธอต้องเจออะไรร้ายๆ
ก็ขอให้เธอเข้าใจ
และจำไว้ว่าเธอ
มีฉันยืนรอที่เดิม

หากว่าเธอมีใครอีกคน
และเขาดูแลเธอดีเหลือเกิน
ไม่เป็นไรฉันพร้อมยอมปล่อยมือ
แต่ถ้าวันหนึ่งเธอต้องเจออะไรร้ายๆ
ก็ขอให้เธอเข้าใจ
และจำไว้ว่าเธอ
มีฉันยืนรอที่เดิม",bowkylion
ใจร้าย,/music/thailyric/11335,"คำร้อง ณรงค์วิทย์ เตชะธนะวัฒน์
ทำนอง/เรียบเรียง พลังกร เหนือวงศ์

อยู่ดีๆ ก็มารังแก ให้ฉันแพ้ฉันเสียใจ
อยู่ดีๆ ก็มาทำลาย ความเข้มแข็ง ศักดิ์ศรีที่ฉันเคยมี

บอก บอกกันได้ไหมสักคำ
ฉันผิด ผิดอะไรหรือ

อยากรู้ใจเธอ มีเหตุผลอะไร
ใจร้ายเธอใจร้ายเหลือเกิน ช่วยบอกกันให้รู้ความจริง
ว่ามันคืออะไร และฉันไปทำอะไรให้เธอต้องช้ำต้องเจ็บหัวใจ
ถึงได้ทำกันอย่างนี้

หากเกลียดกันแล้วมาทำไม อย่าเจอกันไปเลยคงดี
ไม่เข้าใจท่าทีที่มี มันสับสนไม่รู้จะคิดยังไง

บอก บอกกันได้ไหมสักคำ
ฉันผิด ผิดอะไรหรือ

อยากรู้ใจเธอ มีเหตุผลอะไร
ใจร้ายเธอใจร้ายเหลือเกิน ช่วยบอกกันให้รู้ความจริง
ว่ามันคืออะไร และฉันไปทำอะไรให้เธอต้องช้ำต้องเจ็บหัวใจ
ถึงได้ทำกันอย่างนี้

บอก บอกกันได้ไหมสักคำ
ฉันผิด ผิดอะไรหรือ

อยากรู้ใจเธอ มีเหตุผลอะไร
ใจร้ายเธอใจร้ายเหลือเกิน ช่วยบอกกันให้รู้ความจริง
ว่ามันคืออะไร และฉันไปทำอะไรให้เธอต้องช้ำต้องเจ็บหัวใจ
ถึงได้ทำกันอย่างนี้",bowkylion
ซับ (Sub),/music/thailyric/20512,"เธอ เธอรอเขามา
คนที่ร่ำลาที่เค้าทำเธอเสียใจ
เจ็บ เจ็บทุกครั้งไป
ไม่ว่าเมื่อไร ที่เห็นเธอผิดหวัง

เขาไม่สนใจก็ยังจะรอ
เธอวอนขอแค่เพียงเศษหัวใจ
จากคนที่หมดเยื่อใย
ให้พูดอีกไหม คำที่เธอไม่อยากฟัง

ก็บอกแล้วไงว่าเขาไม่รัก
ก็บอกแล้วไงว่าเขาไม่สนเธอ
รอไปเหอะคนดี ทั้งว่าเธอไม่มีหวัง

ก็บอกแล้วไงว่าเขาไม่มา
คอยซับน้ำตาดูแลให้หายดี
ฉันคนนี้ ถ้าเธอรอเขาฉันจะรอเธออีกที
ตรงนี้ๆ ข้างเธอ

อีก อีกนานเท่าไร
ที่ทั้งหัวใจ เธอนั้นจะหายดี
อยู่ อยู่ข้าง ๆ เธอ รออยู่ตรงนี้
แม้รู้ดีแก่ใจ

เธอไม่รักกันและคงไม่มอง
ยอมเป็นที่สำรองเก็บน้ำตา
เมื่อเธอเจ็บจากเค้ามา
เหนื่อยหน่อยนะ ถ้าเธอยังไม่ถอดใจ

ก็บอกแล้วไงว่าเขาไม่รัก
ก็บอกแล้วไงว่าเขาไม่สนเธอ
รอไปเหอะคนดี ทั้งว่าเธอไม่มีหวัง

ก็บอกแล้วไงว่าเขาไม่มา
คอยซับน้ำตาดูแลให้หายดี
ฉันคนนี้ ถ้าเธอรอเขาฉันจะรอเธออีกที
ตรงนี้ๆ ข้างเธอ

ไม่ต้องการให้เธอเธอเอื้อนเอ่ย
เพียงทักว่าจะ อยู่ตรงนี้คอยซับน้ำตาให้เธอ
และจะไม่เสียใจ หากว่าเธอจะรักเขาต่อ
ก็ไม่เป็นไร

ก็บอกแล้วไงว่าเขาไม่รัก
ก็บอกแล้วไงว่าเขาไม่สนเธอ
รอไปเหอะคนดี ทั้งว่าเธอไม่มีหวัง

ก็บอกแล้วไงว่าเขาไม่มา
คอยซับน้ำตาดูแลให้หายดี
ฉันคนนี้ ถ้าเธอรอเขาฉันจะรอเธออีกที
ตรงนี้ๆ ข้างเธอ

ถ้าเธอรักเขา ฉันก็รักเธออยู่ดี",bowkylion
ถ้าฉันรัก,/music/thailyric/12195,"กับคนที่ไม่รัก จะดีสักเท่าไรก็แค่นั้น
จะเจอเรื่องอะไรไม่มีทางเสียน้ำตา
ไม่เคยไหวหวั่น

กับคนที่ฉันรัก ไม่เข้าใจตัวเองสักครั้ง
กี่ทีที่เธอทำให้ฉัน เสียน้ำตา สักเท่าไร
ก็ยอมหมดทั้งใจ

แค่มีเธอเข้ามาในหัวใจ
คนเข้มแข็งคนเดิมก็หายไป

เพราะรักคำเดียวเท่านั้น
ที่ทำให้ฉันนั้นต้องอ่อนไหว
ทำทุกอย่างเพื่อความรักได้ โดยไม่รู้ตัว
กับบางคนที่ทำให้เสียใจ
กลับเป็นคนคนเดียวที่ไม่อาจลืม

เพราะรักคำเดียวเท่านั้น
ที่ทำให้ฉันนั้นต้องอ่อนไหว
ทำทุกอย่างเพื่อความรักได้ โดยไม่รู้ตัว
กับบางคนที่ทำให้เสียใจ
กลับเป็นคนคนเดียวที่ไม่อาจลืม

ทำทุกอย่างเพื่อความรักได้ โดยไม่รู้ตัว
กับบางคนที่ทำให้เสียใจ
กลับเป็นคนคนเดียวที่ไม่อาจลืม",bowkylion
ทราบแล้วเปลี่ยน (Attention Please),/music/thailyric/23522,"Ladies and gentlemen
The captain has turned off
The fasten seat belt sign
You're now free to move about the cabin

ยินดีจะต้อนรับท่านผู้โดยสาร
สู่ท่าอากาศยานหัวใจ
รัดเข็มขัดด้วยนะเพื่อความปลอดภัย
ก่อนที่จะเดินทางไกลโปรดฟัง

มีเรื่องอึดอัดในใจ
โปรดทิ้งเอาไว้ก่อนลา
ส่วนตัวดิฉันมีสิ่งที่ค้างคา
ไม่อยากรอจะขออนุญาต

ประกาศได้ไหมต้องการจะแจ้งให้ทราบ
ว่าตัวฉันไม่มีใครอยู่คนเดียวก็เหงาใจ
รีบด่วนแค่อยากรบกวน
เพราะว่าฉันไม่สมควรจะเหงา

บอกคุณได้ไหมแม้คุณจะไม่อยากทราบ
ลองเปิดใจให้ฉันที
ในเมื่อเราเหงาเหมือนกันอย่างนี้
คงจะดีกว่าไหมความในใจที่พูดไป
ได้โปรดทราบแล้วไม่เปลี่ยนไปได้หรือเปล่า

May I have your attention please
It's that what I need
Our flight time will be forever
Could you please stay right here together

At this time make sure you fasten your seat belt
Kindly blend my heart melts
Because you make me feel unstopable
And just make your heart available

แค่อยากบอกความในใจ
ให้รู้เอาไว้ก่อนลา
เก็บเอาความเหงา
มาฝากเมฆไว้บนฟ้า
แค่สบตาก็คงได้รับรู้

ประกาศได้ไหมต้องการจะแจ้งให้ทราบ
ว่าตัวฉันไม่มีใครอยู่คนเดียวก็เหงาใจ
รีบด่วนแค่อยากรบกวน
เพราะว่าฉันไม่สมควรจะเหงา

บอกคุณได้ไหมแม้คุณจะไม่อยากทราบ
ลองเปิดใจให้ฉันที
ในเมื่อเราเหงาเหมือนกันอย่างนี้
คงจะดีกว่าไหมความในใจที่พูดไป
ได้โปรดทราบแล้วไม่เปลี่ยนไปได้หรือเปล่า

We are pleased to inform you
That all our flights are non-lonely
That is easy oh pleased me
Keep that smile
Please enjoy the flight

(ต่อให้นานแค่ไหน)

(รอถึงเมื่อไร)

ก็จะทราบแล้วไม่เปลี่ยนใจแน่นอน",bowkylion
บานปลาย (Best Wishes),/music/thailyric/22527,"บอกตัวเองให้ห่าง
ไม่ควรยืนอยู่ข้างเธอ
ยิ่งใกล้ก็ยิ่งเผลอ
เธอโปรยความประทับใจ

บอกตัวเองให้หยุด
แต่คิดถึงที่สุด ต้องทำไง
เผลอมีใจ คิดเกินไกลแล้ว

คนบ้าอะไร อยากไกล
ยิ่งใกล้กันอย่างนี้
เธอเข้ามาทุกที

เพื่อนบ้าอะไร อยู่ใกล้
แล้วใจสั่นอย่างนี้
คงจะไม่ดี

ได้โปรดอย่ามองตา ขอเธอนั้นอย่ามาทัก
อย่าได้สนถ้าเธอนั้นไม่ได้รัก ให้ทำไง
เรื่องมันบานปลายและไปกันใหญ่ในใจของฉัน

ได้โปรดเถอะขอร้อง ถ้าเธอนั้นไม่ต้องการ
อย่ามาทำให้ใจต้องทรมาน เธอไม่รู้สักนิด
เหมือนเดินมาไกลแต่ไม่มีสิทธ์ คิดไปเกินกว่านั้น

คนบ้าอะไร อยากไกล
ยิ่งใกล้กันอย่างนี้
เธอเข้ามาทุกที

เพื่อนบ้าอะไร อยู่ใกล้
แล้วใจสั่นอย่างนี้
คงจะไม่ดี

ได้โปรดอย่ามองตา ขอเธอนั้นอย่ามาทัก
อย่าได้สนถ้าเธอนั้นไม่ได้รัก ให้ทำไง
เรื่องมันบานปลายและไปกันใหญ่ในใจของฉัน

ได้โปรดเถอะขอร้อง ถ้าเธอนั้นไม่ต้องการ
อย่ามาทำให้ใจต้องทรมาน เธอไม่รู้สักนิด
เหมือนเดินมาไกลแต่ไม่มีสิทธ์ คิดไปเกินกว่านั้น

รู้อยู่แค่ทำไมใจยังสั่น
ไหวหวั่นและต้องทนอยู่อย่างนี้
ที่เรายืนข้างกัน มันแค่ความสัมพันธ์แบบหวังดี
อยู่ข้างเธอตรงนี้ด้วยใจ

ได้โปรดเถอะขอร้อง ถ้าเธอนั้นไม่ต้องการ
อย่ามาทำให้ใจต้องทรมาน เธอไม่รู้สักนิด
เหมือนเดินมาไกลแต่ไม่มีสิทธ์ คิดไปเกินกว่านั้น",bowkylion
