song_name,href,lyric,artist
อยู่ไหน อยู่ไหน,/music/thailyric/2818,"ทุกครั้งจะยืนจะเดินไปไหน มีเธอคอยตามไม่เคยห่าง
ทุกครั้งเจอเธอทีไรก็ยังนึกหนี
ทุกครั้งมีเธอมาตาม ยังคิดรำคาญกับเธอทุกๆที
เธอยังมาตามกันทุกวัน

(แต่/ก็)พักนี้เธอหายไปไหน พักนี้ไม่เจอะไม่เห็นเหมือนทุกที
ไม่มีเธอ(กลับนึกเหงา/ฉันก็เหงา) มันมีอาการไม่ค่อยดี

อยู่ไหนอยู่ไหน ทุกครั้งเคยมีเธอที่ตรงนี้
แอบเหงาทุกที เวลาที่มองแล้วไม่เห็นเธอ
อยู่ไหนอยู่ไหน รู้ไหมใครบางคนเขาอยากเจอ
อยากมองเห็นเธอ มาคอยตามกันเหมือนทุกที

พักนี้ไม่เจอเธอ โลกใบนี้มันดูไม่ดีเหมือนวันก่อน
พักนี้ไม่มีเธอมันก็ดูเหงาๆ
ทุกครั้งยังเดินทางเดิม ทางนั้นที่เธอตามฉันเหมือนวันเก่า
ก็ยังไม่เคยดีเหมือนเดิม

(แต่/ก็)พักนี้เธอหายไปไหน พักนี้ไม่เจอะไม่เห็นเหมือนทุกที
ไม่มีเธอ(กลับนึกเหงา/ฉันก็เหงา) มันมีอาการไม่ค่อยดี

อยู่ไหนอยู่ไหน ทุกครั้งเคยมีเธอที่ตรงนี้
แอบเหงาทุกที เวลาที่มองแล้วไม่เห็นเธอ
อยู่ไหนอยู่ไหน รู้ไหมใครบางคนเขาอยากเจอ
อยากมองเห็นเธอ มาคอยตามกันเหมือนทุกที

อยู่ไหนอยู่ไหน ทุกครั้งเคยมีเธอที่ตรงนี้
แอบเหงาทุกที เวลาที่มองแล้วไม่เห็นเธอ
อยู่ไหนอยู่ไหน รู้ไหมใครบางคนเขาอยากเจอ
อยากมองเห็นเธอ มาคอยตามกันเหมือนทุกที",buachompoo_ford
ใครคือรักแท้,/music/thailyric/2792,"หนักใจเหลือเกิน เมื่อใจมีรัก รักเอย กลับช่างทรมาน
บอกได้ไหมว่าหัวใจ ว่าใครที่ยอมผูกพัน เขาหรือเธอที่ใจต้องการ

คนหนึ่งก็แสนดี อีกคนมีรักให้กันมานาน
โอ่เอยหัวใจ ทำไมเป็นสองทาง

ใครกันคือรักแท้ ที่เขาจะรักไม่มีวันจาง
ตอบมาให้ฟังได้ไหม หัวใจ

หัวใจคนหนึ่ง ด้วยอุ่นไอรัก ถ้ามี รักเดียวไม่ซ้อนใคร
แต่ที่ฉันได้เจอ รักซ้อนซ่อนความปวดใจ ฉันไม่เคยต้องการอย่างนี้

คนหนึ่งก็แสนดี อีกคนมีรักให้กันมานาน
โอ่เอยหัวใจ ทำไมเป็นสองทาง

ใครกัน คือรักแท้ ที่เขาจะรักไม่มีวันจาง
บอกมาสักคำให้ฉันมั่นใจ ได้ไหมคนดี
หากเธอคือรักแท้ ขอให้เธอรักไม่มีวันจาง
บอกมาสักคำให้ฉันมั่นใจ ได้ไหมคนดี",buachompoo_ford
เส้นทางหัวใจ,/music/thailyric/10811,"อาจจะดูว่าเราแตกต่างกัน
อาจจะดูว่าเป็นเส้นขนาน
ไม่มีทางบรรจบ คบกันไปก็เจ็บ
สองเราควรอยู่ห่างกันไว้

แต่ยิ่งห่างยิ่งห่วงยิ่งผูกพัน
ความรู้สึกทำไมเป็นแบบนั้น
หรือว่าฟ้าบันดาล โชคชะตาเป็นใจ
ให้สองเราไม่อาจจะไกล แยกจากกัน

พรหมลิขิต ขีดเอาไว้ให้เป็นแบบนี้
จริงหรือนี่ ที่จริงแล้วเราเป็นคู่กัน

บนเส้นทางหัวใจและความรัก
มันยากเย็นเหลือเกินจะทานไหว
หัวใจมันดึงดัน ให้รักกันทันใด
แม้สองเราแตกต่างแค่ไหน ก็จะรัก

พรหมลิขิต ขีดเอาไว้ให้เป็นแบบนี้
จริงหรือนี่ ที่จริงแล้วเราเป็นคู่กัน

บนเส้นทางหัวใจและความรัก
มันยากเย็นเหลือเกินจะทานไหว
หัวใจมันดึงดัน ให้รักกันทันใด
แม้สองเราแตกต่างแค่ไหน ก็จะรัก
แม้สองเราแตกต่างแค่ไหน ก็จะรัก",buachompoo_ford
อิน เลิฟ (In Love),/music/thailyric/2819,"ก็เธอมาทำให้ความสุขล้นรอบกาย
เธอคนเดียวที่ทำให้ฉันละลาย เฮ่อ
ถ้าเธอไปทำกับใครแบบนี้ เค้าไม่รักให้มันรู้

มองตัวเองก็อาจจะเหมือนรอดตาย
คนดีๆ ใครบอกว่าหาได้ง่าย เฮ่อ
เธอมอบแต่สิ่งดีๆ ให้ฉันทุกๆ วินาที

ฉันรู้ดี ไม่ได้ฝันไป
เพราะว่าหัวใจ ฉันนั้นรักเธอ
และเหมือนสัญญาณ
ข้างในมันบอกถึงเวลา มอบชีวิตให้คนนี้

ฉันพร้อมยอมทุกอย่าง พร้อมทำทุกอย่าง
และทำทุกทาง ไม่ยอมให้ใจของเราไกลห่าง
ขอแค่เธอไม่เปลี่ยน หัวใจไม่ห่าง
จะไม่มีวันที่รักเราเปลี่ยนไป

ตอนกลางวันก็มัวแต่คิดถึงเธอ
เวลานอนก็ยังหลับฝันละเมอ เฮ่อ
ช่วยบอกตรงๆ อีกทีบอกรักให้ชัดๆ จะได้รู้

เธอคนดีสม่ำเสมอเรื่อยมา
อารมณ์ดีไม่มีปัญหาไม่ว่า เฮ่อ
เธอมอบแต่สิ่งดีๆ ให้ฉันทุกๆ วินาที

ฉันรู้ดี ไม่ได้ฝันไป
เพราะว่าหัวใจ ฉันนั้นรักเธอ
และเหมือนสัญญาณ
ข้างในมันบอกถึงเวลา มอบชีวิตให้คนนี้

ฉันพร้อมยอมทุกอย่าง พร้อมทำทุกอย่าง
และทำทุกทาง ไม่ยอมให้ใจของเราไกลห่าง
ขอแค่เธอไม่เปลี่ยน หัวใจไม่ห่าง
จะไม่มีวันที่รักเราเปลี่ยนไป

Rap:
เอ่อ มีเธอคนเดียวก็เพียงพอ
เป็นเพียงคนเดียวที่เฝ้ารอ ตั้งแต่ที่มีเธอ
นับแต่วันแรกที่ได้เจอ ชีวิตก็เปลี่ยนไป
ต่อจากวันนี้ก็ไม่คิดจะเปลี่ยนใจ

แค่เพียงเราสองคนก็สุขเหนือสิ่งใด
เพราะทุกๆ ครั้งที่ไม่มีเธอข้างกาย
เธอรู้บ้างไหมว่าหัวใจของคนอย่างฉันก็แทบจะวาย
ขอบคุณทุกๆ สิ่งที่ทำให้เราได้พบกัน
และขอสัญญาต่อจากวันนี้ จะรักเธอไปทุกๆ วัน

ฉันพร้อมยอมทุกอย่าง พร้อมทำทุกอย่าง
และทำทุกทาง ไม่ยอมให้ใจของเราไกลห่าง
ขอแค่เธอไม่เปลี่ยน หัวใจไม่ห่าง
จะไม่มีวันที่รักเราเปลี่ยนไป",buachompoo_ford
