song_name,href,lyric,artist
งง,/music/thailyric/17781,"กูไม่รู้ด้วยซ้ำกูหาเงินได้เท่าไร
เลขที่อยู่ในบัญชีตัวค่อนข้างจะใหญ่
คนมันเยอะไปหมดไม่รู้ว่าใครเป็นใคร
มึงอย่าทำกูงง Ay

พวกกูทำมานาน มึงเป็นใคร
หาเงินได้เป็นล้าน ว่ายังไง
พวกมึงแพ้แล้วพาล ไม่เข้าใจ
มึงอย่าทำกูงง Ay มึงอย่าทำกูงง Ay

พวกกูทำมานาน มึงเป็นใคร
หาเงินได้เป็นล้าน ว่ายังไง
พวกมึงแพ้แล้วพาล ไม่เข้าใจ
มึงอย่าทำกูงง Ay มึงอย่าทำกูงง Ay

มึงอย่าทำกูงง กูน่ะเริ่มจะปลง
กูแค่พูดตรงๆ กูไม่อยากจะจน
ตอนนี้กูมีเงินล้าน เงินล้าน On me
พวกเขี้ยนี้ไม่เข้าใจ ยังอยากให้กู Rap free
กูจะมีเพื่อนเยอะกว่านี้
ถ้ากูพูดความจริงไม่เป็น
บอกตัวเองว่าไม่เป็นไร
กูไม่อยากจะ Fake กับใคร

กูทำทุกอย่างเพื่อให้กูไปข้างบน
ยังไงกูก็ไม่ยอม
กูยังไม่นอนและชีวิตกูมันเปลี่ยน
เหมือนกับอยู่ในละคร

แค่อยากร้องตะโกน
Made it on my own
ถ่ายรูปกับแฟนคลับไปพันรูป
Bitch you know that I'm on
แหวนเพชรเงินทอง กูจะเอามากอง
กูอยากได้ทุกอย่าง มึงก็ควรจะรู้มึงทำได้แค่มอง

กูไม่รู้ด้วยซ้ำกูหาเงินได้เท่าไร
เลขที่อยู่ในบัญชีตัวค่อนข้างจะใหญ่
คนมันเยอะไปหมดไม่รู้ว่าใครเป็นใคร
มึงอย่าทำกูงง Ay

พวกกูทำมานาน มึงเป็นใคร
หาเงินได้เป็นล้าน ว่ายังไง
พวกมึงแพ้แล้วพาล ไม่เข้าใจ
มึงอย่าทำกูงง Ay มึงอย่าทำกูงง Ay

พวกกูทำมานาน มึงเป็นใคร
หาเงินได้เป็นล้าน ว่ายังไง
พวกมึงแพ้แล้วพาล ไม่เข้าใจ
มึงอย่าทำกูงง Ay มึงอย่าทำกูงง Ay

บางครั้งกูต้องถามตัวเองชีวิตคืออะไร
สงสัยกูเล่นคอนเสิร์ตเยอะเกินกูลืมกูเป็นใคร
Damn my mama call on my phone
ถามเมื่อไรว่ากูจะกลับบ้าน
แต่ว่ากูน่ะทำแต่งานงาน
กูไม่เคยจะมีเวลาว่าง
กูน่ะยืนคุยกับดวงดาว
สุดท้ายกูน่ะกลายเป็นเพื่อนมัน
Imma fuckin star
ทุกคนน่ะพูดแต่ไม่มีใครลงมือทำ Yea

แค่อยากร้องตะโกน
Made it on my own
ถ่ายรูปกับแฟนคลับไปพันรูป
Bitch you know that I'm on
แหวนเพชรเงินทอง กูจะเอามากอง
กูอยากได้ทุกอย่าง มึงก็ควรจะรู้มึงทำได้แค่มอง

กูไม่รู้ด้วยซ้ำกูหาเงินได้เท่าไร
เลขที่อยู่ในบัญชีตัวค่อนข้างจะใหญ่
คนมันเยอะไปหมดไม่รู้ว่าใครเป็นใคร
มึงอย่าทำกูงง Ay

พวกกูทำมานาน มึงเป็นใคร
หาเงินได้เป็นล้าน ว่ายังไง
พวกมึงแพ้แล้วพาล ไม่เข้าใจ
มึงอย่าทำกูงง Ay มึงอย่าทำกูงง Ay

พวกกูทำมานาน มึงเป็นใคร
หาเงินได้เป็นล้าน ว่ายังไง
พวกมึงแพ้แล้วพาล ไม่เข้าใจ
มึงอย่าทำกูงง Ay มึงอย่าทำกูงง Ay

มึงอย่าทำกูงง
มึงอย่า
มึงอย่าทำกูงง
มึงอย่าทำกูงง
มึงอย่า
มึงอย่าทำกูงง",fiixd
ดีกัน,/music/thailyric/14675,"ฉันก็แค่อยากต้องการมีเวลาดีๆ
ทำไมตอนเจอกันต้องทะเลาะกันทุกที
เหมือนว่าฉันไม่ใช่เหมือนว่าฉันเป็นคนไม่ดี
เบบี้เธออย่าพึ่งพูดเลยเธออย่าพึ่งพูดเลย

เบบี้ดีกันเลยได้ไหมทำอะไรที่ดีต่อใจ
ก็ไม่รู้ทะเลาะทำไม
เธอทำฉันไม่อยากคุยกับใคร Umm

ฉันไม่อยากทะเลาะกับเธอ เธอก็ควรจะรู้
ว่าเธอคือคนเดียวที่ตัวฉันอยากเจอ
ไม่ได้เจอนานๆ
บางทีมันนอยด์บางทีมันเหงานะเธอ
ฉันไม่รู้ ว่าตัวเธอยังรักฉันอยู่ไหม

ทัวร์ติดกันมาสี่เดือน
ความทรงจำคอยเตือน
ภาพของเธอไม่ลางเลือน
หวังว่าเรายังเหมือนเดิม
เธอ บอกฉันไม่ดีบอกว่าฉันไม่มีเวลา
ฉันแค่อยากให้เธอเข้าใจ

ฉันก็แค่อยากต้องการมีเวลาดีๆ
ทำไมตอนเจอกันต้องทะเลาะกันทุกที
เหมือนว่าฉันไม่ใช่เหมือนว่าฉันเป็นคนไม่ดี
เบบี้เธออย่าพึ่งพูดเลยเธออย่าพึ่งพูดเลย

เบบี้ดีกันเลยได้ไหมทำอะไรที่ดีต่อใจ
ก็ไม่รู้ทะเลาะทำไม
เธอทำฉันไม่อยากคุยกับใคร Umm

ฉันแค่อยากรู้เธออยู่ได้ไหม
ตอนที่ฉันไปทัวร์เธอคิดถึงกันไหม
เธออย่าบอกกับฉันว่าเธออยากมีใคร
ชีวิตที่ฉันใช้มันไม่เหมือนกับใคร
ก็บางครั้งฉัน Down
Need you right now
So babe look around
ตอนนี้มีแค่เรา Yeah
ฉันไม่อยากเถียงไม่มีประโยชน์ Yeah
Baby เลิกโกรธ

ฉันก็แค่อยากต้องการมีเวลาดีๆ
ทำไมตอนเจอกันต้องทะเลาะกันทุกที
เหมือนว่าฉันไม่ใช่เหมือนว่าฉันเป็นคนไม่ดี
เบบี้เธออย่าพึ่งพูดเลยเธออย่าพึ่งพูดเลย

เบบี้ดีกันเลยได้ไหมทำอะไรที่ดีต่อใจ
ก็ไม่รู้ทะเลาะทำไม
เธอทำฉันไม่อยากคุยกับใคร Umm",fiixd
ทำได้ไง,/music/thailyric/16913,"ทำแบบนี้ทำได้ไง ให้เธอไปทั้งหัวใจ
รักเธอไปจนแทบจะตาย แบบไม่เหลือที่ให้ใคร
อยากจะรู้ทำได้ไง ชาไปเลยทั้งหัวใจ
อยากจะห้ามความรู้สึกนี้ แต่ก็คิดมันไปไกล

ชั้นรอลงจากเครื่องบิน
เพื่อไห้ได้มาเจอเธอ
แต่เหมือนว่าเธอไม่อยากเจอ
ช่วงหลังๆ เธอชอบเมินกัน
เหมือนว่า ฉันมีเธออยู่ในฝัน
แต่ว่าใจเธอนั้น มีใครอยู่ในนั้น

ไม่เอาไม่เอา รักเรารักเรา
ถามใจเธอยัง
ถ้าเธออยากทำมันพัง
ได้โปรดอย่าทำมันพัง

โปรดให้ฉันกลับมาดูแลเธอ
เธอก็รู้ว่าฉันน่ะแคร์เธอ
เธออย่าทำให้ฉันอ่อนแอเลย
ฉันไม่อยากให้มันเป็นภาพเบลอ

ทำแบบนี้ทำได้ไง ให้เธอไปทั้งหัวใจ
รักเธอไปจนแทบจะตาย แบบไม่เหลือที่ให้ใคร
อยากจะรู้ทำได้ไง ชาไปเลยทั้งหัวใจ
อยากจะห้ามความรู้สึกนี้ แต่ก็คิดมันไปไกล

เป็นทุกอย่างที่เธอต้องการ
รู้ว่าฉันมันน่ารำคาญ
ไม่ต้องการให้ใครสงสาร
เพราะอะไรมันทรมาน Ah

ฉันมันพูดไม่ค่อยคิด
ทำอะไรก็ดูผิด
เรื่องของเราแม่งโคตร Lit
ตอนนี้ฉันไม่มีสิทธิ์
ไม่มีคนจะไปเที่ยว
ชาเป็นผักอยู่คนเดียว
King size นอนคนเดียว
ขอรักเธออีกครั้งเดียว

มันเริ่มจากการที่ฉันกลับบ้านไม่ได้
ทะเลาะบางทีไม่มีคำอธิบาย
คำพูดของเราเธอไม่มีวันเข้าใจ
I just wanna ยิงตัวเองให้ตาย

มันบั่นทอนเหลือเกิน ทำลงไปได้ไง
มันทำให้ตัวฉันไม่มีลมหายใจทำไงดี
จะดีกันหรือไม่ดี ทำอะไรก็ไม่ดี
I'm so fucking sad

โปรดให้ฉันกลับมาดูแลเธอ
เธอก็รู้ว่าฉันน่ะแคร์เธอ
เธออย่าทำให้ฉันอ่อนแอเลย
ฉันไม่อยากให้มันเป็นภาพเบลอ

ทำแบบนี้ทำได้ไง ให้เธอไปทั้งหัวใจ
รักเธอไปจนแทบจะตาย แบบไม่เหลือที่ให้ใคร
อยากจะรู้ทำได้ไง ชาไปเลยทั้งหัวใจ
อยากจะห้ามความรู้สึกนี้ แต่ก็คิดมันไปไกล

ทำแบบนี้ทำได้ไง ให้เธอไปทั้งหัวใจ
รักเธอไปจนแทบจะตาย แบบไม่เหลือที่ให้ใคร
อยากจะรู้ทำได้ไง ชาไปเลยทั้งหัวใจ
อยากจะห้ามความรู้สึกนี้ แต่ก็คิดมันไปไกล",fiixd
ฝันเดิม,/music/thailyric/19159,"กูบอกเด็กๆ ให้ออกจากบ้านตามหาฝัน
อย่าปล่อยให้ตัวสบาย
ไม่ได้ง่ายขนาดนั้น
My dreams just come true
Your dreams could be too
คุณอาจเป็นคนที่ยิ่งใหญ่lyกวันใครจะรู้

แค่ปล่อยให้คำดูถูกนินทา ทุกคำมันกลายเป็นครู
กูไม่อยากทำอะไร กูแค่อยากอยู่ในสตู
To all my haters พวกมึง Lame กูต้องหันหลังไปดู
เพราะกูหน่ะเดินมาไกลเกินไปกว่าที่ตัวใครจะรู้

แผลเปิดกูเต็มตัว มีมีดปักอยู่ข้างหลัง
กูดึงมันออกแล้วตัดคอพวกมึงจากข้างหลัง
โลกแม่ง Full of bullshit กูไม่ละทิ้งความหวัง
และสิ่งเดียวที่ทำให้กูเดินต่อคือความฝัน

And if you feeling me อย่าหลบอยู่ข้างหลัง
แค่ทำภาคแรกให้ดี อย่าสนใจภาคหลัง
โดนด่าแบบแม่งทุกวัน บางคนเ-าชอบขำ
แต่พวกแม่งยังไม่มีงาน กูควรเป็นฝ่ายขำ

มีเรื่องมากมายในใจ ที่กูไม่สามารถพูดออกมา
เพราะว่าบทสนทนา คงไม่ช่วยแก้ปัญหา
กูปล่อยให้พวกมึงคิดกันไปแบบว่าต่างๆ นานา
ถึงมึงจะเกลียดหรือรักกู ในวันสุดท้ายก็คงต้องลา

ลุงกูเพิ่งจะ Passed กูเห็นท่านยิ้มอยู่บนสวรรค์
ถ้ามึงรู้ตัวว่าเดินผิดทางให้มึงรีบกลับหลังหัน
ชีวิตหมุนไปเรื่อยๆ มันหมุนไปต่อเหมือนกับกังหัน
ความสุขไม่ได้ขึ้นอยู่กับรถแพงๆ นั่งแดกหมูหัน

ไอ้ Sus กูพูดเหี้*อะไรให้พวกมึงแม่งตั้งใจฟังดิ
โทษคนอื่นตลอด ตัวเองไม่เคยคิดว่าตัวเองผิด
กูเห็นพระจากข้างหลัง อยากให้ทุกคนเอาทองเข้ามาปิด
เชื่อในสิ่งที่ทำแล้วไปให้สุด ทุกคนอะมีสิทธิ์

ตอนกูแม่งเด็กๆ อาจารย์เขาบอกกูแม่งไม่ได้
แค่กูนั่งเรียนเฉยๆในห้องเรียนยังทำไม่ได้
ทำแม่ร้องไห้ตลอด ในความรู้สึกน่ะมันไม่ง่าย
เหมือนกูพ่าย แต่ว่าพวกมึงจะพูดอะไรก็ได้

เพราะทุกวันที่กูเดิน เขี้ยเนี่ยอะฝันเดิม
กูไม่เคยลืมวันที่กูตกต่ำโดนหมาเมิน
กูไม่ได้ต่างจากมึง กูแค่ทำงานหาเงิน
จำได้วันที่เงินมันแบน แต่ตอนนี้มันหนาเกิน

Yea ตอนนี้มันหนาเกิน
กูมีแต่ ฝันเดิม
ตอนนี้มันหนาเกิน
กูตามแต่ ฝันเดิม

อายุ 14 คือตอนกูเริ่มขีดๆ เขียนๆ
18 ปีที่แล้ว ที่กูทิ้งโรงเรียน
เพื่อแบกถุงขยะตามหาฝันเหมือน 8 Miles
So fuck พวก haters กูไม่สน มึงจะ Hate ก็ Hate ไป
แต่มึงต้องเจอกับอุปสรรค Yeh this shit มันสุดจะหนัก
บางทีมันก็พูดไม่ออก คล้ายกับ Flow ตะกุกตะกัก
บางทีมันจะมีคนหลอก มึงต้องคอยดูทุกจังหวะ
มึงต้องมีสติตลอด And dont you ever give up

เพราะถ้ามันเป็นความฝันของมึง มึงก็ต้องเดินต่อ
อย่าปล่อยให้แก้วมันเต็ม ทุกวันต้อง Learn more
มันมีอยู่ไม่กี่อย่างที่กู Concern for
นั้นคือความฝัน ครอบครัวและเพื่อน แค่นั้นก็เกินพอ

แต่อย่าปล่อยให้มันเป็นแค่ฝัน มึงก็ต้องทำให้มันเป็นจริง
เพราะกูก็มีไอ้พวกความฝัน ว่าสักวันพวกกูทุกคนจะวินดิ
เพราะฉะนั้นมึงลองถามใจดู
เพราะสิ่งที่มึงต้องการนอกจากมึงไม่มีใครรู้

ส่วนกูรู้อยู่แล้วว่ากูต้องการอะไร
มันคือคำเสี่ยวๆ ว่ากูจะอยู่กับ Mic
กูก็เคยหลงทางหลงผิดคิดว่ากูทำไม่ได้
หรือทางที่เลือกมันคงผิด

กูเข้าใจความรู้สึกพวกนั้นดี
เพราะกูอยู่กับมันนานเกินกว่า 10 ปี
กูรู้ว่าแม่งโคตรจะเหนื่อยแต่ Say fuck to คำว่ายอมแพ้
ถึงบางทีกูเปื่อย แต่ว่ากูก็ยังไม่ยอมแพ้

เพราะถ้ามึงยอมเมื่อไรมึงก็ไปไม่ถึงฝัน
กูคงยอมไม่ได้ถ้าจะปล่อยให้มันเป็นอย่างนั้น
ถึงแม้ชีวิตกูจะสิ้นก็ตาม
แต่กูก็มีความฝันและมันไม่ผิดที่กูจะวิ่งตาม

ถ้ามึงไม่ชอบก็ Say fuck to you too
จะไปให้รอด เอาชัดๆ ให้ดูกู
และดู FIIXD และดูทุกคนที่ยังคงทน
ที่ยังคงเดินตามความฝัน ที่ยังคงเดินขึ้นข้างบน

เพราะทุกวันที่กูเดิน เขี้ยเนี่ยอะฝันเดิม
กูไม่เคยลืมวันที่กูตกต่ำโดนหมาเมิน
กูไม่ได้ต่างจากมึง กูแค่ทำงานหาเงิน
จำได้วันที่เงินมันแบน แต่ตอนนี้มันหนาเกิน

Yea ตอนนี้มันหนาเกิน
กูมีแต่ ฝันเดิม
ตอนนี้มันหนาเกิน
กูตามแต่ ฝันเดิม",fiixd
ไม่ใช่ชั้น,/music/thailyric/18688,"คงไม่เป็นไร ถ้าตัวเธออยากจะไป
ฉันก็พอเข้าใจ ถ้าเธออยากจะมีใคร
เพราะฉันไม่ได้ดูแลเธออย่างนั้น
ฉันไม่อยากจะเป็นคนนั้น
คนที่เธอต้องการในฝันไม่ใช่ฉัน

ไม่จะลองหรอก เธอไม่อยากจะลองหรอก
ผมไม่ได้อยากรักคุณ ผมก็แค่อยากนอนกอด
บอกให้ใจเย็นๆ ก่อน คิดไปไกลแบบตลอด
ถ้าพูดถึงเรื่องหัวใจ ผมว่าคงต้องพอก่อน

She wanna go the movie
แล้วไปต่อด้วยซูชิ
แต่ว่าฉันไม่อินหนิ
แถมมันยังไม่ชินอีก

ฉันไม่อยากเห็นเธอต้องเสียน้ำตา
อยู่ด้วยกันได้ไหมก่อนที่เราจะจากลา
I fuck you want the loaddo
เธออยากพึ่งมาโมโห
สาวๆ Take a photo
นั้นแค่หลัง Show the
That I got the go leave you alone
เธออยู่คนเดียวได้ไหมคนดี

คงไม่เป็นไร ถ้าตัวเธออยากจะไป
ฉันก็พอเข้าใจ ถ้าเธออยากจะมีใคร
เพราะฉันไม่ได้ดูแลเธออย่างนั้น
ฉันไม่อยากจะเป็นคนนั้น
คนที่เธอต้องการในฝันไม่ใช่ฉัน
(คงไม่ใช่ฉัน)

คงไม่ใช่ฉันหรอก
เจอผมได้แถวทองหล่อ
คงไม่เหมือนที่เขาบอก
เธอควรไปกับเขาก่อน
Ah เท่าที่ Bad ไปถึง I do
แถมสาวๆ อยากเข้ามาจูบ
เพื่อนเธออาจจะพูดถูก
ใครจะเอาผมอยู่
But I got the thank for you

ความรักดีๆ A wedding ring for you
ยังจำได้ไหมตอนที่แย่ๆ I'm tryna change for you
Top down sit bank ดูดาว With you
Ride to the whole town just to ride with you um

I get just sense the past now
You beat another man now
เพิ่งเข้าใจตอนเธอไป Now
แต่ช่างแม่ง Fuck เด้
ผมเปลี่ยนตัวเองไม่ได้คุณคงต้องรับ Then

คงไม่เป็นไร ถ้าตัวเธออยากจะไป
ฉันก็พอเข้าใจ ถ้าเธออยากจะมีใคร
เพราะฉันไม่ได้ดูแลเธออย่างนั้น
ฉันไม่อยากจะเป็นคนนั้น
คนที่เธอต้องการในฝันไม่ใช่ฉัน

(คงไม่ใช่ฉัน)
(คงไม่ใช่ฉัน)
(คงไม่ใช่ฉัน)",fiixd
