song_name,href,lyric,artist
อยู่ดี,/music/thailyric/17530,"Baby เธอไม่ร้อง อย่างอแงได้ไหม
Baby มันไม่พอถ้าจะมีแค่ใจ
Baby เธอก็ควรจะพอเหอะ
Baby เธอก็ควรจะพอเถอะ

เพราะว่าฉันต้องไปอยู่ดี
เดินตามทางของฉันอยู่ดี
ถึงใครบอกว่ามันไม่ดี
But I gotta go baby
I just gotta go oh oh

I just gotta go
I just gotta go
I just gotta go
Money on my mind
Money on my mind
Money money money
Money on my mind

ก่อนที่มันจะสาย ก่อนที่มันจะสาย
ฉันก็แค่อยากรวย ก่อนที่ตัวฉันนั้นจะตาย
Ay I can't waste no time
เสียเวลาอีกไม่ได้
เธอรู้มันไม่ง่าย เธอรู้มันไม่ง่าย
คนอยากเป็นแบบกูแต่มันทำไม่ได้
กูไม่เคยได้พัก ถึงกูไม่สบาย

นับเงิน On the road but I feel so cold ay
มึงแค่อยากจะ Show มึงควรเลิกมโน
I don't feel your shit
So I buy more gold
สร้อยทอง On my neck
I'mma get some more

Baby เธอไม่ร้อง อย่างอแงได้ไหม
Baby มันไม่พอถ้าจะมีแค่ใจ
Baby เธอก็ควรจะพอเหอะ
Baby เธอก็ควรจะพอเถอะ

เพราะว่าฉันต้องไปอยู่ดี
เดินตามทางของฉันอยู่ดี
ถึงใครบอกว่ามันไม่ดี
But I gotta go baby
I just gotta go oh oh

Baby ต้องขอโทษที
I just gotta get dat money
My life style โคตรจะ Crazy
โปรดละเธออย่าคิดจะรออีก
Baby เธอก็รู้ว่า You deserve a better man
ไม่เคยจะคิดเจ้าชู้
But I'm just mobbin with my gang
ให้เรื่องที่ผ่านมา ก็ถือว่าฉันเป็นตัวแทน
ยังคงจะจำได้ดีในตอนที่ถอด Dat dress แดง

อย่าให้ต้องพูดว่ารักเลย
เธอก็รู้ว่ามันไม่เหมือนเคย
อีกสักพักเดี๋ยวเธอก็ลืมเลย
ปล่อยให้มันเป็นเพียงแค่ภาพเลือน

Baby เธอไม่ร้อง อย่างอแงได้ไหม
Baby มันไม่พอ ถ้าจะมีแค่ใจ
Baby เธอก็ควรจะพอเหอะ
Baby เธอก็ควรจะพอเถอะ

เพราะว่าฉันต้องไปอยู่ดี
เดินตามทางของฉันอยู่ดี
ถึงใครบอกว่ามันไม่ดี
But I gotta go baby
I just gotta go oh oh

ขอโทษที่ไม่มีเวลาให้กับเธอ
เพราะว่าทุกวันฉันยุ่งแต่กับงาน
หนทางที่ฉันต้องเดินใช้เวลา
ก็รู้ดีกว่าเธอนั้นคงจะไม่ให้อภัย

แต่ตัวฉันก็คงจะต้องเดินหน้าต่อไป
ฉันทำตัวไม่ดีทำให้เธอไม่พอใจ
But you are the one girl
เธอคือคนสำคัญ Girl
You the only one girl
Girl girl girl girl
I just gotta go

Baby เธอไม่ร้อง อย่างอแงได้ไหม
Baby มันไม่พอถ้าจะมีแค่ใจ
Baby เธอก็ควรจะพอเหอะ
Baby เธอก็ควรจะพอเถอะ

เพราะว่าฉันต้องไปอยู่ดี
เดินตามทางของฉันอยู่ดี
ถึงใครบอกว่ามันไม่ดี
But I gotta go baby
I just gotta go oh oh",fiixd
