song_name,href,lyric,artist
Forever,/music/thailyric/19572,"ฉันจะรักเธอ Forever
อยู่แบบนี้ Forever
ไม่ต้องการใคร No never
Forever for the worst or better

ฉันจะรักเธอ Forever
อยู่แบบนี้ Forever
ไม่ต้องการใคร No never
Forever for the worst or better

All my life ไม่เคยเจอคนที่ Nice
คนที่ Proud to be my wife but your ok
คนที่ใช่ ที่ไม่ Drink dirty sprite
คนที่มีเวลาอยู่กับผม All day

ฉันไม่เคยคิดเลย
Never miss เลย
I make hits เลย
I'm drip when im with you
เป็นอาทิตย์เลย Take you on a trip เลย
โคตร จะ Lit เลย when im with you

All my heart is with you with you
I fly a million miles just to see you
How many times you helped me through
เพราะว่าวันนี้ ผมจะเลิกเป็นคนเจ้าชู้

ฉันจะรักเธอ Forever
อยู่แบบนี้ Forever
ไม่ต้องการใคร No never
Forever for the worst or better yeah

รอยยิ้มของเธอ Yeah it's perfect to me
ถึงแม้ชีวิตมันไม่เคยจะแฮปปี้
บางครั้งคนเรามักวิ่งหาความแน่นอน
เธอคือความรัก ที่อยากจะเก็บไว้ให้นาน
ในเรื่องของวันวาน ที่เราสร้างมาด้วยกัน
ถึงแม้ผู้หญิงมีเป็นล้าน

เธอคือสิ่งที่ฉันต้องการ
ชีวิตนี้ฉันขาดความรักไม่ได้
หาความรักดีดีมันก็ไม่ได้ง่าย
แต่ฉันเจอเธอ You are my life
เธอคนสุดท้าย

ฉันจะรักเธอ Forever
อยู่แบบนี้ Forever
ไม่ต้องการใคร No never
Forever for the worst or better

ฉันจะรักเธอ Forever
อยู่แบบนี้ Forever
ไม่ต้องการใคร No never
Forever for the worst or better",gavin_d
Monte Carlo,/music/thailyric/19575,"อยากให้เธอเรียกฉัน My man
แม้เรายังไม่ใช่แฟน
ความรักของเธอมันร้ายแรง
และฉันต้องการมันทั้งหมด
ไม่ว่าแลกด้วยอะไร

หนึ่งดื่มก็ต้อง Roll out
10 ดื่ม And we sold out
ลงคนที่เร้าใจ
ก็เธอมันหลายใจ

หนึ่งดื่มไม่ต้องโชว์เขา
มีเธอและฉัน So proud
ถ้าหากวันนี้ฉันเหมาเธอหมด
แล้วเธอจะไปกับฉันหรือเปล่า

แล้วเธอจะไปกับฉันหรือเปล่า

หนึ่งดื่ม Just to go out
สองดื่ม Just to show off
สามดื่ม Just to ลืมเธอ
10 ดื่ม เจอกูหน้าผับ
I'll be throwing up

I'll be throwing up money keep piling up shit
Tryna keep ke ke keep in touch tryna keep in touch
เย้ That what's up เย้ That what's up

จะเปิดเมมจะเอาให้หมด
คืนนี้ก็ยังไม่จบ
เธอนั้นก็ยังไม่กลับ
จะเอาเธอให้สลบเลย

อยากให้เธอเรียกฉัน My man
แม้เรายังไม่ใช่แฟน
ความรักของเธอมันร้ายแรง
และฉันต้องการมันทั้งหมด
ไม่ว่าแลกด้วยอะไร

หนึ่งดื่มก็ต้อง Roll out
10 ดื่ม And we sold out
ลงคนที่เร้าใจ
ก็เธอมันหลายใจ

หนึ่งดื่มไม่ต้องโชว์เขา
มีเธอและฉัน So proud
ถ้าหากวันนี้ฉันเหมาเธอหมด
แล้วเธอจะไปกับฉันหรือเปล่า

น้องครับคนนี้เขา เป็นใครเหรอครับ
ชอบที่สายตาเธอทำให้ฉันหวั่นไหว
น้องครับตัวท็อปเค้าชื่ออะไรหรอครับ
เวลาเธออยู่บนเวทีมันทำให้ฉันไม่ไหว

ค่าเทอมเธอเท่าไรฉันจะจ่ายเอง
เที่ยวกันทุกคืนดมโคเคน
Sipping lean rockstar life
ไม่ใช่โนเนม Lil wayne

ฉันคงติดอีกสักพัก
ตกหลุมรัก คืนนี้คึกคัก
แบบนี้ก็ต้องจัดสิครับ
มาหาป่ะป๊าสิครับ

ก็แค่อยากให้เธอมากับฉัน มารัก

อยากให้เธอเรียกฉัน My man
แม้เรายังไม่ใช่แฟน
ความรักของเธอมันร้ายแรง
และฉันต้องการมันทั้งหมด
ไม่ว่าแลกด้วยอะไร

หนึ่งดื่มก็ต้อง Roll out
10 ดื่ม And we sold out
ลงคนที่เร้าใจ
ก็เธอมันหลายใจ

หนึ่งดื่มไม่ต้องโชว์เขา
มีเธอและฉัน So proud
ถ้าหากวันนี้ฉันเหมาเธอหมด
แล้วเธอจะไปกับฉันหรือเปล่า",gavin_d
Not Enough (ขี้กาก),/music/thailyric/19576,"แค่บอกมาเลยว่าฉันไม่ดีพอ
ฉันจะได้ไม่ต้องรอ
เหตุผลอะไรก็คงไม่สำคัญ
เเค่เธอคิดว่าฉันไม่ดีพอ
แค่เธอไม่รักแค่นั้น
บอกฉันมาคำเดียวก็พอ

บอกฉันมาคำเดียวก็พอ

คนกระจอก อย่างฉันไม่เคยทำร้ายใคร
วันๆ เดินเร่ร่อน ไป ไปมาไปมาจนร้องไห้
คนอย่างเธอ คงจะเจอแต่สิ่งดีดี
ต่างกับฉันที่มันซวยทั้งปี
ที่เธอฝันฉันก็คงไม่มี ไม่มีไม่มีไม่มี

พูดมาเลย เธอไม่เอาฉันหรอก
ไม่ต้องเกรงใจฉันแค่คนกระจอก
พยายามเท่าไร พยายามให้ตาย
สุดท้ายก็เป็นแค่ตัวประกอบ

พูดมาเลยเธอไม่เอาฉันหรอก
ฉันเข้าใจฉันแค่คนกระจอก
พยายามให้ตายก็เป็นได้แค่ไอ้ควาย

แค่บอกมาเลยว่าฉันไม่ดีพอ
ฉันจะได้ไม่ต้องรอ
เหตุผลอะไรก็คงไม่สำคัญ
เเค่เธอคิดว่าฉันไม่ดีพอ
แค่เธอไม่รักแค่นั้น
บอกฉันมาคำเดียวก็พอ

เธอไม่คิดถึงแล้วชัน จะคิดมาก
ทุกวินาทีที่ฉันต้องรอเธอบอก ว่า
ห่างกันสักพัก สับสน Enough คือ Enough
ไอ้ขี้กากทำได้แค่ขอพรว่าเธอจะรัก

ถึงแม้ผมรูปหล่อจีบใครก็ไม่ติดสักครั้ง
ผิดหวัง ไม่เหมือน หนังโรแมนติก
แต่ เหมือน  Ko Moon Young ที่ถูกขัง
ในกระเป๋าตังค์มีแค่ 20 บาท
ถ้าเป็นงานเขา เรียกอาชิมิสเตอร์กาก

วันหลังเธอบอกเราดีดีก็ได้
อยู่กับผมคงจะลำบากใจใช่ไหม
ใช่เปล่า ใช่สิ

พูดมาเลยเธอไม่เอาฉันหรอก
ไม่ต้องเกรงใจฉันแค่คนกระจอก
พยายามเท่าไรพยายามให้ตาย
สุดท้ายก็ได้เป็นตัวประกอบ

พูดมาเลยเธอไม่เอาฉันหรอก
ฉันเข้าใจฉันแค่คนกระจอก
พยายามให้ตายก็เป็นได้แค่ไอ้ควาย

แค่บอกมาเลยว่าฉันไม่ดีพอ
ฉันจะได้ไม่ต้องรอ
เหตุผลอะไรก็คงไม่สำคัญ
เเค่เธอคิดว่าฉันไม่ดีพอ
แค่เธอไม่รักแค่นั้น
บอกฉันมาคำเดียวก็พอ

แค่บอกมาเลยว่าฉันไม่ดีพอ
ฉันจะได้ไม่ต้องรอ
เหตุผลอะไรก็คงไม่สำคัญ
เเค่เธอคิดว่าฉันไม่ดีพอ
แค่เธอไม่รักแค่นั้น
บอกฉันมาคำเดียวก็พอ

บอกฉันมาคำเดียวก็พอ",gavin_d
Paper Planes,/music/thailyric/19573,"Youre my paper plane
When you fly I want forget you
ยังคิดถึง I miss ya
Even these tears want fade away

ฉันเพียงต้องการเธอเท่านั้น
เขาพยายามมากกว่าฉัน
แค่เพียงได้มองเธอก็พอ
ไม่ขออะไรที่ล่วงเกินเธอเกินไป

ฉันคิดถึงเธอบางคราว
แม้ไม่ได้เจอ ก็ยังปวดล้า
ใจฉันยังไม่อยาก ลาใคร
แต่ฉันยังคงต้องเดินต่อไป

ท้องฟ้า ยังไม่เหมือนกันสักวัน
ความรักของเราก็เช่นกัน
ถ้าวันหนึ่งล้มลงไปจะเจ็บไหม
ไม่เจ็บเท่าไม่มีเธอ

เธอคือคนพิเศษ และฉันไม่ได้วิเศษ
แค่คนธรรมดา ที่รักเธอแค่นั้นเอง
เธอคือคนพิเศษ แล้วฉันไม่ได้วิเศษ
แค่คนธรรมดา ที่รักเธอแค่นั้นเอง

Youre my paper plane
When you fly I want forget you
ยังคิดถึง I miss ya
Even these tears want fade away

ฉันเพียงต้องการเธอเท่านั้น
เขาพยายามมากกว่าฉัน
แค่เพียงได้มองเธอก็พอ
ไม่ขออะไรที่ล่วงเกินเธอเกินไป

จะอีกกี่แผลก็ยังไม่ลืมเธอ
สมงสมองก็เริ่มจะเลอะเลือน
ก็ Sippin lean เข้าไปเยอะเกิน
ก็ไม่เป็นไรฉันก็จะเอาไว้เตือนใจ

แล้วเธอก็ไปไปจากฉัน
ไม่มงไม่มองคนข้างหลัง
ทำไมไม่เป็นเหมือนดั่งฝัน
เรื่องเธอกับฉันก็เอาไว้ทบทวนใหม่

เธอคือคนพิเศษ และฉันไม่ได้วิเศษ
แค่คนธรรมดา ที่รักเธอแค่นั้นเอง
เธอคือคนพิเศษ แล้วฉันไม่ได้วิเศษ
แค่คนธรรมดา ที่รักเธอแค่นั้นเอง

Youre my paper plane
When you fly I want forget you
ยังคิดถึง I miss ya
Even these tears want fade away

ฉันเพียงต้องการเธอเท่านั้น
เขาพยายามมากกว่าฉัน
แค่เพียงได้มองเธอก็พอ
ไม่ขออะไรที่ล่วงเกินเธอเกินไป",gavin_d
Sometimes,/music/thailyric/19558,"ฟ้าที่เห็นว่าสวยงาม
ต้องเคยได้เจอกับพายุ
และรักเราก็คล้าย
มีทั้งดีและก็ร้าย

แต่เดี๋ยวอีกไม่นาน จะผ่านไป
เดี๋ยวอีกไม่นาน พายุมันก็จางไป

เจอวันร้ายๆ ก็ไม่เป็นไร แค่มีเธอ
อยู่ให้ฉันรัก แค่ได้มีกัน
แค่หันไปแล้วมีเธอ ก็ไม่กลัวอะไร
ก็ไม่กลัวอะไร

เป็นแค่เรื่องของเวลา
โชคชะตาให้เรียนรู้
และเรื่องที่ร้าย
แค่ทิ้งไว้ตรงนั้น

แต่เดี๋ยวอีกไม่นาน จะผ่านไป
เดี๋ยวอีกไม่นาน พายุมันก็จางไป

เจอวันร้ายๆ ก็ไม่เป็นไร แค่มีเธอ
อยู่ให้ฉันรัก แค่ได้มีกัน
แค่หันไปแล้วมีเธอ ก็ไม่กลัวอะไร

(Take me away)
(Take me away)
(Take me away)
(Take me away)

เจอวันร้ายๆ ก็ไม่เป็นไร ไม่เป็นไร",gavin_d
พี่ชายน้องชาย,/music/thailyric/19574,"ตามหารักดีดี จะมีบ้างไหม 
คงเป็นใคร ที่ยังไม่ใช่ฉัน 
ต้องรอคอยอีกนานเท่าไร 
หรือว่า ควรอยู่คนเดียวแค่นั้น

อย่าพึ่งท้อเลยน้องชาย
อาจจะเพราะว่าเราไม่ชัดเจน
หากว่าเหงาอย่าพึ่ง Cry
เดี๋ยวสักวันก็เจอความรักเอง

ก็ทิ้งเขาไปจนหมดแล้วล่ะคนดีๆ
ความรักที่มีเมื่อก่อนนั้นก็เป็นอดีต
ก็ผมมันเป็นคนใจร้ายเคยมีคดี
ลองตั้งใจคุยกับใครก็ยังไม่รู้วิธีจะจีบ

อันที่จริงแค่ต้องการ Some one
จะเป็นใครไม่สำคัญ
แต่ยังกลัวความสัมพันธ์จะทำให้ทุกข์ใจ
ข้างในปวดร้าวแต่ยังแพ้ความขาว
จะต้องฟัดสาวๆ ไปอีกมากเท่าไร

อยากจะเป็นเจ้าบ่าวเหมือน Gavin.D
เพื่อนมายินดี มีความสุขแบบเต็มที่
เบื่อมากจะเป็นข่าวเรื่อง Lady
แต่ก็ยังไม่ Ready เจอคนตรงกับเคมี

ตามหารักดีดี จะมีบ้างไหม 
คงเป็นใคร ที่ยังไม่ใช่ฉัน 
ต้องรอคอยอีกนานเท่าไร 
หรือว่า ควรอยู่คนเดียวแค่นั้น

อย่าพึ่งท้อเลยน้องชาย
อาจจะเพราะว่าเราไม่ชัดเจน
หากว่าเหงาอย่าพึ่ง Cry
เดี๋ยวสักวันก็เจอความรักเอง

ใจเย็นๆ ก่อน Bro 
Shell be on your way
Sip a mohitto หรือว่า Henny evrything is ok 
มึงต้องคบกันนาน
แล้วพาเธอไปทะเล
เล่นบาสเกตบอล Michael J
แต่งงานกับเธอ Someday

ไม่ต้องรีบให้รักเต็ม 100 
แต่รักทีละน้อยให้เต็มใจ 
ถ้ามึงไม่มีพิษหรือภัย 
She gonna be by your side

มึงเชื่อกูเถอะ การเวลาจะบอกทุกอย่าง Bro 
รับประกันต้องอินเลิฟชาตินี้หรือชาติไหน 
You need that first love
มันต้องเจอ That first trust
แล้วน้องจะมีความสุขมากกว่านี้
เชื่อพี่เถอะ Lazy

ตามหารักดีดี จะมีบ้างไหม 
คงเป็นใคร ที่ยังไม่ใช่ฉัน 
ต้องรอคอยอีกนานเท่าไร 
หรือว่า ควรอยู่คนเดียวแค่นั้น

อย่าพึ่งท้อเลยน้องชาย
อาจจะเพราะว่าเราไม่ชัดเจน
หากว่าเหงาอย่าพึ่ง Cry
เดี๋ยวสักวันก็เจอความรักเอง",gavin_d
รักที่ยืมเขามา,/music/thailyric/19557,"มันอาจจะเรียกว่ารักที่ยืมเขามา
ได้มาครองสักพัก
ไม่นานต้องคืนให้เขาไป
ความรักที่เธอนั้นมี
สัญญาที่ให้ฉันไว้
มันไม่ได้มีอยู่จริง
เธอเลยเอามันคืนไป

ผมน่ะชัดเจน แต่เธอน่ะชัตดาวน์
บางทีก็ให้เอา บางทีก็ไม่ให้เอา
ชีวิตฉันไม่ได้เศร้า แต่ร้องในใจเบาเบา
เห็นใจฉันหรือเปล่า หัวใจที่สีเทา

เธอไม่เคย Around
But I'm here right now
ฝนกำลังจะ Down
หัวใจที่ว่างเปล่า

มันจะ Complicated
เกลียดตัวเองแต่ฉันโคตรรักเธอ
เธอบอก Be patient
Just see yor later

เดี๋ยวค่อยกลับมาเจอ
But all the time it was a lie
เจ็บจี๊ดๆ เหมือนฉันจะตาย
ความรักที่ต้องยืมเขามา

มันอาจจะเรียกว่ารักที่ยืมเขามา
ได้มาครองสักพัก
ไม่นานต้องคืนให้เขาไป
ความรักที่เธอนั้นมี
สัญญาที่ให้ฉันไว้
มันไม่ได้มีอยู่จริง
เธอเลยเอามันคืนไป

เธอมาเอาความรักของเธอคืนไปได้เลย
ความรักที่ให้ยืมมาเชิญคิดราคาได้เลย
ไม่โกรธอะไรทั้งนั้น ช่างมันตัวฉันไม่เคย
ความรักหรือว่าความฝัน ตื่นมาเธอก็หายไปเลย

เธอเคยให้ฉัน ยืมตัวเธอมากอดไว้
เธอเคยให้ฉันยืม พื้นที่ที่ปลอดภัย
เธอเคยให้ฉันยืม เรื่องราวมากมาย
เธอเคยให้ฉันยืม แต่ว่าวันนี้เธอหายไป

ก็เหลือเพียงน้ำตา ที่เธอทิ้งไว้ที่ฉัน
ไม่มีน้ำยา จะขอให้เธออยู่กับฉัน
ทำอะไรไม่ได้นอกจากเมาเพราะกลืนยา
เอาแม่งให้ตายแด่ความรักที่ยืมมา

มันอาจจะเรียกว่ารักที่ยืมเขามา
ได้มาครองสักพัก
ไม่นานต้องคืนให้เขาไป
ความรักที่เธอนั้นมี
สัญญาที่ให้ฉันไว้
มันไม่ได้มีอยู่จริง
เธอเลยเอามันคืนไป

ฉันพยายามจะลืม
ฉันพยายามจะคืน รักที่ยืมที่เขามา
ขอโทษอีกที ที่ดึงเธอเข้ามา
เพราะคนที่ไม่จริงใจ มันไม่เคยเข้าตา
และการที่มีเธอมันไม่ได้ดีเท่ายา
อยู่คนเดียวแทบ Go insane
และเธอคงไม่คิดว่า I'm in pain
ฝากให้เธอไปคิดถ้าเธอได้ยินเพลง
มันโคตรทรมานที่พยายามจะยิ้มเอง

หลับแทบไม่ได้ ฉันกอดใครไม่ได้
และบางอย่างมันหาย มันหาไม่ได้ง่าย
รู้ว่าอันตรายแต่จะอยากได้ Right now
อยากให้เธอมานอนที่แขนซ้าย Right now
เช็ดน้ำตาที่ไหลออกมา ถ้าไม่ไหวก็ถอยออกมา
เป็นแค่รักยืมมา รู้ว่าไม่ได้ยืมนาน
แต่มันก็ยังดีที่ฉันได้ยืมมัน

มันอาจจะเรียกว่ารักที่ยืมเขามา
ได้มาครองสักพัก
ไม่นานต้องคืนให้เขาไป
ความรักที่เธอนั้นมี
สัญญาที่ให้ฉันไว้
มันไม่ได้มีอยู่จริง
เธอเลยเอามันคืนไป",gavin_d
