song_name,href,lyric,artist
ถ้าเราได้ตี้กัน,/music/thailyric/18602,"ฉันเป็นแจกัน
และถ้าหากไม่เป็นไร
งั้นเรามารักกัน

เราจะเริ่มมันตอนนี้
จนเช้าของอีกวัน
เธอว่ามันดีไหม
ถ้าเราได้ตี้กัน

อยากชวนเธอมาตี้ ตี้ ตี้
เธอช่างน่าขยี้ ยี่ ยี่
มันต้องแบบนี้  (Yeah)
เธอน่ะ Sexy

อยากมองเธอแบบนี้ซ้ำๆ
และเข้าไปกระซิบบางคำ
นั่นแหละสิ่งที่ฉันจะทำ
แล้วเธอจะ Happy

เวลาไม่เคยจะพอเวลาเธอกับฉัน
กินปาร์ตี้เป็นพิธี ช่วงเวลากลางวัน
ชอบแบบนี้ รักแบบนี้ เป็นแบบนี้เข้าใจไหมนี้
เธอช่างหวานเกินใครเหมือนเดิม
พอดูแล้วเพลิดเพลิน รื่นเริง

ไปในปาร์ตี้ ลึ้มล่ำ บึ้มบ้ำ
เสียงบนเวที โป้ง โป้ง ป้าง ป้าง
ไม่อยากที่จะ รอคอยเธอนานนาน
ถ้าต้องการ ฉันบอกเลย

ไม่น่าเชื่อว่าเธอกับฉัน ที่ดูไม่ค่อยเข้ากัน
แต่พอเธอรวมกันกับฉัน มันก็ใช่เลย
กลายเป็นรสชาติที่ตามหา เจอกับเธอก็เลิกตามหา
ชอบแบบนี้ ชอบแบบนี้ ที่เป็นเธอ

เธอคือดอกไม้
ฉันเป็นแจกัน
และถ้าหากไม่เป็นไร
งั้นเรามารักกัน

เราจะเริ่มมันตอนนี้
จนเช้าของอีกวัน
เธอว่ามันดีไหม
ถ้าเราได้ตี้กัน

อยากชวนเธอมาตี้ ตี้ ตี้
เธอช่างน่าขยี้ ยี่ ยี่
มันต้องแบบนี้  (Yeah)
เธอน่ะ Sexy

อยากมองเธอแบบนี้ซ้ำๆ
และเข้าไปกระซิบบางคำ
นั่นแหละสิ่งที่ฉันจะทำ
แล้วเธอจะ Happy

เธอบอกฉันเหมือนน้ำทะเลที่มันเค็มจัด
เหมือนกับกางเกงที่ไม่มีเข็มขัด
เป็นศิลปินที่ไม่มีสังกัด
แต่ใจฉันมีแต่เธอและเป็นคนที่จับจอง

เธอเหมือนคาราเมลที่มันช่างหวานชื่น
เหมือนฝนซาที่ทำถนนลื่น
เพราะว่าเธอไม่เหมือนกับคนอื่น
ทำให้ฉันต้องหวั่นไหวและต้องการจะครอบครอง

ต้องลอง Ya
ลองสนุกกับการ Party
เที่ยวให้มันส์สุดๆ ไปเลยเต็มที่
แม้จะเหนื่อย แต่มันก็สะใจดี
เอาไว้วันหยุดเราค่อยกลับมาพบมาเจอกันอีกครั้ง

ไม่น่าเชื่อว่าเธอกับฉัน ที่ดูไม่ค่อยเข้ากัน
แต่พอเธอรวมกันกับฉัน มันก็ใช่เลย
กลายเป็นรสชาติที่ตามหา เจอกับเธอก็เลิกตามหา
ชอบแบบนี้ ชอบแบบนี้ ที่เป็นเธอ

ฉันเป็นแจกัน
และถ้าหากไม่เป็นไร
งั้นเรามารักกัน

เราจะเริ่มมันตอนนี้
จนเช้าของอีกวัน
เธอว่ามันดีไหม
ถ้าเราได้ตี้กัน

อยากชวนเธอมาตี้ ตี้ ตี้
เธอช่างน่าขยี้ ยี่ ยี่
มันต้องแบบนี้  (Yeah)
เธอน่ะ Sexy

อยากมองเธอแบบนี้ซ้ำๆ
และเข้าไปกระซิบบางคำ
นั่นแหละสิ่งที่ฉันจะทำ
แล้วเธอจะ Happy",gavin_d
ทางของเธอ,/music/thailyric/16242,"ถ้าหากที่ทำให้เธอมันไม่ดีพอ
เธอไม่ต้องรีรอ เธอก็แค่ไปตามทางเธอ
ถึงจะรักเธอเท่าไร เธอก็คงไม่เข้าใจ
ก็ปล่อยให้เธอนั้นเลือกทางเดิน Oh baby

ถ้าความฝันของเธอมันคงจะดีกว่า
ไปก่อนที่ฉันนั้นจะกลายเป็นปีศาจ
อย่าจมกับฉันเลย อนาคตจะดีกว่า
เพราะฉะนั้นอย่าหันกลับมา
ทางที่ดีต้องแยกทาง

ฉันก็ไม่เข้าใจ ว่าทำไม
เธอเลือกที่จะไป เธอทำให้
ฉันไม่มีหัวใจ หลังจากนี้
เธอจะทำอะไร

I don't miss you
ฉันน่ะติด PubG 
ดีกว่ามีเธอ เพราะมีก็เหมือนไม่มี
You wish is my command
God gave me other plan
อยากให้มีคนมาแทน ก็จัดเราไปดิ

Aey เมื่อก่อนฉัน On come around
แต่ตอนนี้ไม่เอา อยากจะติดอยู่ก็
Getting out myself ก่อนนะ hey
You are love you are hate
You are love you are hate
You are love you yeah yeah

ประสบการณ์ถ้าไป อย่างว่า
เราคงจะเข้ากันไม่ได้
เคยรักกันจริง แล้วทิ้งให้ฉันอยู่คนเดียวทำไม

ถ้าหากที่ทำให้เธอมันไม่ดีพอ
เธอไม่ต้องรีรอ เธอก็แค่ไปตามทางเธอ
ถึงจะรักเธอเท่าไร เธอก็คงไม่เข้าใจ
ก็ปล่อยให้เธอนั้นเลือกทางเดิน Oh baby

ถ้าความฝันของเธอมันคงจะดีกว่า
ไปก่อนที่ฉันนั้นจะกลายเป็นปีศาจ
อย่าจมกับฉันเลย อนาคตจะดีกว่า
เพราะฉะนั้นอย่าหันกลับมา
ทางที่ดีต้องแยกทาง

ฉันก็ไม่เข้าใจ ว่าทำไม
เธอเลือกที่จะไป เธอทำให้
ฉันไม่มีหัวใจ หลังจากนี้
เธอจะทำอะไร ก็เรื่องของเธอ

Ah yeah เธอก็มีคนใหม่ ฉันก็มีคนใหม่
ช่างทุกเรื่องปะไร Aey
ลืมว่าฉันเป็นใคร Aey
เจออะไรใหม่ๆ Aey
เธอไม่ต้องสนใจ Aey
ฉันจะมาทำไม Aey yeah
Baby girl just go
Leaving me alone

เธอไม่ต้องโมโห
Calling on my phone
เธอเป็นคนที่ไปก่อน
ทิ้งฉันไว้ในห้องนอน
ปิดประตูแล้วล็อกกลอน
ขอฉันอยู่คนเดียวก่อน

เธอเป็นสิ่งที่ดีที่สุดที่ฉันเคยเจอ
แต่ว่าฉันต้องปล่อยให้เธอน่ะเดินไปในทางของเธอ

ถ้าหากที่ทำให้เธอมันไม่ดีพอ
เธอไม่ต้องรีรอ เธอก็แค่ไปตามทางเธอ
ถึงจะรักเธอเท่าไร เธอก็คงไม่เข้าใจ
ก็ปล่อยให้เธอนั้นเลือกทางเดิน Oh baby

ถ้าความฝันของเธอมันคงจะดีกว่า
ไปก่อนที่ฉันนั้นจะกลายเป็นปีศาจ
อย่าจมกับฉันเลย อนาคตจะดีกว่า
เพราะฉะนั้นอย่าหันกลับมา
ทางที่ดีต้องแยกทาง

ฉันก็ไม่เข้าใจ ว่าทำไม
เธอเลือกที่จะไป เธอทำให้
ฉันไม่มีหัวใจ หลังจากนี้
เธอจะทำอะไร ก็เรื่องของเธอ

ขอตัวดีกว่า ถ้าเธอไม่รัก
ไม่ต้องลีลา
รักเหลือเกิน แต่เธอต้องไป
ทางของเธอ เธอตัดสินใจ
โอเค ทางของใคร ทางของมัน
ทางของเรา พอแค่นี้ดีกว่า
เธอยิ่งฝืนเท่าไร เธอยิ่งฝืนเท่าไร
จะยิ่งแย่ไปกว่าเดิม
เธอน่ะทิ้งฉันไว้ดีกว่า เธอน่ะทิ้งฉันไว้ดีกว่า
ไม่อยากให้เธอลำบากเลย

ถ้าหากที่ทำให้เธอมันไม่ดีพอ
เธอไม่ต้องรีรอ เธอก็แค่ไปตามทางเธอ
ถึงจะรักเธอเท่าไร เธอก็คงไม่เข้าใจ
ก็ปล่อยให้เธอนั้นเลือกทางเดิน Oh baby

ถ้าความฝันของเธอมันคงจะดีกว่า
ไปก่อนที่ฉันนั้นจะกลายเป็นปีศาจ
อย่าจมกับฉันเลย อนาคตจะดีกว่า
เพราะฉะนั้นอย่าหันกลับมา
ทางที่ดีต้องแยกทาง

ฉันก็ไม่เข้าใจ ว่าทำไม
เธอเลือกที่จะไป เธอทำให้
ฉันไม่มีหัวใจ หลังจากนี้
เธอจะทำอะไร ก็เรื่องของเธอ

(มันเรื่องของเธอ)
(มันเรื่องของเธอ)
(มันเรื่องของเธอ)
(มันทางของเธอ)
(มันทางของเธอ)",gavin_d
เธอยังรอเขา,/music/thailyric/12269,"อาจเป็นเพราะหัวใจ
เธอไม่เคยมีฉัน
ไม่เคยมองให้ความสำคัญ
ว่าฉันรู้สึกอย่างไร
ใจที่ฉันให้เธอ เธอไม่เคยใส่ใจ
เธอมีเขาอยู่เต็มหัวใจ
ทั้งที่เขาไม่แคร์เธอเลย

เธอยังรอเขา เขาไม่รอเธอ
ใจเธอมีเขา แต่เขาไม่มีเธอ
แม้ว่าวันนี้เธอทำทุกๆ ทาง
ทำเพื่อเขา หวังให้มีสิทธิ์
ให้เขาคิดรักเธอ
สุดท้ายก็เพ้อละเมอ และเสียใจ

ส่วนตัวฉันนั้นคนไกล
ไม่เคยเข้าถึงดวงใจ
ได้แค่มองดูเธอทุกครั้ง ที่เธอเสียใจ
อยากให้เธอนั้นมองมา
อยากให้เธอเช็ดน้ำตา
เอาความทุกข์มาลงที่ฉัน
ฉันขอเจ็บแทนเธอ

เธอยังตามหา แต่เขาที่ไม่เคยเจอ
เธอเคยรู้ไหม ว่าฉันรอเพียงเธอ

มีของขวัญหัวใจ ที่เธอมอบให้เขา
สิ่งที่ได้คืนคือความว่างเปล่า
เพราะเขาไม่เคยใส่ใจ
ส่วนใจที่ฉันให้เธอ
ก็คงไม่มีความหมาย
เธอคงมีเขาอยู่เต็มหัวใจ
ทั้งที่เขาไม่แคร์เธอเลย

เธอยังรอเขา เขาไม่รอเธอ
ใจเธอมีเขา แต่เขาไม่มีเธอ
แม้ว่าวันนี้เธอทำทุกๆ ทาง
ทำเพื่อเขา หวังให้มีสิทธิ์
ให้เขาคิดรักเธอ
สุดท้ายก็เพ้อละเมอ และเสียใจ

ส่วนตัวฉันนั้นคนไกล
ไม่เคยเข้าใจดวงใจ
ได้แค่มองดูเธอทุกครั้ง ที่เธอเสียใจ
อยากให้เธอนั้นมองมา
อยากให้เธอเช็ดน้ำตา
เอาความทุกข์มาลงที่ฉัน
ฉันขอเจ็บแทนเธอ

เธอยังตามหา แต่เขาที่ไม่เคยเจอ
เธอเคยรู้ไหม ว่าฉันรอเพียงเธอ

เธอยังรอเขา เขาไม่รอเธอ
ใจเธอมีเขา แต่เขาไม่มีเธอ
แม้ว่าวันนี้เธอทำทุกๆ ทาง
ทำเพื่อเขา หวังให้มีสิทธิ์
ให้เขาคิดรักเธอ
สุดท้ายก็เพ้อละเมอ และเสียใจ

เธอเคยรู้ไหม ว่าฉันรอเพียงเธอ",gavin_d
บวบ,/music/thailyric/19898,"She กระซิบในหูว่า บวบ บวบ บวบ บวบ บวบ บวบ บวบ
She กระซิบในหูว่า บวบ บวบ บวบ บวบ บวบ บวบ บวบ
She กระซิบในหูว่า บ๊ว บ๊ว บ๊ว บ๊ว บ๊ว บ๊ว บ๊ว
เพลงนี้ 18 บวก บวก บวก บวก บวก บวก บวก

วันจันทร์กูก็ทำงาน
วันอังคารกูก็ทำงาน
วันพุธกูก็ทำงาน
พฤหัส กูก็ทำงาน
วันศุกร์กูไม่ทำละเว้ย
She said she wanna บวบ บวบ in the benzo
สู่ต่อกันไปทองหล่อ ทูเดอะคอนโด
ถึงเวลาผมก็ต้องไป Commando

ลงให้มิดโคตรฟิต
โคตรสเกิร์ตพาไป Turnt
Red alert เกี่ยวเหี้*อะไรกับเพลงนี้วะ
ชิบหายอะไรครับเนี่ย

อ๊อคอ๊อคแล้วก็จับอี Thot lock
ผัวแม่งเคาะประตูอยู่ Knock knock knock
ผัวมันถามว่าเห็นเมียผมหรือเปล่า
ผมบอกไม่เห็นนะไม่ได้ข่าว
เรื่องนี้ส่วนตัวผมนั้นไม่มีอะไรจะกล่าว
(กลับบ้านมึงไปไอ้ควาย)

กูไม่ได้เหี้*เหมือนกับไอซ์หีบเหล็ก
แต่ตอนที่เมียมึงบ้วบกูกูถือ AK47
อย่ามาดื้อกูไม่อยากทำกระหรี่เจ็บ
จัดกันเสร็จเดี๋ยวพาไปแดกบะหมี่เป็ด

ถึงผมเป็นคนซาดิสม์แต่ผมไม่ใช่ Criminal (good boy)
สมองผิดปกติมันเกิดมาจาก Chemical
ถ้าเกิดผมทำคุณปวดจนทนไม่ไหวผมมีไทลินอล
ขอโทษที่ทำคุณร้อง เอ๊าะ เอ๊าะ อ๊าว

She กระซิบในหูว่า บวบ บวบ บวบ บวบ บวบ บวบ บวบ
She กระซิบในหูว่า บวบ บวบ บวบ บวบ บวบ บวบ บวบ
She กระซิบในหูว่า บ๊ว บ๊ว บ๊ว บ๊ว บ๊ว บ๊ว บ๊ว
เพลงนี้ 18 บวก บวก บวก บวก บวก บวก บวก

เธออยากให้กูเอาคว*ไปถูหน้า
เธอชอบคาวๆ แบบทูน่า
กูตามเลือดมาปิรันยา
ก็เธออะเสือป่าแบบ Puma

เธออยากจะบ๊วบอยู่บน Farri
อยากจะไปแม่งทุก Party
อยากจะชิลล์กับ Celebrity
กูเอาตูดเธอมาตี
กูอะทำตูดเธอเด้งกูเอาตูดเธอมาเขี่ยบุหรี่

OK กู Lit จัดสาวๆ เขาอยากได้พิกัด
พาเธอมานั่งดู Pornhub
ก่อนที่เธอจะเผลอหลับ
Bad bitch แม่ง ต้องมาคุกเข่าขอกูแต่งงาน
เพราะกูเย็*เธอ ตั้งแต่ 8 ถึง 4 โมง ข้าราชการ

บร๊วบ​ บรวบ​ บรวบ​ บร๊วบๆ
บรวบ​  บรวบ​ บวบบะจวบบะสำปุ้ย
สับบะปรุก​ ปะสะระคะรังปุ๊ด​
สำบะรุงคิซิคขึปัดสะคะชะมะทุ่ย​
กำมะสักจึบอ็อก​ ตะทะบะจับฮึก​ ทุดะบะจับอ้าก

อิสะบุ๊สิแคง​ อิสะบุ๊สิคี
อะสะบุ๊คะคะระตะมุง
โอ้โห เฮ้ย เฮ้ย นี่มึงเคี้ยวอะไรหนิเฮ้ย
เฮ้ย เฮ้ย เบา เฮ้ย ไอ้ชาย เบา
บรวบ​ บรุ๊บ บรวบ​ บรุ๊บ

She กระซิบในหูว่า บวบ บวบ บวบ บวบ บวบ บวบ บวบ
She กระซิบในหูว่า บวบ บวบ บวบ บวบ บวบ บวบ บวบ
She กระซิบในหูว่า บ๊ว บ๊ว บ๊ว บ๊ว บ๊ว บ๊ว บ๊ว
เพลงนี้ 18 บวก บวก บวก บวก บวก บวก บวก",gavin_d
แบบนี้เอง,/music/thailyric/20392,"พี่ครับ พี่อะน่ารักจัง ขอดูแลได้ไหม
ทุกครั้งที่ผมอยู่ใกล้ๆ ผมแค่อยากเทกแคร์
อมม่าบอกอัปป้าให้ที ว่าผมเจอรักแท้
เพิ่งจะรู้ การรักใครสักคน มันเป็นแบบนี้เอง

เห็นเธอครั้งเดียว มันก็มีความรู้สึก
โดนมาก โดนใจ อยากเก็บเป็นที่ระลึก
เห็นเธออีกครั้ง ก็แค่อยากกอดเธอไว้
ก่อนคนอื่นจะมาตัดหน้า ขโมยหัวใจเธอไป

จีบได้ไหม เธอมีแฟนหรือยัง
ชอบรุ่นพี่ อยากเจอเธอทุกวัน
จับมือฉันอย่าปล่อย เดี๋ยวให้แบงค์พัน
น้ำหนักอะไม่คงที่ แต่รักที่มีน่ะคงกระพัน

ที่เขาเรียกว่ารักน่ะมันเป็นแบบนี้เอง
โลกมันช่างสดใส ราวกับอยู่ในบทเพลง
มีพี่และผม ส่วนผสมที่เข้ากัน
เปรียบดั่งกาแฟขม กับขนมที่ติดฟัน

ถ้าพี่ไม่มีใครมันก็คงจะดี
ไม่อยากคิดถึงในระยะแบบนี้
หากว่าสองเรา เข้ากันได้ดี
ได้โปรดให้ผมได้ดูแล

พี่ครับ พี่อะน่ารักจัง ขอดูแลได้ไหม
ทุกครั้งที่ผมอยู่ใกล้ๆ ผมแค่อยากเทกแคร์
อมม่าบอกอัปป้าให้ที ว่าผมเจอรักแท้
เพิ่งจะรู้ การรักใครสักคน มันเป็นแบบนี้เอง

ที่รัก ผมเรียกแบบนี้ได้ไหม นะ
ขอเรียกที่รักได้ไหม
เพราะหัวใจผมสั่น
ตอนเราอยู่ใกล้กัน

แค่เราจับมือเดินกันไป ก็ไม่กลัวอะไร
ถ้าไม่มีใคร ลองคบดูไหม จะคอยดูแลเทกแคร์

พี่ครับ พี่อะน่ารักจัง ขอดูแลได้ไหม
ทุกครั้งที่ผมอยู่ใกล้ๆ ผมแค่อยากเทกแคร์
อมม่าบอกอัปป้าให้ที ว่าผมเจอรักแท้
เพิ่งจะรู้ การรักใครสักคน มันเป็นแบบนี้เอง

อมม่าบอกอัปป้าให้ที ว่าผมเจอรักแท้
เพิ่งจะรู้ การรักใครสักคน มันเป็นแบบนี้เอง",gavin_d
