song_name,href,lyric,artist
XOXO,/music/thailyric/15706,"เธอช่างหวานเกินใครที่เคยเจอ
เก็บไปเพ้อละเมอและหวั่นไหว
แตะที่ ลิ้นแล้ว ฟินที่หัวใจ
My strawberry เธอดีกว่าใครที่ฉันเจอ

อยากแอบมองเธอไปนานๆ
ได้โปรดอย่าคิดว่าฉันน่ารำคาญ
ฉันไม่ได้จะทำอะไรไม่ดี
ขอให้เธอเข้าใจกันสักที

อกเธอเหมือนกับแตงโม
แอบดูเธอเป็นชั่วโมง
เธอ สดใสเหมือน Rainbow
ตอนเห็นเธอแล้วหิวน้ำเลย
แต่ฉันไม่ได้ต้องการอะไร
นอกจากหัวใจของเธอ

เธอเป็นอะไรที่สวยมาก
เพราะเธอ มันเป็นธรรมชาติ
แค่อยากจะจุ๊บเธอสักนิด
เพื่อที่จะได้ลิ้มรสชาติ
I'm a ปีศาจ เธอก็นางฟ้า
นี่ทวีปไหนที่เธอลงมา
ให้โอกาสฉันเพื่อได้สบตา
Into a world that is so far

Strawberry lips
Let's make it last forever
You got some strawberry hips
Can I make wish eh

เธอช่างหวานเกินใครที่ เคยเจอ
เก็บไปเพ้อละเมอและหวั่นไหว
แตะที่ ลิ้นแล้วฟินที่หัวใจ
My strawberry เธอดีกว่าใครที่ฉันเจอ

เล็กแต่พริกขี้หนูซ่อนรูปนะ My girl
แฟนเธอคงจะมี But you still spin my world
น่ารักและเอ็นดูฉันจะดูแลเธอเอง
เพราะจูบเธอโคตรหอม
ฉันเลยอยากบรรยายมาเป็นเพลง

Okey dokey baby
I'Il be smoking don't be shady
Got the moonlight in the city
Want you hope for another day though
Look at the world but from another place though

Oh my oh my oh my

Oh my oh my oh my
Have I really found this girl dipping
Tinkle twirls and silk line mixing
Could she be the one above the sky
My Hunny bun My bumble me

No one understands me
Present future or past
I got that supersuper vision
That can see past the sea
I'Il be drowning in the ocean
Brought towards the surface
Drawn towards the dandelion
And know that she's perfect

Strawberry lips
Let's make it last forever
You got some strawberry hips
Can I make a wish eh

เธอช่างหวานเกินใครที่ เคยเจอ
เก็บไปเพ้อละเมอและหวั่นไหว
แตะที่ ลิ้นแล้วฟินที่หัวใจ
My strawberry เธอดีกว่าใครที่ฉันเจอ

เธอช่างหวานเกินใครที่ เคยเจอ
เก็บไปเพ้อละเมอและหวั่นไหว
แตะที่ ลิ้นแล้วฟินที่หัวใจ
My strawberry เธอดีกว่าใครที่ฉันเจอ",gavin_d
กวินบินได้,/music/thailyric/18756,"Mans just murky
Came from bexhill pop pop pop
Bring out the uzis shots shots shots
When I come in its like murder
เร็วกว่าเน็ต On the server
กูนะโคตรไว อย่างกับบินบินบินบิน

ปีนี้กูจะ Cash more checks ทำงาน Not fuckin flex
เส้นทาง New quests กูจะซื้อ New creps
Mandem AD the best พวกมึง Just pests
Got dem bit tings coming ไม่ได้กดดัน Just starting
ฟังไม่รู้เรื่องก็อ่านเนื้อดิไอ้ Sus

มึงกลับไปนั่งท่องพุทโธ
มึงอ่ะมัน Pussy
แฟนมึงอ่ะลุค Hoe
ให้เธอมาจุ๊บละก็โบลว
มึงไม่ต้องทำฟลิบละก็โฟลว

เพลงพวกมึงแม่งยังไม่โดน
กุแค่กดใส่เลขละก็โอน
ที่คือเงินที่กูได้มาจากโชว์
เขาถามทำไมกูโอนง่ายจัง
กูไม่รู้เหมือนกันว่าทำเพลงละแม่งจะได้ตัง
บอกเพลงพวกกูห่วยแต่ว่าคนแม่งฟัง
ต้องเสียใจด้วยที่เพลงพวกมึงไม่ดัง

พวกกูบินอยู่ข้างบน ไม่ใช่บินลาเดน
แต่ว่าทำพวกมึงกระเด็น Sus",gavin_d
กอด,/music/thailyric/17346,"อากาศมันหนาว
ก็แค่อยากกอดเธอได้รึเปล่า
คิดถึงวันวานที่เธอกับฉันอยู่ด้วยกัน
In that place that
we use to call ah ah.
And I missing and I miss you.

อากาศมันหนาว
อยากกอดเธอได้รึเปล่า
คิดถึงวันวานที่เธอกับฉันอยู่ด้วยกัน
ตื่นมาตอนเช้า ในห้องที่มีแค่ตัวเอง
You're not around
I need you now baby

ก่อนที่ฉันจะไป
แค่อยากบอกเธอ I love you
เธอคือ The love of my life
and i can't live without you
แต่คืนนี้ขอทูไนท์ อยากอยู่ใกล้ใกล้
เผื่อ cupid ยิงธนู errerr ooh yea
เธอบอกฉันว่า love sick
ฉันบอกเดี๋ยวไปรับแถวสุขุมวิท
Every minute gone be worth it
อากาศแบบนี้มัน perfect
อากาศเหมือนอยู่ประเทศอังกฤษ
เธอเป็นเจ้าหญิง you deserve it
เธอคือยาที่ฉันต้อง เสพ
เพราะเธอคือความรักที่ต้องการ

อากาศมันหนาว
ก็แค่อยากกอดเธอได้รึเปล่า
คิดถึงวันวานที่เธอกับฉันอยู่ด้วยกัน
In that place that
we use to call ah ah.
And I missing and I miss you.

อากาศมันหนาว
แค่อยากกอดเธอได้รึเปล่า
คิดถึงวันวานที่เธอกับฉันอยู่ด้วยกัน
ตื่นมาตอนเช้า ในห้องที่มีแค่ตัวเอง
You're not around
I need you now baby

ยังคิดถึงกันรึเปล่า หรือตอนนี้ลืมกันไป
หรือว่าไม่ได้ make you pround
ก็ฉันไม่เคยตามใจ แต่ลืมเธอไปได้ไม่นาน
ภาพเธอก็กลับมาใหม่
เสื้อกันหนาวที่ซื้อให้เธอ
อย่าลืมหยิบเอามาใส่
ก็รู้ว่าพูดตอนนี้มันอาจจะน่ารำคาญ
ก็คนมันยังไม่ลืมมันอยู่ด้วยกันมานาน
หน้าหนาวกลับมาอีกครั้งช่วยให้คิดถึงวันวาน
ความทรงจำเธอเคยมีฉัน
แต่ว่าตอนนี้คงอันตรธานไป
แม้วันนี้ฉันไม่มีเธออย่างเคย
เธอคงไม่คิดถึงฉันบ้างเลย
แต่ฉันไม่เคยคิดถึงใครอย่างเธอ

อากาศมันหนาว
ก็แค่อยากกอดเธอได้รึเปล่า
คิดถึงวันวานที่เธอกับฉันอยู่ด้วยกัน
In that place that
we use to call ah ah.
And I missing and I miss you.

อากาศมันหนาว
แค่อยากกอดเธอได้รึเปล่า
คิดถึงวันวานที่เธอกับฉันอยู่ด้วยกัน
ตื่นมาตอนเช้า ในห้องที่มีแค่ตัวเอง
You're not around
I need you now baby",gavin_d
เกาะสวาทหาดสวรรค์,/music/thailyric/14521,"สวัสดีครับท่านผู้ชมขอต้อนรับสู่ Island
อยากมีแฟน There's a chance
ในดินแดนมหัศจรรย์

ดวงตะวันไม่เคยดับทำยังไงก็นอนไม่หลับ
อยากมีแฟน There is a chance in love island
In this little love island
ในดินแดนที่เรียกว่า Love island

เธอนั้น Sexy
เธอนั้น Sexy
เธอนั้น Sexy
แบบว่าอั้ม พัชราภา
เอวเธอ เล็กดี
หุ่นเธอเป๊ะดี ขอลองเช็คที
บอก  เอวมาเอวมาเอวมา

ไม่รู้ว่าตาฝาดหรือต้อง Enjoy
โชคชะตาพามาเป็น Sex toy
มองไปตรงไหนฉันก็ตาลอย
อยู่บน เกาะนี่ฉันก็เพลย์บอย
ตื่นขึ้นมาฉัน ก็ Ja สุขกอย
ฉันคงติดใจความสุขเล็กน้อย
Oh ฉัน นั้น ดีใจเวลาดำน้ำกับ girls

นางฟ้าก็เดินเข้ามาตัวฉันแค่อยากสบตา
ดวงดาวและจันทราเรืองแสงที่มัน แสบตา
ดินเนอร์ที่รู้หรา กินหอยกินปูกินปลา
โต้คลื่นจนขาชา จนเห็นโลมาสีชมพู

สวัสดีครับท่านผู้ชมขอต้อนรับสู่ Island
อยากมีแฟน There's a chance
ในดินแดนมหัศจรรย์

ดวงตะวันไม่เคยดับทำยังไงก็นอนไม่หลับ
อยากมีแฟน There is a chance in love island
In this little love island
ในดินแดนที่เรียกว่า Love island

เมื่อช่วงเวลาที่คลื่นทะเลซัดเข้าปะการัง
ทะเลมีปลาในป่ามีเขาบนเกาะนี้แค่เรา มัวและเมา
ดูสิ เธอคนนู้นก็เมา เอ๊ะ เธอคนนี้ก็เมา เอ๊ะ
But don't think to Deep Just bring da Meat
พวกเราแค่เมารักกันเอง
Cuz We eat n Sleep Our Job to Keep
ให้คนรักกันได้ครื้นเครง
ถ้าคุณอกหักก็ลองมา ที่ Love Island ต้องลองมา
ล่องมาด้วยเรือหรือจะเป็นแพ ขอให้คุณถึงก็แล้วกัน Yeah

ใน Island หากคุณอยากมีแฟน
ไม่ต้องนั่งเซ็งเพราะสาวๆ เดินมาหา อุ้ว
ใน Island หากคุณเดินควงแขน
ไม่ต้องกังวลไม่มีใครมาถือสา
What could it be หากว่าคุณไม่มั่นใจ
รักที่แล้วๆ ที่ผ่านมา ไม่ค่อยดี ไม่ค่อยดี วุ๊
ก็ลองมาที่ Love island

สวัสดีครับท่านผู้ชมขอต้อนรับสู่ Island
อยากมีแฟน There's a chance
ในดินแดนมหัศจรรย์

ดวงตะวันไม่เคยดับทำยังไงก็นอนไม่หลับ
อยากมีแฟน There is a chance in love island
In this little love island
ในดินแดนที่เรียกว่า Love island

สวัสดีครับท่านผู้ชมขอต้อนรับสู่ Island
อยากมีแฟน There's a chance
ในดินแดนมหัศจรรย์

ดวงตะวันไม่เคยดับทำยังไงก็นอนไม่หลับ
อยากมีแฟน There is a chance in love island

ในดินแดนที่เรียกว่า Love island",gavin_d
แค่เผลอ (Kae Plur),/music/thailyric/20839,"เรื่องที่มันเป็นแบบนี้อยากอธิบายให้ฟัง
เหมือนคณะตลกที่เอารอยยิ้มเอาหน้ากากมาปิดบัง
มันเริ่มที่ 0 ไปถึง 100 ในระยะสั้นๆ
แต่เธอน่ะเล่นกะใจเป็นประจำ
ทิ้งฉัน I respond for u

เธอมีเหตุผลที่จะไป
เธออยู่ในใจของใครๆ
แล้วหลอกฉันเพื่ออะไร
ได้แค่กายแต่ไม่ได้ใจ
ก็ไม่ได้มีประโยชน์เช่นกัน
:
ถ้าขาดเราเธอก็คงไม่ตาย
ขาดเธอฉันต้องอยู่ให้ได้
พยายามมองข้ามคนที่ร้ายๆ
เจ้าทำให้ข่อยเศร้า You know

เธอเป็นคนที่ไม่จริงจังกับใคร
เธอบริหารเสน่ห์ทำให้ฉันเผลอใจ
เธอไม่เคยรักษา สัญญา
เธอไม่เคยเห็น คุณค่า
ไม่รักกันก็ฉันไม่เคยสำคัญ
หยุดเล่นตลกกับความรักฉันที

She bad girl she bad girl

ไม่เคยเหงาเลย เพราะเธอมีเขา
เธอไม่เคยขอโทษ เรื่องระหว่างเรา
ฉันคิดถึงแล้วไงสุดท้าย
ก็โดนเทเหมือนเดิม เพิ่มเติม
เธอทำเป็นเธอไม่รู้จัก
เธอไม่เคยให้รักกลับมา

อยากเป็นแฟนเธอกับเธอจะเป็นจะตาย
แต่เธอไม่เคยสนใคร
เธอคบแป๊บๆ แล้วเธอก็เลิกไป

ถ้าขาดเราเธอก็คงไม่ตาย
ขาดเธอฉันต้องอยู่ให้ได้
พยายามมองข้ามคนที่ร้ายๆ
เจ้าทำให้ข่อยเศร้า You know

เธอเป็นคนที่ไม่จริงจังกับใคร
เธอบริหารเสน่ห์ทำให้ฉันเผลอใจ
เธอไม่เคยรักษา สัญญา
เธอไม่เคยเห็น คุณค่า
ไม่รักกันก็ฉันไม่เคยสำคัญ
หยุดเล่นตลกกับความรักฉันที

เธอเป็นคนที่ไม่จริงจังกับใคร
เธอบริหารเสน่ห์ทำให้ฉันเผลอใจ
เธอไม่เคยรักษา สัญญา
เธอไม่เคยเห็น คุณค่า
ไม่รักกันก็ฉันไม่เคยสำคัญ
หยุดเล่นตลกกับความรักฉันที

She bad girl she bad girl
She bad girl she bad girl",gavin_d
แง๊นแง๊น,/music/thailyric/16525,"เวลาเธอ Dance on the floor like that
แค่จะ Holla back พาเธอกลับ ฮั่นแนะ
เหมือนเวลาเธอเปียก I'll be sipping on black
เมียมึงยังไม่กลับเนี่ย She be sipping on my cup

อ่าแลบลิ้นดิ อ่าแลบลิ้น
อ่าแลบลิ้นดิ อ่าแลบลิ้น
อ่าแลบลิ้นดิ อ่าแลบลิ้น
เอาจนนอนไม่หลับ
ลิ้นรัว In da club

อะ ขาขวาดิ อะ ขาซ้าย
อะ ขาขวาดิ อะ ขาซ้าย
อะ ขาขวาดิ อะ ขาซ้าย
คืนนี้กูไม่กลับ
Get that pussy in da club

อะ แง๊นแง๊นดิ อะ แง๊นแง๊น
อะ แง๊นแง๊นดิ อะ แง๊นแง๊น
อะ แง๊นแง๊นดิ อะ แง๊นแง๊น
เมียมึงโทรมาเองอยากสัมผัส Rapstar

จัดหนักจัดหนักอย่าไปกลัว
จับนิดจับหน่อยอย่ามาทำเป็นเล่นตัว
Popping champagne เหมือนตัวเองแม่งรวย
วันนี้แค่อยากจะ Drip drip  dripping on my neck

เอาแบบกระชับขอแบบตูดแน่นๆ
กูไม่พาไปแว๊นแต่กูจับ แง๊นแง๊น
อาจจะพานั่งเล่น In da jazz or the van
ขอแบบแรงแรงแรง กูจะแทงแทง Tango

เกิดมาครั้งเดียวอยากจะนับแบงค์พัน
Welcome to the party ขอแบบเพลงลั่นๆ
High as hell bitches I got bitches for my crew
Gucci belt gang Lois Vuitton Balen shoes
เอาไอ้หนู มาดมจู๋ เผื่อเจอเนื้อคู่มานวดกระปู๋
อะโจ๊กหมู อะโม้ก อย่าไปคิดเยอะแยะ ใช้ชีวิต
Like a pornstar

เวลาเธอ Dance on the floor like that
แค่จะ Holla back พาเธอกลับ ฮั่นแนะ
เหมือนเวลาเธอเปียก I'll be sipping on black
เมียมึงยังไม่กลับเนี่ย She be sipping on my cup

อ่าแลบลิ้นดิ อ่าแลบลิ้น
อ่าแลบลิ้นดิ อ่าแลบลิ้น
อ่าแลบลิ้นดิ อ่าแลบลิ้น
เอาจนนอนไม่หลับ
ลิ้นรัว In da club

อะ ขาขวาดิ อะ ขาซ้าย
อะ ขาขวาดิ อะ ขาซ้าย
อะ ขาขวาดิ อะ ขาซ้าย
คืนนี้กูไม่กลับ
Get that pussy in da club

อะ แง๊นแง๊นดิ อะ แง๊นแง๊น
อะ แง๊นแง๊นดิ อะ แง๊นแง๊น
อะ แง๊นแง๊นดิ อะ แง๊นแง๊น
เมียมึงโทรมาเองอยากสัมผัส Rapstar

เห็นกูหน้าเด็กมึงก็ทำเป็นปีนเกลียว
เห็นกูมาคนเดียวกูน่ะ Motherfucking real deal
มองหน้ากูมึงจะมองทำไม ที่นี่มันมีแต่นม
With that rich lifestyle
เทียบกับกูไม่ติด มีแต่คิดแต่ทำไม่ได้
ถ้าไม่ไหวก็ออกจากแก๊ง ออกจากแก๊งกูไป

เห็นสนิทกับโอม Aixd มึงก็คุยกันดี
แต่ตัวกูเองไม่เปลี่ยน กูยังเป็นคนเดิมคนดี
ถ้าจะเจอกู มึงก็เจอกันที่เดิม
In da club or da pub ร้องเพลงอยู่บนเวที
เห็นแต่ขาเรียว Right down to the floor
รออะไรจ๊ะ นัวเนียกัน Some more

มันถึงเวลาแล้วแหละ
มันถึงเวลาแล้วแหละ
Hold my dick hold my cash
มันถึงเวลาแล้วแหละ
มันถึงเวลาแล้วแหละ
Hold my dick hold my cash
มันถึงเวลาแล้วแหละ

ตบมือ Baby ตบมือ
ตบมือ Baby ตบมือ
ตบมือ Baby ตบมือ
อย่าสะกิดเครื่องฟิต สตาร์ทติดง่ายๆ Leggo",gavin_d
ฉันยังไหว,/music/thailyric/15295,"หลับตาลงในอ้อมกอดฉัน
อย่ากังวนเรื่องในวันนั้น
เรื่องที่พลั้งไป เรื่องที่เสียใจ
แม้ไม่เหลือใคร
ก็ตามเพียงแค่ลืมไม่ต้องจำ

ฉันก็ยังเหงาตอนที่เธอไปกับเขา
แค่ครั้งหนึ่งเคยมีคำว่าเรา
แม้นิดเดียวก็เจ็บใจไม่เบา
รู้ตัวว่าฉันคงไม่เป็นอย่างที่หวัง
เป็นเยื่อใยที่ไม่มีใครต้องการ
ความเสียใจที่ไม่มีใครนิยาม

เธอไม่ต้องไปแคร์ ไปสนที่ใครทำร้าย
ฉันนี่ไงที่คอย เธออยู่ตรงนี้
เหนื่อยพอแล้วเจ็บพอแล้ว
เรื่องที่ ช้ำให้เป็นฝัน แค่นั้นพอ

แม้ว่าเธอจะไม่ได้รักกันในตอนนี้
ก็รู้ดีว่าเธอมีแต่เขา
โอบเธอไว้ไม่ ไปไหน
อ้อมกอดฉันให้หลับใหล
แม้ว่าเธออยากพบเจอแต่เขา

ต่อให้เจ็บช้ำไม่ไหว
ทุกข์ทนแค่ไหน
ไม่ต้องกลัวเธอจะมีฉัน
แม้ว่าใจจะอยู่กับเขาคนนั้น

ฉันแค่กลัวว่าเธอจะลืม
ความสัมพันธ์ของเราไม่ยั่งยืน
แค่ฉันเคยมีเธอก็พอ
เพราะว่าเขาคือคนที่เธอน่ะรอ

และเพราะว่ารักจึงผิดหวัง
ทั้งที่ไม่ใช่ความผิดฉัน
ฉันเชื่อใจเธอ Baby
เขาก็คงเป็นคนดี

สุดท้ายฉันคงไม่ขอ
ให้เธอเลือกคนที่เธอน่ะรอ
เพราะฉันคนคั่นเวลา
รักของเราแค่หลอกตา

เธอไม่ต้องไปแคร์ ไปสนที่ใครทำร้าย
ฉันนี่ไงที่คอย เธออยู่ตรงนี้
เหนื่อยพอแล้วเจ็บพอแล้ว
เรื่องที่ ช้ำให้เป็นฝัน แค่นั้นพอ

แม้ว่าเธอจะไม่ได้รักกันในตอนนี้
ก็รู้ดีว่าเธอมีแต่เขา
โอบเธอไว้ไม่ ไปไหน
อ้อมกอดฉันให้หลับใหล
แม้ว่าเธออยากพบเจอแต่เขา",gavin_d
