song_name,href,lyric,artist
อยากเข้าประตูวิวาห์,/music/thailyric/22387,"จับมือเจ้าสิได้บ่ อยู่ใกล้ๆ สิได้บ่
หอมแก้มเจ้าเบาๆ แล้วบอกว่าฮักทั้งหัวใจ
ฮักเจ้านั้นเพียงคนเดียว หญิงอื่นอ้ายบ่ขอเกียว
ถึงจะเป็นแบบนี้ แต่ก็จะฮักเจ้าเรื่อยไป

ขอเพียงเจ้านั้นอยู่ข้างกาย อ้ายนิบ่กล้าค่อนข้างอาย
รับรองว่าเจ้าจะสบาย สอมแหวนนิ้วนางอยู่ข้างช้าย
ถ้าเจ้าเป็นบิ๊กอ้ายสิเป็นเจี้ย ถ้าเจ้าเป็นเมียอ้ายสิเป็นผัว
เจ้าเป็นครูบาอ้ายสิเป็นจัว เจ้าเป็นตำรวจอ้ายสิเป็นโจร

สีสีสี มื้อนี้เป็นมื้อสรรวันดี
มื้อปลาค้อสิเข้าฮู กระปูสิเข้าถ้ำ
น่านผักชีเจ้าสิหมุน

อยากเข้าประตูวิวาห์ มาพร้อมหน้าพร้อมตา
มันคงเป็นวาสนาที่เฮ็ดให้เฮาได้มาพ้อกัน
ผูกแขนซ้ายขวัญมา ผูกแขนขวาเอิ้นขวัญเจ้าอยู่
อ้ายดีใจหลายได้เจ้ามาเป็นคู่ สิเบิ่งสิแยงเจ้าให้ดีๆ

อยากได้เจ้าเป็นแฟน บ่อยากได้เป็นหมู่
ต้องการเจ้ามาเป็นคู่ อีพ่ออีแม่ละเพิ่นว่าจั่งใด๋
แขกผู้ใหญ่กะมา แขกผู้น้อยกะมาเป็นหมู่
ลุงป้าอ่าวอาเพิ่นสิมาสู่ อยากบอกให้ฮู้ว่าอ้ายฮักเจ้าหลาย

โอ้แม่น้องสาวเ จ้าผู้งามผู้ตาหวาน
อยากได้เจ้ามาเป็นคู่อยู่แบบนี้ไปนานๆ
อยู่ด้วยกันไปแบบนี้จนสองเฮานั้นแต่งงาน
อยากมีลูกอยากกับเจ้าจนสองเฮานั้นมีหลาน

ใช้ชีวิตคู่กับคนนี้ไปตลอด
แค่เพียงเจ้าต้องการหยังขอให้นางนั้นมาบอก
อ้ายคนนี้พร้อมจ่ายพร้อมสิเปย์เจ้าตลอด
ถึงแม่นเจ้าอยู่ห่างไกลอ้ายคนนี้ก็ไปฮอด

อยากได้เจ้ามาเป็นคู่อยู่ด้วยกันเคียงข้างกาย
อยากได้เจ้าเป็นมาเป็นคู่นอนเคียงหมอนนอน Good night
แค่เพียงเจ้าตอบตกลง อ้ายก็พร้อมจะปิดไป
ขอบอกเลยเว่าตรงๆ อ้ายคนนี้บ่อันตราย

เจ้านั้นเป็นเหยื่ออ้ายเสือพร้อมจะกิน
เจ้าบ่มีไผครอบครองบ่เป็นชู้บ่ผิดศีล
บ่แม่นคนที่ดีเลิศ อ้ายเป็นคนที่ติดดิน
สองเฮานอนอยู่เถียงนา ยามเวลาฝนตกริน เยเย้

มาเข้าประตูวิวาห์นำกันถึงแก่ชรา
แล้วพากันเต้นยาวๆ มีทั้งพ่อแม่และอ่าวอา
ลูกหลานกะเป็นตาแพง
พ่อแม่อยากได้เจ้าแฮง

ต้มไก่กะมาเป็นพา น้ำส้มน้ำแดงน้ำหวาน
เหล้าขาวผู้เฒ่าต้องการ ดื่มด่ำให้ชื่นอุรา
ผู้เฒ่าผู้แก่เพิ่นให้พร ให้เฮาสองคนนั้นฮักกัน
ชั่วนิรันดร

อยากเข้าประตูวิวาห์ มาพร้อมหน้าพร้อมตา
มันคงเป็นวาสนาที่เฮ็ดให้เฮาได้มาพ้อกัน
ผูกแขนซ้ายขวัญมา ผูกแขนขวาเอิ้นขวัญเจ้าอยู่
อ้ายดีใจหลายได้เจ้ามาเป็นคู่ สิเบิ่งสิแยงเจ้าให้ดีๆ

อยากได้เจ้าเป็นแฟน บ่อยากได้เป็นหมู่
ต้องการเจ้ามาเป็นคู่ อีพ่ออีแม่ละเพิ่นว่าจั่งใด๋
แขกผู้ใหญ่กะมา แขกผู้น้อยกะมาเป็นหมู่
ลุงป้าอ่าวอาเพิ่นสิมาสู่ อยากบอกให้ฮู้ว่าอ้ายฮักเจ้าหลาย

อันว่าผัวเมียนี้ กูมึงอย่าได้ว่า
ให้เอี้นข้อยและเจ้าสนองเฒ่าชั่วชีวัน
ยามกินเข้าให้ผัวแพงกินก่อน
ผัวกินเหลือตั้งแต่ก้าง อีนางหล้าจึงค่อยกิน",sophana
อยากเป็นลูกเขย,/music/thailyric/18329,"อยากเป็นลูกเขยของแม่เจ้า
และอยากเป็นลูกเขยของพ่อเจ้า
อยากเป็นลูกเขยของแม่เจ้า
และอ้ายอยากเป็นลูกเขยของพ่อเจ้า Ya

โอ้ผู้สาวเจ้านั้นเป็นลูกผู้ใด๋
อ้ายเห็นเจ้าในมื้อนั้นและอ้ายโคตรฮู้สึกถืกใจ
อ้ายเห็นเจ้าโพสต์ลงเฟซ
อ้ายเลยเข้าไปกดใจ
ก็ย้อนว่าเจ้าหน้าฮัก
อ้ายเลยอยากทักไปทันใด Ya

ถ้าเจ้าบ่ทันมีแฟนขอบอกเลยมันโคตรจะดี
เพราะเจ้านั้นหน้าฮักอยากให้เจ้ามาเป็น My shawty
ถ้าเป็นแบบนั้นละมันบะโคตรดี
และก็อยากให้เจ้ามาสนใจอ้ายแน่ Baby ya

หน้าตาของอ้ายอาจสิบ่หล่อเหลา
แต่ฮักแท้และความจริงใจอ้ายมีเต็มกระเป๋า
ขอให้เจ้านั้นหันมาและลองแนม กันแน่
เพราะว่าอ้ายนั้นอยากได้เจ้ามาเทคเเคร์.

อยากเป็นลูกเขยของพ่อแม่เจ้า
อยากเป็นผู้เฒ่าละผู้แก่กับนาง
ค่าดองท่อใดสิให้พ่อไปถาม
ขอเพียงน้องนางเปิดใจให้อ้ายแหน่

อยากเป็นลูกเขยของพ่อแม่เจ้า
อยากเป็นผู้เฒ่าละผู้แก่กับนาง
ค่าดองท่อใดสิให้พ่อไปถาม
ขอเพียงน้องนางเปิดใจให้อ้ายแหน่.
เปิดใจให้อ้ายแหน่ เปิดใจให้อ้ายแหน่

แวบแรกที่อ้ายได้เห็นหน้าเจ้า
อ้ายกะอยากจะทักและอยากเอ่ยคำเว่าออกไป
และอยากจะถามไถ่เจ้าเป็นลูกผู้ใด
เวลาที่เจ้าส่งยิ้ม มันเฮ็ดให้ใจของอ้ายละลายทันใด Aey

ข้อยติดใจเจ้าตั้งแต่แวบแรก
ก่อเพราะหุ่นฮอยเจ้าเป็นตาแช่บ
หัวใจและเบอร์โทรให้พร้อมแลก
เพียงเจ้าแนมมา อ้ายนั้นก่อยิ้มเป้ยๆ
เบิดมื้อเบิดคืน

ก็ย้อนว่าเจ้าหน้าฮัก
ก็เพราะว่าเจ้าหน้าฮัก
อ้ายเลยกดเข้าไปทัก Messenger
เฟซแอดไปละเด้อ
ฮับแอดแน่ได้บ่
อ้ายสิบอกพ่อแม่ไปขอ Aey aey
ก็เจ้าน่ะงามอิหลี
อยากให้เจ้าน่ะ มาเป็นคู่ชีวิต
แต่ว่ามันติดที่อ้ายนั้นบ่รวย
อ้ายนั้นบ่รวย Yeah แต่ว่าอ้ายกะ 56 เด้อ

ถ้าสมมุติว่าเฮานั้นเป็นแฟนกัน
ถ้าเป็นแบบนั้นผมว่ามันคงจะดี
เพราะอ้ายคนนี้หน้าตากะบ่ได้หล่อ
แถมพ่อผมนั้นกะบ่ได้รวย

แล้วทำยังไง จั่งสิได้เป็นลูกเขย
การแต่งโตผมนั้นมันโคตรเชย
ผมอยากเป็นผมอยากเป็นลูกเขย
ได้ยินละผมอยากเป็นลูกเขย

กะอยากเป็นลูกเขยของพ่อแม่เจ้า
อยากมีผู้เฒ่าผู้แก่กับนาง
ค่าดองท่อใดสิให้พ่อไปถาม
ขอเพียงน้องนางเปิดใจให้ผมแหน่

อยากเป็นลูกเขยของพ่อแม่เจ้า
อยากเป็นผู้เฒ่าละผู้แก่กับนาง
ค่าดองท่อใดสิให้พ่อไปถาม
ขอเพียงน้องนางเปิดใจให้อ้ายแหน่",sophana
แอบแนมแต่อ้าย,/music/thailyric/21912,"แอบแนมแต่อ้าย อยากให้หันมา
หันมาสบตาอย่าเฉยชาใส่น้องได้บ่
หันขวาหันซ้ายเป็นตาฮักแท้หนอ
พอมีสิทธิ์แหน่บ่ให้ได้เป็นเจ้าของหัวใจ

น้องบ่แม่นดอกผู้ดีที่มีการศึกษา
แต่พอไปวัดไปวาถึงหน้าตาบ่ค่อยดี
มีเพียงหัวใจใครจะทำฮ้ายเจ็บช้ำย่ำยี
จากใจผู้สาวคนนี้มีสิ่งเดียวที่อยากจะขอ

มาคบน้องได้บ่หนา มาฮักน้องได้บ่หนา
อยากให้อ้ายมาฮักษามาหาน้องคนเดียว
อ้ายอย่าเฮ็ดให้น้องต้องเสียใจ
แบบคนที่เคยเฮ็ดให้น้องนั้นฮ้องไห้  โอ้

จะบ่เฮ็ดให้เจ้าต้องเหงา
อ้ายสิยืนเคียงข้างเจ้า
เวลาที่เจ้าโศกเศร้าอ้ายก็จะคอยปลอบใจ
ถ้าหากว่าเจ้ายังบ่มีไผ กะอยากให้เจ้าลองมาคบกัน
อย่าปล่อยให้เก็บไปฝันอยู่คนเดียว

โอ้ว มายด์ มิ้นท์ เด้ออ้าย Yay

หน้าตากะสิวผิวน้องกะดำ
เห็นอ้ายเถื่อเดียวสมองเลยจดจำ
หนึ่งเดียวในใจยกให้เป็น Number one
ถืกใจอ้ายหลายยกให้เป็นชายในฝัน

ขอเพียงอ้ายบ่ถิ่มบ่จากน้องไปไส
บ่ว่าจะเกิดหยังขึ้นก็ยังอยู่ข้างกาย
เป็นคนที่ป้อนยาเวลาน้องบ่สบาย
ขออยู่คู่กันจากนี้จนถึงวันตาย Yay yay

มีอ้ายอยู่ข้างกาย กอดกันไว้เวลามีลมหนาวให้น้องอุ่นใจ
กอดน้องไว้อยู่แบบนี้ กอดน้องให้ฮู้สึกดี
ต้องเป็นอ้ายเท่านั้น ต้องเป็นอ้ายคนนี้ Yay
รอคอยมาเป็นปี รอวันที่อ้ายนั้นหันมา

มาคบน้องได้บ่หนา มาฮักน้องได้บ่หนา
อยากให้อ้ายมาฮักษามาหาน้องคนเดียว
อ้ายอย่าเฮ็ดให้น้องต้องเสียใจ
แบบคนที่เคยเฮ็ดให้น้องนั่นฮ้องไห้  โอ้......

จะบ่เฮ็ดให้เจ้าต้องเหงา
อ้ายสิยืนเคียงข้างเจ้า
เวลาที่เจ้าโศกเศร้าอ้ายก็จะคอยปลอบใจ
ถ้าหากว่าเจ้ายังบ่มีไผ กะอยากให้เจ้าลองมาคบกัน
อย่าปล่อยให้เก็บไปฝันอยู่คนเดียว

ผมไม่ชอบบวกผมไม่ชอบลบ
แต่ผมนั้นชอบคูณ
ถ้าเป็นไปได้ก็อยากได้ก็อยากเอาเธอนั้นมาซูน
อยากเอาเธอนั้นมาหมอนแทนหมูน
เฮ้ย อะหมูนแทนหมอน

ผมอยากได้เจ้ามาเป็นคู่ก่อนนอน
อยากให้เจ้าลองเป็นเมียอ้ายก่อน
เพราะว่าอ้ายอยู่แก๊งลูกเขยใส่มอง
มันคงจะดีถ้าอ้ายนั้นมีเมียสอง
แต่โตอ้ายนี้นั้นกะใส่แต่ทอง
อยากให้เจ้านั้นหันมามอง
ได้ไหมจ๊ะ

มาคบน้องได้บ่หนา มาฮักน้องได้บ่หนา
อยากให้อ้ายมาฮักษามาหาน้องคนเดียว
อ้ายอย่าเฮ็ดให้น้องต้องเสียใจ
แบบคนที่เคยเฮ็ดให้น้องนั่นฮ้องไห้  โอ้

จะบ่เฮ็ดให้เจ้าต้องเหงา
อ้ายสิยืนเคียงข้างเจ้า
เวลาที่เจ้าโศกเศร้าอ้ายก็จะคอยปลอบใจ
ถ้าหากว่าเจ้ายังบ่มีไผ กะอยากให้เจ้าลองมาคบกัน
อย่าปล่อยให้เก็บไปฝันอยู่คนเดียว",sophana
