song_name,href,lyric,artist
รอแล้วก็รอ (Raindrop),/music/thailyric/16857,"ฉันนั่งมอง เฝ้ามองดูฟ้า รอคอยเวลาฝนตก
ลมโบกโชย รวมกลุ่มเมฆครึ้ม ดั่งใจที่มีต่อเธอ

รู้ไหมว่าฉันคอย
รอคอยมันกลั่นตัวเป็นหยดน้ำใจจากเธอ
ให้กับใจที่มันแห้งแล้ง รอน้ำใจเพียงนิดหนึ่ง
เช่นดังฝนช่วยให้ชุ่มชื้นกับรักที่มีต่อเธอ

รู้ไหมว่าฉันคอย มันนานเท่าไรที่ไม่มีน้ำใจจากเธอ

ถ้าคิดว่าฉันเรียกร้องความสนใจ ที่ฉันไม่เคยได้มันเสมอ
ต่อให้ต้องรอไปนานสักแค่ไหน ที่เสียใจที่ไม่มีความหมาย
ไม่มีคุณค่าให้หัวใจเธอรู้สึก ดั่งฝนที่ฉันต้องรอต่อไป

เธอลืมไปแล้วใช่ไหมที่เคยรู้สึก
มันเปลี่ยนไปแล้วหรือยัง ช่วยย้ำในใจเธอลึกๆ

รู้ไหมว่าฉันคอย มันนานเท่าไรที่ไม่มีน้ำใจจากเธอ

ถ้าคิดว่าฉันเรียกร้องความสนใจ ที่ฉันไม่เคยได้มันเสมอ
ต่อให้ต้องรอไปนานสักแค่ไหน ยิ่งเสียใจที่ไม่มีความหมาย
ไม่มีคุณค่าให้หัวใจเธอรู้สึก ดั่งฝนที่ฉันต้องรอต่อไป

ถ้าคิดว่าฉันเรียกร้องความสนใจ ที่ฉันไม่เคยได้มันเสมอ
ต่อให้ต้องรอไปนานสักแค่ไหน ยิ่งเสียใจที่ไม่มีความหมาย
ไม่มีคุณค่าให้หัวใจเธอรู้สึก ดั่งฝนที่ฉันต้องรอต่อไป",yokee_playboy
รักรอที่ฟลอร์เต้นรำ,/music/thailyric/12568,"ใครยังไม่มีคนรักให้ฟังเพลงนี้ก่อน
ถ้าเธอยังไม่มีคนรู้ใจเลยสักที

มาที่ฟลอร์ ที่ฉันรออยู่
อยู่ที่ฟลอร์ ฉันขอฉันจะเต้นรอเธอ
มาที่ฟลอร์เถอะ อยู่ที่ฟลอร์กัน
มาที่ฟลอร์ ยังมีรักเฝ้ารอ

มีความรักรอที่ฟลอร์เต้นรำ
มีคนรักรอเธออยู่ตั้งนาน
ขยับร่างกายให้ได้เคลื่อนไหว
ให้ใจชื่นบาน
ลืมความทุกข์เศร้าโศกและระทม

ถ้ายังไม่เคย เต้นเลยเต้นตาม
ขยับให้ความทุกข์หมดจากหัวใจเธอ เสียบ้าง
เธอมีความรักฉันรออยู่
รักฉันรออยู่ที่ฟลอร์

ยังเต้นรอ เต้นรอ ฉันเต้นรอ
เต้นรอเธออยู่ตรงนั้น

มีความรักรอที่ฟลอร์เต้นรำ
มีคนรักรอเธออยู่ตั้งนาน
ขยับร่างกายให้ได้เคลื่อนไหว
ให้ใจชื่นบาน ลืมความทุกข์เศร้าโศกและระทม

ถ้ายังไม่เคย เต้นเลยเต้นตาม
ขยับให้ความทุกข์หมดจากหัวใจเธอ เสียบ้าง
เธอมีความรักฉันรออยู่
รักฉันรออยู่ที่ฟลอร์",yokee_playboy
