song_name,href,lyric,artist
กัญชาคอมมิชชั่น (Cannabis Commission),/music/thailyric/16893,"กัญชง กัญชา อเมริกาทำสงครามเย็น
(อะ) กัญชง กัญชา อเมริกา (ละ) กดดันยูเอ็น
ให้บังคับโลกที่สามอย่างไทย ลาว เขมร
ออกกฎหมายกัญชง กัญชาเป็นยาเสพติด

คุณคิดว่าใครล้าหลัง ฝรั่งใช้กันลึ่มๆ
เราก็เป็นไอ้ทึ่ม ไทยแลนด์ทะเลาะกันเอง
นักเลงกัญชาต้องลงใต้ดิน ราชการกังฉินเสพสุขสบาย

สาธารณสุข อย. และ ป.ป.ส.
คิดบ้างไหมหนอ ว่าปกป้องผลประโยชน์ใคร
อเมริกาห้ามเรา แต่เขากลับใช้
ทั้งปลูกทั้งขาย เบ่งบานเป็นธุรกิจ
คนไทยกับกัญชา ผูกพันมาแต่ปีมะโว้
กฎหมายดันมาโผล่ ว่ากัญชาเป็นยาเสพติด
ใครปลูกใครใช้ ต้มไก่ก็ยังมีความผิด
มันคือการรอนริด สิทธิ์เสรีภาพประชาชน
ใครละกินคอมมิช คอมมิชชั่น กัญชากัญชง

กัญชง กัญชา อเมริกาทำสงครามเย็น
(อะ) กัญชง กัญชา อเมริกา (ละ) กดดันยูเอ็น
ให้บังคับโลกที่สามอย่างไทย ลาว เขมร
ออกกฎหมายกัญชง กัญชาเป็นยาเสพติด

คุณคิดว่าใครล้าหลัง ฝรั่งใช้กันลึ่มๆ
เราก็เป็นไอ้ทึ่ม ไทยแลนด์ทะเลาะกันเอง
นักเลงกัญชาต้องลงใต้ดิน ราชการกังฉินเสพสุขสบาย

กัญชาเป็นยา เป็นสมุนไพรพื้นบ้าน
มีมานมนาน ตั้งแต่ยุคสมเด็จพระนารายณ์
แต่อเมริกากลัวยาเขาจะขายไม่ได้ จึงกีดกันคนไทย
ปลูกใช้ถือว่ามีความผิด

ขอสิทธิ์คนไทยเข้าถึงกัญชาบ้างหนอ
ขอแก้กฎหมาย ปลดล็อกออกจากยาเสพติด
แล้วก็ช่วยกันคุม ไม่ให้ใช้กันผิดๆ
ดีกว่าคอยรอนริด สิทธิ์เสรีภาพประชาชน
ดีกว่ากินคอมมิช คอมมิชชั่น กัญชากัญชง

กัญชง กัญชา อเมริกาทำสงครามเย็น
(อะ) กัญชง กัญชา อเมริกา (ละ) กดดันยูเอ็น
ให้บังคับโลกที่สามอย่างไทย ลาว เขมร
ออกกฎหมายกัญชง กัญชาเป็นยาเสพติด

คุณคิดว่าใครล้าหลัง ฝรั่งใช้กันลึ่มๆ
เราก็เป็นไอ้ทึ่ม ไทยแลนด์ทะเลาะกันเอง
นักเลงกัญชาต้องลงใต้ดิน ราชการกังฉินเสพสุขสบาย

นักเลงกัญชาต้องลงใต้ดิน
ราชการกังฉินให้มันท้องแตกตาย",add_carabao
ขุนน้ำใจไทย,/music/thailyric/14657,"ขุนน้ำนางนอน
เจ้าไม่อาจซ่อนความดี
ไม่อาจซ่อนสามัคคี
ที่คนไทยมีต่อกัน
จากเหนือจรดใต้
หลายชีวิตทุ่มเทบากบั่น
สิบสามชีวิตติดในถ้ำนั้น
ยิ่งกว่าเดิมพันมันกว่าฟุตบอล

ขุนน้ำนางนอน ก่อนนี้มีใครบ้างรู้
แม่สายนั้นไกลสุดกู่ จู่ๆ ชื่อเสียงกระฉ่อน
สิบสามหมูป่าทีมอคาเดมี่ละอ่อน
จงเป็นตำนาน เป็นอุทาหรณ์
สอนใจคนไทยมิให้ประมาท

เที่ยวถ้ำเที่ยวป่า หน้าน้ำหลากมากอันตราย
ขุนน้ำนางนอนมิใช่นิยาย
แต่เป็นเรื่องจริงเป็นความผิดพลาด
บนโลกใบนี้ไม่เคยมีเรื่องเหนือธรรมชาติ
มีแต่พลังของคนทั้งชาติ
ทุ่มเทบทบาทช่วยเหลือเกื้อกัน

เที่ยวถ้ำเที่ยวป่า หน้าน้ำหลากมากอันตราย
ขุนน้ำนางนอนมิใช่นิยาย
แต่เป็นเรื่องจริงเป็นความผิดพลาด
บนโลกใบนี้ไม่เคยมีเรื่องเหนือธรรมชาติ
มีแต่พลังของคนทั้งชาติ
ทุ่มเทบทบาทช่วยเหลือเกื้อกัน

ตั้งแต่องค์ราชันย์ รัฐบาล ข้าราชการ
ทหาร ตำรวจ และประชาชน
ขุนน้ำใจไทย",add_carabao
คงมาลัย,/music/thailyric/13708,"ร้อยมาลาจากหัวใจ
ร้อยมาลัยจากธนบัตร
เป็นอีกครั้งที่ประเทศชาติ
ธารน้ำใจคนไทยไหลรวม
รวมเป็นหนึ่ง พึ่งพากัน
ทุ่มแรงใจแรงกายเหงื่อท่วม
คนละก้าวเพื่อมีส่วนร่วม
รักษาผู้ป่วยโรงพยาบาล

ร้อยเมตตากรุณา
ร้อยศรัทธาคนแสนคนล้าน
สองข้างทางที่ตูนวิ่งผ่าน
ภาพยืนยันความหวังยังมี
ใต้จรดเหนือเพื่อส่วนรวม
เมื่อใครสักคนลุกขึ้นทำดี
สังคมไทยไม่เคยริบหรี่
สานสามัคคีท่วมท้นศรัทธา

ฟ้ามืดครึ้มฝนจะตก
คนเจ็บป่วยต้องรักษา
หมอไม่ใช่เทวดา
ยังต้องพึ่งพาทั้งยาทั้งเครื่องมือ

ก้าวคนละก้าวใกล้ไกล
คือน้ำใจคนไทยที่ใสซื่อ
คล้องพวงมาลัยให้ชายชื่อ
อาทิวราห์ คงมาลัย

ฟ้ามืดครึ้มฝนจะตก
คนเจ็บป่วยต้องรักษา
หมอไม่ใช่เทวดา
ยังต้องพึ่งพาทั้งยาทั้งเครื่องมือ

ก้าวคนละก้าวใกล้ไกล
คือน้ำใจคนไทยที่ใสซื่อ
คล้องพวงมาลัยให้ชายชื่อ
อาทิวราห์ คงมาลัย

ก้าวคนละก้าวใกล้ไกล
คือน้ำใจคนไทยที่ยิ่งใหญ่
รักษาความดีนี้คงไว้
ดุจดังพวงมาลา คงมาลัย",add_carabao
คืนสู่สวรรค์,/music/thailyric/13423,"บนฟ้ามีดาวล้านดวง
แต่ไม่โชติช่วงไปกว่าดวงจันทรา
บนดินมีแสนราชา
แต่ไม่เด่นไปกว่าพ่อภูมิพล
พ่อคือราชาผู้เหนือราชัน
พ่อคือดวงจันทร์ทอแสงนวลใย
พ่อคือความรักร่วงรุ้งฟุ้งไป
ชุบชูจิตใจของประชาชน

เจ็ดสิบปีแห่งการครองราชย์
พ่อย่างพระบาทเยือนทุกแห่งหน
ไทยทั้งประเทศคามเขตความจน
พ่อบุกฝ่าจนพออยู่พอกิน
ไทยทั้งประเทศคามเขตความจน
พ่อบุกฝ่าจนพออยู่พอกิน

เจ็ดสิบปีแห่งการครองราชย์
พ่อย่างพระบาทเยือนทุกแห่งหน
ไทยทั้งประเทศคามเขตความจน
พ่อบุกฝ่าจนพออยู่พอกิน
ไทยทั้งประเทศคามเขตความจน
พ่อบุกฝ่าจนพออยู่พอกิน

ยี่บหกตุลา คืนวันฟ้าเปิด
พ่อผู้ประเสริฐคืนสู่สวรรค์
ทวยไทยถ้วนหน้าน้ำตานองอนันต์
ส่งพ่อสู่ชั้น ดุสิตาลัย
ทวยไทยถ้วนหน้าน้ำตานองอนันต์
ส่งพ่อสู่ชั้น ดุสิตาลัย",add_carabao
ซับน้ำตาอันดามัน,/music/thailyric/6542,"ไม่เคยคิดไม่เคยฝัน ไม่ทันตั้งตัว
ท้องฟ้ามืดมัว แผ่นดินเลื่อนลั่นสั่นไหว
ไม่เคยพบไม่เคยเห็น ไม่เคยสนใจ
ซูนามิคืออะไร รู้จักแต่ซาซิมิ

มันมาดั่งมัจจุราช มันทุ่มโถมโทรมใส่ชายหาด
มันกวาดทุกสิ่งพินาศ ซูนามิ

ไม่เคยนึกไม่เคยนับ สรรพศพมากมาย
แผ่นดินร่ำไห้ แผ่นน้ำใยเลือดเย็น
ไม่ว่าใครไม่ว่าชาติไหน ไม่มีข้อยกเว้น
ธรรมชาติถือกฎเกณฑ์ มนุษย์เทียบเท่าเม็ดทราย

มันมาดั่งมัจจุราช มันทุ่มโถมโทรมใส่ชายหาด
มันกวาดทุกสิ่งพินาศ ซูนามิ

อันดามัน สวรรค์บนโลกวิไล
ต้องวิปโยคครั้งยิ่งใหญ่ นี่คือชะตากรรม
อันดามัน สวรรค์ไม่ทันเตรียมกาย
ไหลไปเถอะธารน้ำใจ ซับน้ำตาอันดามัน
ไหลไปเถอะธารน้ำใจ ซับน้ำตาอันดามัน
โอ๊ย... โอย ซูนามิ",add_carabao
ดอกไม้ริมทาง,/music/thailyric/15683,"ผู้ชายไม่ใช่ดอกไม้ริมทาง เด็ดดมทิ้งขว้าง
อยู่ที่ข้างถนน
มันเจ็บมันปวด รวดร้าวสุดจะทานทน
เจอคนที่เขารักเราไม่จริง

ผู้ชายไม่ใช่บุหรี่อารมณ์
ให้เธอเสพสม แล้วเธอก็ดีดมันทิ้ง
คำมั่นสัญญา ว่าจะรักกันจริง
ขอบอกนะคุณผู้หญิง
ชายถูกทอดทิ้งมันทรมาน

ผู้ชาย นั้นก็มีน้ำตา
ที่ไหลออกมา ไม่ได้เสแสร้งโศกสันต์
เธอเปรียบผู้ชาย เหมือนดอกไม้ไร้ค่าทุกวัน
มาเสียบอยู่ในแจกัน ของเธอนั้นเบื่อพลันทิ้งไป

ผู้ชายไม่ใช่ดอกไม้ริมทาง เด็ดดมทิ้งขว้าง
มันไม่มีความหมาย
สงสารเถิดคุณ เอาบุญให้เกียรติผู้ชาย
เป็นดอกกุหลาบสุดท้าย
เก็บเสียบแนบไว้ในดวงใจคุณ

ผู้ชาย นั้นก็มีน้ำตา
ที่ไหลออกมา ไม่ได้เสแสร้งโศกสันต์
เธอเปรียบผู้ชาย เหมือนดอกไม้ไร้ค่าทุกวัน
มาเสียบอยู่ในแจกัน ของเธอนั้นเบื่อพลันทิ้งไป

ผู้ชายไม่ใช่ดอกไม้ริมทาง เด็ดดมทิ้งขว้าง
มันไม่มีความหมาย
สงสารเถิดคุณ เอาบุญให้เกียรติผู้ชาย
เป็นดอกกุหลาบสุดท้าย
เก็บเสียบแนบไว้ในดวงใจคุณ",add_carabao
ดินอุดม น้ำสมบูรณ์ ด้วยพระบารมี,/music/thailyric/11889,"แสงสีทอง สาดส่องอำไพ ไกลลิบลับมาสู่ดิน
ก่อกำเนิดราชันย์ ผู้นำขวัญประชา ด้วยพลังแผ่นดิน
พ้องพระนาม ภูมิพล แม่สอนให้ติดดิน
สู้อุทิศผ่าฟัน มุ่งทำงานอาจิณ อยู่กับดินกับน้ำ

น้ำจากฟ้ามาสู่ดิน น้ำจากดินสู่บาดาล
ทรงบริหารจัดการ ด้วยพระปรีชาญาณแห่งการคิดค้น
เป็นผลลัพธ์ว่าคนดินน้ำป่า
ต้องแก้ปัญหาผสมผสานไปพร้อมกัน
บุญที่เรามีพระองค์ท่าน
ผู้นำพาจิตวิญญาณ ผู้นำแผ่นดินร่มเย็น

น้ำจากฟ้ามาสู่ดิน น้ำจากดินสู่บาดาล
ทรงบริหารจัดการ ด้วยพระปรีชาญาณแห่งการคิดค้น
เป็นผลลัพธ์ว่าคนดินน้ำป่า
ต้องแก้ปัญหาผสมผสานไปพร้อมกัน
บุญที่เรามีพระองค์ท่าน
ผู้นำพาจิตวิญญาณ ผู้นำแผ่นดินร่มเย็น

เมื่อเปรียบน้ำเป็นดั่งชีวิต ดินเปรียบดังเป็นร่างกาย
หากขาดแคลนสิ่งหนึ่ง ขาดอย่างหนึ่งอย่างใด เราจะอยู่ได้อย่างไร
ความสมดุลของดินน้ำป่า คนจึงสุขสบาย
แผ่นดินไทยจึงเป็นทอง
ดินอุดมน้ำสมบูรณ์ ด้วยพระบารมี
แผ่นดินไทยจึงเป็นทอง
ดินอุดมน้ำสมบูรณ์ ด้วยพระบารมี",add_carabao
"เดิมพัน 2,000 กิโล",/music/thailyric/13495,"หนทางที่วางเอาไว้
แม้จะไกลแต่ใจไม่หวั่น
ขอได้วิ่งไล่ตามความฝัน
จะกัดฟันให้ถึงเส้นชัย ของพวกเรา
คือภาระหน้าที่ เป็นบุตรที่ดี
ของแผ่นดินไทย แผ่นดินที่ให้เราเกิด
หนทางกีดขวางไม่มี
วันนี้ไทยรวมใจเป็นหนึ่ง
จะล้านบาทหรือเหรียญสลึง
ก็กองรวมกันไว้กองเดียว
เพื่อไปพยาบาล ผู้เจ็บไข้ได้ป่วย
รวมใจคอยช่วย แรงใจคอยเชียร์
เดิมพันสองพันกิโล

โอ๊ย ตั้งสองพันกิโล
ถึงมันจะไกลโข
แต่ไม่ไกลเกินฝัน
โอ้ย ด้วยดวงใจที่มุ่งมั่น
เป็นตายไม่หวั่น
ขอวางเดิมพันด้วยทำดี

โอ๊ย ตั้งสองพันกิโล
ถึงมันจะไกลโข
แต่ไม่ไกลเกินฝัน
โอ้ย ด้วยดวงใจที่มุ่งมั่น
เป็นตายไม่หวั่น
ขอวางเดิมพันด้วยทำดี

โอ๊ย ตั้งสองพันกิโล
ถึงมันจะไกลโข
แต่ไม่ไกลเกินฝัน
โอ้ย ด้วยดวงใจที่มุ่งมั่น
เป็นตายไม่หวั่น
ขอวางเดิมพันด้วยทำดี

วิ่งต่อไปเถิดตูน
คือชัยชนะของคนไทย
วิ่งต่อไปเถิดตูน
คือชัยชนะแห่งความสามัคคี",add_carabao
เทียนพุทธธรรม,/music/thailyric/12174,"อยู่อย่างต่ำธรรมดา แต่ปัญญาสูงเด่น
ดั่งพระจันทร์วันเพ็ญ ประดับนภาราตรี
ท่านคือช้างป่าต้น คือคนสุพรรณบุรี
มหาปราชญ์ฝ่ายบาลี ที่โลกกราบสนิทใจ

ประภาคารแห่งปัญญา อีกเมตตาเป็นที่ตั้ง
เถรวาทจึงมีหวัง มีพลังก้าวเดินต่อไป
พระพุทธศาสนา ศรัทธาของชนชาวไทย
ยังคงส่องสว่างไสว ด้วยเทียนไข พระธรรมปิฎก

พุทธธรรม วรรณกรรมจรรโลงพระพุทธศาสนา
พุทธปัญญา คือศรัทธา คือดวงตาเห็นธรรม
มวลมนุษย์ ยังเวียนว่ายกิเลสหนา
แสงแห่งธรรม นำพาหลุดพ้นกรรม
โชคดี มีเทียนพุทธธรรม
พระพรหมคุณาภรณ์ ป.อ. ปยุตฺโต

พุทธธรรม วรรณกรรมจรรโลงพระพุทธศาสนา
พุทธปัญญา คือศรัทธา คือดวงตาเห็นธรรม
มวลมนุษย์ ยังเวียนว่ายกิเลสหนา
แสงแห่งธรรม นำพาหลุดพ้นกรรม
โชคดี มีเทียนพุทธธรรม
พระพรหมคุณาภรณ์ ป.อ. ปยุตฺโต

เราโชคดี มีเทียนพุทธธรรม
สมเด็จพระพุทธโฆษาจารย์ ป.อ. ปยุตฺโต

เพชรน้ำเอกแห่งวรรณกรรม
คือพุทธธรรมที่โลกบูชา
เพชรน้ำเอกแห่งวรรณกรรม
คือพุทธธรรมที่โลกบูชา",add_carabao
นกกระเรียนคืนถิ่น,/music/thailyric/19261,"สายน้ำใสไหลเรื่อยเปื่อย
จากภูเขาสูงสู่ที่ต่ำ
หล่อเลี้ยงคน พืช และสัตว์
วัฏจักรนี้เป็นไปตามธรรมชาติ

หากคนไม่ยอมเข้าใจ
แผ่นดินจะลุกเป็นไฟ
โลกาย่อมถูกทำลายเพราะคน เพราะคน

วิหคนกงามสง่า นกกระเรียนป่าคืนสู่รัง
คืนสู่ถิ่นบุรีรัมย์ เมืองน้ำดำตำนานแห่งนกกระเรียน
อีสานบ้านเฮาเข้าใจ จึงฝากข่าวมาถึงคนไทย
ของดีมีอยู่ไม่ไกลมาช่วยกัน มาช่วยกัน

พื้นที่ชุ่มน้ำ ณ ห้วยจระเข้มาก
วันนี้เปลี่ยนไปมีนกกระเรียนมาก
จากเดิมที่เคยสูญพันธุ์

ฟักไข่เป็นตัว เป็นหนึ่งเดียวในหล้า
คนไทยภูมิใจ ช่วยกันปกปักรักษา
ให้ธรรมชาติคืนมา ยั่งยืน ยั่งยืน

วิหคนกงามสง่า นกกระเรียนป่าคืนสู่รัง
คนเลี้ยงนกคือความหวัง ทำให้ดีให้ดังนกจะกลับมาเลี้ยงคน
ร่วมมือร่วมแรงร่วมใจ ลูกหลานจะสุขสบาย
ของดีคู่ฟ้าเมืองไทย นกกระเรียน นกกระเรียน

พื้นที่ชุ่มน้ำ ณ ห้วยจระเข้มาก
วันนี้เปลี่ยนไปมีนกกระเรียนมาก
จากเดิมที่เคยสูญพันธุ์

ฟักไข่เป็นตัว เป็นหนึ่งเดียวในหล้า
คนไทยภูมิใจ ช่วยกันปกปักรักษา
ให้ธรรมชาติคืนมา ยั่งยืน ยั่งยืน

นกกระเรียนคืนถิ่น นกกระเรียนคืนถิ่น
คือสัญลักษณ์ของบุรีรัมย์
นกกระเรียนคืนถิ่น นกกระเรียนคืนถิ่น
คือหวังสร้างธรรมชาติยั่งยืน",add_carabao
