song_name,href,lyric,artist
เธออยู่ที่ไหน,/music/thailyric/8886,"เมื่อแสงอาทิตย์จาง เมื่อฟ้ามืดลง
จิตใจมั่นคงกลับอ่อนล้า
และฝนก็เริ่มโปรยหล่นลงมา
จากบนฟ้ากระทบลงที่ฉัน

จบท้ายด้วยน้ำตา ด้วยน้ำตา
เริ่มไหลริน ก็ไหลริน
คำถามเดิมก็กลับมา
เธอคิดเหมือนฉันรึเปล่า
เธอคิดถึงฉันรึเปล่า
ตั้งแต่วันนั้น คราวนั้นที่เราไม่เข้าใจ

เธออยู่ที่ไหน เธออยู่ที่ไหน
ในคืนที่ฝนพรำใจมันยังฝังจำ
ยังโกรธกันอยู่ไหมคืนดีกันสักทีไหม
ใจมันยังรักเธอใจมันยังคิดถึงแต่เธอ

คำพูดตั้งมากมาย
ไม่ได้พูดไป ตั้งใจจะบอกรักเธอ
กี่เรื่องราวที่ทำผิดต่อเธอ
อยากให้เธอยกโทษให้ได้ไหม

ถ้าฉันได้พบเธอ ถ้าพบเธอ
อีกครั้งเดียว อีกครั้งเดียว
จะไม่ทำพลาดอีกแล้ว

เพิ่งรู้ว่าไม่มีเธอ มันเหงาไปทั้งหัวใจ
และมันร่ำร้อง เรียกหาแค่เธออยู่อย่างนั้น

เธออยู่ที่ไหน เธออยู่ที่ไหน
ในคืนที่ฝนพรำใจมันยังฝังจำ
ยังโกรธกันอยู่ไหมคืนดีกันสักทีไหม
ใจมันยังรักเธอใจมันยังคิดถึงแต่เธอ

ที่แล้วที่พลาดไปอยากรื้อฟื้นความเข้าใจ
อยากขอให้เราได้กลับมาเป็นเหมือนเดิม

ทุกครั้งที่ฝนพรำทำให้เวลามันเดินช้าลงไป
สายฝนจับแสงไฟยิ่งมืดเท่าไหร่ยิ่งเหน็บหนาว
เธออยู่ที่ใดจะจ้องมองฟ้าแล้วเหงาอย่างฉันไหมเธอ

เธออยู่ที่ไหน เธออยู่ที่ไหน
ในคืนที่ฝนพรำใจมันยังฝังจำ
ยังโกรธกันอยู่ไหมคืนดีกันสักทีไหม
ใจมันยังรักเธอใจมันยังคิดถึงแต่เธอ

เธออยู่ที่ไหน เธออยู่ที่ไหน
ในคืนที่ฝนพรำใจมันยังฝังจำ
ยังโกรธกันอยู่ไหมคืนดีกันสักทีไหม
ใจมันยังรักเธอใจมันยังรักเพียงแต่เธอ",klear
เนเวอร์ เซย์ กูดบาย (Never Say Goodbye),/music/thailyric/8899,"Never say

แค่เพียงสบตา กับเธอที่เย็นและชากว่าเคย ก็รู้ทันที
ท่าทางไม่ดี ที่ทำให้ฉันจะเป็นจะตาย และคิดไปใหญ่
ถ้ารักกลับกลาย และเธอกำลังจะทิ้งฉันไป
จะต้องพบเรื่องราวแบบไหน โฮ่ว โฮ

Never say 

ก็คงต้องฟัง คำพูดประมาณ ว่าเธอผิดเองที่ไม่เหมือนเดิม
และมีแต่ฉันที่ทรมาน และหวังให้มันไม่ใช่เรื่องจริง
ก็มันไม่อยากได้ยินว่าเธอ ไม่รักกันแล้ว
ไม่อยากขอฟังคำบอกลา ของเธอ
อย่าให้ฉันต้องเจออย่างนั้น ได้ไหม

อย่าทำให้ฉันรู้ตัว ว่าเธอจะจากกัน
หรือรู้ทันว่ารัก ของเราเปลี่ยนไป
ช่วยทำเป็นว่ารัก เหมือนเดิมจนวันสุดท้าย
พร้อมเมื่อไรก็ไป ไม่ต้องพูดคำลา
Never say goodbye

Never say

ช่วยทำว่าเธอยังดีต่อกัน ทำดีกับฉันให้เหมือนที่เคย
อย่าทำให้ฉันระแวงอีกเลย ว่าเธอจะไปจากฉันวันไหน
ถ้าพร้อมเมื่อไรก็ไป ได้เลยไม่ต้องลังเล
อยากจะขอมีความสุขไปทุกวัน
จากวันแรกจนวันสุดท้ายของเรา

อย่าทำให้ฉันรู้ตัว ว่าเธอจะจากกัน
หรือรู้ทันว่ารัก ของเราเปลี่ยนไป
ช่วยทำเป็นว่ารัก เหมือนเดิมจนวันสุดท้าย
พร้อมเมื่อไรก็ไป ไม่ต้องพูดคำลา
Never say goodbye

ถ้าเธอยิ่งยืดเยื้อ ยิ่งทรมาน
ยิ่งผูกพันจะยิ่งช้ำจนเกินไป
ให้มันจบไป แบบไม่ต้องพูดอะไร
จบให้ฉันไม่ต้องทน ฟังความจริงอันโหดร้าย

อย่าทำให้ฉันรู้ตัว ว่าเธอจะจากกัน
หรือรู้ทันว่ารัก ของเราเปลี่ยนไป
ช่วยทำเป็นว่ารัก เหมือนเดิมจนวันสุดท้าย
พร้อมเมื่อไรก็ไป ไม่ต้องพูดคำลา

อย่าทำให้ฉันรู้ตัว ว่าเธอจะจากกัน
หรือรู้ทันว่ารัก ของเราเปลี่ยนไป
ช่วยทำเป็นว่ารัก เหมือนเดิมจนวันสุดท้าย
พร้อมเมื่อไรก็ไป ไม่ต้องพูดคำลา
Never say",klear
ผีเสื้อที่หายไป,/music/thailyric/8731,"ฉันก็เหมือนคนอีกเป็นร้อยพัน ที่ยังเฝ้าคอยฝันใฝ่
ตามหาใครสักคนมาเติมหัวใจ
แค่ใครหนึ่งคนที่เกิดมาเพื่อเป็นคนของเรา

ความรักก็เหมือนตอนที่เราต้องการ ตามหาผีเสื้อตัวหนึ่ง
แต่เมื่อใดที่เจอแล้วไล่คว้า วิ่งตามเท่าไรกลับยิ่งบินยิ่งหนีไกล
ทุกครั้งเอื้อมมือออกไปจับได้เพียง เศษใบไม้ที่ไร้จิตใจ

แต่หากเมื่อไรที่ฉัน หยุดพักไม่สนใจ
หากเมื่อไรนิ่งๆ นานๆ ไม่วิ่งตามไป
ในตอนนั้นผีเสื้อที่จากไปก็ค่อยๆ กลับมา
บินวนมาลงที่ตรงไหล่

ยิ่งไขว่คว้าความรักยิ่งไม่ได้มา
ยิ่งต้องการค้นหาเท่าไหร่ยิ่งไม่เจอใคร
เปลี่ยนตัวเองให้เป็นดังดอกไม้ด้วยความสุขใจ
ไม่นานผีเสื้อที่บินหายไป ก็นำทางพาความรักมา

อย่าคิดจะเฝ้าคอยส่วนที่หายไป แค่เติมตัวเองให้เต็ม
ฟากฟ้ากำหนดรอ เมื่อฉันพร้อม
เมื่อวันผ่านไป คงไม่นานเราพบกัน
วาดฝันข้างในจิตใจฉันเฝ้ารอ ด้วยรอยยิ้มที่มีความหมาย

และหากเมื่อไรที่ฉัน หยุดพักไม่สนใจ
หากเมื่อไรนิ่งๆ นานๆ ไม่วิ่งตามไป
ในตอนนั้น ผีเสื้อที่จากไปก็ค่อยๆ กลับมา
บินวนมาลงที่ตรงไหล่

ยิ่งไขว่คว้าความรัก ยิ่งไม่ได้มา
ยิ่งต้องการค้นหาเท่าไหร่ยิ่งไม่เจอใคร
เปลี่ยนตัวเองให้เป็นดังดอกไม้ด้วยความสุขใจ
ไม่นานผีเสื้อที่หายไป ก็นำทางพาความรักมา

หากเมื่อไรที่ฉัน หยุดพักไม่สนใจ
หากเมื่อไรนิ่งๆ นานๆ ไม่วิ่งตามไป
ในตอนนั้น ผีเสื้อที่จากไปก็ค่อยๆ กลับมา
บินวนมาลงที่ตรงไหล่

ยิ่งไขว่คว้าความรัก ยิ่งไม่ได้มา
ยิ่งต้องการค้นหาเท่าไหร่ยิ่งไม่เจอใคร
เปลี่ยนตัวเองให้เป็นดังดอกไม้ด้วยความสุขใจ
ไม่นานผีเสื้อที่หายไป ก็นำทางพาความรักมา",klear
เพลงนี้ (ใครบางคนแต่งให้เธอ),/music/thailyric/8883,"คนหนึ่งคนมองเธอจากตรงที่ไกลๆ
ใจหนึ่งใจลอยไปอยู่ตรงข้างๆ เธอ
รู้ก็รู้ความจริงก็ทำได้เพียง
เฝ้าละเมอถึงเธอทุกวัน

คนอย่างฉันก็เป็นหนึ่งคนทั่วๆ ไป
ไม่มีอะไรโดนใจให้เธอต้องมองมา
รอบๆ กายเธอเองก็มีผู้คนน่าสนใจ
จะทำเช่นไร

คิด จน เริ่มกลุ้มใจ และเริ่มทนไม่ไหว
ฉันอยากให้เธอรู้

ให้ดอกไม้ หนังสือ กับซื้อตุ๊กตา
ทำขนม ของขวัญ และทำการ์ดสักใบ
ก็ไม่รู้ว่าใครจะทำเพื่อเธอมากเท่าไร ส่วนฉัน

ทำได้แค่นี้ คนธรรมดาหนึ่งคนนี้
อยากแต่งเพลงๆ นี้ให้กับเธอ
เพราะว่าฉันนั้นทำได้เท่านี้

ทำได้อยู่เท่านี้มีเพียงแค่ความรู้สึกที่ดี
เขียนถ้อยคำที่มีอยู่ข้างใน
และขอร้องเพลงๆ นี้ดังออกไป
ว่าใจทั้งใจมันรักเธอคนเดียว

รู้เอาไว้อย่างหนึ่งที่ฉันพอทำไหว
ขอให้เธอรับไว้

ทำได้แค่นี้ คนธรรมดาหนึ่งคนนี้
อยากแต่งเพลงๆ นี้ ให้กับเธอ
เพราะว่าฉันนั้นทำได้เท่านี้

ทำได้อยู่เท่านี้ มีเพียงแค่ความรู้สึกที่ดี
เขียนถ้อยคำที่มีอยู่ข้างใน
และขอร้องเพลงๆ นี้ดังออกไป
ว่าใจทั้งใจมันรักเธอคนเดียว

เขียนถ้อยคำที่มีอยู่ข้างใน
และขอร้องเพลงๆ นี้ดังออกไป
ใจทั้งใจ

ทำได้แค่นี้ คนธรรมดาหนึ่งคนนี้
อยากแต่งเพลงๆ นี้ ให้กับเธอ
เพราะว่าฉันนั้นทำได้แค่นี้

ทำได้อยู่เท่านี้ มีเพียงแค่ความรู้สึกที่ดี
เขียนถ้อยคำที่มีอยู่ข้างใน
และขอร้องเพลงๆ นี้ดังออกไป

อยากรู้ว่าเธอจะรู้สึกอย่างไร
เมื่อเธอได้ยินเพลงนี้ดังออกไป
และรู้ว่าใจฉันรักเธอคนเดียว",klear
อดทนกับความเหงา,/music/thailyric/8566,"เธอมีความฝันที่เธอต้องการ
ฉันก็มีทางที่ฉันต้องเดิน
เป็นการร่ำลาที่เราต้องเตรียมใจเผชิญ
แม้รักกันแค่ไหน

จะทนได้ไหมเมื่อเราต้องไกล
เธอจะเจอใครใกล้เธอรึเปล่า
ยิ่งคิดก็ยิ่งหวั่นไหว ช่วยฉันสัญญาได้ไหม
เมื่อถึงวันต้องไกล อยากขอเธอ

อดทนได้ไหม ช่วยกันได้ไหมเธอ
อดทนกับความเหงาที่เราต้องเจอ
ถ้าเมื่อไรเริ่มเหนื่อย หรือว่าใจเริ่มห่าง
อย่าลืมว่าฉันยังรักและรอเธอ อยู่ตรงนี้

ฝากเธอดูแลตัวเองให้ดี
ฉันก็จะทำให้เธอทุกวัน
จะเกิดเรื่องราวอะไรถ้าเรายังมีกัน
ฉันนั้นจะไม่หวั่นไหว

ถ้านานเป็นเดือนหรือนานหลายปี
เราจะรอกันเรื่อยไปใช่ไหม
แต่แม้ยากเย็นแค่ไหน ช่วยฉันสัญญาได้ไหม
เมื่อถึงวันต้องไกล อยากขอเธอ
อดทนได้ไหม ช่วยกันได้ไหมเธอ
อดทนกับความเหงาที่เราต้องเจอ
ถ้าเมื่อไรเริ่มเหนื่อยหรือว่าใจเริ่มห่าง
อย่าลืมว่าฉันยังรักและรอเธอ

อยู่ตรงที่เดิมเพื่อเธอนั้น ย้ำกันเข้าไว้เธอ
อดทนกับความเหงาที่เราต้องเจอ
โปรดอย่าไปเผลอใจ อย่าไปลองคบใคร
อดทนรอได้ไหม จนถึงวันนั้นที่เป็นวันของเรา

อดทนได้ไหม ช่วยกันได้ไหมเธอ
อดทนกับความเหงาที่เราต้องเจอ
ถ้าเมื่อไรเริ่มเหนื่อย หรือว่าใจเริ่มห่าง
อย่าลืมว่าฉันยังรักและรอเธอ

อยู่ตรงที่เดิมเพื่อเธอนั้น ย้ำกันเข้าไว้เธอ
อดทนกับความเหงาที่เราต้องเจอ
โปรดอย่าไปเผลอใจ อย่าไปลองคบใคร
อดทนรอได้ไหม จนถึงวันนั้นที่เป็นวันของเรา

สิ่งที่เราจะได้มานั้นคุ้มค่าการรอคอย
แค่เวลาเล็กน้อยที่เราต้องจากกันไกล
ห่างกันให้ได้รู้ว่ารักกันมากขนาดไหน
และในตอนสุดท้าย จะเป็นวันของเรา",klear
กลัวไปด้วยกัน,/music/thailyric/17998,"เธอคงกลัวใช่ไหม
ฉันเองก็รู้สึกอยู่
มองไปข้างหน้าเลือนราง
ไม่รู้เจอกับอะไร

เธอกังวลใช่ไหม
ฉันเองก็คิดไม่ต่าง
ทางเดินมันมืดมันไกล
มันหนาวเย็นจับใจ

จะอีกนานแค่ไหน
มันถึงจะผ่านพ้นไป
หวาดกลัวแค่ไหน
อย่างน้อยก็ไม่ได้ยืนอยู่คนเดียว

ในวันนี้ฉันยังมีเธออยู่ข้างกัน
ในวันนี้แม้จะกลัว แม้จะไหวหวั่น
จะหนักหนาสักแค่ไหน ก็ไม่เป็นไร
จับมือข้ามความกลัวนี้ไปด้วยกัน

วันนี้ฉันยังมีเธอที่รักกัน
ในวันนี้แม้จะกลัว แม้จะไหวหวั่น
จะโหดร้ายมากแค่ไหน มืดสักเท่าไร
มันก็ไม่น่ากลัวสักเท่าไร
ถ้าผ่านมันไปด้วยกัน

ไร้เรี่ยวแรงใช่ไหม
มันสั่นไปทั้งหัวใจ
ต้อยต่ำตัวเล็กเกินไป
ไร้พลังจะเปลี่ยนแปลง

แต่เธอยังคงมีฉัน
และฉันนั้นก็มีเธอ
ที่อยู่ตรงนี้ยืนเคียงไม่ทิ้งกันไปไหน

จะอีกนานแค่ไหน
มันถึงจะผ่านพ้นไป
หวาดกลัวแค่ไหน
อย่างน้อยก็ไม่ได้ยืนอยู่คนเดียว

ในวันนี้ฉันยังมีเธออยู่ข้างกัน
ในวันนี้แม้จะกลัว แม้จะไหวหวั่น
จะหนักหนาสักแค่ไหน ก็ไม่เป็นไร
จับมือข้ามความกลัวนี้ไปด้วยกัน

วันนี้ฉันยังมีเธอที่รักกัน
ในวันนี้แม้จะกลัว แม้จะไหวหวั่น
จะโหดร้ายมากแค่ไหน
มืดสักเท่าไร
มันก็ไม่น่ากลัวเท่าไร
ถ้าผ่านมันไปด้วยกัน

อะไรก็ไม่น่ากลัวสักเท่าไร
ถ้าผ่านมันไปด้วยกัน",klear
ฉันอยู่ตรงนี้ข้างๆ เธอ,/music/thailyric/8895,"เธอรู้ใช่ไหม
คนอยู่ตรงนี้ข้างเธอ
คือฉันเองที่ยังเฝ้ารอทุกวัน

ฉันมองที่เธอเคียงข้างเธอ
ทั้งที่รู้ว่าเธอเองยังคิดถึงใครคนที่จากไป
ฉันเองตั้งใจถึงหัวใจ
จะทุ่มเทและช่วยให้เธอลืมเขาไป
ได้เริ่มต้นใหม่ก้าวไปกับฉัน

แต่ดูเหมือนเธอกลับไม่ต้องการ
จะก้าวผ่านมันเท่าไหร่
มันเริ่มท้อใจ มันทรมาน
และเจ็บไปทั้งใจ

เธอรู้ใช่ไหม
เขาจากไปแล้วเนิ่นนาน
และไม่ย้อนกลับมา

สิ่งที่ฝังใจ
อยากให้ลบมันไปสักที
อยู่กับความเป็นจริงของเธอในวันนี้

รับรู้บ้างไหม
ว่าคนอยู่ตรงนี้ข้างเธอคือฉันเอง
ที่ยังเฝ้ารอทุกวัน
รอให้รักของเราที่เธอเคยบอกฉัน
ได้เป็นจริงสักที

รอให้รักของเราที่เธอเคยบอกฉัน
ได้เป็นจริงสักที",klear
