song_name,href,lyric,artist
ถ้าฉันเป็นแม่เธอ,/music/thailyric/17661,"เหมือนว่าเราแปลงร่างเมื่อเรา Online
การ Sign in เปลี่ยนเราเป็นคนร้ายๆ
อะไรผิดหูอ่านดูใจขึ้นง่ายๆ
เก่งกับคนไม่รู้จัก
เปลี่ยนคนน่ารักเป็นอันธพาล

ฉันก็ไม่รู้ว่าฉันไปทำอะไร
ให้เธอโกรธเคืองด่ากันด้วยคำร้ายๆ
แค่เพียงผ่านจอทำไมเกลียดกันง่ายๆ
สนุกนิ้วพิมพ์ใส่
จะเคยคิดไหมว่าฉันเป็นใคร

ถ้าฉันเป็นแม่เธอจะทำ เธอจะทำไหม
ถ้าเป็นที่รัก เธอจะทำไหม
ถ้ารู้จักกันขึ้นมา เธอจะว่าไง
ถ้าเขาเป็นพ่อเธอจะทำ เธอจะทำไหม
ถ้าเป็นที่รัก เธอจะทำไหม
ถ้าเจอตัวจริงต่อหน้า เธอจะว่าไง

จาดั้ด จาดั้ด จั๊ดจั้ดจั้ดจัด เธอจะว่าไง
จาดั้ด จาดั้ด จั๊ดจั้ดจั้ดจัด เธอจะว่าไง

โลกบนนั้นบางครั้งน่ากลัวเกินไป
ความสะใจชั่วคราวสร้างความเสียหาย
คนหนึ่งคนอีกด้านก็มีหัวใจ
แค่ลองคิดมองใหม่
ลองคิดว่าเขาเป็นใครบางคน ถ้า

ถ้าเขาเป็นแม่เธอจะทำ เธอจะทำไหม
ถ้าเป็นที่รัก เธอจะทำไหม
ถ้ารู้จักกันขึ้นมา เธอจะว่าไง
ถ้าเขาเป็นพ่อเธอจะทำ เธอจะทำไหม
ถ้าเป็นที่รัก เธอจะทำไหม
ถ้าเจอตัวจริงต่อหน้า เธอจะว่าไง

จาดั้ด จาดั้ด จั๊ดจั้ดจั้ดจัด เธอจะว่าไง
จาดั้ด จาดั้ด จั๊ดจั้ดจั้ดจัด เธอจะว่าไง  กล้าไหม

ถ้าฉันเป็นแม่เธอจะทำ เธอจะทำไหม
ถ้าเป็นที่รัก เธอจะทำไหม
ถ้ารู้จักกันขึ้นมา เธอจะว่าไง
ถ้าเขาเป็นพ่อเธอจะทำ เธอจะทำไหม
ถ้าเป็นที่รัก เธอจะทำไหม
ถ้าเจอตัวจริงต่อหน้า เธอจะว่าไง

ถ้าเขา ถ้าเขา นั้นเป็นแม่เธอ เธอจะว่าไง
ถ้าเขา ถ้าเขา นั้นเป็นพ่อเธอ เธอจะว่าไง
ถ้าเขา ถ้าเขา นั้นเป็นแฟนเธอ เธอจะว่าไง
ถ้าเขา ถ้าเขา นั้นเป็นเพื่อนเธอ เธอจะว่าไง กล้าไหม",klear
ที่ปลอดภัย,/music/thailyric/18707,"เธออ่อนแอ ได้เลย ไม่ต้องฝืนใจ
อยากจะร้อง ร้องไป ตรงนี้ปลอดภัย
ถ้าหมดแรง ถ้าเหนื่อย อ่อนล้า ทุกข์ใจ

จะอยู่คอยรับฟัง ขอนั่งข้างเธอแล้วผ่านมันไปพร้อมกัน

ร้องไห้ไปเถอะนะ อย่าบังคับหัวใจ
ไม่ต้องแข็งใจ ถ้าทนไม่ไหว
ฉันนั่งอยู่ตรงนี้ จะดูแลให้ข้ามไป ถึงวันใหม่
ไม่มีทางทอดทิ้งเธอไป
จับมือเธอข้ามพ้นคืนวันโหดร้าย

เมื่อเหตุการณ์ร้ายแรงจนเกินอธิบาย
ไม่มีคำพูดใด เอาไว้ ปลอบใจ
จะกอดเธอให้นาน ในความเงียบงัน

จะไม่ถามสักคำ ขอนั่งข้างเธอแล้วผ่านมันไปพร้อมกัน

ร้องไห้ไปเถอะนะ อย่าบังคับหัวใจ
ไม่ต้องแข็งใจ ถ้าทนไม่ไหว
ฉันนั่งอยู่ตรงนี้ จะดูแลให้ข้ามไป ถึงวันใหม่
ไม่มีทางทอดทิ้งเธอไป
จับมือเธอข้ามพ้นคืนวันโหดร้าย",klear
รักให้ตาย,/music/thailyric/18474,"อยากพบเจอ เธอบอกว่าเธออยากเจอ
เธออยากขอโอกาสคืนดี กลับมาคบกัน
โปรดเข้าใจ ในสิ่งที่เธอผิดไป
เธออยากให้ฉันเปิดใจยอม ให้เธอสักครั้งหนึ่ง

ยังรักอยู่ไหม ยังรักอยู่แล้ว
ผ่านนานเท่าไรก็ยังร้องไห้อย่างเดิม
แต่มันเข็ดเกินจะโดนอีกครั้ง
วันนี้ต้องฝืนใจ

รักให้ตายก็คงไม่ไหว
รับเธอคืนมาคงไม่ไหว
รักมากเท่าไรยิ่งย้ำยิ่งจำ
ว่าเคยต้องช้ำเท่าไร
รักแทบตายฉันลืมไม่ไหว
ให้อภัย แต่ใจฉันมันต้องเจ็บแล้วจำ
ยังรักแค่ไหน ก็รับไม่ได้อีกแล้ว

เจ็บแล้วจำ ได้เวลาใช้สตินำ
ต่อให้ทุกๆ ส่วนในใจยังมีแค่เธอ
โปรดเข้าใจ อยากเก็บภาพที่ดีไว้
อยากเก็บให้เธอเป็นความหลังที่คิดถึงที่สุด

ยังรักอยู่ไหม ยังรักอยู่แล้ว
ผ่านนานเท่าไรก็ยังร้องไห้อย่างเดิม
แต่มันเข็ดเกินจะโดนอีกครั้ง
วันนี้ต้องฝืนใจ

รักให้ตายก็คงไม่ไหว
รับเธอคืนมาคงไม่ไหว
รักมากเท่าไรยิ่งย้ำยิ่งจำ
ว่าเคยต้องช้ำเท่าไร
รักแทบตายฉันลืมไม่ไหว
ให้อภัย แต่ใจฉันมันต้องเจ็บแล้วจำ
ยังรักแค่ไหน

สิ่งที่ยังเหลือ สิ่งเดียวที่มีร่วมกัน
คืออดีตไม่ใช่อนาคต
เธอคือความหลังไม่ใช่วันพรุ่งนี้
จากนี้ฉันคงต้องรักตัวเองแล้ว

รักให้ตายก็คงไม่ไหว
รับเธอคืนมาคงไม่ไหว
รักมากเท่าไรยิ่งย้ำยิ่งจำ
ว่าเคยต้องช้ำเท่าไร
รักแทบตายฉันลืมไม่ไหว
ให้อภัย แต่ใจฉันมันต้องเจ็บแล้วจำ
ยังรักแค่ไหน ก็รับไม่ได้

รักให้ตายก็คงไม่ไหว
รับเธอคืนมาคงไม่ไหว
รักมากเท่าไรยิ่งย้ำยิ่งจำ
ว่าเคยต้องช้ำเท่าไร
รักแทบตายฉันลืมไม่ไหว
ให้อภัย แต่ใจฉันมันต้องเจ็บแล้วจำ
ยังรักแค่ไหน ก็รับไม่ได้อีกแล้ว",klear
เสมอตลอดมา,/music/thailyric/18677,"ครั้งเมื่อนานมาแล้ว เธอกับฉันเคยคุยกันทุกวัน
แล้วชีวิตก็พัดพาเราจากกัน
ฉันเดินทางมาไกล เธอก็หายไปมีชีวิตใหม่
หาหนทางยังไงก็ไม่ถึงเธอ

ไม่ได้รู้ข่าว เราห่างหายกันไปตั้งนาน ก็ยังนึกถึง อยู่

เธอสบายดีไหม ในวันที่เหงา อยู่ได้ไหม
อยู่ตรงนั้นได้ไหม ถ้าร้องไห้ทำยังไง
เกิดวันไหนไม่ไหว มีใครปลอบไหม
ตอนเธอไม่สบาย มีใครดูไหม
อยากจะคุยระบาย มีใครรับฟังดูแล

ห่วงเธอ เหมือนอย่างเดิมเสมอถึงแม้ไม่ได้เจอ
อยากจะคุยกับเธอก็ไม่รู้ทำยังไง
ได้แต่คิดอยากรู้เรื่องราวทางนั้น
ได้แต่คิดกับลมกับฟ้าเท่านั้น
ได้แต่คิดอย่างคนห่างไกลที่รักเพียงเธอ
เสมอตลอดมา เสมอตลอดมา

คิดคนเดียวในใจให้ ลมฟ้าพามันไปถึงเธอ
หวังให้เป็นดังเพลง เล่าสู่กันฟัง
ถ้าได้คุยกันจริง เธอคงถามว่าฉันเป็นเช่นไร
ฉันก็คงจะพูดไปว่าไหวอยู่

ไม่ได้รู้ข่าว เราห่างหายกันไปตั้งนาน ก็ยังนึกถึง อยู่

เธอสบายดีไหม ในวันที่เหงา อยู่ได้ไหม
อยู่ตรงนั้นได้ไหม ถ้าร้องไห้ทำยังไง
เกิดวันไหนไม่ไหว มีใครปลอบไหม
ตอนเธอไม่สบาย มีใครดูไหม
อยากจะคุยระบาย มีใครรับฟังดูแล

ห่วงเธอ เหมือนอย่างเดิมเสมอถึงแม้ไม่ได้เจอ
อยากจะคุยกับเธอก็ไม่รู้ทำยังไง
ได้แต่คิดอยากรู้เรื่องราวทางนั้น
ได้แต่คิดกับลมกับฟ้าเท่านั้น
ได้แต่คิดอย่างคนห่างไกลที่รักเพียงเธอ
เสมอตลอดมา เสมอตลอดมา",klear
หลังจากเธอ,/music/thailyric/18673,"คิดถึงเวลาที่เธอกอด
คิดถึงเวลาที่เธอบอกรัก
คิดถึงเวลาที่ใจสั่น
คิดถึงเวลาที่รักกัน
คิดถึงเวลาก่อนนั้น

ก็ไม่รู้ว่าเมื่อไร จะลบลืมเธอออกไป
ก็ไม่รู้จะรักใคร ได้เท่าเธออีกไหม

หลังจากเธอ ฉันก็ไม่คิดจะให้ใจใครอีกเลย
หลังจากเธอ Oh ก็ใช้ชีวิตคนเดียว
ลองเปิดใจตั้งกี่ครั้ง ลองเริ่มใหม่ตั้งกี่ครั้ง
มันทำไม่ไหว
หลังจากเธอ ไม่คิดจะรักใครอีกเลย

ทุกครั้งจะลองเริ่มคบใคร
ทุกครั้งในใจนึกถึงแต่เธอ
ทุกครั้งมันไปไม่ได้ไกล
ทุกครั้งยังไงก็เป็นเธอ
ทุกครั้งต้องยอมหยุดไว้

ก็ไม่รู้ว่าเมื่อไร จะลบลืมเธอออกไป
ก็ไม่รู้จะรักใคร ได้เท่าเธออีกไหม

หลังจากเธอ ฉันก็ไม่คิดจะให้ใจใครอีกเลย
หลังจากเธอ Oh ก็ใช้ชีวิตคนเดียว
ลองเปิดใจตั้งกี่ครั้ง ลองเริ่มใหม่ตั้งกี่ครั้ง
มันทำไม่ไหว
หลังจากเธอ ไม่คิดจะรักใครอีกเลย

ผ่านมานาน สักแค่ไหน ก็ยังวนซ้ำอยู่เหมือนเดิม
ปล่อยเอาไว้ อยู่แบบนี้ ก็คงดี ฉันไม่เป็นไร
ปล่อยหัวใจให้มีแต่เธอ ไม่ต้องฝืนอะไร
อยู่อย่างนี้ อยู่ตรงนี้ กับความหลังที่มีเธอ ตลอดไป

อยู่กับความหลังที่มีเธอตลอดไป",klear
ให้ความลับมันตายไปกับตัวฉัน,/music/thailyric/18689,"ผิดที่ฉันคิดเกินเลยกับเธอ ก็รู้ว่ามันไม่ควร
ผิดที่ฉันเองมีใครอยู่แล้ว อยู่ทั้งคน

ความผิดคือฉันไม่ดีเอง
ผิดที่ฉันเองไม่ห้ามหัวใจ
มันก็ดีแล้วที่คิดว่าจะไม่พูดไป
ฉันเริ่มเองจบเองก็ดีแล้ว

ให้ความลับนี้มันตายไปกับตัวฉัน
เมื่อความจริงนั้นมันทำร้ายคนข้างกาย
ไม่ต้องรู้ว่ารู้สึกกับเธอแค่ไหน
เก็บมันเอาไว้ อย่าให้ความลับทำลายชีวิตของเรา

จะไม่เผลอทำอะไรออกไป ระวังทุกการกระทำ
จะไม่เผลอมองตรงไปหยุดที่เธอ ที่สายตา

ความผิดคือฉัน ไม่ดีเอง
ผิดที่ฉันเองไม่ห้ามหัวใจ
มันก็ดีแล้วที่คิดว่าจะไม่พูดไป
ฉันเริ่มเองจบเองก็ดีแล้ว

ให้ความลับนี้มันตายไปกับตัวฉัน
เมื่อความจริงนั้นมันทำร้ายคนข้างกาย
ไม่ต้องรู้ว่ารู้สึกกับเธอแค่ไหน
เก็บมันเอาไว้ อย่าให้ความลับทำลายชีวิตของเรา

มันไม่ใช่ความรักเป็นเพียงความรู้สึก
อยากได้ในสิ่งที่เราไม่มี
ก็เพราะจิตใจของคนเราอันที่จริง
มันอ่อนแอเหลือเกิน

ให้ความลับนี้มันตายไปกับตัวฉัน
เมื่อความจริงนั้นมันทำร้ายคนข้างกาย
ไม่ต้องรู้ว่ารู้สึกกับเธอแค่ไหน
เก็บมันเอาไว้ ปิดไว้ข้างใน

ให้ความลับนี้มันตายไปกับตัวฉัน
เมื่อความจริงนั้นมันทำร้ายคนข้างกาย
ไม่ต้องรู้ว่ารู้สึกกับเธอแค่ไหน
เก็บมันเอาไว้ อย่าให้ความลับทำลายชีวิตของเรา

มันไม่ใช่ความรักเป็นเพียงความรู้สึก",klear
ให้เธอตายก่อน,/music/thailyric/18690,"สักวัน เราก็ต้องจากกัน
ไปที่แสนไกลอย่าง ไม่ย้อนไม่คืนกลับ
ไม่ฉันก็เธอสักคน ต้องทนอยู่คนเดียว
ทนคิดถึงทรมาน อยู่อย่างเหงาและโดดเดี่ยว

คนที่เหลืออยู่ คือคนที่ปวดร้าว
มองเห็นลมหายใจ คนที่รักเริ่มเบาบาง
ฉันจะไม่ยอม ให้เธอต้องถูกทิ้ง
ถ้าขอกันได้จริง จะยอมให้เธอไปก่อน

เจ็บปวดเท่าไร แต่ฉันจะอดทน
จะทนอยู่รับมันลำพัง ยอมให้เธอไปก่อน
แทบกรีดหัวใจ ต้องเห็นเธอจากไป
ก็ยังดีกว่าให้เธอเป็นคน เห็นฉันตายก่อน

เจ็บปวดเท่าไร แต่ฉันจะอดทน
จะทนอยู่รับมันลำพัง ยอมให้เธอไปก่อน
แทบกรีดหัวใจ ต้องเห็นเธอจากไป
ก็ยังดีกว่าให้เธอเป็นคน เห็นฉันตายก่อน

สักวันหนึ่ง แม้นานเท่าไร  เราคงได้พบกันอีก",klear
กระโดดกอด,/music/thailyric/10575,"เธอยังจำเรื่องราววันสุดท้ายได้หรือเปล่า
มันช่างนานเหลือเกินที่ห่างกันไป
กำลังจะพบเธอจากวันนั้นที่จาก และฉันเองก็หวั่นใจ

ไม่รู้เธอ เป็นคนเดิมหรือแปรเปลี่ยน
ไม่รู้เธอ กลัวใจเธอไม่เหมือนเดิม
ไม่กล้าคิดเดาถ้าผิดคงเสียใจ ไม่รู้เธอคิดแบบไหน

นานแล้วที่ไม่ได้เจอเธอคิดถึงกันหรือเปล่า
นานแล้วที่ไม่ได้เจอเธอคิดถึงกันบ้างไหม
โวโอ คิดถึงเธอขนาดไหน จะทำให้เธอได้รู้
กระโดดกอดหอมแก้มเธอให้รู้ว่าคิดถึงเธอที่สุด
จะร้องตะโกนดังๆ ว่าคิดถึงเธอแค่ไหน
โวโอ คิดถึงเธอแทบขาดใจ ไม่รู้เธอคิดยังไง
ฉันโคตรคิดถึงเธอเลย

วันที่ไม่ได้เจอเธอจะเหงาบ้างหรือเปล่า
วันที่เหนื่อยหัวใจใครอยู่กับเธอ
ยังคงนึกถึงกันอย่างที่ฉันคิดหรือเปล่า ก็ฉันยังมีแต่เธอ

ไม่รู้เธอ เป็นคนเดิมหรือแปรเปลี่ยน
ไม่รู้เธอ กลัวใจเธอไม่เหมือนเดิม
ไม่กล้าคิด เดาถ้าผิดคงเสียใจ ไม่รู้เธอคิดแบบไหน

นานแล้วที่ไม่ได้เจอเธอคิดถึงกันหรือเปล่า
นานแล้วที่ไม่ได้เจอเธอคิดถึงกันบ้างไหม
โวโอ คิดถึงเธอขนาดไหน จะทำให้เธอได้รู้
กระโดดกอดหอมแก้มเธอให้รู้ว่าคิดถึงเธอที่สุด
จะร้องตะโกนดังๆ ว่าคิดถึงเธอแค่ไหน
โวโอ คิดถึงเธอแทบขาดใจ ไม่รู้เธอคิดยังไง
ฉันโคตรคิดถึงเธอเลย

อยากรู้ว่าไม่ได้เจอเธอคิดถึงกันหรือเปล่า
อยากรู้ว่าไม่ได้เจอเธอคิดถึงกันบ้างไหม
โวโอ คิดถึงเธอขนาดไหน จะทำให้เธอได้รู้
กระโดดกอดหอมแก้มเธอให้รู้ว่าคิดถึงเธอที่สุด
จะร้องตะโกนดังๆ ว่าคิดถึงเธอแค่ไหน
โวโอ คิดถึงเธอแทบขาดใจ ไม่รู้เธอคิดยังไง
ฉันโคตรคิดถึงเธอเลย

ไม่รู้เธอคิดยังไง เธอมาให้ฉันกอดที",klear
