song_name,href,lyric,artist
คิดถึงเหลือเกิน,/music/thailyric/4786,"ไกลอาจจะไกลแสนไกล อาจจะไกลจนสุดสายตา
เราห่างกันอาจจะไกลสุดฟ้า อาจจะเกินที่จะพบกัน

แต่ความห่างไกลไม่เคยห้ามใจ ที่ยังคิดถึงส่งไปให้ถึงใจเธอ
อยากจะบอกเธอ คิดถึงเธอเหลือเกิน

ยังไม่ลืมที่ได้เคยใกล้กัน ไม่ลืมวันและคืนนั้นเลย
ยังไม่ลืมที่เราคุ้นเคย ที่เราผูกพันก่อนจากกัน จนไกลแสนไกล

แต่ความห่างไกลไม่เคยห้ามใจ ที่ยังคิดถึงส่งไปให้ถึงใจเธอ
อยากจะบอกเธอ คิดถึงเธอเหลือเกิน

แต่ความห่างไกลไม่เคยห้ามใจ ที่ยังคิดถึงส่งไปให้ถึงใจเธอ
อยากจะบอกเธอ คิดถึงเธอเหลือเกิน

อยากบอกเธอ คิดถึงเธอเหลือเกิน",maleewan_jimena
เจ็บได้ ร้องไห้เป็น,/music/thailyric/4787,"สิ่งที่เธอทำ อยากจะถามหน่อย
เธอเห็นว่าฉันเป็นอะไร ไม่แคร์กันเลย
ไม่เคยเห็นใส่ใจ แทบจะไม่มีความสำคัญ
เธอคิดว่าฉันไม่รู้สึกบ้างหรือไง

เจ็บได้ ร้องไห้เป็น เพราะฉันเป็นคนทนเรื่อยไป
กลัวตัวตนจะไม่เหลือ
เจ็บได้ ร้องไห้เป็น ฉันมีหัวใจมีเลือดเนื้อ
ให้เธอรู้ไว้ จะไม่ทนมากไปกว่านี้

อยากให้เธอลอง และมองฉันใหม่
แค่ในฐานะคนคนนึง ที่เธอเคยลืม
และคงไม่นึกถึง สิ่งหนึ่งที่เธอมองข้ามไป
คือคนที่มีลมหายใจอยู่ข้างเธอ

เจ็บได้ ร้องไห้เป็น เพราะฉันเป็นคนทนเรื่อยไป
กลัวตัวตนจะไม่เหลือ
เจ็บได้ ร้องไห้เป็น ฉันมีหัวใจมีเลือดเนื้อ
ให้เธอรู้ไว้ จะไม่ทนมากไปกว่านี้

เจ็บได้ ร้องไห้เป็น เพราะฉันเป็นคนทนเรื่อยไป
กลัวตัวตนจะไม่เหลือ
เจ็บได้ ร้องไห้เป็น ฉันมีหัวใจมีเลือดเนื้อ
ให้เธอรู้ไว้ จะไม่ทนมากไปกว่านี้",maleewan_jimena
เพราะฉันคนเดียว,/music/thailyric/16765,"ใครจะหวังดีกับเธอ
จะรักเธอเสมอ และรักจนวันตาย
ใครที่ไม่เคยห่างหาย
ใครที่เอาความสุข ผูกอยู่กับเธอ

ใครที่ไม่เคยจืดจาง
ใครที่เอาความหวัง รวมไว้ที่ตัวเธอ
ใครมีให้เธอเสมอ
จนรักที่มากไป กลับทำร้ายกัน

สร้างมาด้วยมือของฉัน
ไม่เคยคิดฝัน ว่าฉันทำลายทุกอย่าง
ทุ่มเทกายใจลงไป จนสุดกำลัง
แล้วพังทลายอย่างนั้น

ไม่อาจโทษดินหรือฟ้า
หรือโชคชะตา ถ้ารู้ให้มันเท่าทัน
ไม่ใช่ใครทั้งนั้น
เพราะฉันคนเดียวใช่ไหม

ทำเพียงเพราะคำว่ารัก
ทำเพราะเชื่ออย่างนั้น หวังไว้ให้มันดี
ใจไม่คิดเลยวันนี้
เหมือนฉันที่ฆ่าเธอให้ตายทั้งเป็น

สร้างมาด้วยมือของฉัน
ไม่เคยคิดฝัน ว่าฉันทำลายทุกอย่าง
ทุ่มเทกายใจลงไป จนสุดกำลัง
แล้วพังทลายอย่างนั้น

ไม่อาจโทษดินหรือฟ้า
หรือโชคชะตา ถ้ารู้ให้มันเท่าทัน
ไม่ใช่ใครทั้งนั้น
เพราะฉันคนเดียวใช่ไหม",maleewan_jimena
ไม่เคยไม่จำ,/music/thailyric/4792,"ดีใจที่เธอยังจำชื่อฉันได้ดี
ห่างหายเป็นปีอุตส่าห์ยังทักกัน
เพียงตัวละครที่มันไม่ค่อยสำคัญ
แค่ช่วงชีวิตสั้นสั้นเคยอยู่เคียงเธอ

พูดคุยเรื่องที่ผ่านมา
ท่าทางเธอคงจะจำไม่ได้เลย

ได้แต่ฝืนยิ้ม พูดว่าฉันก็จำไม่ได้
เรื่องเก่าแบบนั้น ใครก็ลืมได้เลย
แต่มันเจ็บช้ำ มันแค่เพียงไม่กล้าเปิดเผย
เรื่องเก่าเราเคย ฉันไม่เคยไม่จำ

บังเอิญได้เจอกันข้างถนนริมทาง
จึงต้องระวังว่าอย่าได้ร้องไห้
คุยกันทักกันแล้วรีบบอกลาให้ไกล
บอกฟ้าให้ช่วยได้ไหม ไม่อยากเจอเธอ

พูดคุยเรื่องที่ผ่านมา
ท่าทางเธอคงจะจำไม่ได้เลย

ได้แต่ฝืนยิ้ม พูดว่าฉันก็จำไม่ได้
เรื่องเก่าแบบนั้น ใครก็ลืมได้เลย
แต่มันเจ็บช้ำ มันแค่เพียงไม่กล้าเปิดเผย
เรื่องเก่าเราเคย ฉันไม่เคยไม่จำ

ได้แต่ฝืนยิ้ม พูดว่าฉันก็จำไม่ได้
เรื่องเก่าแบบนั้น ใครก็ลืมได้เลย
แต่มันเจ็บช้ำ มันแค่เพียงไม่กล้าเปิดเผย
เรื่องเก่าเราเคย ฉันไม่เคยไม่จำ
เรื่องเก่าเราเคย ฉันไม่เคยไม่จำ",maleewan_jimena
ไม่เสียดายที่ได้รักเธอ,/music/thailyric/4794,"ต่างก็มาคนละทาง มาเจอกันโดยบังเอิญ
ความเหงาข้างในหัวใจ ทำให้เรารักกัน
แต่ลึกๆ ก็รู้ตัวยังมีคนที่สำคัญ
ที่เขารักเธอมากเช่นกัน รอให้กลับไปหา

ฉันก็รู้ว่าสายเกินไป
ไม่สามารถเป็นเจ้าของเธอ
เมื่อสายไปก็ต้องยั้งใจ
เพื่อไม่ให้เกินเลยกว่านี้

หยุดไว้ตรงนี้ มันคงจะดีกว่ายื้อกันไป
หยุดไว้ตรงนี้ แล้วเธอจงเดินกลับหลังไป
ฉันขอสัญญา จะไม่ลืมเธอจนวันตาย
ถึงแม้จะต้องปวดใจ จะไม่เสียดายที่ได้รักเธอ

ช่วงเวลาที่แสนดี ที่เราได้มาเจอะกัน
เวลาแค่เพียงไม่นาน แต่สำคัญมากมาย
จะจดจำวันของเรา บันทึกลงในหัวใจ
ว่าครั้งหนึ่งเคยได้รักใคร หมดใจได้อย่างนี้

ฉันก็รู้ว่าสายเกินไป
ไม่สามารถเป็นเจ้าของเธอ
เมื่อสายไปก็ต้องยั้งใจ
เพื่อไม่ให้เกินเลยกว่านี้

หยุดไว้ตรงนี้ มันคงจะดีกว่ายื้อกันไป
หยุดไว้ตรงนี้ แล้วเธอจงเดินกลับหลังไป
ฉันขอสัญญา จะไม่ลืมเธอจนวันตาย
ถึงแม้จะต้องปวดใจ จะไม่เสียดายที่ได้รักเธอ

ถึงฉันจะตายจากไป จะไม่เสียดายที่ได้รักเธอ",maleewan_jimena
