song_name,href,lyric,artist
อย่าเลย...อย่า (ทรมาน),/music/thailyric/14160,"อย่าเลย อย่าทรมาน ฉันด้วยการ มีคำถาม
เมื่อเราจากกันไม่นาน มันไม่นาน พอให้ฉันลืม

บอกฉันว่าเธอต้องไป ฉันเข้าใจ ฉันก็ไม่อยากฝืน
สุดท้ายคงเพียงแค่ลืม เพียงแค่ลืม ว่าเราเคยรักกัน

ไม่ต้องรู้ได้ไหม ว่าฉันเป็นอย่างไร
ไม่ว่าเธอแค่สงสัย หรือเป็นห่วงฉัน
จากวันนี้ ฉันขอ ให้สองเราจบกัน
แค่นั้นได้ไหม (ขอทีเถอะ)

เมื่อสุดท้ายเธอนั้น ไม่คิดจะกลับมา
อย่าเลยอย่าเสียเวลา กับฉันทีได้ไหม
ยิ่งถามฉันเป็นอย่างไร
มันย้อนคืนวันกลับไป ดังเดิม

ไม่รู้อีกนานเท่าไร จะหายไป ใจที่ยังอ่อนล้า
แค่ขออย่าเดินเข้ามา รอยน้ำตา ยังไม่หายไป

ไม่ต้องรู้ได้ไหม ว่าฉันเป็นอย่างไร
ไม่ว่าเธอแค่สงสัย หรือเป็นห่วงฉัน
จากวันนี้ ฉันขอ ให้สองเราจบกัน
แค่นั้นได้ไหม (ขอทีเถอะ)

เมื่อสุดท้ายเธอนั้น ไม่คิดจะกลับมา
อย่าเลยอย่าเสียเวลา กับฉันทีได้ไหม
ยิ่งถามฉันเป็นอย่างไร
มันย้อนคืนวันกลับไป ดังเดิม

อย่าเลย อย่าทรมาน ฉันด้วยการ มีคำถาม",moving_and_cut
