song_name,href,lyric,artist
ฉันรู้แค่รักเธอหมดใจ,/music/thailyric/8970,"เพลงปะกอบละคร นางสิงห์สะบัดช่อ

บางสิ่งอาจดูไม่ดี หรือไม่สมควร
และมันอาจไปรบกวน
ไปขวางหู ขวางตาใครๆ
ขึ้นอยู่กับเราสองคน แค่ใจสองใจ

ผิดในแง่มุมของใคร
แต่ฉันรู้ว่าฉันนั้นเลือกถูกแล้ว
เธอต้องถามใจ ตัวเธอเองให้ดี
ต้องถามใจว่ามันเรียกร้องหาใคร

แค่ทำตามใจตัวเอง แบบไม่ต้องสนใคร
ซื่อสัตย์กับใจ แบบที่ฉันทำ

ฉันรู้ว่ารักเธอหมดใจ ถูกผิดอยู่ตรงไหน
คงไม่สำคัญ และฉันรู้ว่ารักเธอเท่านั้น
กลั่นกรองจากใจนี้ ชัดทุกอย่าง ชัดกระจ่าง
ฉันขอแค่รักเธอต่อไป อะไรจะมาขวาง

ฉันไม่หวั่น ทุกๆ ลมหายใจ
ให้เธอ ให้ตลอดไป

แค่สิ่งเดียวที่สำคัญ ขอแค่สัญญา
อะไรจะผ่านเข้ามา
ก็แค่เพียงเชื่อใจกันและไม่หวั่นไหว
เธอต้องถามใจ ตัวเธอเองให้ดี

ต้องถามใจ ว่ามันเรียกร้องหาใคร
แค่ทำตามใจตัวเอง ไม่ต้องสนใคร
ซื่อสัตย์กับใจ แบบที่ฉันทำ

ฉันรู้ว่ารักเธอหมดใจ
ถูกผิดอยู่ตรงไหน คงไม่สำคัญ
และฉันรู้ว่ารักเธอเท่านั้น
กลั่นกรองจากใจนี้ ชัดทุกอย่างชัดกระจ่าง

ฉันขอแค่รักเธอต่อไป
อะไรที่มาขวาง ฉันไม่หวั่นรักเธอหมดหัวใจ

ฉันรู้ว่ารักเธอหมดใจ
กฎเกณฑ์ เป็นอย่างไร มันไม่สำคัญ
แค่ฉันรู้ว่าฉันรักฉันยืนยัน
กลั่นกรองจากใจนี้ ชัดทุกอย่างชัดกระจ่าง

ฉันขอแค่รักเธอต่อไป
อะไรจะมาขวางฉันไม่หวั่น
ทุกๆ ลมหายใจ ให้เธอให้ตลอดไป",r_arnattapol
ต่างคนต่างไป,/music/thailyric/6122,"นี่หรือคือเธอที่เคยรัก นี่หรือคือเธอคนนั้น
คนเดิมที่รักที่เคยผูกพัน กลับเปลี่ยนผันไป
อย่าบอกเลยว่ารักกัน ยิ่งได้ฟังยิ่งช้ำใจ
สิ่งที่เธอแสดงต่อกันฉันรับไม่ไหว อยู่ไปก็ทรมาน

ต่างคนต่างไป ต่างคนก็รู้ว่าเราต่างกัน
แค่คำว่ารักไม่พอเหนี่ยวรั้งเราได้ทุกอย่าง
เมื่อมันสายจะเกินแก้ไข

ต่างคนต่างไป ต่างคนต้องรับความจริงเอาไว้
เก็บคำว่ารักที่มีให้กันในหัวใจ เก็บในห้วงทรงจำ
จบความรักที่มีต่อกันต้องยอมทำใจ ให้เราลาจาก

เจ็บปวดแค่ไหนก็ตาม ฉันเองก็ต้องตัดใจ
ไม่เคยรักใครมากเท่านี้
และคงจะไม่รักใครอีกต่อไป เมื่อไม่มีเธอ

ต่างคนต่างไป ต่างคนก็รู้ว่าเราต่างกัน
แค่คำว่ารักไม่พอเหนี่ยวรั้งเราได้ทุกอย่าง
เมื่อมันสายจะเกินแก้ไข

ต่างคนต่างไป ต่างคนต้องรับความจริงเอาไว้
บอกลากันเสีย เพราะนี่คือวันสุดท้าย ฉันจะจำเธอไว้
เพียงแค่วันที่ดี ว่าเคยรักเธอมากแค่ไหน
จนวันที่เราสองคนลาจาก",r_arnattapol
ยอม,/music/thailyric/6123,"ฉัน ฉันก็รู้ดี
ว่าเธอมีคนที่ฝัน
เธอไม่เคยคิดจะรักกัน
ไม่เคยจะหันมามองตา

รู้ตัวฉันไม่ดีพร้อม
ไม่ได้เป็นคนที่เธอ มองหา
เธอเหมือนดาวที่อยู่บนฟ้า
มองเห็นด้วยตาแต่ไม่อาจคว้ามาครอง

แต่ยืนยันจะรักเธอ และเต็มใจจะรักเธอ
ไม่สนว่าเธอจะรักใคร
ไม่ใช่คนที่แสนดี ก็มีแต่รักที่จริงใจ
เจ็บช้ำก็ยอม ยังไงก็ยอม
และไม่เคย เกรงกลัวความผิดหวัง
ยืนยันจะรักเธอ

เขา เขาคงแสนดี
เป็นเหมือนที่เธอคิดไว้
ฉันคนนี้ก็ยังเข้าใจ
เมื่อเธอไม่รักก็ไม่ว่า

รู้ตัวฉันไม่ดีพร้อม
ไม่ได้เป็นคนที่เธอ มองหา
เธอเหมือนดาวที่อยู่บนฟ้า
มองเห็นด้วยตาแต่ไม่อาจคว้ามาครอง

แต่ยืนยันจะรักเธอ และเต็มใจจะรักเธอ
ไม่สนว่าเธอจะรักใคร
ไม่ใช่คนที่แสนดี ก็มีแต่รักที่จริงใจ
เจ็บช้ำก็ยอม ยังไงก็ยอม
และไม่เคย เกรงกลัวความผิดหวัง
ยืนยันจะรักเธอ

ยังยินดีที่จะรัก เจ็บอย่างไรก็ไม่กลัว
ถ้าหากกลัวจะมีหัวใจไว้ทำไม",r_arnattapol
