song_name,href,lyric,artist
คนบนฟ้า,/music/thailyric/5017,"เพียงอุ่นไอ เลือดในกายก็ร้อนรนดั่งไฟ 
ถูกแผดเผาด้วยเพราะความไว้ใจ 
สิ่งที่ฉันมีให้เธอนั้นมืดเปล่า 

รักแล้วไง
สิ่งที่เธอนั้นต้องการมากมาย
นอกจากรักและถ้อยคำห่วงใย
ปิดบังฉันด้วยหัวใจที่มืดมน
ฉัน หัวใจลุ่มหลง เพราะใครบางคน
เฝ้าคอยหลอกฉัน เป็นทาสในใจ

ฝากฉันไว้ ด้วยคราบน้ำตา
เธอเลว เธอช่างไร้ค่า
ไม่เหมือนดังคนบนฟ้าที่วาดไป

สร้างด้วยความรักและความห่วงใย 
จบด้วยความช้ำมันชั่งเสียใจ 
เพียงแค่แรกรักก็เอาเกือบตาย 
หมดสิ้นความหมาย เกินอภัยให้กับเธอ 

เพียงอุ่นไอ เลือดในกายก็ร้อนรนดั่งไฟ
อยู่กับรักที่ไม่เป็นดังใจ
สุดกำลังจะรั่งเธอ หยุด พอที

ในเมื่อรักแล้วไง 
สิ่งที่เธอนั้นต้องการมากมาย
นอกจากรักและถ้อยคำห่วงใย
ปิดบังฉันด้วยหัวใจที่มืดมน
ฉัน หัวใจลุ่มหลง เพราะใครบางคน
เฝ้าคอยหลอกฉัน เป็นทาสในใจ

ฝากฉันไว้ ด้วยคราบน้ำตา
เธอเลว เธอช่างไร้ค่า
ไม่เหมือนดังคนบนฟ้าที่วาดไป

สร้างด้วยความรักและความห่วงใย 
จบด้วยความช้ำมันชั่งเสียใจ 
เพียงแค่แรกรักก็เอาเกือบตาย 
หมดสิ้นความหมาย เกินอภัยให้กับเธอ 

ยอม ให้เธอจากไกล
ไม่มีเรื่องราว ต้องพูดกัน
เป็นเพียงฝัน ทำร้ายให้ฉัน เสีย ใจ

ฝากฉันไว้ ด้วยคราบน้ำตา
เธอเลว เธอช่างไร้ค่า
ไม่เหมือนดังคนบนฟ้าที่ว่าไป

สร้างด้วยความรักและความห่วงใย
จบด้วยความช้ำมันชั่งเสียใจ
เพียงแค่แรกรักก็เอาเกือบตาย
หมดสิ้นความหมาย
ช่างทรมาน

สร้างด้วยความรักและความห่วงใย
จบด้วยความช้ำมันชั่งเสียใจ
เพียงแค่แรกรักก็เอาเกือบตาย
หมดสิ้นความหมาย เกินอภัยให้กับเธอ",retrospect
คืนแห่งความเหงา,/music/thailyric/5018,"แสงดวงตะวันจางลับลาไป
อีกวันมีเพียงฉันกับความเหงา
และเรื่องราวร้อยพันที่ช้ำใจ
เสียงของบทเพลงคอยเฝ้าหลอนใจ
อยากผ่านคืนนี้ไปแค่เพียงใครรับฟัง

ค่ำคืนแห่งความเหงา
ช่วงฉุดรั้งฉันเอาไว้ ก่อนฉันจะขาดใจ
ค่ำคืนแห่งความเหงา
จะมีใครไหมที่เข้าใจฉัน หยุดความเหงาให้มันจบลง

ฉันยังเหมอมองไปรอบๆกาย
แต่ไม่เห็นใครมีแค่เงาของฉันและแสงไฟ
เสียงของบทเพลงคอยเฝ้าหลอนใจ
อยากผ่านคืนนี้ไปแค่เพียงใครรับฟัง

ค่ำคืนแห่งความเหงา
ช่วงฉุดรั้งฉันเอาไว้ ก่อนฉันจะขาดใจ
ค่ำคืนแห่งความเหงา
จะมีใครไหมที่เข้าใจฉัน หยุดความเหงาให้มันจบลง

ช่วงฉุดรั้งฉันเอาไว้ก่อนที่ฉันจะขาดใจ
ช่วงฉุดรั้งฉันเอาไว้ก่อนที่ฉันจะ..ขาดใจ

ค่ำคืนแห่งความเหงา
ช่วงฉุดรั้งฉันเอาไว้ ก่อนฉันจะขาดใจ
ค่ำคืนแห่งความเหงา
จะมีใครไหมที่เข้าใจฉัน หยุดความเหงาให้มันจบลง",retrospect
ปล่อยฉัน,/music/thailyric/5022,"ค่ำคืนนี้มืดลง และตัวฉันยังคงนึกถึงวันเก่าๆ
ภาพฝันที่เราได้ผูกพัน และฉันรู้ดีมันคงไม่มีหนทาง
เริ่มรักก็เหมือนใจจะอ่อนแรง ฉัน.. ฉันรู้ว่าเราต่างกัน
ได้โปรดอย่าลดตัวมายืนข้างฉัน เมื่อเธอนั้นยืนอยู่บนฟ้า

ปล่อยให้ฉันตายลงอยู่ตรงนี้ บอกฉันบอก ฉันย้ำเธออีกที
ว่าเราสองคน ไม่อาจจะหนีความจริงจงทิ้งมันไปข้างหลัง

ปล่อยให้หัวใจ มันอ่อนแรง ฉัน.. เหลือเพียงความเงียบงัน
ปล่อยให้น้ำตามาเป็นเพื่อนฉัน ให้มันหายออกไปจากหัวใจ

ปล่อยให้ฉันตายลงอยู่ตรงนี้ บอกฉันบอก ฉันย้ำเธออีกที
ว่าเราสองคน ไม่อาจจะหนีความจริงจงทิ้งมันไปข้างหลัง

ปล่อยให้ฉันตาย ปล่อยให้ฉันตาย ให้ความรักเป็นเพียงฝันไป
ปล่อยให้ฉันตาย ปล่อยให้ฉันตาย จงปล่อย ฉัน

ปล่อยให้ฉันตายลงอยู่ตรงนี้ บอกฉันบอก ฉันย้ำเธออีกที
ว่าเราสองคน ไม่อาจจะหนีความจริงจงทิ้งมันไปข้างหลัง

ปล่อยให้ฉันตายลงอยู่ตรงนี้ บอกฉันบอก ฉันย้ำเธออีกที
ว่าเราสองคน ไม่อาจจะหนีความจริงจงทิ้งมันไปข้างหลัง",retrospect
เพราะว่ารัก,/music/thailyric/5023,"(เพราะว่ารัก เพราะว่าฝัน ฉันก็เลยทุ่มเทหมดใจทุกสิ่ง
และสุดท้าย ที่ว่ารัก ไม่ทันไรก็เป็นเหมือนเก่า หลอกลวงกันทั้งนั้น)

ทุกวันนี้ความเป็นจริงที่โหดร้าย โลกมันไม่เคยลืมรักฉัน
คำว่ารัก คนที่เคยมาบอกไว้ไม่ทันไรก้อลืมทุกสิ่ง

หลอกลวงกันทั้งนั้น จะรักทำไม ให้มันทำลายใจตัวเอง
หลอกลวงกันทั้งนั้น ให้ฉันตายใจ ฉันพอแล้วพอที ไม่มีที่จริงจัง

เพราะรักเธอ เพราะไว้ใจ เธอมากไป วันนี้จึงเจ็บช้ำ
ยิ่งรักจริง ฉันช้ำใจทรมาน มันทรมานเจียนตาย

ต่อจากนี้เตือนตัวเองมาพอแล้ว รักที่มีแต่ทุ่มเทใจ
ต่อจากนี้เตือนตัวเองให้จำไว้ ไว้ใจใครหมดใจไม่ได้

หลอกลวงกันทั้งนั้น จะรักทำไม ให้มันทำลายใจตัวเอง
หลอกลวงกันทั้งนั้น ให้ฉันตายใจ ฉันพอแล้วพอที ไม่มีที่จริงจัง

เพราะรักเธอ เพราะไว้ใจ เธอมากไป วันนี้จึงเจ็บช้ำ
ยิ่งรักจริง ฉันช้ำใจทรมาน มันทรมานเจียนตาย

(เพราะรัก จึงได้ไว้ใจ เพราะรักจึงไม่รักใคร)
ว๊าก...เพราะรักเธอ เพราะไว้ใจ รักเธอยิ่งเสียใจ",retrospect
สุดที่รัก,/music/thailyric/5027,"เพียงเวลาแค่ไม่นาน ทำให้เราได้คุ้นเคย
สุขและทุกข์ที่ล่วงเลย มันทำให้เรายิ่งผูกพัน
แต่เวลาคือสิ่งเลวร้ายเช่นกัน เวลาช่างแสนสั้น
ทำให้เราต้องจากกัน

สุดเส้นทางปรายขอบฟ้า ชะตาได้กำหนด
ไม่อาจจะพบกัน แต่ตัวฉันไม่เคยจะลืมเธอ
ภาพเก่าคืนย้อนมา
จุดจบคือน้ำตา และรักที่ยังไม่เคยจางหาย

แม้ว่าวันนี้เธอจะอยู่แสนไกล
แต่ความทรงจำดีๆนั้นไม่เคยจางหาย
ตราบที่ดาวเต็มฟ้าเธอยังคงวนเวียนในหัวใจ
หลับให้สบายสักวันคงพบกัน สุดที่รัก

สุดเส้นทางปรายขอบฟ้า ชะตาได้กำหนด
ไม่อาจจะพบกัน แต่ตัวฉันไม่เคยจะลืมเธอ
ภาพเก่าคืนย้อนมา
จุดจบคือน้ำตา และรักที่ยังไม่เคยจางหาย

แม้ว่าวันนี้เธอจะอยู่แสนไกล
แต่ความทรงจำดีๆนั้นไม่เคยจางหาย
ตราบที่ดาวเต็มฟ้าเธอยังคงวนเวียนในหัวใจ
หลับให้สบายสักวันคงพบกัน

แม้ว่าวันนี้เธอจะอยู่แสนไกล
แต่ความทรงจำดีๆนั้นไม่เคยจางหาย
ตราบที่ดาวเต็มฟ้าเธอยังคงวนเวียนในหัวใจ
หลับให้สบายสักวันคงพบกัน สุดที่รัก สุดที่รัก สุดที่รัก",retrospect
ให้ฉันลืมเธอ,/music/thailyric/5028,"ในวันนี้ เธอบอกฉันให้ลืม ให้จบความรัก หยุดจากความฝัน
พูดง่ายดาย แต่หัวใจมันรับไม่ทัน คำนั้นที่เธอบอกกับฉัน

ให้ฉันลืมเธอได้ไง ภาพเราเคยรักกันนาน ตราตรึงในหัวใจ
ให้ฉันลืมเธอได้ไง ไม่อยากมีน้ำตา โปรดเธอคืนย้อนมา (เถอะ)

คำหนึ่งคำบาดลึกใจฉัน ขอเถอะขอที ไม่อยากให้รักเราจบลง
พูดง่ายดาย แต่หัวใจมันรับไม่ทัน คำนั้นที่เธอบอกกับฉัน

ให้ฉันลืมเธอได้ไง ภาพเราเคยรักกันนาน ตราตรึงในหัวใจ
ให้ฉันลืมเธอได้ไง ไม่อยากมีน้ำตา โปรดเธอคืนย้อนมา (เถอะ)

เธอ รักที่มีทำไมเปลี่ยนไป ขอเธออย่าจากไป
ขอโทษในสิ่งที่ฉันทำผ่านไป
ลองนึกถึงวันเก่า ที่เราเคยรักกัน
สายตามอง สองกายแนบชิด ไม่คิดที่จะเปลี่ยนไป
เพราะสิ่งใดใจเธอเปลี่ยนไป หรือเธอสับสน

ให้ฉันลืมเธอได้ไง ภาพเราเคยรักกันนาน ตราตรึงในหัวใจ
ให้ฉันลืมเธอได้ไง ไม่อยากมีน้ำตา โปรดเธอคืนย้อนมา (เถอะ)

ให้ฉันลืมเธอได้ไง ภาพเราเคยรักกันนาน ตราตรึงในหัวใจ
ให้ฉันลืมเธอได้ไง ไม่อยากมีน้ำตา โปรดเธอคืนย้อนมา (เถอะ)",retrospect
คิดถึงพ่อ,/music/thailyric/11868,"หยาดฝนหล่นจากฟ้า หมอกขาวบดบังตา
ในใจฉันสั่น ทุกคนคงไม่ต่างกัน
คิดถึงที่พ่อสอน และย้ำ ให้รักกัน
อย่าทะเลาะกัน พ่อเอ่ยทุกครั้งจำได้หรือเปล่า

เมื่อครั้งเป็นเด็กน้อย จ้องมองอยู่อย่างนั้น
เห็นพ่อทำงานทุกวัน ก็รู้พ่อทำเพื่อใคร
คิดถึงที่พ่อสอน และย้ำ ให้รักกัน
อย่าทะเลาะกัน พ่อเอ่ยทุกครั้งยังจำได้ไหม

ในเวลานี้พ่อยืนอยู่ไกล ไกล ไกล
คิดถึงพ่อจับหัวใจ มีเพียงคำสอนที่พ่อฝากไว้
และได้แต่แหงนมองเพียงรูปถ่าย
จดจำคำสอนของพ่อ ตลอดไป
และต่อจากนี้จะเป็นคนดีให้พ่อภูมิใจ

ในเวลานี้พ่อยืนอยู่ไกล ไกล ไกล
คิดถึงพ่อจับหัวใจ มีเพียงคำสอนที่พ่อฝากไว้
และได้แต่แหงนมองเพียงรูปถ่าย
จดจำคำสอนของพ่อ ตลอดไป
และต่อจากนี้จะเป็นคนดีให้พ่อภูมิใจ

จะไม่ทะเลาะกัน เราจะรักกัน
จากนี้ ให้พ่อภูมิใจ",retrospect
เจ็บกว่าคือฉัน,/music/thailyric/9112,"เขาทำเธอเจ็บช้ำจนใจสั่น
ขอยืนยันว่าฉันก็ไม่ต่าง
แม้ว่าฉันเป็นอดีต
ให้เมินเฉยคงทนไม่ไหว จำเอาไว้
เธอเจ็บเท่าไหร่ เจ็บกว่าคือฉัน

แล้วใครคนนั้นต้องเจอ มันต้องเจอ

เขาทำกับเธอมันเกินไปไหม
เธอถูกทำร้ายเต็มทั้งสองตา
เลือดเธอรินหลั่งไหล
ฉันเก็บอาการไม่ไหว
รักจริงไม่ทำกันขนาดนี้
อย่าอยู่อย่าฝืนทนกับเขาเลยเธอ
รู้ดีและเข้าใจว่าเธอทุ่มเทเพียงไหน

รู้เธอทนทุกอย่างเพื่อรัก
แต่ฉันไม่ขอทนกับสิ่งที่เขาทำเธอ
อีกต่อไป

จดจำไว้ฉันยังรักเธอ
ช้ำที่เธอต้องเจอทุกร่องรอยที่เจ็บ
ที่มีฟ้องอยู่ความจริงเป็นไง
จำได้ไหม หัวใจเป็นของเธอ
เขาทำเธอปวดใจ ยิ่งรุนแรงเท่าไหร่
สักวันต้องเจอกับคนอย่างฉัน

แล้วคนอย่างนั้นต้องเจอ

น้ำตาเธอที่ไหลเพราะกายเจ็บ
รู้ว่าไม่เจ็บลึกเท่าใจแหลก
รักของเขาที่พร่ำบอกกับเธอนั้น
ไม่มีอยู่จริง

ในวันนี้ เธอเจ็บเท่าไหร่ เจ็บกว่าคือฉัน

จดจำไว้ฉันยังรักเธอ
ช้ำที่เธอต้องเจอทุกร่องรอยที่เจ็บ
ที่มีฟ้องอยู่ความจริงเป็นไง
จำได้ไหม หัวใจเป็นของเธอ
เขาทำเธอปวดใจ ยิ่งรุนแรงเท่าไหร่
สักวันต้องเจอกับคนอย่างฉัน

แล้วใครคนนั้นต้องเจอ

ก็เพียงแค่เธอมองคนผิดไป
อภัยให้ตัวของเธอเอง
อย่ารอให้ใครทำลาย
คนเราจะใครก็เคยหลงทาง
แค่กล้าแค่เธอเดินออกมา
จะทนมันไปทำไม

จดจำไว้ ฉันยังรักเธอ
ช้ำที่เธอต้องเจอ ทุกร่องรอยที่เจ็บ
ที่มีฟ้องอยู่ความจริงเป็นไง
จำได้ไหม หัวใจเป็นของเธอ
เขาทำเธอปวดใจยิ่งรุนแรงเท่าไหร่
สักวันต้องเจอกับคนอย่างฉัน

แล้วใครคนนั้น ต้องเจอ มันต้องเจอ",retrospect
เจ็บปวดที่งดงาม,/music/thailyric/9232,"จบกันไปนานแล้ว เวลาของเรา
แต่จากวันนั้น หัวใจฉันยังไม่เคยว่างเปล่า
ยังคงมีเธอในใจ ถึงแม้ตัวไกลจากกัน

ไม่เคยมีวันไหน ที่ฉันลืมได้
บ่อยๆ ที่คิดถึงเธอเหลือเกิน ยังคงร้องไห้
มันยังเจ็บปวดในใจ ยังรักเธอมากอย่างเคย

ถึงแม้เจ็บช้ำสักเท่าไหร่
ยังรู้สึกดีที่หัวใจ ไม่ลืมภาพเธอ
ชีวิตยังเหลือความสวยงาม
ให้ฉันจดจำได้เสมอ

ยังคงมีเธอในหัวใจ อยู่เหมือนเดิม
รักเธออยู่เหมือนเดิม ถึงนานแค่ไหน
ก็ไม่ยอมให้เธอไปจากใจดวงนี้
เป็นความเจ็บปวดที่งดงาม

จะเก็บเธอเอาไว้ในใจจนตาย
เป็นสิ่งดีๆ ของชีวิตคน ที่เคยแพ้พ่าย
ยังพออบอุ่นในใจ ยังได้เจอเธอในฝัน

ถึงแม้เจ็บช้ำสักเท่าไหร่
ยังรู้สึกดีที่หัวใจ ไม่ลืมภาพเธอ
ชีวิตยังเหลือความสวยงาม
ให้ฉันจดจำได้เสมอ

ยังคงมีเธอในหัวใจ อยู่เหมือนเดิม
รักเธออยู่เหมือนเดิม ถึงนานแค่ไหน
ก็ไม่ยอมให้เธอไปจากใจดวงนี้
เป็นความเจ็บปวดที่งดงาม

มีเธอในหัวใจ อยู่เหมือนเดิม
รักเธออยู่เหมือนเดิม ถึงนานแค่ไหน
ก็ไม่ยอมให้เธอไปจากใจดวงนี้

ยังคงมีเธอในหัวใจ อยู่เหมือนเดิม
รักเธออยู่เหมือนเดิม ถึงนานแค่ไหน
ก็ไม่ยอมให้เธอไปจากใจดวงนี้
เป็นความเจ็บปวดที่งดงาม
ที่งดงามอยู่ในใจตลอดไป",retrospect
