song_name,href,lyric,artist
นางฟ้าหน้ารถแห่,/music/thailyric/16555,"ขอเสียงผู้สาวหน้ารถแห่ แหน่เร็ว
อ้าว วันทูทรี ไป

เสียงกลองสนั่น หลังคาสั่นตึกๆ
ปลุกใจให้อ้ายนอนตื่น
ส่วยหน้าให้ตามันซื่นจักหน่อยก่อนเด้อ
แล้วแนมเบิ่งคักๆ จักรถแห่มาแห่งานพุ่นเหลอ
จากเบลอๆ จักเรี่ยวแรงแมนมาแต่ไส

บ่คิดเลยว่า สิพ้อนางฟ้าหน้าตู้ลำโพงรถแห่
ฮักเลยแหม  นี่ล่ะแม่ของลูกของอ้าย
มื้อนี่เฮาสิบ่เมา เว้นเหล้าจักมื้อสหาย
สิจีบเอาคนของใจอยู่แถวนี่ล่ะ

ขอเต้นข้างๆ เจ้าแนเด้อ ขอเบอร์เจ้าแนได้บ่
หัวใจมันส่งคำขอเป็นแฟนน้องหล่า
มีใจให้เจ้ายกแขน มีแฟนให้เจ้ายกขา
อ้ายอยากขอต่อเวลา รถแห่

ขอเต้นข้างๆ เจ้าแนเด้อ เอ้าขอเบอร์เจ้าแนได้บ่
หัวใจมันส่งคำขอเป็นแฟนน้องหล่า
มีใจให้เจ้ายกแขน  เอ้ามีแฟนให้เจ้ายกขา
อ้ายอยากขอต่อเวลา รถแห่ สิได้อยู่กับเจ้าดนๆ

หมดเวลาสนุก เจ็บจนจุกมันบ่ฟลุกคือเฮาคึดไว้
เมื่อผู้บ่าวมาจูงเจ้าไป ใจอ้ายเลยเหี่ยว
แต่กะส่างดอกหล่า ผู้หญิงน่ะบ่ได้มีคนเดียว
กะสั่นขอเต้นเปลี่ยวๆ หาเหยื่อรายใหม่

เสียงกลองสะเดิด เปิดฉากปะทะท่าเต้นมันๆ กับเสี่ยว
หรือเฮาเหมาะอยู่คนเดียวกับหมู่สหาย
ให้ถือว่าความสุขน้อยๆ ที่ได้เจอกับคนถืกใจ
มื้อนี่ขอยาวๆ ไป เอ้ายาวไป

ขอเต้นข้างๆ เจ้าแนเด้อ ขอเบอร์เจ้าแนได้บ่
หัวใจมันส่งคำขอเป็นแฟนน้องหล่า
มีใจให้เจ้ายกแขน มีแฟนให้เจ้ายกขา
อ้ายอยากขอต่อเวลา รถแห่

ขอเต้นข้างๆ เจ้าแนเด้อ ขอเบอร์เจ้าแนได้บ่
หัวใจมันส่งคำขอเป็นแฟนน้องหล่า
มีใจให้เจ้ายกแขน เอ้ามีแฟนให้เจ้ายกขา
อ้ายอยากขอต่อเวลา รถแห่ สิได้อยู่กับเจ้าดนๆ

ขอเสียงผู้สาวหน้ารถแห่ แหน่เร็ว

ขอเต้นข้างๆ เจ้าแนเด้อ ขอเบอร์เจ้าแนได้บ่
หัวใจมันส่งคำขอเป็นแฟนน้องหล่า
มีใจให้เจ้ายกแขน มีแฟนให้เจ้ายกขา
อ้ายอยากขอต่อเวลา รถแห่

ขอเต้นข้างๆ เจ้าแนเด้อ เอ้าขอเบอร์เจ้าแนได้บ่
หัวใจมันส่งคำขอเป็นแฟนน้องหล่า
มีผัวให้เจ้ายกแขน เอ้ามีแฟนให้เจ้ายกขา
อ้ายอยากขอต่อเวลา รถแห่ สิได้อยู่กับเจ้าดนๆ

อ้ายอยากขอต่อเวลา รถแห่
เพื่อสิได้แฟนไปฝากแม่จั๊กคน",tao_pusin
บ่ไปกรุงเทพฯได้บ่,/music/thailyric/21494,"สิไปอิหลี ซั่นบ้อ น้องหล่าคำแพง
คึดคักแล้วบ้อ แก้มแดง จั่งตัดสินใจ
อ้ายเคยได้ยิน พี่น้องบ้านเฮา เพิ่นเว่ามาหลาย
อยู่ยากกรุงเทพฯ บ่ม่วนดอกเมืองใหญ่
ถ้าเป็นไปได้มีแต่อยากคืนเมือบ้าน

อิพ่ออิแม่ เจ้าเด้ ไผสิซอยเบิ่ง
พ่อใหญ่แม่ใหญ่ สิเพิ่ง สิใช้ไผ ลูกหลาน
บักน้อยอิน้อย ผู้ได๋สิเล่น เป็นหมู่มัน
หมูหมากาไก่ งัวควายซุมนั้น
คงคึดนำเจ้าคือกัน  ย่านเมืองพาเจ้าหลงทาง

บ่ไป บ่ไป บ่ไปได้บ่ บ่ไปกรุงเทพฯ ได้บ่
อยู่บ้านเฮา กะสุข กะพอ กะมีซุอย่าง
บ่ไป บ่ไป บ่ไปได้บ่ กรุงเทพฯมันฮ้อนคือจั่งหยัง
อยู่บ้านเฮาเย็นส่วยส่วยเด้อนาง
อ้ายสิพาไปนอนเล่นเถียงนาฮ่าง
บ่ไปกรุงเทพฯ ได้บ่ ได้บ่ ได้บ่

บ่คิดเบิ่งใหม่ แนตี้ คนดีคนฮู้
บ้านเฮากะพอ หากิน หาอยู่ ได้อยู่น้า
งานการถ้าเฮาขยัน คงบ่อดตายดอกอ้ายว่า
แนวอยากแนวกิน กะเก็บผักเก็บหญ้า
ป่นปูป่นปลา กะแซบเติบอยู่เด้นาง

บ่ไป บ่ไป บ่ไปได้บ่ บ่ไปกรุงเทพฯ ได้บ่
อยู่บ้านเฮา กะสุข กะพอ กะมีซุอย่าง
บ่ไป บ่ไป บ่ไปได้บ่ กรุงเทพฯ มันฮ้อนคือจั่งหยัง
อยู่บ้านเฮาเย็นส่วยส่วยเด้อนาง
อ้ายสิพาไปนอนเล่นเถียงนาฮ่าง
บ่ไปกรุงเทพฯ ได้บ่ ได้บ่ ได้บ่ ได้บ่
ได้บ่น้องหล่า",tao_pusin
บุญผลา,/music/thailyric/16603,"บ่น่าเซื่อเนาะว่าเฮาสิมาพ้อกัน
คนตั้งว่าจักล้าน พอปานว่ามีผู้มาซุกยู้ใส่
ให้เฮาเว้าจา ให้ถืกชะตา ถืกใจ
จนตกหลุมความฮัก แล้วขึ้นบ่ได้ งึดใจอยู่เด้เนาะ

ว่าโอ้ละหนอ นางเอย
เจ้ากะเคยคึดนำอยู่แม่นบ่
ว่าฮักเฮาที่เกิดที่ก่อ กะย้อนว่าย้อนว่า

ย้อนบุญผลา เด้เนาะ พาเฮามาพบพ้อ
ฮู้สึกคือกัน อยู่เนาะ คือฮักที่รอที่ฝัน
ให้บุญผลา พาฮัก ให้ฮักเฮาคือเก่าทุกวัน
ได้หายใจอยู่ใกล้ๆ กัน จนฮอดมื้อตาย ได้ซ่ำนี้กะพอ

บ่น่าเซื่อเนาะ ว่าอ้ายสิพ้อฮักแท้
นอกจากพ่อกับแม่ กะมีแต่เจ้าฮั่นล่ะเด้อ อ้ายว่า
อดข้าวกะตาย ขาดเจ้ากะบ่ได้ สั่นดอกวา
เบิ่งแงงกันเด้อหล่า ให้สมบุพเพเฮาฮ่วมสร้างมาเด้อ

ว่าโอ้ละหนอ นางเอย
เจ้ากะเคยคึดนำอยู่แม่นบ่
ว่าฮักเฮาที่เกิดที่ก่อ กะย้อนว่าย้อนว่า

ย้อนบุญผลา เด้เนาะ พาเฮามาพบพ้อ
ฮู้สึกคือกัน อยู่เนาะ คือฮักที่รอที่ฝัน
ให้บุญผลา พาฮัก ให้ฮักเฮาคือเก่าทุกวัน
ได้หายใจอยู่ใกล้ๆ กัน จนฮอดมื้อตาย ได้ซ่ำนี้กะพอ

ว่าโอ้ละหนอ นางเอย
เจ้ากะเคยคึดนำอยู่แม่นบ่
ว่าฮักเฮาที่เกิดที่ก่อ กะย้อนว่าย้อนว่า

ย้อนบุญผลา เด้เนาะ พาเฮามาพบพ้อ
ฮู้สึกคือกัน อยู่เนาะ คือฮักที่รอที่ฝัน
ให้บุญผลา พาฮัก ให้ฮักเฮาคือเก่าทุกวัน
ได้หายใจอยู่ใกล้ๆ กัน จนฮอดมื้อตาย ได้ซ่ำนี้กะพอ",tao_pusin
ผู้สาวเก่า,/music/thailyric/18407,"เป็นจั่งได๋ สบายดีบ่นาง
จั่งแม่นงามตั้งแต่แฟนเขา
ดีใจนำเดอผู้สาวเก่า
ที่เขาดูแลอย่างดี

ยังคึดฮอดเป็นห่วงอยู่เด้อนาง
แม้ว่าอ้ายสิตายจากหน้าที่
ฮักจั่งได๋กะฮักจั่งซี่
ยังบ่มีวิธีสิลืม

ขึ้นซื่อว่าเป็นผู้สาวเก่า
บ่มีไผสิลืมได้ง่ายๆ
ฮักสิตายคิดฮอดสิตาย
กะอดเอา

แม่นว่าอ้ายสิเจ็บปานได๋
กะดีใจที่ยังเป็นเขา
ฮูเขาสิดูแลเจ้า ได้ดีกว่าอ้าย
ผู้ซายที่มีแต่ใจ

เป็นจั่งได๋ สบายดีบ่นาง
จั่งแม่นงามเหมาะสมกันกับเขา
ในฐานะอ้ายผู้บ่าวเก่า
อวยพรให้เจ้า โชคดีเด้อนาง",tao_pusin
ฝากเพลงถึงเธอ,/music/thailyric/11388,"อยู่แห่งไหน ขวัญใจเจ้าอย่าชัง
หากได้ฟัง หวังยังคงเมตตา
ตอบสัญญา รักมากับลม

ลมรักเอย จงล่องลอย
ลอยรักคืนมาร่วมทาง

ฝากนำคำร้อง
ผ่านลำคลองท้องธารกว้างไกล
อยู่คุ้งแควใด รู้เถิดหัวใจ
พี่ร้อนดั่งไฟเผาร่าง
เสกมนต์ขลัง ให้ฟังไม่จืดจาง
จากอารมณ์ระทมดังแก้วบาง
แหลกแล้วนาง ยามรักจางห่างใจ
แหลกแล้วนาง ยามรักจางห่างใจ

ลมช่วยกระซิบบอก
หฤทัย ใจฉันยังมั่นต่อใจ
แม้จนชีพมลาย
ขอตายแทบตักเธอ

ฝากเพลงลอยฟ้า
ข้ามภูผา ท้องนาป่าไพร
ได้รับยามใด ดลให้หัวใจ
อ่อนไหวด้วยไฟรักเพ้อ
เสกมนต์ขลังให้ฟังเมื่ออยากเจอ
อยากมาหาพี่ยาที่จากเธอ
ใฝ่ฝันละเมอ ขอเธอได้โปรดคืนมา
ใฝ่ฝันละเมอ ขอเธอได้โปรดคืนมา",tao_pusin
พบรักวันแห่เทียน,/music/thailyric/14550,"ล่ะตาสบตาประสานจ้อง
อ้ายยืนจึ้งแลมองเบิ่งทางน้องผู้น่าฮัก
เว้าจากใจคักๆ อ้ายหลงฮักแต่แรกพ้อ
แค่เห็นหน้ากะว่าหลง

หลายฮอยโค้งพันโค้ง บ่เคยจ่องใจสาวใด
บัดพ้อหน้าคนไค โอ๊ยหัวใจ เปลี่ยนลาย จ้อย

สองเราได้มาพบกัน เนื่องในงานแห่เทียนเมืองอุบล
ฉากรักสองเราเริ่มต้น เมื่อคนสองคน ส่งใจประสานใจ

ท่าทีเจ้าทำเขินอาย ถ้อยคำทักทายแค่ได้ฟังก็รู้
สำเนียงเสียงหวานผ่านหู อ้ายก็พอฮู้ว่าเจ้าเป็นสาวภูไท
มาเที่ยวงานบ้อหล่า ตาสบตาสื่อภาษาใจ
อ้ายจึงอาสาเป็นไกด์ พาเจ้าเที่ยวงานเที่ยวเมืองอุบล

ปานหลุดพ้น จากลมความเหงาพัดซูนใจไหวหวั่น
ปานหลุดพ้น จากลมความเหงาพัดซูนใจไหวหวั่น

ย่างเลาะงาน พาเบิ่งนั่นนี้ ของดีแท้แนะนำ
หัวยุ่มย้ามบัดยามเพิ่นพอใจ
ถามอันใดกะตอบไวปานหยัง
จังคำถามหลายแท้ บอกน้องแน
เมืองอุบลบ้านอ้ายมีหม่องใดขึ้นชื่อ
คือสำเนียงเสียงเว้าของเจ้าว่ามา

เลยขันอาสาพาเจ้าไปซุหม่อง เฮียงกันลองซอง เบิ่งแม่น้ำสองสี
สายใยแห่งรัก เริ่มขันเกลียวผูกมิตรไมตรี
หลอยสาบานแม่น้ำสองสี ให้เฮาได้เป็นคู่กัน.

ผาแต้มตำนาน หลักฐานประวัติศาสตร์
ภาพเขียนบอกเล่าชนชาติ คนรุ่นใหม่ได้กล่าวขาน
แก่งสะพือ ขึ้นชื่อมานาน หาดคูเดื่อคือกัน
นั่งกินอาหารพักผ่อนหย่อนใจ

สุขที่ได้ พาใจสองเฮามาเว้ากันหวานคัก
สุขที่ได้ พาใจสองเฮามาเว้ากันหวานคัก

จนสะมัก บาดยามตักกุ้งเต้น เห็นทางเจ้าเหนียมอาย
กว่าสิได้กินแต่ละคำ หน้างามๆ
บาดยามเขินอายคือเป็นตาฮักแท้
อยากพาแว ไปให้แม่เบิ่งหน้า
แล้วบอกแม่ว่า ว่าที่ใภ้แม่
กะได้แต่อดกลั้น ความคิดไว้หว่างใจ

ของฝากบ่หลาย แต่มอบจากใจฮู้บ่
เหมาร้านหมูยอ ของฝากขึ้นชื่อเมืองอุบล
นี้เด้อน้องหล่า แทนคำสัญญาของเฮาสองคน
เผื่อความฮักส่งผล ให้เฮาสองคนได้มาฮักกัน

จบงานลากันฝันค้าง
จบงานลากันฝันค้าง
ความหวังสิเข้าทางแนบ่
สาธุเด้อให้สายแนนจ่องจ้อ
ตอโค้งเข้าใส่กัน
ปีหน้าฮอดงานแห่เทียนให้มาพ้อ
อ้ายสิเฝ้ารอด้วยหัวใจมั่น
ผูกสองใจฮักกัน อย่ามายม้าง",tao_pusin
รักคุณยิ่งกว่าใคร,/music/thailyric/12610,"รักคุณ เสียยิ่งกว่าใคร
มอบกล่องดวงใจ เอาไว้ที่คุณ
หวงคุณ เอาเสียยกใหญ่
หึงจนหัวใจ ว้าวุ่น
ไม่อยากให้ใครใกล้คุณ
ไม่อยากให้คุณ ใกล้ใคร

แม้ใจคุณมีประตู
จะเข้าไปอยู่เฝ้าดูหัวใจ
ใส่ลูกบิดแล้วรีบปิดกลอน
แถมไม่เปิดต้อน รับใคร
อยากจะเป็นคนเดียวอยู่ใน
ห้องหัวใจของคุณ

รักคุณ เสียยิ่งกว่าใคร
ปิดตาคุณได้จะปิดตาคุณ
ไม่อยากให้คุณ เห็นใคร
ไม่อยากให้ใคร เห็นคุณ
ผมเฝ้าบนบานทำบุญ
เพราะกลัวว่าคุณ จะเปลี่ยนใจ

ปิดปากคุณได้ ก็จะปิดปาก
เดี๋ยวคุณรับฝาก ความรักจากใคร
ปิดจมูกไม่ให้ได้กลิ่น
ปิดหูไม่ให้ได้ยิน เสียงใคร
ถ้าปิดประตูห้องได้ดั่งใจ
จะอยู่ข้างในสองคนกับคุณ

โอ โฮ๊ะ โอ โฮ๊ะ โอ
โฮ๊ะ โอ โฮ๊ะ โอ โอ
โฮ๊ะ โอ โฮ๊ะ โอ โอ

รักแต่คุณ รักแต่คุณ
รักแต่คุณ รักคุณหมดใจ

รักคุณ เสียยิ่งกว่าใคร
ปิดตาคุณได้จะปิดตาคุณ
ไม่อยากให้คุณ เห็นใคร
ไม่อยากให้ใคร เห็นคุณ
ผมเฝ้าบนบานทำบุญ
เพราะกลัวว่าคุณ จะเปลี่ยนใจ

ปิดปากคุณได้ ก็จะปิดปาก
เดี๋ยวคุณรับฝาก ความรักจากใคร
ปิดจมูกไม่ให้ได้กลิ่น
ปิดหูไม่ให้ได้ยิน เสียงใคร
ถ้าปิดประตูห้องได้ดั่งใจ
จะอยู่ข้างในสองคนกับคุณ

รักคุณ เสียยิ่งกว่าใคร
รักคุณ เสียยิ่งกว่าใคร
รักคุณ เสียยิ่งกว่าใคร
รักคุณ เสียยิ่งกว่าใคร",tao_pusin
เฮาบ่อยากมีหมู่คือโต,/music/thailyric/14972,"กะฮู้อยู่ว่าเฮากับโตเป็นหมู่กัน
เฮาบ่ควรสิคึดแนวนั้นกับหมู่
อุกหลาย สิขาดใจบ่เป็นตาอยู่
คันบ่บอกให้ฮู้ย่านอยู่บ่ฮอดวันจันทร์

สิด่ากะด่า สิว่ากะว่า
เอาตามที่เห็นสมควรกะแล้วกัน
เฮาเก็บมาดน เฮาทนมานาน
ให้เฮาเว้าแนจักสองสามคำ

เฮาบ่อยากมีหมู่น่าฮักคือโตฮู้บ่
เฮาบ่อยากมีหมู่ที่ใจเฮาคึดพ้อหน่ำๆ
เฮาบ่อยากมีหมู่คือโต คนอิหยังแฮงเบิ่งแฮงงาม
สิเคียดให้เฮากะซาม เฮามาเป็นแฟนกันเถาะ

ถ่าดนไปกะย่านเขายาดไปต่อหน้า
ถ่าเวลากะย่านอกหักล่ะเนาะ
ฮักกัน ฮักแบบหมู่บ่เบื่อซั่นบ่
มันบ่อุ่นดอกเนาะกอดคอบ่คือกอดกัน

สิด่ากะด่า สิว่ากะว่า
เอาตามที่เห็นสมควรกะแล้วกัน
เฮาเก็บมาดน เฮาทนมานาน
ให้เฮาเว้าแนจักสองสามคำ

เฮาบ่อยากมีหมู่น่าฮักคือโตฮู้บ่
เฮาบ่อยากมีหมู่ที่ใจเฮาคึดพ้อหน่ำๆ
เฮาบ่อยากมีหมู่คือโต คนอิหยังแฮงเบิ่งแฮงงาม
สิเคียดให้เฮากะซาม เฮามาเป็นแฟนกันเถาะ

สิด่ากะด่า สิว่ากะว่า
เอาตามที่เห็นสมควรกะแล้วกัน
เฮาเก็บมาดน เฮาทนมานาน
ให้เฮาเว้าแนจักสองสามคำ

เฮาบ่อยากมีหมู่น่าฮักคือโตฮู้บ่
เฮาบ่อยากมีหมู่ที่ใจเฮาคึดพ้อหน่ำๆ
เฮาบ่อยากมีหมู่คือโต คนอิหยังแฮงเบิ่งแฮงงาม
สิเคียดให้เฮากะซาม เฮามาเป็นแฟนกันเถาะ

สิเคียดให้เฮากะซาม เฮามาเป็นแฟนกันเถาะ",tao_pusin
