song_name,href,lyric,artist
ไม่มีไม่ตาย,/music/thailyric/17411,"คนถ้ามันจะทิ้งกันไป
มันไม่พูดอะไรออกมาให้ได้ยิน
นี่แหละคนไม่รักเราจริงได้แล้วก็ทิ้ง
เราไปแค่นั้น
เบื่อที่ต้องมาเจออะไร
ร้องไห้ฟูมฟายแค่เขาไม่รักกัน
เจ็บจนใจจะขาดฉันเองมันพลาด
รักเธอหมดหัวใจ

หรือรักแท้มันต้องแลกด้วย Money
แต่คนอย่างเรามันไม่มีอะดิ
คนไม่มีใจจะให้ทำไงดี
แค่ปล่อยให้มันเป็นไป

ไม่มีไม่ตายก็ไม่เป็นไร
ไม่มีไม่ตายฉันยังสบาย
ยังดีกว่าอยู่กับคนหลายใจ
ยังดีนะที่ยังหายใจ
มองดูผู้คนที่อยู่รอบกาย
Strong my heart ดูแลหัวใจ
อยู่กับเพื่อนก็ไม่เห็นเป็นไร
ไม่มีเธอไม่ตายนี่นา

อยู่กับเพื่อน I'm single lady
อยู่อย่างนี้มันสบายใจดี
เปล่งออร่าความโสดกระจาย
เหวี่ยงความทุกข์ให้ไปไกล 10 ไมล์
เย่เย เย่เย เย่เย้เย่เย้
เย้เย เยเย้ เฮ้เฮ เฮ

ไม่มีก็ไม่ตาย
แต่เลิกกับเธอไปแล้วไอ้ตัวเรานี้ก็เกือบตาย
อยากจะมีแฟนไอ้ตัวเราก็เสือกควาย
มันยังลืมเธอไม่ลง ความทรงจำยังมั่นคง
หรือต้องทำแบบพี่โอมที่ต้องจุดแล้วก็วน
หนทางเราไม่มีทางแสงนำทางไม่มีส่อง
หวาดระแวงกันทุกทางเหมือนถุงยางไม่มีกล่อง
กดไลค์ทักเธออย่างไวให้หัวใจเป็นคนลุย
แชททุกคืนคุยทุกรอบแต่คำตอบเป็นคนคุย
คนคุยโพ่งดิ แหกขี้ตาอีกทีแม่งแชทหายโล่งอีก
กว่าจะตอบอีกทีสงสัยต้องมีตั๋วงาน
เหมือนต้องมีแผนตั้งดั่งที่เจ้าสัววาง
ที่หายไปนี่คือตายหรือว่าเธอโดนผัวตาม

หรือรักแท้มันต้องแลกด้วย Money
แต่คนอย่างเรามันไม่มีอะดิ
คนไม่มีใจจะให้ทำไงดี
แค่ปล่อยให้มันเป็นไป

ไม่มีไม่ตายก็ไม่เป็นไร
ไม่มีไม่ตายฉันยังสบาย
ยังดีกว่าอยู่กับคนหลายใจ
ยังดีนะที่ยังหายใจ
มองดูผู้คนที่อยู่รอบกาย
Strong my heart ดูแลหัวใจ
อยู่กับเพื่อนก็ไม่เห็นเป็นไร
ไม่มีเธอไม่ตายนี่นา

อย่าไปจมกับความเสียใจ
ใจของเรามันไม่ใช่ของใคร
รูปคู่เธอฉันจะไม่เก็บเอาไว้
จะไปช้อปปิ้ง จะเอาเงินไปใช้
เย่เย เย่เย เย่เย้เย่เย้
เย้เย เยเย้ เฮ้เฮ เฮ

ไม่มีไม่ตายก็ไม่เป็นไร
ไม่มีไม่ตายฉันยังสบาย
ยังดีกว่าอยู่กับคนหลายใจ
ยังดีนะที่ยังหายใจ
มองดูผู้คนที่อยู่รอบกาย
Strong my heart ดูแลหัวใจ
อยู่กับเพื่อนก็ไม่เห็นเป็นไร
ไม่มีเธอไม่ตาย

ไม่มีไม่ตายก็ไม่เป็นไร
ไม่มีไม่ตายฉันยังสบาย
ยังดีกว่าอยู่กับคนหลายใจ
ยังดีนะที่ยังหายใจ
มองดูผู้คนที่อยู่รอบกาย
Strong my heart ดูแลหัวใจ
อยู่กับเพื่อนก็ไม่เห็นเป็นไร
ไม่มีเธอไม่ตายนี่นา",wonderframe
ไม่อยากเป็นพี่น้อง (บีบี๋),/music/thailyric/17436,"ไม่อยากเป็นแล้วแค่พี่น้องจะได้ไหม
เปลี่ยนไปเป็นแฟนกันเลยจะได้ป้ะ
อย่ามาทำให้รักแล้วหาย ไม่เอานะ
เปลี่ยนคำว่าพี่กับหนูเป็นบี่บี๋ได้ป่าว

จะเรียกที่รัก จะเรียกบู๋บู๋
จะเรียกบีบี๋ จะเรียกเบบี้
เรียกไอตูดหมึก ไอเหม่ง
You make me crazy
จะบอกพ่อบอกแม่ว่าจะเอาคนนี้
บอกพี่ป้าน้าอาว่าจะเป็นแฟนคนนี้

ทำบุญแล้วได้บุญ ถ้ารักคุณจะได้อะไร
กวนตีนแล้วได้ตีน ที่กวนใจก็หวังจะได้ใจ
หน้าตาหนูซื่อ พี่มองหนูดื้อได้ไง
ถ้าสตอรี่พี่ว่างโพสต์รูปหนูบ้างก็ได้นะ
คิดถึงนะบอกได้มั้ย คิดถึงมั้ยบอกได้นะ
คนนี้แค่เพื่อนค่ะแม่ แต่อนาคตก็ไม่แน่
ลูกเขยแม่แน่นอน

ไม่อยากเป็นแล้วแค่พี่น้องจะได้ไหม
เปลี่ยนไปเป็นแฟนกันเลยจะได้ป้ะ
อย่ามาทำให้รักแล้วหาย ไม่เอานะ
เปลี่ยนคำว่าพี่กับหนูเป็นบี่บี๋ได้ป่าว

มีคำถามที่อยากจะถามเธอสักที
เป็นแฟนกันไหมถ้าเธอโอเคก็คงดี
อยากเรียกที่รัก Just wanna call you baby
เป็นแค่คนคุยที่ดันสถานะไม่มี

ทำบุญแล้วได้บุญ ถ้ารักคุณจะได้อะไร
กวนตีนแล้วได้ตีน ที่กวนใจก็หวังจะได้ใจ
หน้าตาหนูซื่อ พี่มองหนูดื้อได้ไง
ถ้าสตอรี่พี่ว่างโพสต์รูปหนูบ้างก็ได้นะ
คิดถึงนะบอกได้มั้ย คิดถึงมั้ยบอกได้นะ
คนนี้แค่เพื่อนค่ะแม่ แต่อนาคตก็ไม่แน่
ลูกเขยแม่แน่นอน

ไม่อยากเป็นแล้วแค่พี่น้องจะได้ไหม
เปลี่ยนไปเป็นแฟนกันเลยจะได้ป้ะ
อย่ามาทำให้รักแล้วหาย ไม่เอานะ
เปลี่ยนคำว่าพี่กับหนูเป็นบี่บี๋ได้ป่าว

ไม่อยากเป็นแล้วแค่พี่น้องจะได้ไหม
เปลี่ยนไปเป็นแฟนกันเลยจะได้ป้ะ
อย่ามาทำให้รักแล้วหาย ไม่เอานะ
เปลี่ยนคำว่าพี่กับหนูเป็นที่รักได้ป่าว",wonderframe
ร้องไห้ครั้งสุดท้าย,/music/thailyric/16876,"ยิ่งวันเวลาที่ผ่านอะไรมาด้วยกันมากมาย
ไม่กี่นาทีสิ่งที่เคยฝันก็แหลกสลาย
ไม่เคยจะคิด ว่าเชื่อใจคนที่ไม่เคยจริงใจ
ไม่เคยระแวงจะถูกเธอแทงที่กลางหัวใจ

เกือบจะลืมว่าวันที่ความรักดีอยู่วันนั้นมันนานเท่าไร
เกือบจะจำไม่ได้ว่าเธอคือคนนั้นที่บอกรักฉันมากมาย
เกือบจะลืมว่าคนที่ยังหายใจอยู่ตรงนี้คือตัวฉันไง
แต่วันพรุ่งนี้ จะไม่มีคนที่เคยงมงาย

ฉันจะร้องไห้ เป็นครั้งสุดท้าย
แค่อีกครั้งที่จะยอมให้น้ำตามันไหล
จะลบทุกรอยน้ำตา จะทิ้งทุกความเสียใจ
บอกใจตัวเองว่าพรุ่งนี้ ฉันจะใช้ชีวิตใหม่

ไม่เคยคิดว่าคนที่รักจะทำร้าย
ไม่เคยคิดว่าคนที่รักจะกลายเป็นร้าย
ไม่เคยคิดว่าคนๆ หนึ่งที่ทำให้ฉันยิ้ม
จะเป็นคนเดียวกันกับคนที่ทำให้ฉันวันนี้ต้องร้องไห้

แม้ความเจ็บที่มากเกินจะเยียวยา
แม้วันที่ผ่านฉันคงไม่อาจย้อนเวลา
แต่ฉันจะเอาชีวิตของฉันคืนกลับมา
และนี่จะเป็นอีกครั้งสุดท้าย ที่คนๆ นี้จะเสียน้ำตา

ฉันจะร้องไห้ เป็นครั้งสุดท้าย
แค่อีกครั้งที่จะยอมให้น้ำตามันไหล
จะลบทุกรอยน้ำตา จะทิ้งทุกความเสียใจ
บอกใจตัวเองว่าพรุ่งนี้ ฉันจะใช้ชีวิตใหม่

เกือบจะลืมว่าวันที่ความรักดีอยู่วันนั้นมันนานเท่าไร
เกือบจะจำไม่ได้ว่าเธอคือคนนั้นที่บอกรักฉันมากมาย
เกือบจะลืมว่าคนที่ยังหายใจอยู่ตรงนี้คือตัวฉันไง
แต่วันพรุ่งนี้ จะไม่มีคนที่เคยงมงาย

ฉันจะร้องไห้ เป็นครั้งสุดท้าย
แค่อีกครั้งที่จะยอมให้น้ำตามันไหล
จะลบทุกรอยน้ำตา จะทิ้งทุกความเสียใจ
บอกใจตัวเองว่าพรุ่งนี้ ฉันจะใช้ชีวิตใหม่

บอกใจตัวเองว่าพรุ่งนี้ ฉันจะใช้ชีวิตใหม่",wonderframe
แล้วหลาว (ไอ้โบ้),/music/thailyric/21507,"ตอนนั้นน่ะเคยมีเธอแต่ตอนนี้เลิกกันแล้วหลาว
ตอนนี้ยังไม่มีใครอยู่คนแล้วมันก็หนาว
พอยามที่เธอนั้นเหงาเธอมาคืนดีกับฉันแล้วหลาว
เธอนึกจะไปก็ไปทิ้งฉันไว้เหมือนไอ้โบ้แล้วหลาว

เราเป็นไอ้โบ๋ เป็นไอ้โบ้ ไอ้โบ้ ไอ้โบ้
ก็เรามันโง่ โอ๊ยปั๊ดโถ่ว โอ้วโนว โอ้โนว
เราไม่อยากจะเป็นแล้วไอ้โบ้ เพราะไม่อยากดูโง่
เราเป็นทุกวันจนแทบได้โล่ เอามาประดับเสร็จแล้วล่ามโซ่

ถึงเราจะเป็นไอ้โบ้แต่ว่าเราก็โก้
ไม่พูดเยอะขอโทษ ก็เรามันโบ๋ปั๊ดโถ่ว
ที่แปลโง่ไงเล่า คอยเธอแบบไอ้โบ้
นั่งรออย่างโง่ๆ อย่าน่าเศร้า

พี่บ่าวเห้ออย่ามาทำตัวใส่หนุ่ยพรรค์นี้
อย่าทำเป็นว่าไม่สนใจแล้วก็ทำไม่โร้ไม่ชี้

เปรียบหนุ่ยเป็นสายชาร์จแบต
แล้วพี่บ่าวเป็นโทรศัพท์
พอพี่ชาร์จแบตจากหนุ่ยเสร็จ
เดี๋ยวพี่ก็ไปแล้วล่ะ
ปล่อยให้หนุ่ยคอยพี่นั้นล้อบมาหา
เหมือนหมาหน้าเซเว่นรอคอยลมแอร์หนาวๆ

ก็พี่ชอบหลอกฟันๆ ด้วยดาบคาตานะ
ฟัน ฉับ ฉับ ฉับ ด้วยซามูไรใครจะสู้พี่ว่ะ
ตัวหนุ่ยไม่มีอะไรหนุ่ยมีแต่ความรัก
แตก 1 แตก 2 พี่เอาไปเลย หนุ่ยให้พี่นั้นชนะเลย
เอาไปเลยพี่บ่าวคือ Number one

ตอนนั้นน่ะเคยมีเธอแต่ตอนนี้เลิกกันแล้วหลาว
ตอนนี้ยังไม่มีใครอยู่คนแล้วมันก็หนาว
พอยามที่เธอนั้นเหงาเธอมาคืนดีกับฉันแล้วหลาว
เธอนึกจะไปก็ไปทิ้งฉันไว้เหมือนไอ้โบ้แล้วหลาว

เราเป็นไอ้โบ๋ เป็นไอ้โบ้ ไอ้โบ้ ไอ้โบ้
ก็เรามันโง่ โอ๊ยปั๊ดโถ่ว โอ้วโนว โอ้โนว
เราไม่อยากจะเป็นแล้วไอ้โบ้ เพราะไม่อยากดูโง่
เราเป็นทุกวันจนแทบได้โล่ เอามาประดับเสร็จแล้วล่ามโซ่

โอ๋ๆ ไม่เอาร้องสิจ๊ะ
พี่บ่าวไม่ได้หายไปไหนแค่ไปเล่นเกม FreeFire มา
พี่หายไปแป๊บเดียวกำลังจะตายกำลังพันยา
พี่บ่าวไม่ได้มีใครเลยมีเพียงสาวหนุ่ยเป็นภรรยา

ได้โปรดหนุ่ยอย่าทำหน้าบูด หนุ่ยอย่าทำเหมือนตูด
และคล้ายๆ ไอ้ตูบ เป็นซ้ำๆวนลูปเลย
พี่มีหนุ่ยแค่ 1 คน ไม่ได้มีใครเลย
และไม่คิดนอกใจเลย ขอร้องว่าหนุ่ยอย่าคิดไปไกลเลย

พี่บ่าวต้องขอโทษที ที่พี่ไม่เคยให้ความสำคัญกับน้อง
พี่บ่าวต้องขอโทษอีกทีนะ หนุ่ยก็ไม่จำเป็นต้องร้อง

โอ๊ยได้ไหมจ๊ะคนดี ถ้าหนุ่ยให้อภัยฮั่นน่ะคงดี
พี่มาร้องเพลงผ่านเสียงดนตรี มันอีได้ไหม ได้ไหมคนดี

ถ้ามันไม่ได้เดี๋ยวพี่พาไปกินชาไข่มุก
แล้วถ้ามันยังไม่แน่นเดี๋ยวพี่พาไปกินชาบู

ตอนนั้นน่ะเคยมีเธอแต่ตอนนี้เลิกกันแล้วหลาว
ตอนนี้ยังไม่มีใครอยู่คนแล้วมันก็หนาว
พอยามที่เธอนั้นเหงาเธอมาคืนดีกับฉันแล้วหลาว
เธอนึกจะไปก็ไปทิ้งฉันไว้เหมือนไอ้โบ้แล้วหลาว

เราเป็นไอ้โบ๋ เป็นไอ้โบ้ ไอ้โบ้ ไอ้โบ้
ก็เรามันโง่ โอ๊ยปั๊ดโถ่ว โอ้วโนว โอ้โนว
เราไม่อยากจะเป็นแล้วไอ้โบ้ เพราะไม่อยากดูโง่
เราเป็นทุกวันจนแทบได้โล่ เอามาประดับเสร็จแล้วล่ามโซ่",wonderframe
วงวาร (Loop),/music/thailyric/22515,"แกแม่งโคตรจะใจร้าย
แกเห็นเราเป็นของเล่น
แกรักใครไม่เป็น
หรือแกแค่ไม่ได้รักกันแกแม่งโคตรให้ความหวัง
รักแกไปใจก็พัง

เลิกโง่ได้แล้วมั้ง
มีคนใจร้าย รีบหนีไป

ล้ะจะไม่พยายามมันอีกต่อไป
ไม่ไหวแล้วนะครั้งนี้จะไม่ทน

จบก็คือจบ
พอก็คือพอ
ไม่เห็นต้องนั่งรอ
จะต้องง้อไปทำไม

แต่ทักมาก็ตอบ
ถ้าโทรมาก็ยังรับ
ให้ไปหาฉันก็ไปนะ
จะรีบคลานไปอย่างไว

เฮ้อ วงวาร

ทีกับเค้าคนนั้นทำไมแกถึงดูใส่ใจจัง
ทีกับเค้าทำไมแกดูรักเค้าจัง
แล้วดูแกทำกับเรา กับเรา กับเรา กับเรา
ละเลยตลอด ทิ้งกันตลอดแค่การกระทำ
มันก็ชัดเจนอยู่แล้วว่าเขาไม่รัก

จริงๆ แล้วเขาไม่ได้ใจร้ายแต่เขาไม่เคยรัก

ก็คงต้องจบ ต้องพอ ไม่รอ ไม่ง้อ
ปากดีไปงั้นแหละ ขาดแกไม่ได้หรอก
ล้ะจะไม่พยายามมันอีกต่อไป
ไม่ไหวแล้วนะครั้งนี้จะไม่ทน

จบก็คือจบ
พอก็คือพอ

ไม่เห็นต้องนั่งรอ
จะต้องง้อไปทำไม
แต่ทักมาก็ตอบ
ถ้าโทรมาก็ยังรับ

ให้ไปหาฉันก็ไปนะ
จะรีบคลานไปอย่างไวจบก็คือจบ (ช่วยไปไกลๆ)
พอก็คือพอ (ไม่ต้องมาให้เห็นอีกต่อไป)
ไม่เห็นต้องนั่งรอ
จะต้องง้อไปทำไม (ฉันไม่สนใจ)

แต่ทักมาก็ตอบ (ไม่ถึงวินาที)
ถ้าโทรมาก็ยังรับ (โคตรอยากได้ยินเสียงแกเลยว่ะ)
ให้ไปหาฉันก็ไปนะ
จะรีบคลานไปอย่างไว (เหมียนหมา)
วงวาร",wonderframe
