song_name,href,lyric,artist
ซ่อนรูป,/music/thailyric/20217,"กินทุกอย่างที่อยู่ในเรดาร์
กินได้หมดอะไรที่ขวางหน้า
นั่งกินมันไม่เท่มันยังดูธรรมดา
ระดับนี้ต้องนอนกินบอกเลยไม่ธรรมดา

ไม่ต้องแปลกใจทำไมฉันถึงอ้วน (แล้วไง)
เดินผ่านผู้ชายเขาเรียกไอ้ต้าวอ้วน (หื้ม)
น้องมิชเชอลีนจนนับชั้นไม่ถ้วน
จากนาฬิกาทรายกลายเป็นนาฬิกาปลุก

Yeah จะเปลี่ยนนี่ต้องทำยังไง
มันต้องทำยังไง มันต้องทำยังไง
ใครพอบอกวิธีได้ไหม
มันต้องทำยังไง มันต้องทำยังไง

เราเป็นคนซ่อนรูป ซ่อนรูปอ้วน แล้วก็ลงรูปผอม (จกตาอะเปล่า)
ถ้าผอมขึ้นมาเมื่อไร คอยดูเหมยตูอย่ามาง้อ (อย่ามาง้อนะ)
แต่ว่าเห็นอะไรไม่ได้ ตอนนี้ท้องมันเริ่มจะร้อง (โอ๊ย)
ทุกวันนี้แทบแยกยัง ไม่รู้ว่าอ้วนหรือว่าท้อง (ท้องพ่อมึง)

ดูเซ่ ดูเซ่ โยโยโย่ เมื่อก่อนไซส์เล็ก แต่ตอนนี้ พุงออก (แล้วไง)
ดูเซ่ ดูเซ่ โยโยโย่ น้องหนาตัวจริง King size เลยขอบอก (โนสนโนแคร์จ้า)
ดูเซ่ ดูเซ่ เดี๋ยวก็โยโย่ ลงเร็วขึ้นเร็ว ใครๆ ก็ดูออก
ดูเซ่ ดูเซ่ โยโยโย่ ไม่มีคนข้างเคียงมีแต่เหนียงข้างคอ

ฉันอ้วนก็ไม่แปลก เพราะฉันแหลกไม่ได้ดม
มันหนักไปทุกส่วนโดยเฉพาะบนหัวคน
ใครหน้าไหนมาว่าก็จะไม่ทน
ไหนมีตัวช่วยอะไรตอนนี้พร้อมจะพุ่งชน

ชาบู ชานม หรือว่าชาเม่
Sye S สูตรใหม่พร้อมจะเปย์
ส่วนเกินจะลดลงแบบไม่เกเร
มั่นใจ สวยเชียว ผู้เห็นแล้วเดินเซ

พลัสไปให้สุด สุดจริงๆ แบบว่าโคตรเรียล
พลัสไปให้สุด ตัวจริงๆ แบบว่าสวยเชียว
พลัสไปให้สุด เรียลจริงๆ แบบไม่ปีนเกรียว
พลัสไปให้สุด พลัสไม่หยุดวันละซองเดียว

ตัวจริง ไม่ต้องพูดเยอะ
จริงใจ ไม่พูดเลอะเทอะ
สุดจริง ไม่เชื่อก็ลองเถอะ
เรียลจริง จะไม่พูดเยอะ

เราไม่ต้องซ่อนรูป ไม่ต้องใช้แอปบีบเอวจนผอม (อุ้ย)
ถ้าถามเรื่องความมั่นใจ บอกเลยตอนนี้มีเกินร้อย (อ่าห๊ะ)
ส่องกระจกดูตัวเองทุกเช้า เพิ่มความมั่นใจทีละน้อย (มั่นเวอร์)
สวยเป๊ะดูดีกว่าใคร ใครๆ ก็รู้ตั้งแต่ปากซอย (สวยเว้ย)

ดูเซ่ ชาเม่ No yo yo ตัวจริงเรียลจริงแบบว่าโคตรจะ S
ดูเซ่ ชาเม่ No yo yo ตัวจริงเรียลจริงแบบว่าโคตรจะเด็ด
ดูเซ่ ชาเม่ No yo yo แซ่บพริก 10 เม็ดใครก็บอกหนูเผ็ด
ดูเซ่ ชาเม่ No yo yo ไม่มีผลข้างเคียง ไม่มีเหนียงข้างคอ

ดูเซ่ ชาเม่ No yo yo ตัวจริงเรียลจริงแบบว่าโคตรจะ S
ดูเซ่ ชาเม่ No yo yo ตัวจริงเรียลจริงแบบว่าโคตรจะเด็ด
ดูเซ่ ชาเม่ No yo yo แซ่บพริก 10 เม็ดใครก็บอกหนูเผ็ด
ดูเซ่ ชาเม่ No yo yo ไม่มีผลข้างเคียง ไม่มีเหนียงข้างคอ

สวยเชี่ย",wonderframe
ตู้เย็น,/music/thailyric/22385,"แม่เคยบอกถ้าอะไรจะเสียให้แช่ตู้เย็น
เนื้อ นม ขนม จะมีอายุนานกว่าที่เป็น
ยืดเวลาไว้ แค่เอาของใส่ตู้เย็น
จะเหมือนกันไหม

จะเอาความรักไปแช่ตู้เย็น
ยืดวันหมดอายุให้นานกว่าที่เป็น
ให้เธออยู่กับฉันอีกสักแป๊บนึง
พยายามจะดึงเวลาก่อนเธอต้องไป

แม่เคยบอกถ้าอะไรจะเสียให้แช่ตู้เย็น
เนื้อ นม ขนม จะมีอายุนานกว่าที่เป็น
ยืดเวลาไว้ แค่เอาของใส่ตู้เย็น
จะเหมือนกันไหม ถ้าเอาความรักไปแช่เย็น

หัวใจสลายเมื่อเธอพูดว่าไม่รักกัน
มันคงจะสายแต่ว่าฉันเตรียมใจไม่ทัน
รักเธอหล่นหายแต่เป็นฉันที่ต้องรับมัน
ถ้างั้น

จะเอาความรักไปแช่ตู้เย็น
ยืดวันหมดอายุให้นานกว่าที่เป็น
ให้เธออยู่กับฉันอีกสักแป๊บนึง
พยายามจะดึงเวลาก่อนเธอต้องไป

รู้ว่าไม่มีหวังแต่จะขอลองสักครั้ง
อะไรที่พลาดพลั้งฉันก็พร้อมจะแก้ให้เธอ
ได้ทุกอย่างเสมอขอแค่เธออยู่

แม้จะไม่มีหวังแต่อยากขอลองอีกครั้ง
ฉันจะดึงจะรั้งโปรดเถอะเธออย่าทิ้งฉันไป
ฉันจะอยู่ยังไงกับชีวิตที่ไม่มีเธอ

(ถ้าเธอไปแล้วเราจะอยู่ยังไงอะ ไม่ไปได้ไหมอะ)

เธอเหมือนอาหาร เป็นที่ต้องการของหัวใจ
ฉันจะเก็บเธอไว้ในตู้เย็น We'll be fine
ถ้าไม่มีเธอสักวันนึงฉันคงต้องตาย
Don't say goodbye don't make me cry

แล้วในวันนี้วันที่รักเราสลายไป
วันที่ทะเลาะเราทำร้ายทิ่มแทงหัวใจ
ไล่ตามจุดหมายแต่สุดท้ายไม่มีเส้นชัย
ถ้างั้น (ไม่ไปได้ไหมอะ)

จะเอาความรักไปแช่ตู้เย็น
ยืดวันหมดอายุให้นานกว่าที่เป็น
ให้เธออยู่กับฉันอีกสักแป๊บนึง
พยายามจะดึงเวลาก่อนเธอต้องไป

รู้ว่าไม่มีหวังแต่จะขอลองสักครั้ง
อะไรที่พลาดพลั้งฉันก็พร้อมจะแก้ให้เธอ
ได้ทุกอย่างเสมอขอแค่เธออยู่

แม้จะไม่มีหวังแต่อยากขอลองอีกครั้ง
ฉันจะดึงจะรั้งโปรดเถอะเธออย่าทิ้งฉันไป
ฉันจะอยู่ยังไงกับชีวิตที่ไม่มีเธอ",wonderframe
ทั้งเด็ดทั้งโดน (Alone),/music/thailyric/15155,"ทั้งเด็ดทั้งโดนนี่ยัง Alone ได้ไง
อาจไม่เข้าตา แต่ว่าจัดจ้านถึงใจ

ทั้งเด็ดทั้งโดนแต่ยัง Alone ทั้งๆ ที่พร้อมโอน
ติดได้แค่ตัวแต่ไม่ติดใจ ติดที่ Friendzone
ก็ไม่รู้ทำไงมันเป็นที่ฮอร์โมน
ที่มันพุ่งพรวดพราดไวกว่าไอโฟน

รู้ดี ว่ามีแค่ตัวกับใจที่ฉันมี
อยากให้เธอได้ลองดูสักที
แล้วเธอค่อยตัดสินว่าฉันดีไม่ดี

ทั้งเด็ดทั้งโดนนี่ยัง Alone ได้ไง
อาจไม่เข้าตา แต่ว่าจัดจ้านถึงใจ
ทั้งเด็ดทั้งโดนนี่ยัง Alone ได้ไง
อย่าดูนอกกายต้องเข้ามาดูข้างใน

ทั้งเด็ดทั้งโดนยังโสดด้วยนะแต่ไม่เห็นมีใคร
ที่เข้ามาทัก ที่เข้ามาคุย มาจีบแล้วแบบว่าโดนใจ
ลงทุนนิดหนึ่งกล้าๆ หน่อยถ้าอยากจะเล่นกับไฟ
ระวังจะโดนเผากลายเป็นควันเหมือนสมุนไพร

ฉันน่ารักและไม่ขี้บ่น
ฉันใสๆ และไม่หมองหม่น
ชอบไหมคะ ไม่ต้องวกวน
พูดตรงๆ ได้เลย

รู้ดี ว่ามีแค่ตัวกับใจที่ฉันมี
อยากให้เธอได้ลองดูสักที
แล้วเธอค่อยตัดสินว่าฉันดีไม่ดี

ทั้งเด็ดทั้งโดนนี่ยัง Alone ได้ไง
อาจไม่เข้าตา แต่ว่าจัดจ้านถึงใจ
ทั้งเด็ดทั้งโดนนี่ยัง Alone ได้ไง
อย่าดูนอกกายต้องเข้ามาดูข้างใน

ทั้งเด็ดทั้งโดน แต่ยัง Alone
ทั้งเด็ด ทั้งโดน ทั้งเด็ด ทั้งโดน
ทั้งเด็ด ทั้งโดน ทั้งเด็ด ทั้งโดน

รู้ดี ว่ามีแค่ตัวกับใจที่ฉันมี
อยากให้เธอได้ลองดูสักที
แล้วเธอค่อยตัดสินว่าฉันดีไม่ดี

ทั้งเด็ดทั้งโดนนี่ยัง Alone ได้ไง
อาจไม่เข้าตา แต่ว่าจัดจ้านถึงใจ
ทั้งเด็ดทั้งโดนนี่ยัง Alone ได้ไง
อย่าดูนอกกายต้องเข้ามาดูข้างใน ดูสักที",wonderframe
ป๊อด,/music/thailyric/14930,"หลงรักคนเจ้าชู้
ยิ่งมองยิ่งดูกี่ทีก็ยิ่งอยากที่จะรู้จัก
แอบมองมาสักพัก
ก็รู้ว่ามันไม่ง่าย ที่จะเดินเข้าไปทักทาย
แอบส่องกระจกอีกที ในตอนท้าย
ดูความเรียบร้อย ดูหน้าดูตาให้ไม่ต้องอาย
แต่พอเดินมา เจอเธอสบตาฉันแทบละลาย
แบบนี้มันคงไม่ง่าย เอาไว้ก่อน
เอาไว้ค่อยคุยวันหลังละกัน

อย่าเอาแต่มอง กลัวเธอไม่สนกัน
ก็ลุคแบดๆ แบบผมคงไม่เหมาะสม
บวกกับไอ้พฤติกรรมที่ผมทำ
ก็เหมือนกาแฟคู่กับขนมปัง
ที่หวานไม่เข้ากับขม
แต่มันลงตัวถ้าเกิดว่าเอามาผสมกัน

คุณมาคนเดียวหรือมากับใคร
นัดแฟนเอาไว้หรือเพื่อนคนไหน
ถ้าหาว่าคุณไม่ว่าอะไร
ที่นั่งข้างๆ ยังว่างใช่ไหม

โทษครับรบกวนไหม พอดีอยากขอไลน์ไว้
แต่กลัวเธอจะหายไป

อาการแบบนี้เขาเรียกกันว่าอะไร
หายใจไม่ค่อยสะดวก
เหงื่อออก หน้าแดง เหมือนโดนยิงแบบแรงๆ

แบบนี้เขาเรียกว่าป๊อดว่ะ
(เขาเรียกอะไรนะ)
อ๋อ เขาเรียกว่าป๊อดว่ะ
อาการป๊อดมันเหมือนกับโดนไฟช็อต
ต่อให้กินเหล้าเข้าไปทั้งล็อต
ก็ยังต้องพันด้วยผ้าก็อต

เหมือนหยุดหายใจเฉียบพลัน
เลือดพุ่งด้วยความดัน
แต่ต้นตอทั้งหมด มันเกิดจากอาการพัง

หลงรักคนเจ้าชู้
ยิ่งมองยิ่งดูกี่ทีก็ยิ่งอยากที่จะรู้จัก
แอบมองมาสักพัก
ก็รู้ว่ามันไม่ง่าย ที่จะเดินเข้าไปทักทาย
แอบส่องกระจกอีกที ในตอนท้าย
ดูความเรียบร้อย ดูหน้าดูตาให้ไม่ต้องอาย
แต่พอเดินมา เจอเธอสบตาฉันแทบละลาย
แบบนี้มันคงไม่ง่าย เอาไว้ก่อน
เอาไว้ค่อยคุยวันหลังละกัน

จริงใจกับคุณจริงใจจริงๆ ผมไม่ได้หลอกนะ
ขนาดเขาบอกเจ้าชู้ แต่ใครจะรู้ว่านกตลอดนะ
ไม่ได้มาแค่หยอด ผมอยู่ในศีลไม่ใช่แค่วันพระ
ถ้าเกิดเราได้คบกันจริง จะกระซิบบอกรักยูทุกวันนะ

กลัวเธอจะเหงาเข้าไปคุยด้วยได้ไหม
ให้ตรงนี้มีแค่เราไม่ต้องไปสนใจใคร
ถ้าหากเธอเหงาขอแค่กอดผมเอาไว้
เทกแคร์เธอยันเช้า แล้วเธอจะโอเคไหม

ตกหลุมรักคนเจ้าชู้
ยิ่งมองยิ่งดูกี่ทีก็ยิ่งอยากที่จะรู้จัก
แอบมองมาสักพัก
ก็รู้ว่ามันไม่ง่าย ที่จะเดินเข้าไปทักทาย
แอบส่องกระจกอีกที ในตอนท้าย
ดูความเรียบร้อย ดูหน้าดูตาให้ไม่ต้องอาย
แต่พอเดินมา เจอเธอสบตาฉันแทบละลาย
แบบนี้มันคงไม่ง่าย เอาไว้ก่อน
เอาไว้ค่อยคุย
เอาไว้ค่อยคุยวันหลังละกัน

แบบนี้เขาเรียกว่าป๊อดว่ะ
ก็คงต้องยอมว่าป๊อด",wonderframe
เปงเคียด,/music/thailyric/17739,"ถ้าพี่ไม่มีใครให้หนูไปดูแลได้นะ
ถึงพี่จะไม่จริงใจก็ลองมาหลอกหนูดูได้นะ
หนูน่ะโง่จะตายพี่ลองมาชิมดูได้นะ
รับรองว่าพี่ติดใจรับรองได้เลยนะคะ

เปงเคียดแล้วก็เปงท้อ
เป็นอะไรก็ได้ที่ไม่ใช่เป็นพี่น้อง
แอบแซ่บจ้า แต่พี่ไม่รู้
แอบคุยมันเชยไปพอแล้วไอ้เรื่องเจ้าชู้

ก็หนูไม่มีใคร แต่อยากได้ใจพี่มาครอง
แม้ใครคิดแย่งไป ถ้าใจกล้าก็มาลอง
แม้แต่สายตาของสาวใด ก็อย่ามายุ่งคนนี้จอง
ลีลาไม่เท่าไร แต่ไม่แพ้ใครเลยขอบอก

ลีลานี่ที่หนูว่านี่ก็คือการเต้น
อย่าคิดไปไกลดิ เพราะหนูไม่ใช่ของเล่น
แต่น้องรักพี่หมดใจอันนี้น่ะไม่พูดเล่น
ขอแค่เป็นผู้ชาย ทรงนี้ก็พอ

จะทรงเอ ทรงโจร หรือเอเยนต์
หนูน่ะรับได้หมดขอแค่รักจริงไม่พูดแกล้ง
แต่ถ้าคิดว่าดูก่อนก็มาคุยเล่นๆ
ถ้าคิดจะหลอกฟัน ระวังจะเจอหน้าแข้ง

โอ๊ย เมื่อไรจะมีแฟนสักที
ก็โสดมาก็นานแล้วกะอยากมีหลัวสักที
หรือต้องโสดขึ้นคาน ไปอีกร้อยๆ ปี
อยากมีโมเมนต์แบบเดินควงแขนสักที

ถ้าพี่ไม่มีใครให้หนูไปดูแลได้นะ
ถึงพี่จะไม่จริงใจก็ลองมาหลอกหนูดูได้นะ
หนูน่ะโง่จะตายพี่ลองมาชิมดูได้นะ
รับรองว่าพี่ติดใจรับรองได้เลยนะคะ

หมูติดมัน หมูติดมัน ถ้าพี่เคี้ยวหนูระวังหนูจะติดฟัน
Baby boy I love you หนูอยากบอกว่ารักจัง
แต่ถ้าพี่ไม่รักหนู ได้โปรดเถอะมารักกัน
ไหวป่ะ ไหวป่ะ หนูน่ะดื้อหน่อยแล้วพี่จะไหวป่ะ
เข้ามา เข้ามา อันนี้น่ะไม่ได้อ่อยถ้าอยากอร่อยก็เข้ามา

อยากได้ความรักที่ดีต้องมาเอาจากนุ้ย
อยากได้ความจริงใจน่าว่ายางแค่นุ้ย
อยากได้คนซักผ้าน่าว่ายางแค่นุ้ย
นุ้ยหั้นทำได้เเม๊ดนิแต่พี่อย่าเจ้าชู้

เปงเคียดแล้วก็เปงท้อ
เป็นไอไหร๊กะด้ายเท่ม้ายช่ายเป็นเพ่น้อง
แอบแซ่บจ้า แต่พี่ม้ายโร้
แอบคุยมันเชยไปพอแล้วไอ้เรื่องจ้าวชู้

ถ้าพี่ไม่มีใครให้นุ้ยไปดูแลได้นะ
ถึงพี่อีม้ายจริงใจ กะลองมาล้อกนุ้ยได้นั้น
นุ้ยหั่นโบ๋อีตาย พี่ลองมาชิมแลได้นะ
รับรองพี่บ่าวต้องติดใจรับรองได้เลยนะคะ

ถ้าพี่ไม่มีใครให้หนูไปดูแลได้นะ
ถึงพี่จะไม่จริงใจก็ลองมาหลอกหนูดูได้นะ
หนูน่ะโง่จะตายพี่ลองมาชิมดูได้นะ
รับรองว่าพี่ติดใจรับรองได้เลยนะคะ

คนเจ้าชู้ดูแล้วคงไม่เจริญ
อยากให้พี่มีแค่หนู หนู หนู นะคงเจริญ
คนเจ้าชู้ดูแล้วคงไม่เจริญ

อยากให้พี่มีแค่หนู หนู หนู นะคงเจริญ
OK OK อยากให้พี่ตัดสินใจอย่ามัวแต่ลังเลนะ
Ye ye ye ye ถ้าพี่มีแค่หนู
รับรองว่าจะไม่โดนเทแน่นอน",wonderframe
