song_name,href,lyric,artist
อย่าปล่อยมือฉันได้ไหม,/music/thailyric/13053,"คนที่ไร้หนทาง ชีวิตมืดมนทุกอย่าง
กับคำว่ารัก จะไปหวังอะไร ก็ใครจะมาใส่ใจ
แค่คนที่ไร้ตัวตน ถนนให้เริ่มต้นใหม่
ก็มองไม่เห็นทาง ที่ฉันจะก้าวไป
ไม่เหลืออะไรจริงๆ ดั่งคนหมดหวัง
ท่ามกลางทะเลมืดมิดไม่มีแสงไฟ
เกือบทิ้งทุกลมหายใจ
แต่สุดท้าย ก็มีเธอเข้ามา

ได้โปรดอย่าปล่อยมือฉัน
ได้ไหม ยืนยันให้มั่นใจ
จะอยู่ตรงนี้ใช่ไหม อย่าจากฉันไป
คนที่มองเห็นค่าความเป็นคนข้างใน
ก็เธอผู้เป็นดังแสงไฟ
ที่ทำให้ยังหายใจไปได้อีกวัน

คนที่เขาดีพอ ที่ควรคู่เธอทุกอย่าง
เธอยังไม่สนกลับมาเห็นใจเคียงข้าง
มาร่วมทางกับฉัน เกือบจะหมดหวัง
ท่ามกลางทะเลมืดมิดไม่มีแสงไฟ
เกือบทิ้งทุกลมหายใจ
แต่สุดท้าย ก็มีเธอเข้ามา

ได้โปรดอย่าปล่อยมือฉัน
ได้ไหม ยืนยันให้มั่นใจ
จะอยู่ตรงนี้ใช่ไหม อย่าจากฉันไป
คนที่มองเห็นค่าความเป็นคนข้างใน
ก็เธอผู้เป็นดังแสงไฟ
ที่ทำให้ยังหายใจไปได้อีกวัน

เกือบจะหมดหวัง
ท่ามกลางทะเลมืดมิดไม่มีผู้ใด
จากนี้ทุกลมหายใจ
อยากจะใช้ เดินไปพร้อมเธอ

ได้โปรดอย่าปล่อยมือฉัน
ได้ไหม ยืนยันให้มั่นใจ
จะอยู่ตรงนี้ใช่ไหม อย่าจากฉันไป
คนที่มองเห็นค่าความเป็นคนข้างใน
เธอผู้เป็นดังแสงไฟ
ที่ทำให้ยังหายใจไปได้อีกวัน

และเธอผู้เป็นดังแสงไฟ
ที่ทำให้ฉันหายใจไปได้อีกวัน",dax_rockrider
