song_name,href,lyric,artist
นะนะ,/music/thailyric/5110,"หายห่างไปเป็นไงบ้างจ๊ะ ข่าวคราวส่งมาด้วยนะ
อย่าทำเป็นลืมนะจ๊ะ ห้ามเที่ยวเพลินนะ
เรื่องกินระวังด้วยนะ หยูกยาอย่าลืมนะจ๊ะ
ก่อนนอนสวดมนต์ด้วยนะ ขอพระคุ้มครอง

ขอฝากดาวดูแลด้วยนะ ฝากเดือนช่วยเตือนด้วยนะ
อย่าลืมคนรอนะจ๊ะ รีบกลับมา
ฝนตกพร่ำยิ่งทำให้เหงา หลับตาก็มีแต่เขา
เมื่อไหร่เมื่อไหร่จะเช้า เหงาจังเหงาใจ

เขาคงหลับไปแล้วป่านนี้ ขอให้ฝันดีคืนนี้อย่าเหงา
เขาคงหลับไปแล้วป่านนี้ ขอให้ฝันดีอย่าเหมือนเช่นเรา

จะมีใครรำคาญก็แล้วแต่ ที่มาคอยตอแยก็เพราะห่วง
ทำอะไรต้องห่วงตัวเองด้วยนะ สัญญานะ
ไม่ต้องคอยกังวลเรื่องของฝาก ไม่ต้องคอยลำบากไม่ต้องห่วง
แค่ดูแลแค่ห่วงตัวเองเท่านั้น สัญญานะ

จะมีใครรำคาญก็แล้วแต่ ที่มาคอยตอแยก็เพราะห่วง
ทำอะไรต้องห่วงตัวเองด้วยนะ สัญญานะ
ไม่ต้องคอยกังวลเรื่องของฝาก ไม่ต้องคอยลำบากไม่ต้องห่วง
แค่ดูแลแค่ห่วงตัวเองเท่านั้น สัญญานะ

เขาคงหลับไปแล้วป่านนี้ ขอให้ฝันดีคืนนี้อย่าเหงา
เขาคงหลับไปแล้วป่านนี้ ขอให้ฝันดีอย่าเหมือนเช่นเรา

เขาคงหลับไปแล้วป่านนี้ ขอให้ฝันดีคืนนี้อย่าเหงา
เขาคงหลับไปแล้วป่านนี้ ขอให้ฝันดีอย่าเหมือนเช่นเรา

เขาคงหลับไปแล้วป่านนี้ ขอให้ฝันดีคืนนี้อย่าเหงา
เขาคงหลับไปแล้วป่านนี้ ขอให้ฝันดีอย่าเหมือนเช่นเรา",lanna_commins
ผู้หญิงธรรมดา,/music/thailyric/5115,"ฉันเป็นผู้หญิงที่ธรรมดา แค่เพียงผู้หญิงที่ธรรมดา
เธอไม่ต้องไขว้คว้าให้เหนื่อยอะไร
ฉันเป็นผู้หญิงที่ธรรมดา แค่เพียงผู้หญิงที่ธรรมดา
ไม่ได้เป็นนางฟ้าให้เธอเข้าใจ (ไม่ได้อยู่บนฟ้า ฉันอยู่นี่ไง)

อยู่บนพื้น  บนพื้นดินเดียวกัน ห่างกันเพียงเอื้อมมือ
สิ่งที่ฉันนั้นต้องการก็คือ หนึ่งคนที่มีรักจริง

ฉันเป็นผู้หญิงที่ธรรมดา แค่เพียงผู้หญิงที่ธรรมดา
ดวงดาวจากบนฟ้าไม่เกี่ยวกับฉัน
ฉันเป็นผู้หญิงที่ธรรมดา แค่เพียงผู้หญิงที่ธรรมดา
ดวงดาวจากบนฟ้า ฉันไม่ต้องการ

แค่อ้อมแขน แค่สองมืออุ่นอุ่น หากเธอจะมีให้กัน
แค่เธอรักและให้ความสำคัญ เท่านั้นก็คง (จะ) มากพอ

ฉันเป็นผู้หญิงที่ธรรมดา แค่เพียงผู้หญิงที่ธรรมดา
ดวงดาวจากบนฟ้า ฉันไม่ต้องการ

แค่อ้อมแขน แค่สองมืออุ่นอุ่น หากเธอจะมีให้กัน
แค่เธอรักและให้ความสำคัญ เท่านั้นก็คง (จะ) มากพอ

ฉันเป็นผู้หญิงที่ธรรมดา แค่เพียงผู้หญิงที่ธรรมดา
เธอไม่ต้องไขว้คว้าให้เหนื่อยอะไร
ฉันเป็นผู้หญิงที่ธรรมดา แค่เพียงผู้หญิงที่ธรรมดา
ไม่ได้เป็นนางฟ้าให้เธอเข้าใจ (ไม่ได้อยู่บนฟ้า ฉันอยู่นี่ไง)",lanna_commins
ไว้ใจ๋ได้กา,/music/thailyric/5122,"แต่ก่อนแต่ไร ไปแอ่วต่างได๋กัน
เฮาก็ไปโตยกัน ตึงวันแสนม่วนใจ๋
พอพบฮู้จักสาวชาวกรุงบ่เต้าใด
อ้ายก็ไปเอาอกเอาใจ๋แต่เขา

แค่เพียงบ่เมิน เชื่อกำเปิ้นแล้วกา
ฮู้จักเพียงหน้าตา ฮู้ใจ๋เปิ้นหรือเปล่า
ตึงวันเปิ้นมีป้อจายมาคอยเฝ้า
เปิ้นจะอี้แล้วคงบ่ดีไปไว้ใจ๋

เคยกิ๋นผักกาดจอ บ่เคยกิ๋นพิซซ่า
หากว่าลงต๊องจะยะจะได
เปิ้นบ่ไจ้คนเมือง บ่เมินหากเปิ้นลาไกล
อ้ายจะอู้จะได้บ่ออก

ก็บ่ได้หวง ทวงอะหยังวุ่นวาย
เป็นแต่เพียงเสียดาย ข้ากลัวอ้ายโดนหลอก
เปิ้นกึ้ดกับอ้ายจะไดก็บ่บอก
เป็นจะอี้แล้วอ้ายจะไว้ใจได้กา

ปากแดงๆ จะไว้ใจได้กา
หน้าสวยๆ จะไว้ใจได้กา
แก้มขาวๆ จะไว้ใจได้กา
ตาหวานๆ จะไว้ใจได้กา
ใส่เอวลอย จะไว้ใจได้กา
นุ่งสั้นๆ จะไว้ใจได้กา
อยู่เมืองไกล จะไว้ใจได้กา
บ่ไจ้ข้าเจ้า จะไว้ใจได้กา

ปากแดงๆ จะไว้ใจได้กา
หน้าสวยๆ จะไว้ใจได้กา
แก้มขาวๆ จะไว้ใจได้กา
ตาหวานๆ จะไว้ใจได้กา
ใส่เอวลอย จะไว้ใจได้กา
นุ่งสั้นๆ จะไว้ใจได้กา
อยู่เมืองไกล จะไว้ใจได้กา
บ่ไจ้ข้าเจ้า จะไว้ใจได้กา",lanna_commins
สวัสดีเจ้า,/music/thailyric/5123,"ส-วัส-ดี-เจ้า ส-วัส-ดี-เจ้า
ฉันก็ไม่คิดมาก่อน ฉันก็ไม่นึกมาก่อน
ฉันก็ไม่รู้มาก่อน ว่าจะเจอ
แล้วก็ได้พบกันอีก แล้วก็ได้เห็นกันอีก
แล้วก็ได้พูดกันอีก ได้เจอะเจอ

ส-วัส-ดี-เจ้า ส-วัส-ดี-เจ้า
เป็นยังไงบ้าง เป็นยังไงบ้าง ไปเที่ยวที่ไหนมา
สวัสดีเจ้า สวัสดีเจ้า กิ๋นข้าวเจ๊าแล้วกา

เซย์ ฮัลโล สักนิด
คิดถึงเธอมากเลย เออเอ้อเออเอ้อเออเอ้อเออ
ดูนอท เซย์ กู๊ดบาย
ส-วัส-ดี-เจ้า ส-วัส-ดี-เจ้า

อาจเจ็บหัวใจ อาจตัวฮ้อนก่อ
และอาจเป็นไข้เป็นเมื่อยเจ๊บต๊อง
อย่าเพิ่งหม่นหมองฉันจะเทคแคร์ดูแลอย่างดี
หมอกจับยอดดอยจะลอยพัดผ่าน
จะเปิดพัดลม ปัดความรำคาญ
ลำไยลูกหวาน สตรอเบอร์รี่ก็มีให้เธอ

เป็นจะไดพ่อง เป็นจะไดพ่อง ไปแอ่วตังใดมา
สวัสดีเจ้า สวัสดีเจ้า กิ๋นข้าวเจ๊าแล้วกา

เซย์ ฮัลโล สักนิด
คิดถึงขนาดเลย เออเอ้อเออเอ้อเออเอ้อเออ
ดูนอท เซย์ กู๊ดบาย

อาจเจ็บหัวใจ อาจตัวฮ้อนก่อ
และอาจเป็นไข้เป็นเมื่อยเจ๊บต๊อง
อย่าเพิ่งหม่นหมองฉันจะเทคแคร์ดูแลอย่างดี
หมอกจับยอดดอยจะลอยพัดผ่าน
จะเปิดพัดลมปัดความรำคาญ
ลำไยลูกหวาน สตรอเบอร์รี่ก็มีให้เธอ

ส-วัส-ดี-เจ้า ส-วัส-ดี-เจ้า
ฉันก็ไม่คิดมาก่อน ฉันก็ไม่นึกมาก่อน
ฉันก็ไม่รู้มาก่อน ว่าจะเจอ
แล้วก็ได้พบกันอีก แล้วก็ได้เห็นกันอีก
แล้วก็ได้พูดกันอีก ได้เจอะเจอ

ฉันก็ไม่คิดมาก่อน ฉันก็ไม่นึกมาก่อน
ฉันก็ไม่รู้มาก่อน ว่าจะเจอ
แล้วก็ได้พบกันอีก แล้วก็ได้เห็นกันอีก
แล้วก็ได้พูดกันอีก ได้เจอะเจอ
ส-วัส-ดี-เจ้า ส-วัส-ดี-เจ้า

สวัสดีเจ้า",lanna_commins
พิราบรำพัน,/music/thailyric/5116,"พิราบรำพัน โก่งคอรอคู่
วันนี้ไม่รู้ ไม่รู้ ไม่รู้ ว่าคู่อยู่ไหน
เฝ้าพร่ำรำพึง คิดถึงอยู่ไย
เขาจากเจ้าไป ไปไหน ต่อไหน
เขาไม่หวนมา

พิราบเจ้าเอ๋ย เพิ่งเคยอกหัก
เพราะความที่รัก ที่รัก
ที่รัก เขามากนักหนา
ร้องไห้ทำไม ช่างไร้เดียงสา
ไม่รู้เหรอว่า น้ำตา น้ำตา ไม่ช่วยอะไร

เจ้าอย่าลืมว่าเจ้ามีปีก
เจ้าอย่าลืมว่าเจ้าบินได้
บินจงบิน ออกบินไปสู่ฟ้าไกล
ไม่เหมือนฉันที่มันดักดาน
ไม่เหมือนฉันที่โง่งมงาย
บินก็บินไม่ได้ ตายก็ไม่ตายสักที

เจ้าอย่าลืมว่าเจ้ามีปีก
เจ้าอย่าลืมว่าเจ้าบินได้
บินจงบิน ออกบินไปสู่ฟ้าไกล
ไม่เหมือนฉันที่มันดักดาน
ไม่เหมือนฉันที่โง่งมงาย
บินก็บินไม่ได้ ตายก็ไม่ตายสักที

พิราบเจ้าเอ๋ย จงบินไปเถอะ
และขอ ให้เจ้าได้พบกับเจอกับสิ่งดี ๆ
ถ้าบังเอิญเจอเขา
ช่วยบอกเขาที ว่าคน คนนี้
ยังรอตรงนี้ ยังคงคิดถึง
ขอให้เขาโชคดี และคน คนนี้ยังคงคิดถึง",lanna_commins
