song_name,href,lyric,artist
เงาสะท้อน II,/music/thailyric/20149,"(กลายเป็นเงาในบทเพลง)
(กลายเป็นเงาในบทเพลง)
(กลายเป็นเงาในบทเพลง)

กูทำเพลงตามใจ กูไม่ฟังคำใคร
เหล่าคำสาปของศิลปิน มึงเคยได้ยินใช่ไหม
ต้องล้มลุกคลุกดิน ไม่มีกินมีใช้
กว่าจะได้ซึ่งทุกสิ่งต้องไขว่คว้ามาเดียวดาย

ต้องนับหนึ่งถึงร้อย กว่าจะได้ใช้สอย
กูจะไม่มีทางพลาดให้ ประวัติศาสตร์ซ้ำรอย
ผ่านเหล้ายาเเละผู้สาวซำน้อย
Men lie women lie but nunber don't lie boi

Cuz imma เหยี่ยว บินเดี่ยว All the way
ฟังชัดๆว่ากูไม่เกี่ยวกูไม่มีเอี่ยวไปอยู่ในเกมส์ของใคร
เดินลำพังคนเดียว For real กับไมค์
เอากูเป็นเพื่อนมึงก็เลือกเอาเองจะเอาเรื่องเพลงหรือผลกำไร

กูไม่ศรีธนชัยร้ายเเต่จอมปลอม
Walk n talk เเบบสุนทรภู่กูให้มึงดูเเบบกลอนกลอน
สำหรับเพื่อนกูทั้งหลายที่หายไปกับเงินทอง หรือเงินทอน
เพราะว่าความฝันกูยังไม่เสร็จอย่าริเชิญเสด็จไปเชิงตะกอน

อยู่ใต้ดินเเต่ว่ากูกินอยู่บนบัลลังก์
โลกทุกวันมันร้ายอย่าไว้ใจคนให้จงระวัง
ไรม์กูคงกระพันเเละกูพนันกับยมบาล..
เเม้นตายตกไปอยู่ในโลงเเต่กูยังคงเป็นองค์ประธาน

ต้องพลาดเสียบ้างให้รู้ประสบการณ์กูยังเคยพ่าย
กูมองเห็นมึงยันไส้ก่อนมึงเอาปากมาเกยให้
ไม่เคยคิดอคติเเต่มึงดูถูกจากเคยไหว้
ถึงกูไม่อยู่กับค่ายเเต่ว่ากูก็อยู่มาได้

กูทำเพลงตามใจ กูไม่ฟังคำใคร
เหล่าคำสาปของศิลปิน มึงเคยได้ยินใช่ไหม
ต้องล้มลุกคลุกดิน ไม่มีกินมีใช้
กว่าจะได้ซึ่งทุกสิ่งต้องไขว่คว้ามาเดียวดาย

ต้องนับหนึ่งถึงร้อย กว่าจะได้ใช้สอย
กูจะไม่มีทางพลาดให้ ประวัติศาสตร์ซ้ำรอย
ผ่านเหล้ายาเเละผู้สาวซำน้อย
Men lie women lie but nunber don't lie boi

เป็นดั่งเงาสะท้อน
มองเห็นตัวเองบรรเลงในบทเพลง
ทุกครั้งที่ฉันร่ำร้อง
เงาสะท้อนของฉันเอง เเละมันคือกฎเกณฑ์

ถ้าใจมึงพูดว่าชนะ ใครจะว่ามึงเเพ้
ลองคิดเเล้วทบทวนดูใหม่ซะ อะมันไม่มีข้อเเม้
กู Talkin with myself คำคนไม่สนไม่เเคร์
ต่อให้ต้องตายชีพมลายเเละดับลง
เเต่ว่า Rhyme กูยังคงเป็นของเเท้ เป็นของเเท้

ที่กูต้องเกรงเเละต้องกลัวก็มีเเต่ตัวกู
Passion ในบทเพลงกูยังมีเต็มพวกมึงก็ควรดู
จะ Back ทำเหี้*ไรยังอยู่ในเกมส์อันนี้ยังชัวร์อยู่
อุปสรรคถาโถมร้อยพันมึงเข้ามาสิอย่าดีเเต่มัวขู่

กูบ่ยั่นเพราะมีปู่มั่นคือครูบา
กูทำทุกวัน ทำเท่าที่ทำ เเละกูยังทำเหมือนเมื่อวาน
เป็นเงาสะท้อนในทุกวัน ผ่านมันจนชำนาญ
สัญชาติมังกรจะไม่หอนเห่าให้เหล่ากุ้งฝอยต้องรำคาญ

กูทำเพลงตามใจ กูไม่ฟังคำใคร
เหล่าคำสาปของศิลปิน มึงเคยได้ยินใช่ไหม
ต้องล้มลุกคลุกดิน ไม่มีกินมีใช้
กว่าจะได้ซึ่งทุกสิ่งต้องไขว่คว้ามาเดียวดาย

ต้องนับหนึ่งถึงร้อย กว่าจะได้ใช้สอย
กูจะไม่มีทางพลาดให้ ประวัติศาสตร์ซ้ำรอย
ผ่านเหล้ายาเเละผู้สาวซำน้อย
Men lie women lie but nunber don't lie boi",mc_king
ชิม,/music/thailyric/16895,"ดูจากหน้าท่าจะหวานจริงๆ
เห็นเธอบอกทำได้ทุกสิ่งแล้วทำผมบินได้หรือเปล่าละ
ก็อยากจะได้ อยากจะได้จริงๆ
นี่ผมพูดจริงๆ ขอผมชิมได้หรือเปล่า

ชิมดูสิว่าได้หรือเปล่า
ที่ผ่านมาทั้งชีวิตไม่เคยคิดว่าจะได้เอาเอาเอาเอา
ใจเธอมาครองบอกไว้ก็ได้แค่มอง
ใยล่ะเธอทำไมไม่ลอง
มาเป็นเจ้าของให้เธอได้ครอบครอง ก็มาเดะ

ฉันคิดถึงเธอแทบทุกนาที
อาการแบบนี้ไม่มีมาก่อน
นานๆ ทีนะไม่ได้เป็นถี่
จะหายทันทีถ้าพี่ได้กอด
แต่อย่าให้มันเกินไปวันที่สี่
มันเป็นแบบนี้มันเป็นตลอด
ต้องให้เธอช่วยแล้วนะคนดี
ขอสองสามทีให้พี่ได้บ่ ได้บ่

ดูจากหน้าท่าจะหวานจริงๆ
เห็นเธอบอกทำได้ทุกสิ่งแล้วทำผมบินได้หรือเปล่าละ
ก็อยากจะได้ อยากจะได้จริงๆ
นี่ผมพูดจริงๆ ขอผมชิมได้หรือเปล่า

ขอผมชิมได้ไหมจะตั้งใจสักคราว
ขอผมชิมได้ไหมก็ถ้าไม่ให้ก็เดี๋ยวจะยาว
ลองชิมดูนะครับถึงไม่ได้เรื่องได้ราว
นี่ผมพูดจริงๆ นะขอผมชิมได้หรือเปล่า

ตั้งแต่หัวไปยันฮี
ส่วนตรงนี้ก็ของแพง
ก็เธอสวยขอดูหน่อยสิ
น่าบิดชิมครีมโอ้ย Gut damn
อยากให้เธอชอบคนอย่างฉันลูกครึ่งเมกันนี่ของแปลก
My mom มหาสารคาม N my dad ขอนแก่น

เพียงแค่ได้ชิมเธอนั้นสักครั้งหนึ่ง
ครั้งนี้มันไม่เหมือนกับครั้งอื่น
เธอมาทำให้ฉันล้มยืนงงทำฉันลืม
พูดยังไม่ทันขาดคำต้องมาเจอกันอีกและ
จะชิมตรงไหนก่อนดีแหะ..
ฟีลมันดีแท้ Melodic rap

ดูจากหน้าท่าจะหวานจริงๆ
เห็นเธอบอกทำได้ทุกสิ่งแล้วทำผมบินได้หรือเปล่าละ
ก็อยากจะได้ อยากจะได้จริงๆ
นี่ผมพูดจริงๆ ขอผมชิมได้หรือเปล่า

ขอผมชิมได้ไหมจะตั้งใจสักคราว
ขอผมชิมได้ไหมก็ถ้าไม่ให้ก็เดี๋ยวจะยาว
ลองชิมดูนะครับถึงไม่ได้เรื่องได้ราว
นี่ผมพูดจริงๆ นะขอผมชิมได้หรือเปล่า

ขอชิมตรงนั้น ได้ไหมผมขอสักครั้ง
รสชาติมันคงจะหวานที่เคยได้ทานครั้งใด
ขอชิมตรงนี้ ผมว่ามันคงจะดี
ได้โปรดนะเธออย่าหนี ผมการันตรีว่าถึงใจ

ถึงใจ I say that oh
Say it again oh
ก็ถ้าแม่ไม่ไปเคาะประตู ก็อกๆ
เอาจริงๆ พี่ไม่ได้ขู่จะทำให้หนูอ๊อกๆ

ดูจากหน้าท่าจะหวานจริงๆ
เห็นเธอบอกทำได้ทุกสิ่งแล้วทำผมบินได้หรือเปล่าละ
ก็อยากจะได้ อยากจะได้จริงๆ
นี่ผมพูดจริงๆ ขอผมชิมได้หรือเปล่า

ขอผมชิมได้ไหมจะตั้งใจสักคราว
ขอผมชิมได้ไหมก็ถ้าไม่ให้ก็เดี๋ยวจะยาว
ลองชิมดูนะครับถึงไม่ได้เรื่องได้ราว
นี่ผมพูดจริงๆ นะขอผมชิมได้หรือเปล่า",mc_king
เชย,/music/thailyric/14890,"ก็ต้องขอโทษทีนะน้อง โทษทีพี่มันเชย
พี่ไม่ทำเหมือนอย่างใครๆ ไม่นำสมัยเอาซะเลย
เสื้อผ้าเธอแสนแพงฟังแต่ Gucci gang
Aye what you gonna do ผมฟังแต่ Wu tang clan

ก็ต้องขอโทษทีนะน้อง โทษทีพี่มันเชย
พี่ไม่ทำเหมือนอย่างใครๆ ไม่นำสมัยเอาซะเลย
เสื้อผ้าเธอแสนแพงฟังแต่ Gucci gang
Aye what you gonna do ผมฟังแต่ Wu tang clan

เพราะว่าพี่น่ะเป็นคนเชยๆ อะ เธอเลยเลิกซะเลย
คบกันไปมันก็เหมือนที่เคยอะ เจ็บอยู่ตรงที่เดิม
ถ้าคิดกันแบบพี่น้องผมเองก็คงต้องปวดใจ
เสื้อผ้าที่ใส่กระเป๋าต้องพองไม่รู้น้องเอาไปอวดใคร
ไม่มีอีกแล้วนะ ผู้ชายที่อยู่กับเธอทุกจันทร์
ไม่ใช่ว่าหยุดแค่นั้น แต่ผมน่ะหยุดมันทุกวัน
ตื่นมาทุกครั้งหัวใจมันสั่นอย่างทุกวัน
ที่ดีแต่ก็ทิ้งทุกอัน รู้สึกชีวิตฉันมันทุรัง
ผมบอกว่าผมเป็น Hip Hop สไตล์ผมชอบใหญ่ๆ
ถ้านอกจากหน้าอกหน้าใจของคุณจะชอบอะไร
และเพลงที่คุณได้ฟังมันบอกคุณว่าอะไร
ถึงมาทิ้งผมไปเพียงเพราะเสื้อผ้าที่ใส่น่ะ

ก็ต้องขอโทษทีนะน้อง โทษทีพี่มันเชย
พี่ไม่ทำเหมือนอย่างใครๆ ไม่นำสมัยเอาซะเลย
เสื้อผ้าเธอแสนแพงฟังแต่ Gucci gang
Aye what you gonna do ผมฟังแต่ Wu tang clan

ก็ต้องขอโทษทีนะน้อง โทษทีพี่มันเชย
พี่ไม่ทำเหมือนอย่างใครๆ ไม่นำสมัยเอาซะเลย
เสื้อผ้าเธอแสนแพงฟังแต่ Gucci gang
Aye what you gonna do ผมฟังแต่ Wu tang clan

ผมเชื่อว่าสิ่งที่ผมใช้เวลาผ่านไปก็ยังเก๋า
เวลาตกน้ำมันก็ไม่ไหล เมื่ออยู่กับไฟก็ไม่เผา
ไม่มีความหมายแม้ตอนกูตาย การเต้นหัวใจมันจะหยุดลง
Hip Hop มีไว้เพื่อให้กูเสพและเป็นปัจเจกบุคคล
นี่คือความเชื่อแรกเลย ที่แท้เหมือนเลือดแลกมา
พอผ่านไปก็แช่เลย อย่าเดินให้เมื่อยถ้าแค่ลา
บางอย่างยาวนานในใจ แต่ผ่านไปไวเพียงทศวรรษ
ก็ตามถนัดกันแต่ละคนบางคนจะลบ บางคนจะรัก
แต่คุณก็คิดว่ามันเชย หัวใจผมก็เลยต้องชาชิน
เมื่อก่อนที่เคยได้ฟังประจำ และคุณก็ทำเป็นอาจิน
ไอ้ผมก็ฟังได้หมดแหละ ไม่มีการแบ่งวรรณะ
แต่ทำไมต้องทิ้งกางเกงขาใหญ่
แล้วบอกให้ไปใส่กางเกงพละ Mafucker

ก็ต้องขอโทษทีนะน้อง โทษทีพี่มันเชย
พี่ไม่ทำเหมือนอย่างใครๆ ไม่นำสมัยเอาซะเลย
เสื้อผ้าเธอแสนแพงฟังแต่ Gucci gang
Aye what you gonna do ผมฟังแต่ Wu tang clan

ก็ต้องขอโทษทีนะน้อง โทษทีพี่มันเชย
พี่ไม่ทำเหมือนอย่างใครๆ ไม่นำสมัยเอาซะเลย
เสื้อผ้าเธอแสนแพงฟังแต่ Gucci gang
Aye what you gonna do ผมฟังแต่ Wu tang clan",mc_king
เชลย,/music/thailyric/19925,"ฉันคงเป็นได้เเค่เพียงเชลยของเธอ
ทุกวันก็เจอเเต่เรื่องเดิมๆ ทำร้าย
เเท้จริงเธอต้องการฉันไปทำไม
ในเมื่อในใจเธอมีตัวเลือกอยู่เเล้ว

ฉันคงจะเป็นได้เเค่เพียงเชลยของเธอ
ความสุขของฉันที่มอบให้เธอไปใช้
นกในกรงมันกำลังจะบินออกไป
ได้โปรดเธออย่าทำร้าย หัวใจมัน

คงจะไม่มีวันที่เธอนั้นเห็นใจ
สถานะคืออะไรช่วยบอกอย่าเล่นไป
บางครั้งที่เธอคุยกันทำเป็นไม่เห็นไง
เธอก็บอกกับฉันตลอดถ้าไม่จำเป็นให้เว้นไป

เหมือนว่ามันจะดีที่เธอนั้นมีมนุษยสัมพันธ์
ลืมผู้ชายคนนี้มันไม่เคยดีไม่เคยมีความสำคัญ
เเต่ละวัน ฉันได้เเต่คอยนับมัน
เเต่เเค่ฉัน ที่เธอไม่เคยรักกัน

Oh คงไม่มีทางที่จะได้เธอมาครอบครอง
But now I'm just hit up my phone
รูปเธอกับฉันยังคงอยู่ในไอโฟน

ฉันคงเป็นได้เเค่เพียงเชลยของเธอ
ทุกวันก็เจอเเต่เรื่องเดิมๆ ทำร้าย
เเท้จริงเธอต้องการฉันไปทำไม
ในเมื่อในใจเธอมีตัวเลือกอยู่เเล้ว

ฉันคงจะเป็นได้เเค่เพียงเชลยของเธอ
ความสุขของฉันที่มอบให้เธอไปใช้
นกในกรงมันกำลังจะบินออกไป
ได้โปรดเธออย่าทำร้าย หัวใจมัน

ฉันกลายเป็นคนชินชาไม่เเคร์เวลาเเละความตาย
รักเราก็เหมือนกับโชคชะตาที่ตกลงนาฬิทราย
เเม้มันจะนาน เเต่ยังต้องการ หลุดมันจากไทม์ไลน์
ให้เธอไปกับเขาสบาย ไม่ได้ขอมากไปให้เธอปล่อยฉัน

จะอธิบายให้ฟังละกันในยามที่คุณขาดผม
จะไม่มีใครให้ยืมสตังค์ในวันที่คุณขัดสน
จะไม่มีตัวสำรองใดๆในตอนตัวจริงไม่ว่าง
ถ้าไม่ได้อยู่ในใจอยู่ในฐานะอะไรได้บ้าง

เเต่ก็อะนะ มึงก็ควรจะปลง
อีกายังดีกว่าเเก้วที่เจื้อยเเจ้วอยู่ในกรง
ก็คงไม่ต่างอะไรกับคนอยู่ดีเเต่ยอมจำนน
สุดท้ายก็อาจจะตรอมใจหายไปกับสายลม

ฉันคงเป็นได้เเค่เพียงเชลยของเธอ
ทุกวันก็เจอเเต่เรื่องเดิมๆทำร้าย
เเท้จริงเธอต้องการฉันไปทำไม
ในเมื่อในใจเธอมีตัวเลือกอยู่เเล้ว

ฉันคงจะเป็นได้เเค่เพียงเชลยของเธอ
ความสุขของฉันที่มอบให้เธอไปใช้
นกในกรงมันกำลังจะบินออกไป
ได้โปรดเธออย่าทำร้าย หัวใจมัน

ปล่อยไปจากตรงนี้ให้เธอปล่อยฉันไป
ใจมันอยากจะหนีไม่อยากเป็นเชลย
ปล่อยไปจากตรงนี้ให้เธอปล่อยฉันไป
ใจมันอยากจะหนีไม่อยากเป็นเชลย",mc_king
