song_name,href,lyric,artist
14 วัน,/music/thailyric/17750,"เราเรียกมันว่า Covid ยังไม่มียารักษา
มนุษยชาติ Novice ตอนนี้กำลังค้นหา
คำสั่งออกมา ปิดร้าน ปิดบ้าน ปิดงาน ปิดบาร์
ปิด Data อู้ว ปิดหู ปิดตา You know it

เรามีชีวิตอยู่ด้วยการระวังทุกวัน แต่ปนระแวง
ออกไปแดกข้าวแกงใครเป็นใครอะไรยังไม่แสดง
และมีไอ้พวกชิบหายเอาหน้ากากไปขายให้ต่างชาติแทน
ไม่ตาย เหมือนตาย เพราะไร แม่งแพง..ไอ้ Sus เอ้ย

ปีนี้เหี้_ที่สุด
แทบจะไม่ได้ออกไปไหนเลยทั้งอาทิตย์
ดูจากรัฐบาลทำงานกูว่าไม่นานก็คงติด
It's covid oh damn panic panic panic
เข้ามาใกล้กูทีละนิด แม่งทำชีวิตกูเครียดตาย
Covid Covid มึงว่ามึงติดหรือยัง
Covid covid ดูข่าวทุกวัน
Covid covid covid กูยังไม่พร้อมที่จะตาย
ปีนี้เหี้_ที่สุด
ต้องทรมานอีกนานเท่าไร Covid covid

เขาว่ากันว่า มันมาจาก ค้างคาว
วิธีการแดกอันสั่นสะเทือน
ทำเมืองทั้งเมืองต้องร้างเอา ร้างเอา
รับประทานไม่เหลือจนเชื้อทำร้ายทำลายทั้งพงศ์เผ่า
นอนเรียงตายเป็นเบือในบ้านในเรือ ที่เหลือไม่ลงข่าว

เอวัดดั๊บโย่ว เจียโหยว อู่ฮั่น
มองที่มายคันทรี่ ประเทศกูมี มึงรู้ยัง
สวดอิติปิโส ออกอากาศโชว์ทุกบ้าน
เฟสสามเฟสสี่ เราควบคุมดีจึงไม่ต้องการ

ตรวจไม่เจอหรือว่าเธอไม่ตรวจ
ไปที่ไปรษณีย์โคตรเร็วเจอแต่เจลหลายขวด
ส่งให้คนข้างหลังแต่แม่งมาพังกันทั้งหน่วย
ที่ช่วยก็เอกชนแท้ๆ Yed แม่ก็คนเราแค่ป่วยก็แม่งห่วย

ปีนี้เหี้_ที่สุด
แทบจะไม่ได้ออกไปไหนเลยทั้งอาทิตย์
ดูจากรัฐบาลทำงานกูว่าไม่นานก็คงติด
It's covid oh damn panic panic panic
เข้ามาใกล้กูทีละนิด แม่งทำชีวิตกูเครียดตาย
Covid Covid มึงว่ามึงติดหรือยัง
Covid covid ดูข่าวทุกวัน
Covid covid covid กูยังไม่พร้อมที่จะตาย
ปีนี้เหี้_ที่สุด
ต้องทรมานอีกนานเท่าไร Covid covid

แม่งแพร่ระบาดไปในอากาศพุทธศักราชแห่งไวรัส
2563 มันทำมึงขยาดเชิญมึงลำบากต่อไปนะ
มึงจำเป็นที่ต้องไปเฟ้นเลือกหาใน ลาซาด้า หรือว่า ช็อปปี้
เพราะหน้ากากป้องกันที่ดีคือซ่อนอยู่ในโกดังที่ไหนสักที
มึงเชื่อกู

ประเทศนี้เหมือนกับเกมและนักการเมือง คือ NPC
พวกมึงทั้งหลายคือตัวละคร รอฟัง คำสั่ง อีกที
ใครเลียก็จะ Vel ขึ้นไว ถูกใจเป็น MVP
Covid แค่มอนสเตอร์ไง ผู้เล่นพรรคใหม่กลายเป็นคดี

งานที่คุยกันไว้พี่ขอเลื่อนนะ
เงินก็ยิ่งต้องใช้ทำไมต้องเลื่อนวะ
ตีนก็ไม่ได้เคลื่อนทำไมได้เรื่องวะ
คุยกันมาเป็นเดือนเขาขอแค่เพื่อนนะ

ปีนี้เหี้_ที่สุด
แทบจะไม่ได้ออกไปไหนเลยทั้งอาทิตย์
ดูจากรัฐบาลทำงานกูว่าไม่นานก็คงติด
It's covid oh damn panic panic panic
เข้ามาใกล้กูทีละนิด แม่งทำชีวิตกูเครียดตาย
Covid Covid มึงว่ามึงติดหรือยัง
Covid covid ดูข่าวทุกวัน
Covid covid covid กูยังไม่พร้อมที่จะตาย
ปีนี้เหี้_ที่สุด
ต้องทรมานอีกนานเท่าไร Covid covid

ประเทศไทยต้องชนะ Oh
ประเทศไทยต้องชนะ Oh
ประเทศไทยต้องชนะ ต้องชนะ
ต้องชนะ นะ นะ นะ",mc_king
Done (เสร็จ),/music/thailyric/15594,"ยังไงก็โดน โอเค อ่ะ
คุณคิดยังไงล่ะคืนนี้
บอกให้ผมได้ฟังอีกสักที
อาการที่มันร้ายๆ แค่วางก่อนก็ดี

ถ้านอกจากผมแล้วยังมีใครบ้าง
ช่วยบอกได้ไหมตรงนั้นมีใครนั่ง
ผมบอกคุณแล้วว่าในแก้วคุณมันว่าง
จะรินกันแบบไหนจะเป็นใครๆ ก็ช่าง

บอกคุณนั้นคิดให้ดีก่อน อีกครั้ง
เร็วอีกนิดถ้าคุณไม่คิดก็ผิดแล้ว
บอกกับผมบอกกับผมอีกครั้ง
ก่อนที่ผมจะพาไปโดนจนเสร็จแล้ว

เนี่ย ชีวิตกูใครก็รู้ว่ากูเรียล
หลายคนไม่พลาดแล้วคุณจะยากแค่ไหนเชียว
บอกผมถ้าพร้อมให้คุณร้องว่า Well done
ความถี่ไม่ทิ้งช่วงไม่ต้องห่วงใช้เอวดัน

ไม่ต้องรีบร้อนแต่ขอกอดที
ถ้างานคุณดีไม่ใช่แค่ One night stand
ถ้าขาดความรักมาบอกผมสิ
ผมขอสักที แม้ว่าต้องจ่ายแพง

ยังไงก็โดน โอ๊ะโอว Yeah
ถ้าคุณคิดถึงก็โทร
บอกว่ารักให้ฟัง I know
เห็นบอกว่าร้ายแต่สุดท้ายก็โดน

ยังไงก็โดน โอ๊ะโอว Yeah
ถ้าคุณคิดถึงก็โทร
บอกว่ารักให้ฟัง I know
เห็นบอกว่าร้ายแต่สุดท้ายก็โดน

ยังไงก็โดน โอ๊ะโอว Yeah
ถ้าคุณคิดถึงก็โทร
บอกว่ารักให้ฟัง I know
เห็นบอกว่าร้ายแต่สุดท้ายก็โดน

ยังไงก็โดน โอ๊ะโอว Yeah
ถ้าคุณคิดถึงก็โทร
บอกว่ารักให้ฟัง I know
เห็นบอกว่าร้ายแต่สุดท้ายก็โดน

บอกกับไว้คุณไว้แล้วว่ายังไงคืนนี้คุณต้องโดน
คุณทำให้ผมเหมือนกับโดนต้องมนต์
ต้องบอกเอาไว้ไม่มีใครร้ายเท่าโจร
แต่ว่าบางคนก็โดนปล้นไมค์
และมีบางหนที่ผมโดนปล้นใจ
ถึงผมจะร้ายแต่ไม่เคยจะปล้นใคร
คือคำสาปว่ะไอ้น้องถ้าเป็นกลอนก็ด้นไป

บอกคุณนั้นคิดให้ดีก่อน ก่อนตอบ
อยากรู้จังคุณเป็นยังไง ตอนถอด
หลงทางตั้งนานยังไม่เจอทางออก
แต่หลงเธอไม่มีเศร้ามีทั้งเข้าและทั้งออก

นั่นชีวิตคุณ ใครก็รู้ว่าคุณ Hot
คืนนี้ถ้าได้โดนเราจะโดนกันให้น็อค
ไม่ผสมครับผมถนัด On the rock
คุยกันเสร็จสรรพปั๊บแล้วก็จับคุณ On top

ไม่ต้องรีบร้อนแต่ขอกอดที
ถ้างานคุณดีไม่ใช่แค่ One night stand
ถ้าขาดความรักมาบอกผมสิ
ผมขอสักที แม้ว่าต้องจ่ายแพง

ยังไงก็โดน โอ๊ะโอว Yeah
ถ้าคุณคิดถึงก็โทร
บอกว่ารักให้ฟัง I know
เห็นบอกว่าร้ายแต่สุดท้ายก็โดน

ยังไงก็โดน โอ๊ะโอว Yeah
ถ้าคุณคิดถึงก็โทร
บอกว่ารักให้ฟัง I know
เห็นบอกว่าร้ายแต่สุดท้ายก็โดน

ยังไงก็โดน โอ๊ะโอว Yeah
ถ้าคุณคิดถึงก็โทร
บอกว่ารักให้ฟัง I know
เห็นบอกว่าร้ายแต่สุดท้ายก็โดน

ยังไงก็โดน โอ๊ะโอว Yeah
ถ้าคุณคิดถึงก็โทร
บอกว่ารักให้ฟัง I know
เห็นบอกว่าร้ายแต่สุดท้ายก็โดน โว้ว

ถามตรงประเด็นไม่เล่นๆ เอาไง
อยากให้คุยเล่นหรือเน้นๆ เอาใจ
พูดแบบเนื้อๆ อยากให้เชื่อไม่เดาไป
แบงค์พันที่อยู่ในเสื้อ ให้คุณเลือกว่าเอาใคร
ซื้อให้คุณดื่ม ผมจะทำให้คุณตื่น
เหมือนจะดูว่าผมหื่น แต่ไม่ทำอย่างคนอื่น
ให้ผมได้ทำให้คุณได้หลับสบาย ๆ ในทุกๆ คืน
และบอกกับคุณเอาไว้ว่าโดนจนคุณต้องจำไม่มีวันลืม

ยังไงก็โดน โอ๊ะโอว Yeah
ถ้าคุณคิดถึงก็โทร
บอกว่ารักให้ฟัง I know
เห็นบอกว่าร้ายแต่สุดท้ายก็โดน

ยังไงก็โดน โอ๊ะโอว Yeah
ถ้าคุณคิดถึงก็โทร
บอกว่ารักให้ฟัง I know
เห็นบอกว่าร้ายแต่สุดท้ายก็โดน

ยังไงก็โดน โอ๊ะโอว Yeah
ถ้าคุณคิดถึงก็โทร
บอกว่ารักให้ฟัง I know
เห็นบอกว่าร้ายแต่สุดท้ายก็โดน โว้ โวว",mc_king
No Soda,/music/thailyric/15039,"ดื่มอีกครั้ง เพื่อจะได้ลืมเธอ
ไม่มีเธอ ฉันก็ยังเหมือนเดิม
และไม่มีวันที่ฉันจะกลับไปเจอ
อย่าพูดมากไป เอาแก้วนี้เติมเว้ย

คืนนี้ฉันไม่เอาหรอกโซดา
เพราะว่าเธอไม่โทรมา
ไม่ต้องห่วงว่าเหล้ามันเข้ม
ได้โปรดอย่าเห็นใจ
คืนนี้ฉันไม่เอาหรอกโซดา
เพราะว่าเธอไม่โทรมา
รีบรินใส่แก้วให้ไว
จะได้ยกเธอให้กับเขาไป

ขอเพียงแค่ฉันนั้นได้เมา
ขอเพียงแค่ฉันนั้นได้เมา

จำฉันคนนี้ได้เปล่า
ไปไหนไม่เห็นได้ข่าว
เธอก็น่าจะไปได้ดี
ส่วนฉันคนนี้เอาแต่เมา
และตอนที่เธอคุยกับเขา
เธอใช้วิธีไหนกัน
เพราะตอนที่เธอคุยกับเขา
เราก็ยังตามไม่ทัน
Even know even know
I just try to lay low
เพราะสุดท้ายพยายามเท่าไร
ฉันก็ยังเป็นแค่ไอ้โง่
ไม่ว่า Louis หรือว่า Gucci
ผมจะไปหาให้คุณทุกที่
Even know even know
I got money

คืนนี้ฉันไม่เอาหรอกโซดา
เพราะว่าเธอไม่โทรมา
ไม่ต้องห่วงว่าเหล้ามันเข้ม
ได้โปรดอย่าเห็นใจ
คืนนี้ฉันไม่เอาหรอกโซดา
เพราะว่าเธอไม่โทรมา
รีบรินใส่แก้วให้ไว
จะได้ยกเธอให้กับเขาไป

ขอเพียงแค่ฉันนั้นได้เมา
ขอเพียงแค่ฉันนั้นได้เมา

เธอช่วยบอกฉันทีได้ไหม
วิธีไหนที่จะลืมกัน
แม้จะเมาทุกๆ วัน
อันตรายแต่ก็ยังฝืนทำ
รสชาติก็ดูจะไม่เบา
เอาแบบเมื่อกี้ที
เธอบอกว่าเธอไม่ชอบคนดี
แต่ชอบคนนี้ดี
และแน่นอนไม่ว่าใคร
ก็ต้องการคนที่ใส่ใจ
ไม่มีเธอไม่เป็นไร
ฉันพยายามจะยืนให้ไหว
หัวใจที่มันยังเต้น
ฉันเองจะหยุดมันไว้
ยินดีกับเธอและเขา
แม้เราจะไม่ใช่คนสุดท้าย

คืนนี้ฉันไม่เอาหรอกโซดา
เพราะว่าเธอไม่โทรมา
ไม่ต้องห่วงว่าเหล้ามันเข้ม
ได้โปรดอย่าเห็นใจ
คืนนี้ฉันไม่เอาหรอกโซดา
เพราะว่าเธอไม่โทรมา
รีบรินใส่แก้วให้ไว
จะได้ยกเธอให้กับเขาไป

ขอเพียงแค่ฉันนั้นได้เมา
ขอเพียงแค่ฉันนั้นได้เมา

ให้ฉันเมา ฉันนั้นเมาดีกว่า
Aey ลืมเธอเนี่ยแหละ
Aey และเธอไม่ต้องโทรมา
Aey ไม่รู้จักกันเลยดีกว่า

เจ็บก็ดื่มเข้าไปทุกคืน
ฉันฝืนหัวใจเป็นอาจิน
ดีกว่าเห็นเธอเป็นของคนอื่น
ตื่นมาและตายในความจริง

คืนนี้ฉันไม่เอาหรอกโซดา
เพราะว่าเธอไม่โทรมา
ไม่ต้องห่วงว่าเหล้ามันเข้ม
ได้โปรดอย่าเห็นใจ
คืนนี้ฉันไม่เอาหรอกโซดา
เพราะว่าเธอไม่โทรมา
รีบรินใส่แก้วให้ไว
จะได้ยกเธอให้กับเขาไป

ขอเพียงแค่ฉันนั้นได้เมา
ขอเพียงแค่ฉันนั้นได้เมา",mc_king
ก็ได้เหรอ,/music/thailyric/12972,"บางครั้ง เธอน่าหลงใหล
แต่ยิ้มของเธอมันชวนให้สงสัย
มอง ตรงไหน
ถึงจะพบความลับที่เธอปิดยังฉันไว้

แต่กลับไม่รู้อะไรจากเธอ เลยสักอย่าง
เป็นคนที่ขาดความรัก ฉันก็เลยต้องการ
นั่งมองเธออยู่ตรงนี้ ตรงหน้าต่าง
ก็มีคิดถึงกันบ้าง แต่เธอก็คงไม่มา

เธอตอบคำถามของฉันได้ไหม แค่สงสัย
อยากรู้จังเลย ทำไมเป็นอย่างนั้น
เธอทำเหมือนกับว่าฉัน ไม่สำคัญ
แต่ตอนที่คุยกับเขา
เธอยิ้มให้เราได้ทั้งวัน

อยากอยู่กับเขาจริงๆ ปะ
เดี๋ยวผมจะพาไปข้ามฝั่ง
เข้าใจนะครับมีคนขัดใจ
เหมือนใกล้จะเสร็จแต่ห้ามหลั่ง

เธอรู้ไม่ดีแต่ห้ามสั่ง
จะโดนยังไงก็ไม่หวั่น
แต่ถ้าหากว่าเขานั้นทิ้งเธอไป
ต้องห้ามหัวใจไม่ให้สั่น

อยากอยู่กับเขาจริงๆ ปะ
รับรองว่าผมจะไม่เยอะ
แต่เราคุยแบบเพื่อกันได้เนอะ
โอเคแบบนี้ก็ได้เหรอ

อยากอยู่กับเขาจริงๆ ปะ
รับรองว่าผมจะไม่เยอะ
แต่เราคุยแบบเพื่อกันได้เนอะ
โอเคแบบนี้ก็ได้เหรอ

ก็เห็นว่าเธอนั้นคุยกับเขา
แล้วชวนกันไปไหนต่อไหน
ถ้าถามว่าเป็นยังไง
ผมตอบได้เลยไม่ไหว ไม่ไหว

มันน่าจะโดนสักที เจอคนอย่างงี้
เหมือนชวนมารักแล้วหลอก
ถ้าไม่คบต่อก็น่าจะบอก
ฉันรู้ดีว่าใช่สิทธิ์อยู่ในฐานะที่พัก

ใจฉํนยังงงๆ คือบอกตรงๆ
ว่ากูไม่น่าไปทักเลย
ต้องตามหัวใจ ที่มันคล้อยเคลื่อน
มองแล้วก็ขำทำกันได้ลง
โอ้แม่คนร้อยเพื่อน

เธอตอบคำถามของฉันได้ไหม แค่สงสัย
อยากรู้จังเลย ทำไมเป็นอย่างนั้น
เธอทำเหมือนกับว่าฉัน ไม่สำคัญ
แต่ตอนที่คุยกับเขา
เธอยิ้มให้เราได้ทั้งวัน

อยากอยู่กับเขาจริงๆ ปะ
เดี๋ยวผมจะพาไปข้ามฝั่ง
เข้าใจนะครับมีคนขัดใจ
เหมือนใกล้จะเสร็จแต่ห้ามหลั่ง

เธอรู้ไม่ดีแต่ห้ามสั่ง
จะโดนยังไงก็ไม่หวั่น
แต่ถ้าหากว่าเขานั้นทิ้งเธอไป
ต้องห้ามหัวใจไม่ให้สั่น

อยากอยู่กับเขาจริงๆ ปะ
รับรองว่าผมจะไม่เยอะ
แต่เราคุยแบบเพื่อกันได้เนอะ
โอเคแบบนี้ก็ได้เหรอ

อยากอยู่กับเขาจริงๆ ปะ
รับรองว่าผมจะไม่เยอะ
แต่เราคุยแบบเพื่อกันได้เนอะ
โอเคแบบนี้ก็ได้เหรอ

ก็ต้องเข้าใจนะ ตัวเองเข้าใจช่ะ
ไม่ได้คุยจริงๆ จังๆ ก็แค่ขำๆ กันไปวันๆ
ก็ต้องเข้าใจนะ ตัวเองเข้าใจช่ะ
ก็ไม่ได้คุยกันทุกวัน
ก็แค่อาทิตย์ถึงจันทร์

ก็ต้องเข้าใจนะ ตัวเองเข้าใจช่ะ
เพราะที่เป็นคนอย่างนี้ต้องเข้าสังคมนะ
แต่มันเกี่ยวกันปะ เป็นคุณจะงงไหมล่ะ
เป็นแค่คนไม่รู้จัก
เธอพิมพ์ไปทักคอนนิจิวะ

อยากอยู่กับเขาจริงๆ ปะ
เดี๋ยวผมจะพาไปข้ามฝั่ง
เข้าใจนะครับมีคนขัดใจ
เหมือนใกล้จะเสร็จแต่ห้ามหลั่ง

เธอรู้ไม่ดีแต่ห้ามสั่ง
จะโดนยังไงก็ไม่หวั่น
แต่ถ้าหากว่าเขานั้นทิ้งเธอไป
ต้องห้ามหัวใจไม่ให้สั่น

อยากอยู่กับเขาจริงๆ ปะ
รับรองว่าผมจะไม่เยอะ
แต่เราคุยแบบเพื่อกันได้เนอะ
โอเคแบบนี้ก็ได้เหรอ

อยากอยู่กับเขาจริงๆ ปะ
รับรองว่าผมจะไม่เยอะ
แต่เราคุยแบบเพื่อกันได้เนอะ
โอเคแบบนี้ก็ได้เหรอ",mc_king
