song_name,href,lyric,artist
สถานีอวกาศ,/music/thailyric/18104,"นาซ่าก็พาเธอกลับมาไม่ได้
ไม่ว่าจะใช้วิธีใด
เขาถามฉันว่าเอาเธอไปซ่อนไว้ที่ไหน
ฉันซ่อนเธอไว้ในใจ

และฉันจะพาเธอหนีไปให้ไกล ให้ไกลจากเขา
ที่ๆ เราจะไม่มีเรื่องร้ายๆ
จะขอเธอเป็นแฟนที่วงแหวนดาวเสาร์
ฉันจะเอามนุษย์ต่างดาวมารับใช้

จะให้เธอเป็นเจ้าหญิงที่สวยเกินใคร
เดินอยู่ในปราสาทดั่งในนิยาย
และไม่จำเป็นต้องกลัวซึ่งอันตราย
เพราะทุกวันเธอยังมีฉันอยู่ข้างกาย

จินตนาการข้ามขอบฟ้าเหตุการณ์
ดวงดาวอันเงียบสงบในระบบสุริยะจักรวาล
เตรียมตัวขึ้นยาน จะไม่ปล่อยให้รอนาน
ทิ้งความรู้สึกทั้งหมดกดปุ่มปลดปล่อยพลังงาน

Alright ฉันจะพาเธอไปที่ไม่มีใคร
มีแค่เธออยู่ตรงนี้ฉันก็ดีใจ
ไม่ว่าจะเป็นที่ใด ฉันจะอยู่ตรงนี้
จะยิ้มแบบนี้ให้เธอทุกทีไป

และฉันจะพาเธอหนีไปให้ไกล ให้ไกลจากเขา
ที่ๆ เราจะไม่มีเรื่องร้ายๆ
จะขอเธอเป็นแฟนที่วงแหวนดาวเสาร์
ฉันจะเอามนุษย์ต่างดาวมารับใช้

จะให้เธอเป็นเจ้าหญิงที่สวยเกินใคร
เดินอยู่ในปราสาทดั่งในนิยาย
และไม่จำเป็นต้องกลัวซึ่งอันตราย
เพราะทุกวันเธอยังมีฉันอยู่ข้างกาย

มองดูเนบิวลามันพาพัดไปอยู่ภายในดาราจักร
มันคือความคิดถึงและเป็นส่วนหนึ่งในจักรวาลนี้
ฉันรอเธอ ทุกเวลา ทุกนาที
หลับฝันถึงเราบนนี้ ลืมความเป็นจริงสะคนดี
เพราะฉันยัง

กลัวว่าเขาจะกลายเป็นดวงจันทร์สำหรับเธอ
แม้ว่าห่างแค่ไหนก็กลับมาใกล้โคจรกันได้อย่างเดิม
ยิ่งระยะทางความที่มันต่างนั่นมันมากกว่าทางที่เดิน
หมดหัวใจสลายสุดท้ายก็หายและตายใน Universe

Alright ฉันจะพาเธอไปที่ไม่มีใคร
มีแค่เธออยู่ตรงนี้ฉันก็ดีใจ
ไม่ว่าจะเป็นที่ใด..ฉันจะอยู่ตรงนี้
จะยิ้มแบบนี้ให้เธอทุกทีไป..

และฉันจะพาเธอหนีไปให้ไกล ให้ไกลจากเขา
ที่ๆ เราจะไม่มีเรื่องร้ายๆ
จะขอเธอเป็นแฟนที่วงแหวนดาวเสาร์
ฉันจะเอามนุษย์ต่างดาวมารับใช้

จะให้เธอเป็นเจ้าหญิงที่สวยเกินใคร
เดินอยู่ในปราสาทดั่งในนิยาย
และไม่จำเป็นต้องกลัวซึ่งอันตราย
เพราะทุกวันเธอยังมีฉันอยู่ข้างกาย

และเธอไม่ต้องกังวล
อยู่ในสถานีอวกาศมาทัศนศึกษากับผม
อยากให้เธอได้ดู Ooh อยากให้ได้รู้ Ooh
มันคือปรากฏการณ์ของจักรวาล
บิ๊กบาดาบูม

บิ๊กบาดาบูม เหตุมันเกิด BigBang
จนกลายเป็นดาวเคราะห์แดงตอนนี้เรากำลังโคจร
บิ๊กบาดาบูม อยากให้ดูตรงนี้แทน
You got my OG I need that
มาส่งให้เลยไม่ต้องโทรจอง

และฉันจะพาเธอหนีไปให้ไกล ให้ไกลจากเขา
ที่ๆ เราจะไม่มีเรื่องร้ายๆ
จะขอเธอเป็นแฟนที่วงแหวนดาวเสาร์
ฉันจะเอามนุษย์ต่างดาวมารับใช้

จะให้เธอเป็นเจ้าหญิงที่สวยเกินใคร
เดินอยู่ในปราสาทดั่งในนิยาย
และไม่จำเป็นต้องกลัวซึ่งอันตราย
เพราะทุกวันเธอยังมีฉันอยู่ข้างกาย",mc_king
ส่วนหนึ่ง,/music/thailyric/18372,"อย่าลืมเผื่อใจ ถ้าหากว่าเจาไปรักใคร จะได้ไม่ช้ำ
จงเก็บส่วนหนึ่งเอาไว้ เธออาจจะต้องให้เขาไป คนที่ไม่ใช่ฉัน

ทุกๆ วันที่ลืมตาตื่นขึ้นมา และฉันก็พบเธอ
เหมือนดีใจในของบางสิ่งที่ตัวฉันเองได้ค้นเจอ
คุยกันทุกวัน คิดถึงมันทุกครั้ง
บอกรักเธอทุกวัน จะไม่มีวันพรากกัน

คำสัญญาที่เราเคยได้ให้กันไว้
ไม่ได้ไม่ต้องการมันแต่เพราะว่าฉันนั้นกลัวใจ
ยังรักเธอเหมือเดิมและแม้ว่าเธอจะมีใคร
ครั้งนี้ก็คงเหมือนกันเหมือนทุกๆ ครั้งที่เผื่อไว้

อย่าลืมเผื่อใจ ถ้าหากว่าเขาไปรักใคร จะได้ไม่ช้ำ
จงเก็บส่วนหนึ่งเอาไว้ เธออาจจะต้องให้เขาไป คนที่ไม่ใช่ฉัน
สิ่งต่างๆ มันทำให้รู้ เมื่อเรารักใครต้องเผื่อใจเอาไว้ทุกครั้ง
และมันทำให้ฉันได้รู้ ไม่มีรักใดจะคงอยู่ตลอดไป เผื่อใจไว้ก็ดี

ไม่จำเป็นต้องรักก็ได้ ไม่ต้องกลัวเสียน้ำใจ
เธอไม่ต้องบอกว่าฉันใช่ นึกให้ดีก่อนจะตัดสินใจ
เคยมีอดีตเลวร้ายมา ภาพเก่ามันเริ่มกลับย้อนมา
ไม่อยากจะเก็บเอาไว้เพราะมันทำร้ายทำลายหัวใจตัวเองอยู่เรื่อยมา

แม้จะดูเหมือนคนที่เห็นตัว
ก็ฉันกลัวก็เลยต้องเผื่อไว้..
แท้จริงเลยเธอเองก็ยังไม่ชัวร์
และก็ยังไม่รู้ตัวว่าเบื่อไว

ยิ่งค้นหาเท่าไรมันก็ยิ่งไม่เข้าใจ
ยิ่งวิ่งตามเท่าไหร่รู้สึกว่ารักนี้มันก็ยิ่งไกลออกไป

อย่าลืมเผื่อใจ ถ้าหากว่าเขาไปรักใคร จะได้ไม่ช้ำ
จงเก็บส่วนหนึ่งเอาไว้ เธออาจจะต้องให้เขาไป คนที่ไม่ใช่ฉัน
สิ่งต่างๆ มันทำให้รู้ เมื่อเรารักใครต้องเผื่อใจเอาไว้ทุกครั้ง
และมันทำให้ฉันได้รู้ ไม่มีรักใดจะคงอยู่ตลอดไป เผื่อใจไว้ก็ดี

รักคือการให้ไป แต่ไม่ใช่ทุกครั้งจะได้มา
รักคือการให้ไป แต่ไม่ใช่ทุกครั้งจะได้มา
รักคือการให้ไป แต่ไม่ใช่ทุกครั้งจะได้มา
รักคือการให้ไป แต่ไม่ใช่ทุกครั้งจะได้มา",mc_king
สิ่งทั้งสอง,/music/thailyric/16393,"In god we trust and I believe in Jesus
In god we trust and I believe in Jesus

ไหนใครบอกว่ารักจนกว่าวันสุดท้าย
แม้วิญญาณและชีพมลายแต่ว่าฉันไม่ลืม
หากมันเป็นสวรรค์เพราะฉะนั้นต้องไปให้ไหว
หรือเป็นนรกที่มีแต่ไฟแต่ว่าฉันจะยืน
โปรดเถิดโปรดเถอะฟ้ามองลงมาสักครั้งได้ไหม
คิดว่ามันเป็นครั้งสุดท้ายให้ฉันได้ใช้วันหนึ่ง
อยู่กับเธอตรงนี้แม้เวลาไม่มากไม่มาย
ขอได้ไหมเป็นครั้งสุดท้ายขอให้ฉันไม่ลืมเธอ

คิดถึงทุกลมหายใจและเธอเคยก็สัญญา
รักที่ให้ไป ให้เธอเก็บไว้แต่นั้นมา
ตั้งแต่รู้จัก ฉันไม่ได้ทำให้มีน้ำตา
ได้โปรดอย่าเอ่ยอะไรแบบนั้นด้วยคำที่ทำให้ร่ำลา
ถ้าฉันผ่านจุดที่หลงก็จะกลายเป็นรัก
มันช่างงดงามและผ่านเวลามานานนัก
กลายเป็นความผูกพันที่ใครต่อใครต่อใครเขาใช้กัน
และจะถ้ามีใครทิ้งใครไปแบบนั้นมันได้ที่ไหนกัน

และฉันจะบอกให้เธอได้รู้ได้รู้ได้รู้ว่าคนอย่างนี่น่ะ
แม้ว่าไกลเท่าไหร่ก็ยังจะไปจะไปทุกที่น่ะ
และทุกครั้งที่ฉันจะนอนจะนอนและฉันก็พร้อมที่จะ
I can pray for you for you for you to my jesus

ไหนใครบอกว่ารักจนกว่าวันสุดท้าย
แม้วิญญาณและชีพมลายแต่ว่าฉันไม่ลืม
หากมันเป็นสวรรค์เพราะฉะนั้นต้องไปให้ไหว
หรือเป็นนรกที่มีแต่ไฟแต่ว่าฉันจะยืน
โปรดเถิดโปรดเถอะฟ้ามองลงมาสักครั้งได้ไหม
คิดว่ามันเป็นครั้งสุดท้ายให้ฉันได้ใช้วันหนึ่ง
อยู่กับเธอตรงนี้แม้เวลาไม่มากไม่มาย
ขอได้ไหมเป็นครั้งสุดท้ายขอให้ฉันไม่ลืมเธอ

ไม่มีสิ่งใดจะพรากเราไปไกลจาก
วันเวลาที่ดีขอเธอคนนี้อย่าไกลห่าง
แม้ว่าจะต้องทนกี่อีกสักกี่ฝนก็ตาม
ความลำบากหรืออุปสรรคที่มีร้อยพัน
ให้ฉันได้ตายก่อนเธอวันหนึ่ง
เธอไม่ต้องถามว่าทำไม
ฉันไม่ค่อยจะเหมือนคนอื่น
และไม่เคยบอกกับใคร

และฉันจะบอกให้เธอได้รู้ได้รู้ได้รู้ว่าคนอย่างนี่น่ะ
แม้ว่าไกลเท่าไหร่ก็ยังจะไปจะไปทุกที่น่ะ
และทุกครั้งที่ฉันจะนอนจะนอนและฉันก็พร้อมที่จะ
I can pray for you for you for you to my jesus

ไหนใครบอกว่ารักจนกว่าวันสุดท้าย
แม้วิญญาณและชีพมลายแต่ว่าฉันไม่ลืม
หากมันเป็นสวรรค์เพราะฉะนั้นต้องไปให้ไหว
หรือเป็นนรกที่มีแต่ไฟแต่ว่าฉันจะยืน
โปรดเถิดโปรดเถอะฟ้ามองลงมาสักครั้งได้ไหม
คิดว่ามันเป็นครั้งสุดท้ายให้ฉันได้ใช้วันหนึ่ง
อยู่กับเธอตรงนี้แม้เวลาไม่มากไม่มาย
ขอได้ไหมเป็นครั้งสุดท้ายขอให้ฉันไม่ลืมเธอ

และนี่คือสิ่งสุดท้ายที่เชื่อมเราไว้ในความเป็นนิรันดร์
นรกหรือว่าสวรรค์ที่ต่างขนานไปคนละทิศทาง
อาจเห็นแค่ในละคร มาจากในหนัง หรือฟังจากนิทาน
แม้วันได้ที่เดินไม่ได้พรุ่งนี้ต้องตายหรือกลายเป็นพิการ
แต่คุณก็อยู่ดูแลแม้มันจะยากแต่คุณยังเคียงข้าง
เรายิ้มหัวเราะมามาก อดทนลำบากทุกอย่างที่เพียรสร้าง
และนี่แหละรัก นี่แหละรัก ที่หลายคนมักจะดูพลาด
จะฝ่าเข้าไปแม้ไฟจะเผาหรือในหุบเขาเงามัจจุราช

ไหนใครบอกว่ารักจนกว่าวันสุดท้าย
แม้วิญญาณและชีพมลายแต่ว่าฉันไม่ลืม
หากมันเป็นสวรรค์เพราะฉะนั้นต้องไปให้ไหว
หรือเป็นนรกที่มีแต่ไฟแต่ว่าฉันจะยืน
โปรดเถิดโปรดเถอะฟ้ามองลงมาสักครั้งได้ไหม
คิดว่ามันเป็นครั้งสุดท้ายให้ฉันได้ใช้วันหนึ่ง
อยู่กับเธอตรงนี้แม้เวลาไม่มากไม่มาย
ขอได้ไหมเป็นครั้งสุดท้ายขอให้ฉันไม่ลืมเธอ

In god we trust and I believe in Jesus
In god we trust and I believe in Jesus",mc_king
หยิ่ง,/music/thailyric/14951,"ใครที่มาบอกว่าเธอนั้นสวยเกินไป
เลยทำให้เธอนั้นติดนิสัยจึงออกอาการได้ใจ
ชอบมาขู่ผู้ชาย สายตาเธอดูร้าย
ตามหาคนดีที่สุด แต่ที่ผมพูดน่ะถูกใช่ไหมล่ะ

แต่เธอก็ดูดีตรงนี้ผมไม่ค้าน
ตอนยิ้มเธอยิ่งหวานแลดูเธอมีจริตจกร้าน
เหมาะสมดูเป็นกุลสตรี และถ้าเธอยังว่าง
บอกกันบ้างคงจะดีนะเธอ

One for the money two for the bitchese
Three for hiphop and four for tha homie
คิดให้ดีก่อนจะทำร้ายใจ ไม่ว่าใครๆ เขาก็รู้
Why you don't know me

สวยไม่จริงบอกจริงๆ อย่าได้หยิ่งไป
รับรองว่าเธอต้องฟินแถมยังติดดินและก็ยิ่งจริงใจ
ตกลงจะเอาไหมครับ ปุ๊ปๆ ปั๊ปๆ ประเดี๋ยวก็อดตาย
แค่นี้ก็ทำเป็นโกรธ อีกหน่อยจะโสดก็เพราะหยิ่งไง

สวยไม่สร่าง พอตอนสว่างไม่สวยเลย
ชอบคนรวย ชวนกันรวยต้องเล่นหวยเลย
รู้กันทั้งบาง เขาเรียกว่านาง นางฟ้า Bigo live
ไหนว่าจะโกรธ อีกหน่อยจะโสดก็เพราะหยิ่งไง

เอาเข้าแล้วล่ะซิ เจอเธอทุกทีก็มีแต่อีโก้
ผมมันคนไม่มี Money ลองดูดีๆ นี่ปีโป้
ก็กะจะลองฮอนด้าซิตี้แต่ตังค์เต็มที่แค่ฟีโน่
เธอขับ Maserati ในเมืองแบบนี้ต้อง Eco car
ไม่ต้องหรูหรา ไม่น่าประทับใจ
เกิดมาสวยยังงี้ ถ้าใจดี พี่ก็รักตาย
ขอบอกไว้ก่อนมันไม่ค่อยมีผู้ชายที่จริงใจ
เสนอขนาดนี้ไม่รู้คนดีจะหยิ่งทำไม

One for the money two for the bitchese
Three for hiphop and four for tha homie
คิดให้ดีก่อนจะทำร้ายใจ ไม่ว่าใครๆ เขาก็รู้
Why you don't know me

สวยไม่จริงบอกจริงๆ อย่าได้หยิ่งไป
รับรองว่าเธอต้องฟินแถมยังติดดินและก็ยิ่งจริงใจ
ตกลงจะเอาไหมครับ ปุ๊ปๆ ปั๊ปๆ ประเดี๋ยวก็อดตาย
แค่นี้ก็ทำเป็นโกรธ อีกหน่อยจะโสดก็เพราะหยิ่งไง

สวยไม่สร่าง พอตอนสว่างไม่สวยเลย
ชอบคนรวย ชวนกันรวยต้องเล่นหวยเลย
รู้กันทั้งบาง เขาเรียกว่านาง นางฟ้า Bigo live
ไหนว่าจะโกรธ อีกหน่อยจะโสดก็เพราะหยิ่งไง

รู้ว่าเธอมีคนติดตามมากมาย
แต่ว่าพอกันทีเมื่อเจออย่างงี้เข้าไป
ถึงแม้ว่าเธอจะสวยแต่ดันไม่มีคู่ใจ
กลับมาคิดดูอีกทีหรือว่าเธอไม่ชอบผู้ชาย

เบาๆ ลงบ่อยเวลามองกระผมไม่ใช่โจร
เป็นคนที่ดูตลกไม่สกปรก ถ้าตกลง
มาเอากัน เอ๊ย ไม่ใช่ผมหมายถึงเอาใจ
แต่เธอก็ดันไม่ฟังแล้วเดินหันหลังกลับไป

สวยไม่จริงบอกจริงๆ อย่าได้หยิ่งไป
รับรองว่าเธอต้องฟินแถมยังติดดินและก็ยิ่งจริงใจ
ตกลงจะเอาไหมครับ ปุ๊ปๆ ปั๊ปๆ ประเดี๋ยวก็อดตาย
แค่นี้ก็ทำเป็นโกรธ อีกหน่อยจะโสดก็เพราะหยิ่งไง

สวยไม่สร่าง พอตอนสว่างไม่สวยเลย
ชอบคนรวย ชวนกันรวยต้องเล่นหวยเลย
รู้กันทั้งบาง เขาเรียกว่านาง นางฟ้า Bigo live
ไหนว่าจะโกรธ อีกหน่อยจะโสดก็เพราะหยิ่งไง",mc_king
