song_name,href,lyric,artist
รักแท้แค่มาช้า (Love Will Be OK),/music/thailyric/10330,"แม้นานเท่าไร
ยังไงจะรอๆๆ เพื่อรักเธอ
I think I'm loving you.
So don't you run, run, run away

ขอได้ไหมอย่าเลยอย่าเพิ่งจากไป
ให้ฉันได้พิสูจน์ความในใจสักครั้งนี่คือรักจริง
ฉันไม่เหมือนคนนั้นที่เขาเคยทิ้ง
และฉันต้องทำอย่างไร ให้เธอเชื่อฉันให้เธอเข้าใจ

ภาษาเกาหลี

รักแท้ยังมีอยู่ในหัวใจแค่มาช้าไป เชื่อใจฉันนะเธอ
แม้ว่าเธอจะปิดตายหัวใจ ฉันจะเปิดให้ได้

Love will be all right
แค่ต้องการได้ฟังคำเดียวที่มีในใจ
Love will be all right
แค่ต้องการได้ฟังคำเดียวที่รอมานาน
Love will be all right
ไม่ต้องกลัวเพราะเราจะกุมมือกันและกัน
Everything all right
รักจริงยังมีเสมอ แค่รอเธอตอบ

เหตุผลของฉันนั้นมีมากล้น หากจะค้นก็คงเจอแต่รักเธอ
รู้บ้างไหม ชีวิตฉันนั้นช่างดูสวยงามเมื่อมีเธอ

ภาษาเกาหลี

รักแท้ยังมีอยู่ในหัวใจแค่มาช้าไป เชื่อใจฉันนะเธอ
แม้ว่าเธอจะปิดตายหัวใจ ฉันจะเปิดให้ได้

โอเคที่ผ่านมามันผิดจนทำให้เธอรู้สึกว่าเธอนั้นกลัวที่จะเจ็บช้ำ
ฉันเองที่จะทำให้เธอคิดว่าความรักจะไม่ทำให้เธอนั้นต้องมาเจ็บซ้ำ

เธอจะได้รู้สึกไหมข้างในใจตรงนี้
รักแท้ยังมีอยู่ในหัวใจแค่มาช้าไปเชื่อใจฉันนะเธอ
แม้ว่าเธอจะปิดตายหัวใจ ฉันจะเปิดให้ได้

Love will be OK
แค่ต้องการได้ฟังคำเดียวที่มีในใจ
Love will be OK
แค่ต้องการได้ฟังคำเดียวที่รอมานาน
Love will be OK
ไม่ต้องกลัวเพราะเราจะกุมมือกันและกัน
Everything OK
รักจริงยังมีเสมอ แค่รอเธอตอบ",natthew
