song_name,href,lyric,artist
แค่พี่น้อง (Status),/music/thailyric/16273,"ในตอนนี้ สถานะของฉันคืออะไร
ในตอนนี้ ฉันยังสำคัญใช่ไหม
แต่พอใครถาม ไม่เหมือนที่คุยกันไว้
เธอตอบเขา ฉันเป็นแค่พี่น้องกัน

คนที่ทำให้เธอยิ้ม
คนที่ทำให้สุขสันต์
คนที่ทำให้เธอผูกพัน
คนที่ทำให้ประทับใจอยู่ทุกครั้ง (ทุกครั้ง)
คนที่ทำให้เธอหลง
และเป็นคนคอยไปรับไปส่งอยู่ทุกวัน
อยากจะให้โอกาสเธอ บอกกับเขาอีกสักครั้ง

(เนี่ยอ่อพี่น้องกัน)

แค่พี่น้อง พูดมาได้ไงคำนี้
โอ้คนดี รู้ไหมมันไม่น่ารัก
แค่พี่น้อง ที่ไหนเขาทำอย่างนี้
อยากจะถามให้ชัดๆ
ว่าพี่น้องประสา อะไร

เธอรู้ดีว่าเธอกับฉันนั้นเป็นอะไร
และเธอก็รู้ดี มันมีความหมายแค่ไหน
ถ้าไม่ใช่ความรัก เธอจะเรียกมันว่าอะไร
เธอบอกเขา ว่าเป็นแค่พี่น้องกัน

คนที่ทำให้เธอยิ้ม
คนที่ทำให้สุขสันต์
คนที่ทำให้เธอผูกพัน
คนที่ทำให้ประทับใจอยู่ทุกครั้ง (ทุกครั้ง)
คนที่ทำให้เธอหลง
และเป็นคนคอยไปรับไปส่งอยู่ทุกวัน
อยากจะให้โอกาสเธอ บอกกับเขาอีกสักครั้ง

(เนี่ยอ่อพี่น้องกัน)

แค่พี่น้อง พูดมาได้ไงคำนี้
โอ้คนดี รู้ไหมมันไม่น่ารัก
แค่พี่น้อง ที่ไหนเขาทำอย่างนี้
อยากจะถามให้ชัดๆ
ว่าพี่น้องประสา อะไร

แค่พี่น้อง พูดมาได้ไงคำนี้
โอ้คนดี รู้ไหมมันไม่น่ารัก
แค่พี่น้อง ที่ไหนเขาทำอย่างนี้
อยากจะถามให้ชัดๆ
ว่าพี่น้องประสา อะไร

แค่พี่น้อง พูดมาได้ไงคำนี้
แต่เราสอง รู้ดีเราเป็นอะไร
แค่พี่น้อง ที่ไหนเขาทำอย่างนี้
อยากจะถามให้ชัดๆ
ว่าพี่น้องประสาอะไร",tilly_birds
ใครพี่น้องเธอ,/music/thailyric/16415,"ในตอนนี้ สถานะของฉันคืออะไร
ในตอนนี้ ฉันยังสำคัญ ใช่ไหม
ใครนะที่ชอบเผลอมาเดินจูงมือกับฉัน
ทุกคืนต้องส่งข้อความมาละ
Good night

ใครอะ ที่เธอโทรหาตลอด (ใคร)
ใครอะ ที่อยู่กับเธอทุกวัน ว่าไง
ใครนะ ที่เธอชอบหวงเวลาไปคุยกับใคร
Oh baby hmmm ไหนใคร
เธอตอบเขา ฉันเป็นแค่เพื่อนของเธอ

Ooh ดูไงก็เห็นว่าเราน่ะ เป็นอะไร
Ooh ใครๆ ก็รู้ ดูไงก็ใช่
บอกเขาว่าไม่ใช่แฟน
บอกเขาว่า I'm your friend
เพิ่งรู้ว่าเราแค่เพื่อนเท่านั้น
ตอบอย่างกับเซเลบซะงั้น

Who's your friend huh
Who's your friend huh
ใครเพื่อนเธอ ไหน พูดอีกที (นานานานานา)
Who's your friend huh
Who's your friend huh
เพื่อนที่ไหน เขาทำอย่างนี้ (นานานานานา)
พูดไม่คิด ว่าเธอไม่คิด แค่เพื่อนสนิท Ah ah
อยากจะถามให้ชัดๆ ว่าพี่น้องประสาอะไร

Ask real
นี่เธอพูดจริงว่าเป็นพี่น้องกันใช่ป่ะ
นี่เธอเดินจูงมือกับน้องเธอทุกคนป่ะ Huh
เธอ Say good night ก่อนนอน Every night
มันใช่อะไรที่ทำกับพี่น้องเธอใช่รึเปล่า
มันมีความหมายแค่ไหน
ถ้าไม่ใช่ความรัก เธอจะเรียกมันว่าอะไร
กลัวเรตติ้งจะตกป่ะ เลยต้องทำเป็นโสดอะ
อยากเป็นพี่ฉันใช่ไหม Huh

คนที่ทำให้เธอยิ้ม
คนที่ทำให้สุขสันต์ คนที่ทำให้เธอผูกพัน
คนที่ทำให้ประทับใจอยู่ทุกครั้ง
คนที่ทำให้เธอหลงและเป็นคนคอย
ไปรับไปส่งอยู่ทุกวัน
อยากจะให้โอกาสเธอบอกกับเขาอีกสักครั้ง
(เนี่ยอ่อพี่น้องกัน)

แค่พี่น้อง พูดมาได้ไง คำนี้ (นานานานานา)
โอ้คนดี รู้ไหม มันไม่น่ารัก (นานานานานา)
แค่พี่น้อง ที่ไหน เขาทำอย่างนี้
บอกเลยนะ ใครเชื่อเธอก็บ้า ถามจริง

เนี่ยอ่อพี่น้องกัน
เนี่ยอ่อพี่น้องกัน
เนี่ยอ่อพี่น้อง

เพิ่งรู้ว่าเราเป็นแค่พี่น้อง ตอบอย่างกับเซเลบซะงั้น

Who's your sister
Who's your sister พูดมาได้ไงคำนี้
Who's your sister
Who's your sister รู้ไหม มันไม่น่ารัก
พูดไม่คิด ว่าเธอไม่คิด
เป็นแค่พี่น้อง พูดมาได้ไง
บอกเลยนะ ใครเชื่อเธอก็บ้า

Who's your friend huh
Who's your friend พูดมาได้ไงคำนี้
Who's your friend huh
Who's your friend รู้ไหมมันไม่น่ารัก
พูดไม่คิด ว่าเธอไม่คิด
แค่เพื่อนสนิท Ah ah ah ah
อยากจะถามให้ชัดๆ ว่าเพื่อน ประสา อะไร",tilly_birds
จากกันด้วยดี (Ordinary),/music/thailyric/15090,"เป็นธรรมดา เรื่องการอำลา
หากเราบังเอิญ ได้พบคนที่ดีกว่า
(พบคนที่ดีกว่า)

เรื่องความสัมพันธ์ เป็นเรื่องสำคัญ
แต่เมื่อถึงวัน ที่หมดเวลา
ก็ต้องเลิกรา (ก็ต้องเลิกรา)

เมื่อมันไม่ใช่ เราจะไม่ฝืน
แต่ในหัวใจ เราจะไม่ลืม
เรื่องที่ผ่านมา จากกันด้วยดี

ถ้าต้องทิ้งไป เราก็จะไม่เสียใจ
เราก็จะไม่เสียดาย
ไม่ใช่คนรักกัน
ไม่ได้แปลว่าเราไม่รักกัน
เธอก็ยังมีฉันเหมือนเดิม

เรื่องเธอและฉัน ที่เคยมีกัน ยังคงสวยงาม
และความทรงจำ ของเราในตอนนั้น
ไม่เคยเลือนลาง (ไม่เคยเลือนลาง)

เราอาจต้องพราก และไม่ได้คบ
แต่ในหัวใจ เรายังได้พบ
เรื่องที่ผ่านมา จากกันด้วยดี

ถ้าต้องทิ้งไป เราก็จะไม่เสียใจ
เราก็จะไม่เสียดาย
ไม่ใช่คนรักกัน
ไม่ได้แปลว่าเราไม่รักกัน
เธอก็ยังมีฉันเหมือนเดิม

พบคนที่ดีกว่า พบคนที่เราจะรัก
ไม่ใช่คนรักกัน ไม่ได้แปลว่าเราไม่รักกัน
เธอก็ยังมีฉันเหมือนเดิม

ถ้าต้องทิ้งไป เราก็จะไม่เสียใจ
เราก็จะไม่เสียดาย
ไม่ใช่คนรักกัน
ไม่ได้แปลว่าเราไม่รักกัน
เธอก็ยังมีฉันเหมือนเดิม

พบคนที่ดีกว่า พบคนที่เราจะรัก
ไม่ใช่คนรักกัน ไม่ได้แปลว่าเราไม่รักกัน
เธอก็ยังมีฉันเหมือนเดิม

พบคนที่ดีกว่า พบคนที่เราจะรัก
ไม่ใช่คนรักกัน ไม่ได้แปลว่าเราไม่รักกัน
เธอก็ยังมีฉันเหมือนเดิม",tilly_birds
ฉันมันเป็นใคร (Who I Am),/music/thailyric/18936,"มันทรมานกับการจะล้าง
เธอออกไปให้มันพ้นจากจิตใจ
เลยอยากจะถาม เธอมีวิธีการ
ทำอย่างไรถึงได้ลบฉันออกไป

เพราะในตอนนี้ ทุกอย่างข้างในนี้
ยังมีแต่เธอ มีแต่เธอ อยู่ทุกที่
มันพอจะมี จะมีสักครั้งไหมที่ในนั้น
ยังมีฉัน แค่สักนิด

ในความทรงจำนั้น
ยังมีฉันอยู่บ้างไหม
ในใจเธอดวงนั้น
ยังมีฉันหลงเหลือไหม
มีฉันเข้ามาบ้างไหม

ฉันมันเป็นใคร
อยู่ตรงไหนในความทรงจำของเธอ
เธอคิดถึงใคร
ในความฝันเคยมีภาพฉันบ้างไหม

ฉันมันเป็นใคร
อยู่ตรงไหนในความทรงจำของเธอ
เธอคิดถึงใคร
ในความฝันเคยมีภาพฉันบ้างไหม

เรายังมีความหมาย
อะไรกับใครบ้างไหม
ตัวตนของเรานั้น
มันยังสำคัญใช่ไหม
เรามีคุณค่าแค่ไหน
เมื่อไม่มีใครแล้ว

ฉันมันเป็นใคร
ชีวิตนี้ คนกำหนดไม่ใช่เธอ
ฉันจะเป็นใคร
อยู่ที่ฉัน ไม่ใช่เธอ ไม่ใช่ใคร

ฉันมันเป็นใคร
ชีวิตนี้ คนกำหนดไม่ใช่เธอ
ฉันจะเป็นใคร
อยู่ที่ฉัน ไม่ใช่เธอ ไม่ใช่ใคร",tilly_birds
เดอะแบก (Baggage),/music/thailyric/22200,"หนักเหมือนกันนะ แบกความสัมพันธ์เอาไว้
เหนื่อยเหมือนกันไหม เพราะว่าฉันเริ่มจะไม่ไหว

เราทะเลาะกันทุกเวลา
รอยยิ้มเริ่มกลายเป็นน้ำตา
ทุกๆ วันก็มีแต่ปัญหา
และ มีแค่ฉัน แค่ฉัน ที่พยายามจะ

แบกไว้ แบกไว้
แม้ว่าข้างใน แทบไม่ไหว ไม่ไหวเลย
หัวใจที่มี ก็แหลกไป แหลกไป
รักเรามันไม่เป็นอย่างที่เคย

ใจมันขอร้องให้ฉันพอ
เพราะเธอไม่พร้อมที่จะไปต่อ
แขนยังคงแบก แต่หัวใจแทบแหลก
อยากปล่อยและวางรักลงสักที

ได้แต่ประคองไม่ให้พัง
เพราะใจของฉันยัง อยากให้เราไปด้วยกัน
แขนยังคงแบก แต่หัวใจแทบแหลก
อยากปล่อยและวางรักลง วางรักลงสักที

ขอแค่นี้ เราคุยกันได้ไหม
เธอชอบวิ่งหนี และทิ้งฉันเอาไว้

เลิกกันเป็นพันครั้ง
และในทุกๆ ครั้ง ก็มีเพียงแค่ฉัน
ที่ยังคงมีความหวัง
ให้เราเริ่มใหม่อีกครั้ง
ฉันเลย

แบกไว้ แบกไว้
แม้ว่าข้างใน แทบไม่ไหว ไม่ไหวเลย
หัวใจที่มี ก็แหลกไป แหลกไป
รักเรามันไม่เป็นอย่างที่เคย

ใจมันขอร้องให้ฉันพอ
เพราะเธอไม่พร้อมที่จะไปต่อ
แขนยังคงแบก แต่หัวใจแทบแหลก
อยากปล่อยและวางรักลงสักที

ได้แต่ประคองไม่ให้พัง
เพราะใจของฉันยัง อยากให้เราไปด้วยกัน
แขนยังคงแบก แต่หัวใจแทบแหลก
อยากปล่อยและวางรักลง วางรักลง

พอแล้วสักที มันไม่มีความหมาย
ยอมรับสักที เราไม่มีความหมาย
ถ้ามันพังแล้ว แบกไว้เพื่ออะไร

พอแล้วสักที หยุดทำดีได้แล้ว
ยอมรับสักที มันไม่ดีขึ้นแล้ว
แค่ทิ้งใจไป วางรักลงได้ไหม

แบกไว้ แบกไว้
แบกไว้ แบกไว้
แบกไว้ แบกไว้
แบกไว้ แบกไว้

ใจมันขอร้องให้ฉันพอ
เพราะเธอไม่พร้อมที่จะไปต่อ
แขนยังคงแบก แต่หัวใจแทบแหลก
อยากปล่อยและวางรักลงสักที

ได้แต่ประคองไม่ให้พัง
แต่ต้องยอมรับมัน เมื่อเราถึงทางตัน
ไม่ต้องไปแบก ให้หัวใจมันแหลก
ต้องปล่อยและวางรักลง วางรักลง สักที",tilly_birds
"ติดตรงที่ฉัน (It's Not You, It's Me)",/music/thailyric/22566,"ไม่คิดว่าจะมีใครที่ทำให้รู้สึกดีอย่างนี้
เธอเข้ามาทำให้ใจที่มันเคยเป็นสีเทาไม่เหงา

ทักมาตอนฉันตื่น พูดว่าฝันดีทุกคืน
ห่วงใยกันในทุกวัน ทำให้ฉันดูสำคัญ
ทำให้ยิ้มทุกครั้ง วันที่ใจของฉันพัง
เหมือนว่าเธอคือคนในฝัน

แต่ติดตรงที่ฉัน เพิ่งโดนใครทำร้าย ให้เสียใจมา
ขอบใจในความหวังดี ขอบใจที่เธอแสนดี
แต่ว่าฉันคิดถึงเขาทุกเวลา

เธอยังไม่ต้องถาม ได้ไหม
ยังไม่ต้องถามว่าฉันรักเธอหรือไม่
เพราะฉันแค่ไม่พร้อม เข้าใจใช่ไหม
แค่ไม่พร้อมที่จะเริ่มต้นใหม่

โปรดเห็นใจกันเถอะนะ
ไม่อยากทำให้เธอผิดหวัง
แค่ขอเวลาสักพัก
ก่อนที่ใจจะรักใครได้อีกครั้ง

แต่ติดตรงที่ฉัน เพิ่งโดนใครทำร้าย ให้เสียใจมา
คนที่ยังจดจำ เพราะเขามีความหมายกับฉันเรื่อยมา
อาจเพราะว่าเขาคือใคร ที่ใกล้เคียงคนที่ใช่
แต่เขาดันมาจากไป ตอนที่ฉันให้เขาหมดใจ

ไม่อยากเป็นคนไม่ดี ทำเธอรู้สึกไม่ดี
ที่ตัวฉันยังคิดถึงเขาทุกเวลา

เธอยังไม่ต้องถามได้ไหม
ยังไม่ต้องถามว่าฉันรักเธอหรือไม่
เพราะฉันแค่ไม่พร้อม เข้าใจใช่ไหม
แค่ไม่พร้อมที่จะเริ่มต้นใหม่

โปรดเห็นใจกันเถอะนะ
ไม่อยากทำให้เธอผิดหวัง
แค่ขอเวลาสักพัก
ก่อนที่ใจจะรักใครได้อีกครั้ง

โปรดเห็นใจกันเถอะนะ
ไม่อยากทำให้เธอผิดหวัง
แค่ขอเวลาสักพัก
ก่อนที่ใจจะรักเธอได้

(ขอโทษที่ฉันนั้นยังไม่ลืมภาพเขา)
(ขอโทษที่ฉันไม่พร้อมให้เธอเข้ามา)
(ขอโทษที่ฉันนั้นยังไม่ลืมภาพเขา)
(ขอโทษที่ฉันไม่พร้อมให้เธอเข้ามา)

เธอยังไม่ต้องถามได้ไหม
ไม่ต้องถามว่าฉันรักเธอหรือไม่",tilly_birds
ถ้าเราเจอกันอีก (Until Then),/music/thailyric/22556,"จากวันนั้น ที่เธอได้ไปจากฉัน
ไม่รู้เธออยู่ที่ไหน ตอนนี้เธอเป็นอย่างไร

เธอจากไปไม่ลาสักคำ
อยากแค่ขอสบตาเธออีกครั้ง

ที่เธอไป ฉันยอมรับและเข้าใจ
ไม่ว่าอะไรเธอเลย ยังรักเธอ รู้ใช่ไหม

ใจฉันยังคิดถึงเหมือนเคย
ไม่มีใครแทนที่เธอได้เลย

ถ้าเราได้เจอกันอีกสักวัน อยากถาม
เธอจำฉันได้อยู่หรือเปล่า
เธอจะยิ้มให้ฉันหรือเปล่า
หากเราได้เจอกันอีกสักครั้ง อยากขอ
กอดเธอไว้ให้อุ่นเหมือนเก่า
ให้คำว่าเรายังคง

เหมือนเดิม ไม่เคยจางหายไป
เหมือนเดิม ไม่เคยจางหายไป
เหมือนเดิม ไม่เคยจางหาย
แม้นานเท่าไร ฉันรอเธอได้เสมอ

ยังคงยิ้ม ให้ความทรงจำทุกชิ้น
(ให้ความทรงจำทุกชิ้น)
รูปเรา เธอเก็บไว้ไหม
(รูปเรา เธอเก็บไว้ไหม)
เพราะฉันไม่เคยโยนทิ้ง
(ไม่เคยโยนทิ้ง)

สิ่งดีๆ ไม่เคยหายไป
เธอเคยลองนึกถึงมันบ้างไหม

ถ้าเราได้เจอกันอีกสักวัน อยากถาม
เธอจำฉันได้อยู่หรือเปล่า
เธอจะยิ้มให้ฉันหรือเปล่า
หากเราได้เจอกันอีกสักครั้ง อยากขอ
กอดเธอไว้ให้อุ่นเหมือนเก่า
ให้คำว่าเรายังคงเหมือนเดิม

ฟ้าและท้องทะเลต้องห่างกัน
เหมือนที่เราทั้งสองต้องจากกัน ฉันเข้าใจ
แม้ว่าเธอไม่หวนคืนกลับมา
ขอแค่เธอไม่ลืมช่วงเวลา ที่มีความหมาย

ถ้าเราได้เจอกันอีกสักครั้ง อยากถาม
เธอจำฉันได้อยู่หรือเปล่า
เธอจะยิ้มให้ฉันหรือเปล่า
หากเราได้เจอกันอีกสักครั้ง อยากขอ
กอดเธอไว้ให้อุ่นเหมือนเก่า
ให้คำว่าเรายังคง เหมือนเดิม

ฟ้าและท้องทะเลต้องห่างกัน
เหมือนที่เราทั้งสองต้องจากกัน
ฉันเข้าใจ
แม้เธอไม่หวนคืนกลับมา
ขอแค่เธอไม่ลืมช่วงเวลา
ที่มีความหมาย

ถ้าเราได้เจอกันอีกสักครั้ง อยากถาม
เธอจำฉันได้อยู่หรือเปล่า
เธอจะยิ้มให้ฉันหรือเปล่า
หากเราได้เจอกันอีกสักครั้ง อยากขอ
กอดเธอไว้ให้อุ่นเหมือนเก่า
ให้คำว่าเรายังคง

เหมือนเดิม ไม่เคยจางหายไป
เหมือนเดิม ไม่เคยจางหายไป
เหมือนเดิม ไม่เคยจางหาย
แม้นานเท่าไรฉันรอ เธอได้ เสมอ",tilly_birds
