song_name,href,lyric,artist
เธอไม่ได้อยู่คนเดียว (On My Shoulder),/music/thailyric/22567,"ข้างนอกนั้นมีเสียงรถมากมาย
แต่ฉันได้ยินแค่เสียงร้องไห้ของเธอ

เธอบอก ไม่อยากให้ฉันมาพบเธอ
เธอบอกว่าในตอนนี้เธอดูไม่ดี
แต่ช่างมันเถอะนะ

ฉันทำได้แค่ช่วยเช็ดน้ำตา
แต่ก็ไม่รู้จะพูดกับเธอว่าไง
ฉันไม่รู้เลย

เธอบอก ไม่อยากเป็นภาระของใคร
เธอบอก ไม่อยากให้ใครดูแลเรื่อยไป
ไม่อยากลำบากใครอีกแล้ว

แต่ลองมองมาที่ฉัน ถ้าไม่ไหว
เธออ่อนแอกับฉันได้ รู้ไหม
ถ้าเธออยากจะร้องไห้ตอนไหน
เธอมาร้องกับฉันได้ รู้ไหม

เธอไม่ต้องเข้มแข็งมากเกินไป
แค่นี้ก็เก่งมากแล้ว เธอรู้ไหม
ถึงแม้คืนนี้จะดูว่าเหมือนไม่มีทางจบ

เธอบอกว่าพังหมดแล้ว ไปถึงข้างใน
เธอบอกไม่อยากจะต้องมาทนทุกข์ใจ
เธอแบกมันไม่ไหว

แต่ฉันอยากบอกว่าทุกครั้งที่เสียใจ
มันแปลว่าข้างในนั้น เธอยังมีความรู้สึก
เธอยังมีหัวใจ

แต่ลองมองมาที่ฉัน ถ้าไม่ไหว
เธออ่อนแอกับฉันได้ รู้ไหม
ถ้าเธออยากจะร้องไห้ตอนไหน
เธอมาร้องกับฉันได้ รู้ไหม

เธอไม่ต้องเข้มแข็งมากเกินไป
แค่นี้ก็เก่งมากแล้ว เธอรู้ไหม
ถึงแม้คืนนี้จะดูว่าเหมือนไม่มีทางจบ

ข้างนอกนั้น มีเสียงรถมากมาย
แต่อยากให้เธอฟังเสียงฉันไว้ว่า
เธอไม่ได้อยู่คนเดียว",tilly_birds
"เบื่อคนขี้เบื่อ (I'm Not Boring, You're Just Bored)",/music/thailyric/22441,"เหมือนจะไปได้ดี
ที่เรายังคุยกันแบบนี้
เธอทำให้รู้สึกดี
และเธอก็บอกรู้สึกแบบนี้

แต่แล้วเวลาผ่านไป
ความรู้สึกเรากลับสวนทาง
ของฉันมากขึ้นไป
แต่ของเธอดูน้อยลงจนจางหาย

เธอบอกว่าฉันไม่ได้ผิดอะไร
เธอก็แค่รู้สึกเบื่อๆ ไปเอง
แต่ที่เธอทำให้ฉันคิดอะไร
ในตอนสุดท้ายฉันก็คิดไปเอง

เธอแค่เหงาก็เธอแค่เหงา
เธอคุยแก้เหงาแก้เบื่อ
แต่ว่าเรื่องของเราเธอก็ไม่เอา
เทฉันเพราะเธอแค่เบื่อ

ฉันก็เบื่อไม่แพ้เธอ
เพราะเจอแต่คนขี้เบื่อแบบเธอ
คุยกันไม่ยาว ชั่วคราว เธอก็ไป
ต้องสนุกแค่ไหนเธอ
ฉันต้องเป็นรถไฟเหาะเลยเหรอ
ต้องยอมรับใช่ไหมเธอมันคนขี้เบื่อ

เธอบอกว่าฉันไม่ได้ผิดอะไร
เธอก็แค่รู้สึกเบื่อๆ ไปเอง
แต่ที่เธอทำให้ฉันคิดอะไร
ในตอนสุดท้ายฉันก็คิดไปเอง

กินข้าวกันก็เบื่อ
ไปเที่ยวกันก็เบื่อ
ดูหนังกันก็เบื่อ
บอกฝันดีก็เบื่อ
บอกคิดถึงก็เบื่อ

เพลงฉันเธอก็เบื่อ
ฉันที่คอยแก้เบื่อ
เธอก็ยังคงเบื่อ
เธอไม่เคยจะเบื่อตัวเองบ้างเหรอ

เธอแค่เหงาก็เธอแค่เหงา
เธอคุยแก้เหงาแก้ เบื่อ
แต่ว่าเรื่องของเราเธอก็ไม่เอา
เทฉันเพราะเธอแค่เบื่อ

ฉันก็เบื่อไม่แพ้เธอ
เพราะเจอแต่คนขี้เบื่อแบบเธอ
คุยกันไม่ยาวชั่วคราวเธอก็ไป
ต้องสนุกแค่ไหนเธอ
ฉันต้องเป็นรถไฟเหาะเลยเหรอ
ต้องยอมรับใช่ไหมเธอมันคนขี้เบื่อ

ฉันตามหาแค่ใครสักคน
ที่พร้อมจะไปด้วยกัน
เธอตามหาแค่ใคร
ที่ใช้เวลาด้วยกันแค่วันๆ
กับเธอแล้วฉันคงไม่ใช่
อะไรที่มันสำคัญ
อย่ามองฉันว่าเป็นคนน่าเบื่อ
เพราะเธอเพียงแค่ขี้เบื่อ

โทษทีฉันไม่ไหว
เธอเคยเห็นคุณค่าฉันบ้างไหม

อ๋อ ไม่อ่ะ

(เบื่อ เบื่อ)
(ขี้เบื่อ)

(เบื่อ เบื่อ)
(ขี้เบื่อ)

(เบื่อ เบื่อ)
(ขี้เบื่อ)

(เบื่อ เบื่อ)
(ขี้เบื่อ)

เบื่อ

ฉันก็เบื่อไม่แพ้เธอ
เพราะเจอแต่คนขี้เบื่อแบบเธอ
คุยกันไม่ยาวชั่วคราวเธอก็ไป
ต้องสนุกแค่ไหนเธอ
ฉันต้องเป็นรถไฟเหาะเลยเหรอ
ต้องยอมรับใช่ไหมเธอมันคนขี้เบื่อ

ฉันก็เบื่อไม่แพ้เธอ
เพราะเจอแต่คนขี้เบื่อแบบเธอ
คุยกันไม่ยาวชั่วคราวเธอก็ไป
ต้องสนุกแค่ไหนเธอ
ฉันต้องเป็นรถไฟเหาะเลยเหรอ
ต้องยอมรับใช่ไหมเธอมันคนขี้เบื่อ",tilly_birds
ผู้เดียว (The One),/music/thailyric/16915,"ใครนะที่พูดกัน ว่ารักแท้มีจริง
แต่รักที่ฉันผ่านมา ต้องจบลงที่ความปวดร้าว
ทนทุกข์ทรมานจนกลัว กลัวการรักใครอีก
แต่ใครที่หายไปจากฉัน
อาจเป็นเพราะเขาไม่ใช่คนนั้น
คนที่ฉันจะสวมแหวนลงที่นิ้วนาง

เธอมีเพียงผู้เดียว เธอมีเพียงผู้เดียว
คนที่ฉันจะรักไปชั่วกาล
ทุกอดีตที่เคย ช้ำและมีน้ำตา
มันคอยสอนว่า คนที่ควรจะรัก
มีเพียงผู้เดียว เธอมีเพียงผู้เดียว
ที่เป็นคนสุดท้ายและทุกอย่าง
ฉันจะเก็บหัวใจ ไว้ให้เธอผู้เดียว
คงมีสักวัน ที่ได้พบเจอผู้นั้น

ยังคงตามหาแม้ต้องโดดเดี่ยวลำพัง
แต่คนที่รออยู่ปลายทางคือผู้นั้น
คนที่จะมอบหัวใจเป็นครั้งสุดท้าย

เธอมีเพียงผู้เดียว เธอมีเพียงผู้เดียว
คนที่ฉันจะรักไปชั่วกาล
ทุกอดีตที่เคย ช้ำและมีน้ำตา
มันคอยสอนว่า คนที่ควรจะรัก
มีเพียงผู้เดียว เธอมีเพียงผู้เดียว
ที่เป็นคนสุดท้ายและทุกอย่าง
ฉันจะเก็บหัวใจ ไว้ให้เธอผู้เดียว
คงมีสักวัน ที่ได้พบเจอผู้นั้น

เพียงแค่เธอมองดู กระจกบานนั้น
เธออาจจะเห็นใบหน้าใครอยู่ในนั้น
ที่เฝ้ารอให้เธอรักเขาสักครั้ง

เธอมีเพียงผู้เดียว เธอมีเพียงผู้เดียว
คนที่ฉันจะรักไปชั่วกาล
ทุกอดีตที่เคย ช้ำและมีน้ำตา
มันคอยสอนว่า คนที่ควรจะรัก
มีเพียงผู้เดียว เธอมีเพียงผู้เดียว
ที่เป็นคนสุดท้ายและทุกอย่าง
ฉันจะเก็บหัวใจ ไว้ให้เธอผู้เดียว
คงมีสักวัน ที่ได้พบเจอ

เธอมีเพียงผู้เดียว เธอมีเพียงผู้เดียว
คนที่ฉันจะรักไปชั่วกาล
ทุกอดีตที่เคย ช้ำและมีน้ำตา
มันคอยสอนว่า คนที่ควรจะรัก
มีเพียงผู้เดียว เธอมีเพียงผู้เดียว
ที่เป็นคนสุดท้ายและทุกอย่าง
ฉันจะเก็บหัวใจ ไว้ให้เธอผู้เดียว
คงมีสักวัน ที่ได้พบเจอผู้นั้น",tilly_birds
เพื่อนเล่น ไม่เล่นเพื่อน (Just Being Friendly),/music/thailyric/20872,"หยุดคิดแบบนี้
หยุดคิดเลย
รู้สึกดีทั้งที่เป็นแค่เพื่อนกัน

หยุดไว้แค่นี้
หยุดไว้เลย
ได้โปรด เธออย่าเล่นเกินไปกว่านั้น

เล่นทักมาหาฉันเสมอแทบทุกคืนวัน
มากเกินกว่าเพื่อนควรจะเป็น
เล่นเป็นห่วงฉันแม้ในเรื่องที่ไม่สำคัญ

เธอชอบมาทำให้ฉัน เอ๊ะ ยังไง
ที่เล่นแบบนี้นั้นมันแปลว่าไง
ฉันยังสับสนและสงสัย
เป็นเพื่อนกัน ต้องเล่นแบบไหน

ได้แต่พยายามจะไม่คิดอะไร
ที่ไม่ควรคิด
เวลาที่เราใกล้ชิดมากไป
รู้ตัวอีกที ในใจมีแต่คำถาม
มากมายเกินจะทนไหว
บอกฉันทีจะได้ไหม

ถ้าเธอให้ฉันเป็นเพื่อนเล่น
อย่าเล่นเกินกว่านั้นได้ไหม
ถ้าฉันเล่นเกินเส้นไป เธอรับได้ไหม
ช่วยบอกฉันสักที ว่าที่ฉันยืน
เธอยืนที่เดียวกันไหม
หยุดเล่นเกินเพื่อนเล่น

เอ่อ คือตอนนี้เราเป็นแค่เพื่อนกัน
และฉันก็คิด
อยากมีสิทธิ์มากกว่านั้น
(อ๋อ ได้เลย)
งั้นเธอคือเพื่อนสนิทของฉัน

เพื่อนอะไรบอกฝันดีก่อนนอน
เพื่อนแบบไหนดมหัวแล้วบอกหอม
เริ่มไม่แน่ใจ เอาหน้ามาใกล้ตลอด
เวลาฉันต้องการใคร ก็เป็นเธอที่มากอด

ใจเธอคิดเหมือนกันหรือเปล่า
เจอแบบนี้ไป ฉันแอบเผลอใจให้ไป
แม้มันไม่อาจเป็นจริง

ถ้าเธอให้ฉันเป็นเพื่อนเล่น
อย่าเล่นเกินกว่านั้นได้ไหม
ถ้าฉันเล่นเกินเส้นไป เธอรับได้ไหม
ช่วยบอกฉันสักที ว่าที่ฉันยืน
เธอยืนที่เดียวกันไหม

ถ้าเธอไม่เคยที่จะรู้สึกเหมือนที่ใจฉันรู้สึก
แค่เพื่อนเล่น ฉันก็เป็นให้เธอไม่ไหว
จะได้พร้อมทำใจ รอให้เธอบอก
ว่าเป็น เพื่อนกันเท่านั้น
หยุดเล่นเกินเพื่อนเล่น

ได้แต่พยายามจะไม่คิดอะไร
ที่ไม่ควรคิด
เวลาที่เราใกล้ชิดมากไป
รู้ตัวอีกที ในใจมีแต่คำถาม
มากมายเกินจะทนไหว
บอกฉันทีจะได้ไหม

ถ้าเธอให้ฉันเป็นเพื่อนเล่น
อย่าเล่นเกินกว่านั้นได้ไหม
ถ้าฉันเล่นเกินเส้นไป เธอรับได้ไหม
ช่วยบอกฉันสักที ว่าที่ฉันยืน
เธอยืนที่เดียวกันไหม

ถ้าเธอไม่เคยที่จะรู้สึกเหมือนที่ใจฉันรู้สึก
แค่เพื่อนเล่น ฉันก็เป็นให้เธอไม่ไหว
จะได้พร้อมทำใจ รอให้เธอบอก
ว่าเป็น เพื่อนกันเท่านั้น
หยุดเล่นเกินเพื่อนเล่น",tilly_birds
ยังคงสวยงาม (When The Film's Over),/music/thailyric/18646,"เปรียบความรัก เรื่องเราสองคน
เป็นเหมือนหนังเรื่องหนึ่ง
มีทั้งซึ้ง มีทั้งเศร้าปน
รวมเรื่องมากมาย

จนถึงตอนท้ายๆ (แม้รักเธอมากแค่ไหน)
มันไปต่อไม่ได้ (แม้พยายามเท่าไร)
ฉันและเธอคงจบลงเท่านี้

เก็บทุกความรู้สึกที่ดีเอาไว้
อย่าให้หาย อย่าให้หาย
หากว่าเราไม่อาจจบฉากสุดท้าย
อย่างที่ฝัน เรื่องเธอและฉัน
ก็ยังคงสวยงาม ยังสวยงาม

สิ่งที่ฉันจำคือถ้อยคำที่เธอคอยห่วงใย
ไม่ลืมสายตา ในเวลาที่เธอคอยปลอบใจ
ย้อนดูซ้ำๆ ฉากที่เรากอดกันไว้
ไม่ลืมภาพวัน ที่อยู่ด้วยกันวันนั้น

แต่วันนี้ไม่มีเธอ (ไม่มีเราอีกต่อไป)
ทำได้แค่คิดถึงเธอ (ไม่รู้ถึงเธอบ้างไหม)
ถ้าเธอฟังฉันอยู่ อยากให้เธอลอง

เก็บทุกความรู้สึกที่ดีเอาไว้
อย่าให้หาย อย่าให้หาย
หากว่าเราไม่อาจจบฉากสุดท้าย
อย่างที่ฝัน เรื่องเธอและฉัน
ก็ยังคงสวยงาม ยังสวยงาม

ก็ยังคงสวยงาม

ไม่ว่านานแสนนานเท่าไร
จำแค่ภาพสองเราเอาไว้ ฉันขอแค่นี้

แม้วันนี้ไม่มีเธออีกแล้ว
แม้วันนี้ไม่มีเราอีกแล้ว ก็ไม่เป็นไร

ความทรงจำไม่มีวันเลือนหาย
อดีตเรายังคงมีความหมาย
จะไม่เสียใจ จะไม่ร้องไห้

เก็บทุกความรู้สึกที่ดีเอาไว้
อย่าให้หาย อย่าให้หาย
หากว่าเราไม่อาจจบฉากสุดท้าย
อย่างที่ฝัน เรื่องเธอและฉัน
ก็ยังคงสวยงาม ยังสวยงาม

ฉากสุดท้ายนั้นจะเป็นอย่างไร
เราทั้งสองจะคงตลอดไป ในใจดวงนี้",tilly_birds
ยิ้มเธอคือทุกอย่าง (Always Here),/music/thailyric/22608,"เธอไม่สบายใจกับสิ่งไหน ให้เธอบอกฉัน
อย่าคิดว่าไม่มีใครในวันที่ไม่เป็นอย่างหวัง

มีฉันอยู่ตรงนี้
ไม่ว่าจะร้ายดี
ฉันเป็นให้เธอได้ทุกอย่าง
เพราะยิ้มเธอคือทุกอย่างของฉัน

แค่ฉันได้ฟังเสียงเธอหัวเราะ ฉันก็สุขใจ
และหากว่ามีวันใดที่เธอเศร้า ฉันก็ทนไม่ไหว

มีฉันอยู่ตรงนี้
ไม่ว่าจะร้ายดี
ฉันเป็นให้เธอได้ทุกอย่าง
เพราะยิ้มเธอคือทุกอย่าง

หากว่าเธอนั้นไม่สบายใจ
มาหาฉันได้เสมอ
อยากให้เธอได้ระบายใจ
จะรับฟังเธอเสมอ

จะไม่ปล่อยมือ แม้ท้องฟ้าจะไม่เหมือนดังเดิม
อยู่ข้างเคียงเธอเสมอ
ฉันพร้อมจะ เป็นให้เธอได้ทุกอย่าง
เพราะยิ้มเธอคือทุกอย่างของฉัน

ไม่ว่าเหนื่อยแค่ไหน
จะเป็นที่พักใจให้เธอ
ไม่ว่าเบื่ออะไร อะไร
จะเป็นสีสันให้เธอเสมอ

เพราะเธอยัง มีฉันอยู่ตรงนี้
ไม่ว่าจะร้ายดี
ฉันเป็นให้เธอได้ทุกอย่าง
เพราะยิ้มเธอคือทุกอย่างของฉัน

นานานานานานานานานานานานานา
นานานานานานานานานานานานานา

หากว่าเธอนั้นไม่สบายใจ
มาหาฉันได้เสมอ

อยากให้เธอได้ระบายใจ
จะรับฟังเธอเสมอ

จะไม่ปล่อยมือ แม้ท้องฟ้าจะไม่เหมือนดังเดิม
อยู่ข้างเคียงเธอเสมอ ฉันพร้อมจะ
เป็นให้เธอได้ทุกอย่าง
เพราะยิ้มเธอคือทุกอย่าง (เพราะยิ้มเธอคือทุกอย่าง)

จะไม่ปล่อยมือ แม้ท้องฟ้าจะไม่เหมือนดังเดิม
อยู่ข้างเคียงเธอเสมอ ฉันพร้อมจะ
เป็นให้เธอได้ทุกอย่าง
เพราะยิ้มเธอคือทุกอย่าง

นานานานานานานานานานานานานา
นานานานานานานานานานานานานา",tilly_birds
