song_name,href,lyric,artist
ฤดูหนาว,/music/thailyric/17317,"เธอ เธอมาทำให้เพ้อละเมอ
ทำให้คิดถึงเรื่อยไป
แต่ตอนนี้เธออยู่ไหน
ตอนนี้เธออยู่ไหน ไม่รู้เลย

คุย คุยกี่คนก็เหมือนเดิมๆ
จนมันเริ่มทนไม่ไหว
ทำไมต้องหาย ทำไมต้องหายไป

เธอเป็นเหมือนฤดูหนาว
มาทำให้รู้สึกดีแค่ชั่วคราว
สิ่งที่เหลือคือปวดร้าว
แล้วใจฉันก็ว่างเปล่า

ไม่อยากให้เธอหายไป ได้ไหม
เจ็บแบบเดิมซ้ำๆ คง ไม่ไหว
ไม่อยากกลับไปเริ่มใหม่ ฉันขอ
คนที่จะไม่หายไป ก็พอ

เหตุผลที่ฉันต้องหายไป (หายไป)
ทำให้เธอได้แต่เฝ้ารอ
คือฉันไม่สนเรื่องหัวใจ (หัวใจ)
ไม่หวังให้ใครมาเป็นเจ้าของ

ใครว่าการมีคนรักทำให้เธอคิดว่ามันดี (ดี)
อาจเหงาแต่ฉัน ไม่ต้องการอะไรมากกว่านี้
โทษทีที่ฉันไม่ใช่คนนั้นที่เธอเฝ้าตามหา (หา)
ไม่ได้เย็นชา ก็ฉันแค่ไม่ต้องการเธอ

เธอเป็นเหมือนฤดูหนาว
มาทำให้รู้สึกดีแค่ชั่วคราว
สิ่งที่เหลือคือปวดร้าว
ใจฉันก็ว่าง..ว่างเปล่า

ไม่อยากให้เธอหายไป ได้ไหม
เจ็บแบบเดิมซ้ำๆคง ไม่ไหว
ไม่อยากกลับไปเริ่มใหม่ ฉันขอ
คนที่จะไม่หายไป ก็พอ

ไม่มีฤดูหนาวในประเทศไทย
ไม่มีความรู้สึกเหลืออีกต่อไป
ไม่มีความไว้ใจเหลือจะให้ใคร
มีแต่ใจที่ชาเหมือนจะบ้าตาย

ทุ่มเทเท่าไรก็ไร้ค่า
สะสมความเจ็บจนรู้ว่า
คนที่เราควรจะให้ค่า
อาจ ไม่ใช่คนนั้น

เรามาลองคิดดู
อีกฝั่งที่ปลายนิ้วนั้นสุดจะไกล
ได้แต่เฝ้าดู แม้ใจจะบอบช้ำ
แต่เราก็ยังอยู่ได้ ได้อยู่
อดีตที่สวยงาม
มันทำให้เรา do the sequel
เก็บอ้อมกอดของเราไว้

เลิกคิดถึงซะ คิดยังไงก็ไม่ถึงเขา
อยู่เองให้ได้ วันสุดท้ายก็มีแค่เรา

ฉันมันเป็นใคร ฉันจะเป็นใคร
ไม่มีผู้ใด จะมาทำลาย ได้อีกต่อไป

เจ็บจนใจมันด้านชา ซ้ำๆ
ใครเข้ามาก็หายไป ทั้งนั้น
แต่ยังหวังจะได้เจอ สักครั้ง
คนที่จะยืนข้างกัน สักที

ไม่อยากให้เธอหายไป ได้ไหม
เจ็บแบบเดิมซ้ำๆ คง ไม่ไหว
ไม่อยากกลับไปเริ่มใหม่ ฉันขอ
คนที่จะไม่หายไป ก็พอ",tilly_birds
ลู่วิ่ง (Can't Keep Up),/music/thailyric/21643,"(เพราะตอนนี้ ฉันวิ่งตามเธอไม่ทัน)
(เพราะตอนนี้ ฉันวิ่งตาม ตาม ตาม)

วิ่งตามเธออย่างนี้ มันเหนื่อยรู้ไหม
เธอลองมาเป็นฉันไหมสลับกันดู
ต้องแพ้ให้เธออย่างนี้ ไปอีกนานแค่ไหน
ถ้ารู้สึกมากกว่าที่เธอมี ฉันก็คงแพ้ไป

วิ่ง วิ่ง อยู่อย่างนี้ วิ่ง วิ่ง อยู่กับที่
ไม่ไปไหน ไม่ไปไหน
วิ่งตามเธออย่างนี้ นิ่งเฉยอยู่กับที่
อีกไกลไหม จะไปถึง

พยายามวิ่งตามเท่าไร
เร็วแค่ไหน แค่ไหน ก็ไกล
เพราะฉันยังวิ่งตามไม่ทันเธอเลยสักครั้ง
บอกได้ไหม ต้องทำเช่นไร
ฉันสงสัย ฉันไม่เข้าใจ
เหมือนดิ้นรนวิ่งบนลู่วิ่งยังไงยังงั้น

เธอช่วยรอกันหน่อย ยืนอยู่กับที่ได้ไหม
ข้างหลังเธอยังมีใคร ที่ยังไปไม่ถึงไหน
ถามเธอสักคำหน่อย เธอเคยคิดถึงฉันไหม
ถ้าเธอมีใจให้ฉันก็หันมาหน่อย
เพราะตอนนี้ฉันวิ่งตามเธอไม่ทัน

อยากที่จะเลิกวิ่งมาตั้งหลายครั้ง
แต่เธอก็ทำให้ฉันเริ่มใหม่ทุกครั้ง
พอฉันจะหยุด เธอก็ฉุดไม่ให้ไป
เธอขอให้อยู่ เพื่อให้เธอสบายใจ
สุดท้ายไม่ได้ข้างกัน แต่ฉันก็ยังยินดีที่จะต้อง

วิ่ง วิ่ง อยู่อย่างนี้ วิ่ง วิ่ง อยู่กับที่
ไม่ไปไหน ไม่ไปไหน
วิ่งตามเธออย่างนี้ นิ่งเฉยอยู่กับที่
อีกไกลไหม จะไปถึง

พยายามวิ่งตามเท่าไร
เร็วแค่ไหน แค่ไหน ก็ไกล
เพราะฉันยังวิ่งตามไม่ทันเธอเลยสักครั้ง
บอกได้ไหม ต้องทำเช่นไร
ฉันสงสัย ฉันไม่เข้าใจ
เหมือนดิ้นรนวิ่งบนลู่วิ่งยังไงยังงั้น

เธอช่วยรอกันหน่อย ยืนอยู่กับที่ได้ไหม
ข้างหลังเธอยังมีใคร ที่ยังไปไม่ถึงไหน
ถามเธอสักคำหน่อย เธอเคยคิดถึงฉันไหม
ถ้าเธอมีใจให้ฉันก็หันมาหน่อย
เพราะตอนนี้ฉันวิ่งตามเธอไม่ทัน

เธอช่วยรอกันหน่อย ยืนอยู่กับที่ได้ไหม
เหนื่อยล้ามานานเท่าไร ก็ยังไปไม่ถึงไหน
ถามเธอสักคำหน่อย เธอเคยคิดถึงฉันไหม
ถ้าเธอมีใจให้ฉันก็หันมาหน่อย
เพราะตอนนี้ฉันวิ่งตามเธอไม่ทัน

(เพราะตอนนี้ฉันวิ่งตามเธอไม่ทัน)
(เพราะตอนนี้ฉันวิ่งตามเธอไม่ทัน)
(เพราะตอนนี้ฉันวิ่งตามเธอไม่ทัน)
(เพราะตอนนี้ฉันวิ่งตามเธอไม่ทัน)
วิ่ง วิ่ง

(เพราะตอนนี้ฉันวิ่งตามเธอไม่ทัน)
วิ่ง วิ่ง
(เพราะตอนนี้ฉันวิ่งตามเธอไม่ทัน)
วิ่ง วิ่ง
(เพราะตอนนี้ฉันวิ่งตามเธอไม่ทัน)
วิ่ง วิ่ง
เพราะตอนนี้ฉันวิ่งตามเธอไม่ทัน",tilly_birds
ให้เธอหายดี (SuperMom),/music/thailyric/18442,"เจ็บที่ตรงไหน
บอกฉันได้ไหม
ให้ฉันช่วยดู

แม้ไม่อาจรู้
ว่าฉันจะแก้ไข
มันได้อย่างไร

เจ็บขนาดไหน
ปวดขนาดไหน
ทรมานรึเปล่า

แค่เห็นเธอปวดร้าว
เห็นเธอเหน็บหนาว
ก็ทนแทบไม่ไหว

เธออยากให้ฉันช่วยอะไร ช่วยยังไง
โปรดบอกกัน
เพราะว่าน้ำตาของเธอ
น้ำตาของเธอ ก็คือของฉัน

ช่วยแบ่งมาให้ฉันได้ไหม ช้ำเท่าไร
ที่เธอมี
ฉันจะขอทำทุกทาง ขอทำทุกอย่าง
ให้เธอหายดี

เธอรู้ไหมว่าทุกครั้ง
ที่เห็นยิ้มเธอ
ฉันสุขใจเพียงไหน
และเมื่อใด
ที่ได้ยินเสียงหัวเราะเธอ
ฉันดีใจเท่าไร

ไม่อยากให้ สิ่งเหล่านี้ ต้องหายไป
เพราะหากว่ามันต้องหายไป
หากว่าเธอต้องหายไป
ฉันคงอยู่ไม่ไหวจริงๆ

เธออยากให้ฉันช่วยอะไร ช่วยยังไง
โปรดบอกกัน
เพราะว่าน้ำตาของเธอ
น้ำตาของเธอ ก็คือของฉัน

ช่วยแบ่งมาให้ฉันได้ไหม ช้ำเท่าไร
ที่เธอมี
ฉันจะขอทำทุกทาง ขอทำทุกอย่าง
ให้เธอหายดี

แม้จะมากมายเท่าไร
ฉันยอมทั้งใจ
ให้เธอหายดี",tilly_birds
ให้เธอ,/music/thailyric/19409,"ฟ้า และท้องทะเลกับลมนั้นมีอยู่
แต่ใครจะรู้ จะรู้ว่ามีอะไร ในใจฉัน
ก็คงจะมีอะไร ไวัให้กัน
ก็คงจะมีตะวัน ที่สดใส
ก็คงมีเดือนและดาวดวงนั้น ที่เธอฝันใฝ่
ฮืม ฮืม

ฟ้า และท้องทะเลกับลมนั้นรู้อยู่
และเธอก็รู้ ก็รู้ว่ามีแต่เธอในใจฉัน
จะเก็บเอาความห่วงใยไว้ให้กัน
เก็บเอาคืนและวันที่ดีไว้
เก็บเอาเดือนและดาวดวงนั้น
ที่เธอฝันใฝ่ มาให้เธอ

จะรักเพียงเธอ
และพร้อมจะทำให้เธอสดใส
ฉันมั่นใจ เรามีอะไรอะไรที่เข้ากัน

ก็คงจะมีแต่เธอ ที่รู้ใจกัน
ก็คงจะมีแต่เธอ เท่านั้น
ก็เธอคือดวงตะวัน
ที่ฉันนั้นมีอยู่เต็ม หัวใจ

แม้ ดินฟ้าจะเป็นอย่างไรก็ยังอยู่
ก็ใจมันรู้ มันรู้ว่ามีสิ่งเดียว คือเธอนั้น
จะเก็บเอาความห่วงใย ไว้ให้กัน

เก็บเอาคืนและวัน ที่ซึ้งใจ
เก็บเอาเดือนและดาวดวงนั้น
ที่เธอฝันใฝ่ มาให้เธอ

จะรักเพียงเธอ
และพร้อมจะทำให้เธอสดใส
ฉันมั่นใจ เรามีอะไรอะไรที่เข้ากัน

ก็คงจะมีแต่เธอ ที่รู้ใจกัน
ก็คงจะมีแต่เธอ เท่านั้น
ก็เธอคือดวงตะวัน
ที่ฉันนั้นมีอยู่เต็ม หัวใจ

ก็คงจะมีแต่เธอ ที่รู้ใจกัน
ก็คงจะมีแต่เธอ เท่านั้น
ก็เธอคือดวงตะวัน
ที่ฉันนั้นมีอยู่เต็ม หัวใจ

แม้ ดินฟ้าจะเป็นอย่างไร ก็ยังอยู่
ก็ใจมันรู้ มันรู้ว่ามีสิ่งเดียว คือเธอนั้น
จะเก็บเอาความห่วงใย ไว้ให้กัน
เก็บเอาคืนและวัน ที่ซึ้งใจ
เก็บเอาเดือนและดาวดวงนั้น
ที่เธอฝันใฝ่ มาให้เธอ
มาให้เธอ",tilly_birds
อภัย (Broken),/music/thailyric/15735,"ทะเลาะเสียงดัง ข้าวของก็พัง อย่างนี้ประจำ
บางครั้งบางครา บางช่วงเวลา ต้องเสียน้ำตา
ความไม่เข้าใจ มันทำให้เรา ไม่ยอมจะเปิดรับ
แต่ว่าข้างใน ฉันเชื่อว่าเรา ยังคงมีความรัก

รอยร้าวที่ยัง มองเห็นทุกวัน บนกรอบรูปของเรา
แต่ภาพข้างใน มองเห็นทีไร ยังสวยเหมือนเก่า

ความรู้สึกเราอาจโดนทำร้าย
สิ่งของอาจพังทลาย แต่ฉันจะไม่มีวันทำลาย

รอยยิ้มของเธอ ที่ยังคงเหมือนเดิม
สายตาคู่นั้นของเรา ยังเป็นเหมือนแรกเจอ
ไม่ว่าสิ่งไหน ที่พังลงไปไม่เหมือนเคย
หัวใจยังเหมือนวันเก่า ไม่เปลี่ยนหรือแปลงไปเลย

ความรู้สึกเราอาจโดนทำร้าย
สิ่งของอาจพังทลาย แต่ฉันจะไม่มีวันทำลาย

รอยยิ้มของเธอ ที่ยังคงเหมือนเดิม
สายตาคู่นั้นของเรา ยังเป็นเหมือนแรกเจอ
ไม่ว่าสิ่งไหน ที่พังลงไปไม่เหมือนเคย
หัวใจยังเหมือนวันเก่า ไม่เปลี่ยนหรือแปลงไปเลย

เพราะว่ารอยยิ้มของเธอ มันยังคงเหมือนเดิม
สายตาคู่นั้นของเรา ยังเป็นเหมือนแรกเจอ
ไม่ว่าปัญหาใดๆ เราสองจะรับฟัง
ฉันยอมทำได้ทุกอย่าง เพื่อไม่ให้ใจเราพัง

ยอมทำได้ทุกอย่าง เพื่อไม่ให้ใจเราพัง
ยอมทำ ได้ทุกอย่าง เพื่อไม่ให้ใจเราพัง
ยอมทำได้ทุกอย่าง เพื่อไม่ให้ใจ เราพัง",tilly_birds
อย่าอยู่เลย,/music/thailyric/19971,"เธอทนอยู่กับเขามานาน อยู่กับเขามานาน
ฉันทนดูเธอทรมานไม่ไหว
เธอยอมให้เขาตลอด ใครเตือนกี่ทีแต่เธอก็ไม่ฟัง
เธอยังอยู่กับเขา

รักที่เขาเคยบอก คำที่เขาลวงหลอก
เธอก็เชื่อตลอดมา
แต่สุดท้ายรอยน้ำตาและบาดแผลตามร่างกาย
มันคอยย้ำว่าเขาทำเธอเสียใจ

อย่าอยู่อย่างนี้เลย
ถ้าเขาไม่ได้รักเธอ เขาไม่ได้รักเธอ
แค่ฝืนเดินออกมา
ลืมตาได้แล้ว เธอ อย่าหลงเขาจนไม่สนใจ
ว่าตัวเอง ต้องทนอยู่กับความทรมานเกินไป

กี่คนแล้วที่อาจจะดีกว่า แต่เธอก็ไม่ได้สนใจ
เธออาจจะรักเขาจนไม่มองใครๆ โอ้ว
ก็รู้ว่าเธอนั้นรักมาก และก็รู้ว่าเขาคงเป็นรักแรก
แต่รอยน้ำตาเธอเเนบตรงที่แก้ม ฉันรู้เลยเขาคงไม่รักเเน่
ทุกครั้งที่ฉันโทรหาเธอ ความเจ็บผ่านเสียงปลายสาย
เธอบอกเขาทำร้ายเธออีกแล้ว จนเธอนั้นเจ็บเจียนตาย

รักที่เขาเคยบอก
คำที่เขาลวงหลอก เธอก็เชื่อตลอดมา
แต่สุดท้ายรอยน้ำตาและบาดแผลตามร่างกาย
มันคอยย้ำว่าเขาทำเธอเสียใจ

อย่าอยู่อย่างนี้เลย
ถ้าเขาไม่ได้รักเธอ เขาไม่ได้รักเธอ
แค่ฝืนเดินออกมา
ลืมตาได้แล้ว เธอ อย่าหลงเขาจนไม่สนใจ
ว่าตัวเอง ต้องทนอยู่กับความทรมานเกินไป

เธอลืม อาจจะลืมไป ว่าเธอเคยเป็นใคร ที่มีความสุขเเค่ไหน
ลืมตา เธอจงลืมตา ปาดน้ำตา และเปิดหัวใจ
เพราะเธอไม่ควรทนอยู่กับคนที่ทำร้ายใจ
ถ้ารักแล้วไม่ดี พอสักที เธอก็ออกมาจะได้ไหม

(พอสักที เธอก็ออกมาสักที)

อย่าอยู่อย่างนี้เลย
ถ้าเขาไม่ได้รักเธอ เขาไม่ได้รักเธอ
แค่ฝืนเดินออกมา (แค่ฝืนเดินออกมา จะได้ไหม)
ลืมตาได้แล้วเธอ อย่าหลงเขาจนไม่สนใจ
ว่าตัวเอง ต้องทนอยู่กับความ ทรมานเกินไป
(อย่าทนทรมานอีกเลย)",tilly_birds
อยู่ได้ ได้อยู่ (ineednoone),/music/thailyric/17190,"เจอมากี่ครั้งเรื่องรักๆ เดี๋ยวจะเล่าให้ฟัง
ชอบคนไหน ไม่ว่าใคร เขาก็ไม่ชอบกลับ
ใครมารัก เราก็มักที่จะไม่รักตอบ (สักครั้ง)
หัวใจมันบอบช้ำ

เจอมากี่ที ดูเหมือนจะดี แต่ก็โดนเททุกที
คงต้องเข้าใจ คนที่ไม่ใช่ ก็คือไม่ใช่ แค่นี้
อีกกี่ครั้ง ที่ผิดหวัง ทำให้เรา ต้องมาเจ็บอยู่ดี
แล้วจะทำไม

ไม่ต้องมีใคร อยู่ได้ ได้อยู่
ให้ฉันเหงาตาย มันก็ดี กว่ามีใคร
แต่ไม่ได้เรื่องสักอย่าง

เคว้งคว้างแล้วไง อยู่ได้ ได้อยู่
ให้มันรู้ไป บอกตัวเอง
อีกสักครั้ง ยังอยู่ได้อยู่

รู้ตัว ว่าต้องเลือกสิ่งไหน หัวใจไม่เคยฟังสักครั้ง
รู้ว่า อะไรที่สำคัญ แต่ไม่เคยเรียนรู้เลย

เจ็บมากี่ครา บ่อยจนชินชา
ไม่เป็นไรนะ ให้เจ็บกว่านี้ก็ไหว
อาจไม่เจอรักแท้ แต่คนที่อ่อนแอ
และไอ้ขี้แพ้ จะไม่ใช่เราอีกต่อไป

เจอมากี่ที ดูเหมือนจะดี แต่ก็โดนเททุกที
คงต้องเข้าใจ คนที่ไม่ใช่ ก็คือไม่ใช่ แค่นี้
อีกกี่ครั้ง ที่ผิดหวัง ทำให้เรา ต้องมาเจ็บอยู่ดี
แล้วจะทำไม

ไม่ต้องมีใคร อยู่ได้ ได้อยู่
ให้ฉันเหงาตาย มันก็ดี กว่ามีใคร
แต่ไม่ได้เรื่องสักอย่าง

เคว้งคว้างแล้วไง อยู่ได้ ได้อยู่
ให้มันรู้ไป บอกตัวเอง อีกสักครั้ง ยังอยู่ได้อยู่

(ไม่ต้องมีใคร อยู่ได้ ได้อยู่
ให้ฉันเหงาตาย มันก็ดี กว่ามีใคร
แต่ไม่ได้เรื่องสักอย่าง)

เคว้งคว้างแล้วไง อยู่ได้ ได้อยู่
ให้มันรู้ไป บอกตัวเอง อีกสักครั้ง ยังอยู่ได้อยู่

ไม่ต้องมีใคร อยู่ได้ ได้อยู่
ให้ฉันเหงาตาย มันก็ดี กว่ามีใคร
แต่ไม่ได้เรื่องสักอย่าง

เคว้งคว้างแล้วไง อยู่ได้ ได้อยู่
ให้มันรู้ไป บอกตัวเอง (บอกตัวเอง)
อีกสักครั้ง (อีกสักครั้ง)

ยังอยู่ได้อยู่

ยังอยู่ได้อยู่

ยังอยู่ได้อยู่",tilly_birds
